S.No,Year,State,Registration No,Association name,Address,Amount of FC Received
1,2011-2012,Assam,020760009,A Chik Baptist Convention,Baghpara Union Compound P.O. Khagarpur BongaigaonAssam-,0.00
2,2011-2012,Assam,020780080,Aaranyak,Samanwoy Path (Survey) P.O. Beltola GuwahatiKamrup Distt. (Assam)-781028,35450190.88
3,2011-2012,Assam,020780104,Adhoc  Pacifist Organisation,H.No.25 Narikal Basti5th Bye Lane Zoo Narengi Road GuwahatiAssam-781024,0.00
4,2011-2012,Assam,020520001,Agency for Growth and Upliftment of All,Don Bosco Doom Dooma Tinsukia (Assam) -786151,4640574.00
5,2011-2012,Assam,020820017,Aid for the Disabled Samity, MorigaonAssam-782105,0.00
6,2011-2012,Assam,020780107,AIDS Literacy Society,Monaliv Clininc and Research CenterZOO - Narengi Road Guwahati781021,0.00
7,2011-2012,Assam,020780041,AIDs Prevention Society,MonalivClinic & AidsResearch Centre Zoo Narangi Road GuwahatiAssam-781021,0.00
8,2011-2012,Assam,020760016,AJAGAR SOCIAL CIRCLE,VILL Agia PO AgiaGoalpara783120,1000000.00
9,2011-2012,Assam,020820057,AJMAL FOUNDATION,COLLEGE ROADHOJAI782435,0.00
10,2011-2012,Assam,020780028,Al-Ameen Charitable Fund Trust,Barpeta  Assam-,0.00
11,2011-2012,Assam,020780020,Amri Karbi C D Project,Christian Hospital Compound KamrupAssam-782402,0.00
12,2011-2012,Assam,020760007,Amtika Community Development Project,Tukrajhar KokrajharAssam-,0.00
13,2011-2012,Assam,020770002,Anchalik Gram Unnyan Parishad,Vill & P.O.:  Jania Distt.- BarpetaAssam-781314,118500.00
14,2011-2012,Assam,020820055,Anfar Foundation,C/o- Anfar Shopping Centre J. Kedia RoadHojai782435,0.00
15,2011-2012,Assam,020780084,Ankan Academy,Vill & P.O.- Puthimari Kamrup Distt.Assam-781380,0.00
16,2011-2012,Assam,020780031,ARCHDIOCESE OF GUWAHATI,Kharguli Guwahati Assam-781001,90156934.00
17,2011-2012,Assam,020720005,Asapalli Christian Hostel Trust,P.O.Fulertal  CacharAssam-788106,1647925.00
18,2011-2012,Assam,020640009,ASHA DARSHAN TRUST,P.O-TAMULPUR DISTRICT-BAKSA(BTAD) STATE-ASSAMGUWAHATI781367,1936783.00
19,2011-2012,Assam,020780056,Ashadeep,KANAKLATA PATH LACHIT NAGAR GUWAHATIGUWAHATI781007,755338.09
20,2011-2012,Assam,020690001,Assam Baptist Convention,Post Box No. 49 Mission Compound GolaghatAssam-785621,1435867.64
21,2011-2012,Assam,020780074,Assam Centre for Rural Development (ACRD),Indrakanta Bhawan Kanaklata Path  P.O. Ulubari Guwahati-7Kamrup Distt. (Assam)-781007,1167501.00
22,2011-2012,Assam,020820038,Assam Gana Mukti Society,Premnagar Dhing Road NagaonAssam-782002,2259426.72
23,2011-2012,Assam,020780076,Association for Socio-Cultural and Environmental Development,SBI Officers Colony House No.341st Floor Hatigarh Chari Ali Guwahati781024,0.00
24,2011-2012,Assam,020770001,ATA Bhavkamari Society Dev. Association,Vill-ATA-Bhowkamari P.O.-SarutapaDistt. Barpeta Assam.-,0.00
25,2011-2012,Assam,020780047,ATMA NIRBHAR-EK CHALLENGE,Gopinath Nagar P.O. GuwahatiAssam-781016,602681.41
26,2011-2012,Assam,020780095,Auxilium Reach out,Near Holy Child Higher Secondary School Krishnanagar ChandmariGuwahati Kamrup Metro781005,13582804.00
27,2011-2012,Assam,020820023,Bahumukhi Krishi & Samaj Kalyan Samiti,P.O. Herapati NowgaonAssam-782002,0.00
28,2011-2012,Assam,020650002,Balidunga Jana Kalyan Samity,Vill.- Balidunga P.O- Bhuragaon P.S- LaharighatBhuragaon782121,0.00
29,2011-2012,Assam,020720025,BARAK VALLEY WELFARE DEVELOPMENT SOCIETY,R.K.Mission RoadSilchar788007,0.00
30,2011-2012,Assam,020760003,Bengtal Catholic Mission Bengtal,Bengtol BongaigaonAssam.-783381,2671054.00
31,2011-2012,Assam,020780096,Bhabendra Nath Sakia Children Welfare Trust,Basisthapur : 2 Beltola Guwahati Kamrup DistrictAssam-781028,0.00
32,2011-2012,Assam,020640007,Bishnu Jyoti Janakalyan Samity,Sonpur Village Nalbari (Assam) -,0.00
33,2011-2012,Assam,020720022,Bishnupriya Manipuri Welfare Trust,P.O. Vivekananda Road Durga Lane SilcharDistt. Cachar (Assam)-788007,0.00
34,2011-2012,Assam,020740020,Bishops House,Tezpur SonitpurAssam-784001,0.00
35,2011-2012,Assam,020740032,Bodo Evangelical Lutherean Church,Udalgiri DarrangAssam-784509,0.00
36,2011-2012,Assam,020730003,Bongaigaon Gana Seva Society,Karija Dolaigaon P.O. Box No. 43 Kissan BazarBongaigaon (Assam)-783380,1807311.77
37,2011-2012,Assam,020760004,Boro Baptist Church Association,HQ and PO Tukrajhar BongaigaonChirang783394,2403983.07
38,2011-2012,Assam,020740040,BORO BAPTIST CONVENTION,HARISINGAHARISINGA784510,1418462.00
39,2011-2012,Assam,020740042,BRAHMAPUTRA ENVIRONMENT CONSERVATION AND COMMUNITY MANAGEMENT GROUP,Vill Kalaigaon Post KalaigaonKalaigaon784521,0.00
40,2011-2012,Assam,020720004,Burrows Memorial Christian Hospital Society,Banaskandi CacharAssam-788101,1303994.62
41,2011-2012,Assam,020810002,Cachar Hill Tribes Synod,Haflong  North CacharAssam-788819,659450.00
42,2011-2012,Assam,020830003,Carmel Nilaya,Post- Cinnamara  JorhatAssam-785008,0.00
43,2011-2012,Assam,020740001,Catholic Church,Tangla  DarrangAssam-784521,2058784.00
44,2011-2012,Assam,020740002,Catholic Church,Dimakuchi DarrangAssam-784526,17000.00
45,2011-2012,Assam,020740010,Catholic Church,Rangpara  Sonipur Assam-784505,165700.00
46,2011-2012,Assam,020740011,Catholic Church,Borpukhari SonitpurAssam-784174,81625.00
47,2011-2012,Assam,020740012,Catholic Church,Tetenbari SonitpurAssam-784171,178650.00
48,2011-2012,Assam,020740013,Catholic Church,Borgang SonitpurAssam-784167,81625.00
49,2011-2012,Assam,020740015,Catholic Church,Gohpur SonitpurAssam-784168,0.00
50,2011-2012,Assam,020740016,Catholic Church,PO: Nahargari Dholaibil  SonitpurAssam-784182,305826.00
51,2011-2012,Assam,020740017,Catholic Church,Mangaldai  DarrangAssam-784125,0.00
52,2011-2012,Assam,020740018,Catholic Church,Rowta DarrangAssam-784508,0.00
53,2011-2012,Assam,020740019,Catholic Church,Ambagaon DarrangAssam-784510,0.00
54,2011-2012,Assam,020740023,Catholic Church,Tezpur SonitpurAssam-784001,0.00
55,2011-2012,Assam,020740026,Catholic Church,Missamari SonitpurAssam-784506,0.00
56,2011-2012,Assam,020740027,Catholic Church,Mazbath DarrangAssam-784507,0.00
57,2011-2012,Assam,020740028,Catholic Church,Udalguri DarrangAssam-784509,0.00
58,2011-2012,Assam,020760002,Catholic Church,Damra GoalparaAssam-783122,252200.00
59,2011-2012,Assam,020760005,Catholic Church,Soraibil KokrajharAssam-783350,211.00
60,2011-2012,Assam,020780002,Catholic Church,Baganpara NalbariAssam-781342,0.00
61,2011-2012,Assam,020780014,Catholic Church,Barpeta  Assam-781315,615665.00
62,2011-2012,Assam,020780016,Catholic Church,Barama NalbariAssam-781346,0.00
63,2011-2012,Assam,020790003,Catholic Church,Gogamukh North LakhimpurAssam-787029,0.00
64,2011-2012,Assam,020790004,Catholic Church,St. Francis Sales School Telem DhimajiAssam-787060,0.00
65,2011-2012,Assam,020790005,Catholic Church,Sabati North LakhimpurAssam-787001,211750.00
66,2011-2012,Assam,020790006,Catholic Church,Dhemaji North LakhimpurAssam-787057,0.00
67,2011-2012,Assam,020790007,Catholic Church,Harmutty  North LakhimpurAssam-784160,200000.00
68,2011-2012,Assam,020790008,Catholic Church,Doolahat North Lakhimpur Assam -787031,0.00
69,2011-2012,Assam,020790009,Catholic Church,Silapathar DhemajiAssam-787059,0.00
70,2011-2012,Assam,020790010,Catholic Church,Jowai DehmajiAssam-787060,0.00
71,2011-2012,Assam,020800004,Catholic Church,Umswai Karbi AnglongAssam-782410,628564.00
72,2011-2012,Assam,020800005,Catholic Church,Sojong Karbi AnglongAssam-782485,388047.00
73,2011-2012,Assam,020810001,Catholic Church,Haflong North CacharAssam-788819,0.00
74,2011-2012,Assam,020820006,Catholic Church,Prem Nagar Dhing Road PO HaiborgaonNagaon782002,2730530.90
75,2011-2012,Assam,020820007,Catholic Church,Catholic Mission Rangalu P.O. JakhalabandhaDist. Nagaon Assam-782136,66507.00
76,2011-2012,Assam,020820008,Catholic Church,Lumding NowgongAssam-782447,0.00
77,2011-2012,Assam,020820009,Catholic Church,Jagi Road NowgongAssam-782410,0.00
78,2011-2012,Assam,020820025,Catholic Church,Salana NowgaonAssam-782139,0.00
79,2011-2012,Assam,020780019,Catholic Church Doomni,Doomni BarpetaAssam-781373,179490.00
80,2011-2012,Assam,020760006,CATHOLIC CHURCH GOSSAIGAON,Gosaigaon KokrajharAssam-783360,0.00
81,2011-2012,Assam,020740024,Catholic Hospital,Borgang SonitpurAssam-784167,2931033.00
82,2011-2012,Assam,020740021,Catholic Relief Services,Tezpur SonitpurAssam-784001,0.00
83,2011-2012,Assam,020780079,Centre for Development Action and Appropriate Technology,Swapta Swahid Path Sarumataria G.S. Road GuwahatiKamrup Distt. (Assam)-781006,0.00
84,2011-2012,Assam,020780115,Centre for Development and Peace Studies,Annada Apts 77 KK Bhatta Road ChenikuthiGuwahati781003,888520.00
85,2011-2012,Assam,020780117,CENTRE FOR HUMANISTIC DEVELOPMENT,FIRST FLOOR HOUSE NO. 33 ASHIRWAD M.C ROAD BAROWARIGUWAHATI781003,0.00
86,2011-2012,Assam,020760012,Centre for Youth and Rural Development,V.P.O. Bengtol Dst. KokrajharAssam-783394,0.00
87,2011-2012,Assam,020720007,Christian Literature Houses Society,P.B.39 Court Road SicharAssam-,43743.00
88,2011-2012,Assam,020840015,Claretian Society For Integral Human Development,Claret Bhavan Borjhar PO Guwahati KamrupAssam-781015,15503040.00
89,2011-2012,Assam,020780097,Community Based Development Society of Kamrup,Village Dhulabari PO Deulkuchi Rangia KamrupAssam-781354,0.00
90,2011-2012,Assam,020810006,Community Resource Management Services,BPO Impol PO Mahur N.C.Hills Assam -788830,0.00
91,2011-2012,Assam,020780082,Congregation of Saint Therese- St. Joseph Region,Regional Mission House Sawkuchi- P.O.Kamrup Distt. (Assam)-781034,384853.20
92,2011-2012,Assam,020780008,Council of Baptist Churches in North East India,Pan Bazar Guwahati Assam-781001,8207904.00
93,2011-2012,Assam,020770005,D K Education Society,Noonmati GuwahatiGuwahati781020,0.00
94,2011-2012,Assam,020730006,Darul Uloom Balapara,Jogighopa P.O. Ashok Paper Mills Distt.- BongaigaonAssam-783388,2407771.00
95,2011-2012,Assam,020720016,Deshbandhu Club,Behara Bazar CacharAssam-788817,585100.00
96,2011-2012,Assam,020790019,DIKRONG VALLEY ENVIRONMENT AND RURAL DEVELOPMENT SOCIETY,H.O. No.1. Barpathar P.O. Gosaibari Dist. Lakhimpur Assam PIN-787033Lakhimpur/Guwahati787033,136825.00
97,2011-2012,Assam,020730004,Diocesan Development Society,Bishop's House Vill. Chapaguri P.O. HagrabariBongaigaon Assam-783380,6766219.00
98,2011-2012,Assam,020780069,Diocesan Social Service Society,Bishop's House Ambari GuwahatiKamrup Distt. (Assam)-781001,34169253.95
99,2011-2012,Assam,020720002,DIOCESE OF AIZAWL,Bishop's  House Ramthar Veng  Post- ChanmariAizawal Mizoram-796007,39521152.91
100,2011-2012,Assam,020740003,Diocese of Tezpur,Sonitpur TezpurAssam-784001,65859094.35
101,2011-2012,Assam,020800010,Diphu Catholic Church,Resurrection Church DIPHUKarbi Anglong Distt. (ASSAM)-782460,544777.00
102,2011-2012,Assam,020800011,Diphu Catholic Health Centre,Catholic Health Centre Chutianala (Post) DiphuKarbi Anglong Distt. (Assam)-782460,713168.00
103,2011-2012,Assam,020800015,Diphu Christian Hospital Society,Hilltop Christian School Colony Diphu Ward No. 9Karbi Anglong (Assam)-782460,0.00
104,2011-2012,Assam,020620010,District Community Development Programme,Bheludanga PO Kawaripathar Sonitpur Assam -784170,1326500.00
105,2011-2012,Assam,020750015,District Multipurpose Development and Information Centre,Rangalipathar Village Naharkatia DibrugarhAssam-786610,1275000.00
106,2011-2012,Assam,020780120,DISTRICT PHYSICALLY HANDICAPPED ASSOCIATION,Vill.- Goroimari P.O.- TukraparaGuwahati781137,0.00
107,2011-2012,Assam,020780070,Dolphin Foundation,River Valley Borthakur Clinic RoadKharghuli781004,0.00
108,2011-2012,Assam,020760011,Don Bosco,Bhatarmar KokrajharAssam-783370,1074200.00
109,2011-2012,Assam,020760015,Don Bosco Centre,GojaparaPO Dwarka783120,249910.00
110,2011-2012,Assam,020780093,Don Bosco Communications,Don Bosco Provincial House Guwahati KamrupAssam-781001,0.00
111,2011-2012,Assam,020760010,Don Bosco Educational Centre,P.O Dotma KokrajharAssam-783347,120000.00
112,2011-2012,Assam,020780048,Don Bosco School,Dakuapara  BokoAssam-781123,604000.00
113,2011-2012,Assam,020780105,Don Bosco Society,V I P Road Guwahati Kamrup Assam -781017,233930693.00
114,2011-2012,Assam,020780043,Don Bosco Youth Mission & Education Services,Pan Bazar GuwahatiAssam-781001,24936866.04
115,2011-2012,Assam,020780101,Down Town Charity Trust,G.S.Road Dispur GuwahatiKamrup (Assam)-781006,0.00
116,2011-2012,Assam,020840014,Dr.Kuntal Goswami Memorial Public Charitable Trust,Zoo Narengi Road Opp Gitanagar Police StationGuwahati Kamrup (Assam)-781024,0.00
117,2011-2012,Assam,020780126,Eastern Peoples Community Participation,P.D. Chaliha Road Hedayetpur House No.- 9 P.O.- Silpukhuri Dist-   Kamrup ( Metro)Guwahati781003,0.00
118,2011-2012,Assam,020830002,Eastern Theological  College, RajbariJorhat-785014,1382229.88
119,2011-2012,Assam,020750016,EDUCATED UNEMPLOYED WELFARE SOCIETY,THANA CHARALI NEAR OVERBRIDGEDIBRUGARH786001,5000.00
120,2011-2012,Assam,020780124,ENVIRON,60 LNB Road Hatigaon Guwahati-781006Guwahati781006,301296.00
121,2011-2012,Assam,020720006,Fellowship of Baptist Churches of North East India,P.B.No. 6 Court Road Silchar CacharAssam-788001,352669.00
122,2011-2012,Assam,020780130,Foundation for Social Transformation - enabling north east india,J.N Borooah lane JorpukhuriGuwahati781001,726791.00
123,2011-2012,Assam,020840021,FRANSALIAN AGENCY FOR SOCIAL CARE AND EDUCATION,M.S.F.S. PROVINCIALATESATAGAON-NARENGI781027,2950023.00
124,2011-2012,Assam,020700003,Fulkumari Bapuji Club,G.T.B.Road Dhubri Ward No.9 Near 2 No. Police Poin DhubriDhubri Assam-783324,0.00
125,2011-2012,Assam,020620009,Gana Chetana Samaj,Vill: Eragaon. PO Balipara SonitpurAssam-784101,16035551.00
126,2011-2012,Assam,020780127,GAUHATI LIONS EYE HOSPITAL,LIONS HOSPITAL ROADCHATRIBARI GUWAHATI781008,0.00
127,2011-2012,Assam,020820041,Gharoa,DTS Hill Colony Po-Lumding Disst. - NagaonAssam-782447,0.00
128,2011-2012,Assam,020820039,Global Health Immunisation & Population Control Organisation,Vill. Rangaloo P.O. Jumarmur Via- KathiatoliNagaon (Assam)-782427,0.00
129,2011-2012,Assam,020780102,Global Organisation for Life Development,Pub Sarabua Ist Byelane (West) Houst No.14 GuwahatiKamrup (Assam)-781003,0.00
130,2011-2012,Assam,020730009,GOOD EARTH EDUCATION TRUST,P.O.BENGTOLCHIRANG (BTAD)783394,0.00
131,2011-2012,Assam,020780015,Gram Swaraj Parishad,Rangia KamrupAssam-781354,0.00
132,2011-2012,Assam,020820027,Gram Vikas Parishad,At. Rangaloo P.O. Jumarmur Dist. NowgaonAssam-782427,0.00
133,2011-2012,Assam,020780123,grameen sahara,IInd Floor Samabai Building Kulshi Road ChhayagaonChhayagaon781124,0.00
134,2011-2012,Assam,020620005,Gramin,Biswanath College Road P.O.- Chariali Biswanath CharialiDistt.- Sonitpur (Assam)-784176,0.00
135,2011-2012,Assam,020640005,Gramya Vikash Mancha,Vill Kardaitola  P O Barbari NalbriNalbari781351,1796646.00
136,2011-2012,Assam,020660004,GREEN HEART NATURE CLUB,Ward No. 6 (Bazar) P.O. KokrajharKokrajhar783370,0.00
137,2011-2012,Assam,020840023,GREEN HERITAGE,H No-35 W No-55 Krishnapur BeltolaGuwahati781028,0.00
138,2011-2012,Assam,020770007,GREEN VALLEY DEVELOPMENT SOCIETY,VILL P.O. BALABHITA DIST. BARPETAASSAM781313,0.00
139,2011-2012,Assam,020650001,Guide,Uday Nagar Jungal Balahu Path Ward No.6 Morigaon TownAssam-782105,0.00
140,2011-2012,Assam,020780064,Guwahati Gana Seva Society,G.P.O.Box-100 GNB Road Ambari Guwahati KamrupAssam-781001,10766902.15
141,2011-2012,Assam,020780059,Guwahati Pain and Palliative Care Soceity,Rukmininagar P.O. Assam Sachivalay Guwahati KamrupAssam-781006,469330.00
142,2011-2012,Assam,020820032,Haji Abdul Majid Memorial Public Trust,P.O. Hojai Vill: Gopalnagar Dist: NagaonAssam-782435,0.00
143,2011-2012,Assam,020800006,Hawaipur Community Development Project,Hawaipur Karbi AnglongAssam-,4505936.00
144,2011-2012,Assam,020810008,Hmasawnna Pawl,Muolhoi Gilgal Veng BPO DintharHaflong788819,0.00
145,2011-2012,Assam,020820045,Hospitaller Sisters of Mercy (Mercy Hospital),Mullapatty No.2 Khutikalia PO Haibargaon NagaonAssam-782002,0.00
146,2011-2012,Assam,020780094,House for Orphan and Peoples Entity,Annex-Bibhawari G.S.Road (Near Rajib Bhawan)Kamrup (Dispur-Guwahati) Assam-781005,0.00
147,2011-2012,Assam,020780108,Human Resource Development Foundation of South Kamrup,Mirza (Jamartal) Kamrup AssamKamrup781128,0.00
148,2011-2012,Assam,020840011,Indian Council for Child Welfare,Assam State Branch Ambari G.N.B. RoadGuwahati (Assam)-781001,0.00
149,2011-2012,Assam,020620008,Institute of Integrated Resources Management,B.S. Road Mission Chariali PO DekargaonSonitpurTezpurSonitpur (Assam)-784001,589200.00
150,2011-2012,Assam,020830024,INSTITUTION FOR CULTURE AND RURAL DEVELOPMENT,Life  Plus Baghchung P.B. 125JORHAT785001,8468578.20
151,2011-2012,Assam,020780109,INTERGRATED DEVELOPMENT ASSOCIATION,VILL. CHAMATAPATHAR P.O. CHAMATAPATHAR(SONAPUR)GUWAHATI782402,0.00
152,2011-2012,Assam,020750009,International Brotherhood Mission,Jyoti Nagar  Naliapol DibrugarhAssam-786001,365500.00
153,2011-2012,Assam,020820058,Jagrata Eco Social Cultural Development Committee,Pub TupakuchiRaha782103,0.00
154,2011-2012,Assam,020820049,Jaluguti Agragami Mahila Samity,vill po Jalugati cd blockkapaliMorigaon782104,0.00
155,2011-2012,Assam,020800007,Jirsong Asong,Diphu Karbi AnglongAssam-782460,31007784.80
156,2011-2012,Assam,020810007,Jnana Jyoti Seva Samiti,C/o Good Shephered SchoolGunjung788819,1802906.00
157,2011-2012,Assam,020830021,Jorhat Christian Medical Centre,P.O.Barbheta JorhatAssam-785004,722198.71
158,2011-2012,Assam,020830025,JORHAT LIONS SERVICE TRUST,JORHAT LIONS EYE HOSPITAL. M.G.ROADJORHAT785001,7372817.00
159,2011-2012,Assam,020800013,Karbi Anglong Baptist Convention,Post Box 19 Diphu Karbi AnglongAssam-782460,1924637.39
160,2011-2012,Assam,020740030,Kokila Vikas Ashram,Sonapur SonitpurAssam-784168,0.00
161,2011-2012,Assam,020780009,Kumarikatta St Josephs Church,Kumarikatta NalbariAssam-781360,1287612.00
162,2011-2012,Assam,020640011,LOTUS PROGRESSIVE CENTRE,VILL AND PO MOROWA  DISTRICT  NALBARI STATE  ASSSAM  PIN 781348Town    Nalbari781348,0.00
163,2011-2012,Assam,020780051,Maa Kamakhya Society,Vill- Hajobari P.O Chandrapur Dist. KamrupAssam-781150,0.00
164,2011-2012,Assam,020820013,Makunda Christian Leprosy & General Hospital,P.O.- Bazaricherra District - KarimganjAssam-788727,841280.06
165,2011-2012,Assam,020780013,MALIGAON DON BOSCO SCHOOL MALIGAON,Maligaon Guwahati Assam-781011,684767.00
166,2011-2012,Assam,020840022,MANAV SARATHI,147. Udayan R.G.B Road GaneshguriGuwahati781005,0.00
167,2011-2012,Assam,020640006,Manav Shakti Jagaran,Vill Kairara PO Sondha Via Milanpur NalbariAssam-781337,0.00
168,2011-2012,Assam,020820031,Markazul Maarif,Markaz Road Madani Nagar Hojai Dist: Naugaon Assam-,18544124.32
169,2011-2012,Assam,020770008,Mission to the Hearts of Million,R.O-Barbaradi P.o- BhogerparBarpeta781309,0.00
170,2011-2012,Assam,020820001,Morigaon Mahila Mehfil,Civil Hospital Road Morigaon Town Ward No 7Morigaon782105,1807350.00
171,2011-2012,Assam,020820010,Muktidada Shrine,Hojai NowgaonAssam-782435,0.00
172,2011-2012,Assam,020740022,Muktidata Junior Seminary,Dhanwa Nagar TezpurAssam-784001,960000.00
173,2011-2012,Assam,020640003,Nalbari Zilla Samaj Seva Sangha,Nalbari Assam -781335,0.00
174,2011-2012,Assam,020780072,National Alliance Mission,"""Navajeevan"" Gandhibasti GuwahatiKamrup Distt. (Assam)-781003",1272028.24
175,2011-2012,Assam,020780129,Nations Life Foundation,Patgaon Rani Road BorjharGuwahati781005,1212865.00
176,2011-2012,Assam,020730007,Nature's Foster,Shastri Road North Bongaigaon Post Box. No. 41 BongaigaonAssam-783380,102496.00
177,2011-2012,Assam,020730010,Nazareth Women Empowerment Society,Post Box No. 26 BhowlaguriBongaigaon783381,949775.00
178,2011-2012,Assam,020660001,NEDAN FOUNDATION,WARD NO 7 BAGANSHALI P.O. KOKRAJHARDIST. KOKRAJHAR783370,951046.37
179,2011-2012,Assam,020820040,Nilanchal Unayan Sanskrita Parishad,Amlokhi (Bolibosty) PO Amoni Nagaon Assam -782138,0.00
180,2011-2012,Assam,020820035,Nirmala Nivas Convent,Salana  NowgaonAssam-,44375.00
181,2011-2012,Assam,020740004,North Bank Baptist Christian Association,Chariali Sonitpur Assam-784176,5323242.00
182,2011-2012,Assam,020740009,North Bank Baptist Medical Association,P.O. Box 144 TezpurAssam-784001,11230615.58
183,2011-2012,Assam,020830018,North East Affected Areas Development Society,Bandhekiakhowa P.O.  JorhatAssam-785107,6445244.00
184,2011-2012,Assam,020780100,North East Chamber of Commerce and Industry,10 Jannat 6th Bye Lane Zoo Narengi Road  GuwahatiKamrup (Assam)-781024,0.00
185,2011-2012,Assam,020780045,North East Diocesan Social Service Society,P O Box. 186 GuwahatiAssam-781001,22158816.36
186,2011-2012,Assam,020720013,North East India Baptist Bible College,P.B 41 Court Road  SilcharAssam-788001,4281527.00
187,2011-2012,Assam,020840010,North East Network,J.N. Borooah Lane Jorpukhuri GuwahatiAssam-793001,11040675.00
188,2011-2012,Assam,020660002,North East Research and Social Work Networking (NERSWN),W/No-8 Near Law College Hatimata KokrajharKokrajhar783370,2744225.00
189,2011-2012,Assam,020690002,North East Social Trust (NEST),Dighalipam Village Near Dichoi TinaliDergaon785614,0.00
190,2011-2012,Assam,020780046,North East Society for Protection of Youth,Ashram Road  GuwahatiAssam-781007,0.00
191,2011-2012,Assam,020720011,North East Vice Province, SilcharAssam-788005,2119301.00
192,2011-2012,Assam,020730001,North East Vision,Post Box- 32 Bongaigaon Distt.Assam-783380,564140.00
193,2011-2012,Assam,020780068,North East Voluntary Association of Rural Development,Dokhingaon KahiliparaKamrup Distt. (Assam)-781019,0.00
194,2011-2012,Assam,020840009,North Eastern Community Health Association,6th Mile G.S. Road Khanapara GuwahatiAssam-781022,245294.00
195,2011-2012,Assam,020780090,North Eastern Regional Youth Commission,Peace Centre G.N.B.Road AmbariGuwahati Kamrup (Assam)-781001,342173.00
196,2011-2012,Assam,020780113,North Eastern Social Research Centre,Jesuit House 5 Chief Secretary Lane Jahaz Ghat Uzan BazaarGuwahati781001,4851372.00
197,2011-2012,Assam,020780034,Omeo Kumar Das Institute of Social Change and Development,K.K.Bhatta Road Chenikuti Guwahati KamrupAssam-781003,0.00
198,2011-2012,Assam,020640004,Pancharatna Gramya Bikash Kendra,Dhekiabari (Kharshitha) Nalbari (Assam) -781370,0.00
199,2011-2012,Assam,020810005,Pavitra Athma Sevika Sanstha,Holy Spirit Convent New Airport RoadVillage Garal P.O. Bhattapara Guwahati781017,11660597.00
200,2011-2012,Assam,020710002,Peoples Action For Development,Mission BaligaonGogamukh787034,2264400.00
201,2011-2012,Assam,020780111,PFI FOUNDATION,46 Sijubari Masjid Path HatigaonGuwahati781038,2484000.00
202,2011-2012,Assam,020820044,Prahar Gusthi,B.Barua Road Amolapatty PO Nagaon Dist. NagaonAssam-782001,0.00
203,2011-2012,Assam,020830020,Prerona Protbandhi Shishu Bikas Kendra,Cinnamara JorhatAssam-785008,119558.00
204,2011-2012,Assam,020780089,Priscilla Centre,CBCNEI Compound Panbazar Guwahati Kamrup DistrictAssam-781001,2540315.00
205,2011-2012,Assam,020620011,Promotion And Advancement of Justice Harmoni and Rights of Adivasi,Sahityarathi PathDhanora Nagar Tezpur784001,3216391.00
206,2011-2012,Assam,020620013,PURVODAYA SEVA SAMAJ,Catholic ChurchBalipara784101,20064236.90
207,2011-2012,Assam,020720023,Rajiv Open Institute,Raj Villa Ambicapatty SilcharCachar Distt. (Assam)-788004,0.00
208,2011-2012,Assam,020840002,Ramakrishna Mission Ashram,Ramakrishna Mission RoadUlubari781007,133922.00
209,2011-2012,Assam,020820020,Ramakrishna Mission Seva Samiti, KarimganjAssam-788710,522786.00
210,2011-2012,Assam,020720012,Ramakrishna Mission Sevasram,Silchar CacharAssam-788004,977096.00
211,2011-2012,Assam,020780033,Rashtriya Gramin Vikas Nidhi,Silpukhuri Guwahati Assam-781003,3210989.00
212,2011-2012,Assam,020780122,RESOURCES CENTRE FOR SUSTAINABLE DEVELOPMENT (RCSD),HOUSE NO 20 KUNDIL NAGAR BY LANE 12 (WEST) RAJGARH ROADGUWAHATI781007,0.00
213,2011-2012,Assam,020780011,Resurrection Church (Catholic Church),Sonaighuli GuwahatiAssam-781018,0.00
214,2011-2012,Assam,020830016,Rua Rural Integrated Development Association,Kunwari Pukhuri JorhatAssam-785011,1142525.00
215,2011-2012,Assam,020740038,Rural Organisation for Social Service,Vill Tangla M.B.Road PO Tangla Odalguri BTADAssam-784521,0.00
216,2011-2012,Assam,020840007,Rural Volunteers Centre,Akajan  Dhemaji Assam-787059,4587553.99
217,2011-2012,Assam,020780053,Rural Women Upliftment Association of Assam,Japorigog H. S. Lane Sundarpur E.C.B. Road GuwahatiAssam-781005,541000.00
218,2011-2012,Assam,020740014,Sacred Heart Convent,Tezpur SonitpurAssam-784001,478204.00
219,2011-2012,Assam,020750010,Sacred Heart Province,Ferrado Institute P.O. TinsukiaAssam-786125,611846.00
220,2011-2012,Assam,020820030,Sadana Asom Gramya Puthibaral Sangha,Chanmari Road Haibargaon NowgaonAssam-782002,0.00
221,2011-2012,Assam,020780067,Salesian Sisters of North East India,St. Mary's Convent Maligaon GuwahatiKamrup Distt. (Assam)-781011,10948751.15
222,2011-2012,Assam,020820037,Salvatorians Society,Catholic Mission Dhing Road NagaonAssam-782002,2799442.00
223,2011-2012,Assam,020740025,Sanjivan Ashram,Dhekiajuli SonitpurAssam-784110,0.00
224,2011-2012,Assam,020780063,Satribari Christian Hospital,K.C.Chaudhary Road Guwahati Distt. KamrupAssam-781008,394458.00
225,2011-2012,Assam,020780081,Seraphina Seva Samaj,St. Clare's Convent Borjhar GuwahatiKamrup Distt. (Assam)-781015,37620.00
226,2011-2012,Assam,020720014,Seva Kendra,Bishops House  SilcharDist: Cachar Assam-788005,3417739.94
227,2011-2012,Assam,020750003,Seva Kendra,Bishop's  House Dibrugarh- P.O.Assam-786001,2632447.15
228,2011-2012,Assam,020780023,Shanti Sadhana Ashram,Beltola P.O. GuwahatiAssam-781028,393046.00
229,2011-2012,Assam,020520002,Shanti Seva Ashram,Balugada Sabji Bari Makum Road Tinsukia (Assam) -786125,3777.38
230,2011-2012,Assam,020780030,Shishu Sarothi Centre For Rehabilitation and Training For Multiple Disability,Off Ramkrishna Mission Road BirubariGuwahati781016,2387060.00
231,2011-2012,Assam,020740035,Sipajhar Diamond Club Community Centre,Sipajhar Distt. DarrangAssam-784145,0.00
