389,2011-2012,Karnataka,094630152,Diocese of Belthangady,Bishope House Udayanagar Belthangady Dakshina KannadaKarnataka-574214,12860102.91
390,2011-2012,Karnataka,094630048,Diocese of Mangalore,Bishop House Kodialwau MangaloreKarnataka-575003,11247311.45
391,2011-2012,Karnataka,094620021,Diocese of Shimoga,Shimoga  Karnataka-,25516352.00
392,2011-2012,Karnataka,094421249,Divine Light Charitable Trust,EL Shaddai No 13 2 Beside Assisi Church Hennur RoadBangalore560084,0.00
393,2011-2012,Karnataka,094421284,DIVINE LIGHT MINISTRIES,EL Shaddai No 13 2 Beside Assisi Church Hennur RoadBangalore560084,1.00
394,2011-2012,Karnataka,094420102,Divine Light Trust For the Blind,NO.277 Main Road White FieldBangalore Karnataka.-560066,272311.00
395,2011-2012,Karnataka,094440014,Divine Providence Convent,Tilakwadi  BelgaumKarnataka.-590006,1190581.00
396,2011-2012,Karnataka,094440025,Divine Providence Orphanage,Tilakwadi BelgaumKarnataka.-590006,207350.00
397,2011-2012,Karnataka,094590203,Divya Deepa Charitable Trust,Kenchalagudu village Rayanakere post Manandavadi RoadMysore570008,1023411.00
398,2011-2012,Karnataka,094421309,DIVYA DOWNS DEVELOPMENT TRUST,Janet Building 3rd Main 4th Cross Near Viveknagar Bus Stop Opp SBI ATM ViveknagarBangalore560047,0.00
399,2011-2012,Karnataka,094421089,Divya Jyothi Welfare Trust,No. 5 Rayappa Road Kammanahalli BangaloreKarnataka-560084,0.00
400,2011-2012,Karnataka,094420673,Divya Jyoti Vidya Kendra,Vishwa Bld Chikkanna Layout Sondeppa Circle BangaloreKarnataka-562123,0.00
401,2011-2012,Karnataka,094420109,Divya Shanthi Christian Association,60 Karamchanda Layout  LingarajapuramBangalore Karnataka.-560084,6182008.27
402,2011-2012,Karnataka,094420108,Divya Shanthi Trust,60Karmachanda Layout LingarajapuramBangalore Karnataka.-560084,2200899.50
403,2011-2012,Karnataka,094600012,Doigulip Tibetan Resettlement Hospital Association, North Kanara.Karnataka-,2246308.28
404,2011-2012,Karnataka,094630025,Dominican Fathers Mangalore Society,Ashok Nagar Mangalore Dakshina KannaraKarnataka-575006,5000827.11
405,2011-2012,Karnataka,094570179,Dominion Charitable Trust,N D 245 North Tank Block Coromandel Post Kolar Gold FieldsKOLAR   Karnataka-563118,597249.00
406,2011-2012,Karnataka,094690005,Don Bosco Integrated Rural Development Society,Trasi-Hosadu UdupiKarnataka-576247,3115770.00
407,2011-2012,Karnataka,094540070,DON BOSCO SOCIETY,PLOT 617 DARIYAPUR GDA LAYOUT NAGANAHALLI ROADGULBARGA585102,2502821.00
408,2011-2012,Karnataka,094610038,Don Bosco Society Deodurga,Don Bosco Chandanakere RoadDeodurga584111,3002341.00
409,2011-2012,Karnataka,094420661,Don Bosco Yuva Prachodini,Bannerghata Road Mount St Joseph PostBangalore Karnataka.-560076,0.00
410,2011-2012,Karnataka,094690015,DR U KRISHNA MUNIYAL MEMORIAL TRUST,NO.34 - C SHIVALLI INDUSTRIAL AREAMANIPAL576104,0.00
411,2011-2012,Karnataka,094420719,Dr. Jachami Rastriya Seve Peetha,49hb Samaja Road BasavanagudiBangalore Karnataka-,0.00
412,2011-2012,Karnataka,094590182,Dr. M. Nagaraju & Renuka Nagaraju Charitable Trust,No.197 14th Cross. Jayanagar MysoreKarnataka-570014,36189086.00
413,2011-2012,Karnataka,094630173,Dr. M.V. Shetty Memorial Trust,A.B.Shetty CircleMangalore Dakshina KannadaKarnataka-575001,391527.00
414,2011-2012,Karnataka,094421238,Dr. Prem Nath Agricultural Science Foundation,No.9 Layout No.1RMV Extn. 11 stage1Block1 Cross1MainBangaloreKarnataka-560094,0.00
415,2011-2012,Karnataka,094600019,Dre Gomang Buddhist Cultural Association,Tibetan Camp  Karnataka-,499964.00
416,2011-2012,Karnataka,094421298,Dream A Dream,No.398/E 17th Cross 9th Main Jayanagar 3rd BlockBangalore560011,12358217.00
417,2011-2012,Karnataka,094570107,Dream India Network,No 10-3 12th Main 13th CrossAnnapalayam Adugodi Post560030,0.00
418,2011-2012,Karnataka,094421401,DREAM SCHOOL FOUNDATION,A1/1 Dattaprasad Apartments 10th Main MalleswaramBangalore560003,3943690.00
419,2011-2012,Karnataka,094600008,Dregomangangari Khangtsen Cultural Society,Tebetan Colony Mundgod Uttara KannaraKarnataka-,1216583.00
420,2011-2012,Karnataka,094600073,DREPUNG GOMANG EDUCATION SOCIETY,P.O. TIBETAN COLONYTATTIHALLI MUNDGOD581411,23537067.81
421,2011-2012,Karnataka,094600043,Drepung Loseling Educational Society,Tatticalli PO Mundgog Karwar North KannadaKarnataka-,24302662.33
422,2011-2012,Karnataka,094600014,DREPUNG LOSELING LIBRARY SOCIETY,Adm Block Lama Camp No.II  Tatiehalli North KanaraKarnataka-581411,20145.00
423,2011-2012,Karnataka,094600022,Drepung Loseling Pethub KES,Tibetan Colony  Uttar KannaraKarnataka-581411,715261.00
424,2011-2012,Karnataka,094590096,Driklung Charitable Society, MysoreKarnataka-,5024489.30
425,2011-2012,Karnataka,094460021,Drishsti,29 MIG Housing Board Colony BidarKarnataka-,2543750.00
426,2011-2012,Karnataka,094590207,DSS NIRMALA PROVINCE,DSS NIRMALA PROVINCIAL HOUSE PETRANIKETAN H NO 134 SHIVAJI ROADN R MOHALLA570007,3298225.68
427,2011-2012,Karnataka,094640052,Durgadevi Mahila Samaja Devarayapatna,Tumkur Karnataka -572104,0.00
428,2011-2012,Karnataka,094380001,Dzogchen Shri Senha Charitable Society,PO:Tibetan Settlement Kollegal  talukChamarajanagarKarnataka-571457,12655555.41
429,2011-2012,Karnataka,094590108,Dzongkar Chocde College Mahayama Buddhist Cultural Association,Tibetan Settlement Gurupura Munrur Mysore.Karnataka-,4854089.04
430,2011-2012,Karnataka,094420875,Echo (Prathidwani),Convent road Kammanahalli St. Thomas Town P.O.BangaloreKarnataka-560084,6955470.00
431,2011-2012,Karnataka,094590196,ECO AGRI RESEARCH FOUNDATION,142 4TH MAIN 4TH CROSS BANNIMANTAP C LAYOUTMYSORE570015,0.00
432,2011-2012,Karnataka,094421013,Eco-Watch,506/1 New Diagonal Road3rd Block Jayanagar BangaloreKarnataka-560011,37280.62
433,2011-2012,Karnataka,094420148,Ecumenical Christian Centre,White Field Bangalore Karnataka. -560066,3345429.00
434,2011-2012,Karnataka,094421375,EDUCATION DEVELOPMENT CENTER INDIA,NO.42 39TH CROSS 8TH BLOCK JAYANAGARBANGALORE560070,2852143.00
435,2011-2012,Karnataka,094421001,Efcum India,No.316 1st B Cross3rd Block HRBR Layout St. Thomas Town Post560084,1264167.00
436,2011-2012,Karnataka,094640087,ELIM CHARITABLE TRUST,Swandena Hally Road  Sathyamangala Village  Sathyamangala Industrical Area  TumkurTUMKUR572106,0.00
437,2011-2012,Karnataka,094570017,Ellen Thoburn Cowen Memorial Hospital School And Nursing, Kolar Karnataka-563101,1277533.99
438,2011-2012,Karnataka,094421291,EMBASSY OF HOPE,NO.161 GIRI MALLIGE COMPLEX 3RD FLOOR BABUSAPALYA MAIN ROAD KALYAN NAGARBANGALORE560043,1318408.50
439,2011-2012,Karnataka,094420950,Emerging Young Leaders-india,18-Bornman Enclave KothanurBangalore560077,1863897.93
440,2011-2012,Karnataka,094420377,Emmanuel Church,7/1 High Street Cross Cooke TownBangalore Karnataka-560005,0.00
441,2011-2012,Karnataka,094421087,Emmanuel Orphanage and child Care Centre,Muninarasimhappa GardenBTM ist StageThavarekere BangaloreKarnataka-560029,0.00
442,2011-2012,Karnataka,094420599,Empacs Charitable  Society,15 M.G. Road BangaloreKarnataka.-560001,335403.00
443,2011-2012,Karnataka,094421352,Enable India,473/B Adugudi Road 8th Block KoramangalaBangalore560095,2756644.00
444,2011-2012,Karnataka,094421007,End Time Full Gospel Harvesters India,No.7 1st Main Road SK Garden BangaloreKarnataka-560046,0.00
445,2011-2012,Karnataka,094421112,End Time Harvest Ministries,NO 28KUVEMPUNAGARJALAHALLI EASTBANGALORE 560014BANGALORE560014,555530.00
446,2011-2012,Karnataka,094421056,Environment Support Group,S-3Rajashree Apartments18/57`1st main RdSRK GardensBannerghatta RdJayanagarBangaloreKarnataka-560041,3312043.24
447,2011-2012,Karnataka,094590189,Environmental and Social Education for Valuerable Committee,Sera Jhe MonasteryBylakuppee571104,379094.00
448,2011-2012,Karnataka,094420364,EQUITABLE TOURISM OPTIONS,Flat No A-2 1st Floor NO 21/7 2nd Cross 1st A Main RoadAtmananda Colony Sultanpalya RT Nagar Post560032,8314540.68
449,2011-2012,Karnataka,094570045,ETCM Hospital Community Health,ETCM  Hospital Kolar Karnataka-563101,0.00
450,2011-2012,Karnataka,094421339,Eternal Foundation Trust,32 Ground Floor  9th Cross Anjanappa Temple Street Ramaswamy PalyaMaruthi Sevanagar post Bangalore560033,0.00
451,2011-2012,Karnataka,094420344,Eternal Light Ministeries,Ground Floor Beech E - 1 Manyata Embassy Business Park Outer Ring RoadNagawaraNagawara560045,13209772.00
452,2011-2012,Karnataka,094420218,Evangelical Trust Association of South India,No 55 K.H.B. Colony Vth Block  2nd Cross Koramangala BangaloreKarnataka-560095,566844.00
453,2011-2012,Karnataka,094420620,EVANGELISTIC COMPANIONS OF INDIA,No 17 and 17 12th Main Jayanthi Nagar Main Road HoramavuBangaore560016,1913982.00
454,2011-2012,Karnataka,094480032,Evangelizing Asia for Christ,Gurupura villageBargenahalli(PO) Tarikere(TK)ChikkamagaloreKarnataka-577144,0.00
455,2011-2012,Karnataka,094421392,FAITH TRUST,No.85 ANJANAPPA LAYOUT 1 MAIN 2ND CROSS NARAYANAPURA ROAD KOTHANUR POST BANGALORE-560077 BANGALORE KARNATAKABANGALORE560077,352412.31
456,2011-2012,Karnataka,094630202,FAIZUL ISLAM ACADEMY OF GENJERAL EDUCATION,SHAMS KODIALGUTHU EAST 3RD CROSS M.G. ROADMANGALORE575003,0.00
457,2011-2012,Karnataka,094421465,FAME India,#156 II main 36th cross VII block JayanagarBangalore560082,109015.52
458,2011-2012,Karnataka,094421357,FAMILY DEVELOPMENT SERVICES,NO.34HANUMANTHAPPA ROADR.S PALYA SOONANGI LAYOUT KAMANAHALLIBANGALORE560033,7009961.00
459,2011-2012,Karnataka,094420325,Family Welfare Centre,No.- 21 Museum Road BangaloreKarnataka-560025,0.00
460,2011-2012,Karnataka,094420007,Far East Broadcasting Associates of India,NO. 7 Commissariat Road  BangaloreKarnataka.-560025,4758410.19
461,2011-2012,Karnataka,094570055,Farmers Development Agency,240 First Cross Nagarathpet Chickballapur KolarKarnataka-562101,0.00
462,2011-2012,Karnataka,094420274,Federation of Voluntary Organisation for Rural Development,44 New Bamboo Bazar Road Cantonment Bangalore Karnataka-560051,0.00
463,2011-2012,Karnataka,094420103,Fedina,No-154 Anjaneya Tehple Street Village-DohlurBangalore Karnataka.-560071,13066917.00
464,2011-2012,Karnataka,094420098,FELLOWSHIP WITH MENTALLY RETARDED INDIA,No. 7 80 Feet Road 6th Block KoramangalaBangalore Karnataka.-560095,9589884.60
465,2011-2012,Karnataka,094420459,Fence,57 1st Floor3 rd Main 4th Cross BangaloreKarnataka.-560018,2189789.00
466,2011-2012,Karnataka,094540054,Feroz Shah Memorial Education Society,H.No.1-414 near Old I.B. Station Bazar PO Box No.92 GulbargaKarnataka-585102,0.00
467,2011-2012,Karnataka,094421078,Fides India Society,Vinayalaya 18th Cross Malleswaram BangaloreKarnataka-560055,7719328.00
468,2011-2012,Karnataka,094420401,Forum  for Alternative Net Work Systems,33/1 Cozy Apartments Bangalore.Karnataka-,0.00
469,2011-2012,Karnataka,094421348,FOUNDATION FOR EXCELLENCE INDIA TRUST,840 MHT House First Floor 5thMainIndiranagar First Stage560038,32199736.13
470,2011-2012,Karnataka,094421481,Foundation for Revitalization of Local Health Traditions,74 2 Jarakabande Kaval Post Attur Via YelahankaBangalore560106,3176591.00
471,2011-2012,Karnataka,094630010,Fr. Mullars Centenary Charitable Society,PB 501 Kankanady Mangalore  Dakshin KannadaKarnataka-575002,0.00
472,2011-2012,Karnataka,094630014,Fr. Mullers Charitable Institutions,Kankanady Mangalore  Dakshin KannadaKarnataka-575002,160839.00
473,2011-2012,Karnataka,094630032,Fr. Patrao Hospital,Darbe PutturSouth KanaraKarnataka-,161775.00
474,2011-2012,Karnataka,094590040,Fraciscan Sisters of Mary Assumption Convent,Kollegal Taluk Kornataka  -571440,3568154.50
475,2011-2012,Karnataka,094420255,Franciscan Service Society,PB No.3417 Koramangala BangaloreKarnataka-560034,2555155.00
476,2011-2012,Karnataka,094421356,FRANCISCAN SISTERS OF ALL SAINTS,Alverna Bhavan S.O.S Post Kalena Agrahara Bannerghatta RoadBangalore560076,1627199.00
477,2011-2012,Karnataka,094420427,Franciscan Sisters of Immaculate Soceity,6 Zangford Gardens BangaloreKarnataka-,4370547.00
478,2011-2012,Karnataka,094420124,Franciscan Sisters of Mary,Mariam Nivas Providence Convent Housur Road Dharmaram College Dist.- Bangalore Karnataka-560029,2225677.63
479,2011-2012,Karnataka,094421002,Franciscan Sisters of Mary Hosadurga,Convent of O.L. of Providence Hosur RoadDharmaramCollege PostBangaloreKarnataka-560029,8786566.00
480,2011-2012,Karnataka,094421325,FRANCISCAN SISTERS OF ST ELIZABETH (BANGALORE),SAINT ELIZABETHS HOUSE 27/28 4TH B CROSS MARUTHINAGAR MADIWALABANGALORE560068,1432737.00
481,2011-2012,Karnataka,094440053,Fransalian Adarsh Balbhawan Trust,Kakkeri BelgaumKarnataka.-590106,0.00
482,2011-2012,Karnataka,094420753,Freedom Foundation,180 Hennur Cross Bangalore Karnataka-560043,8552830.00
483,2011-2012,Karnataka,094421455,FREUDENBERG TSUNAMI VICTIMS REHABILITATION FOUNDATION,3RD FLOOR SILVER JUBILEE BLOCK MISSION ROAD 3RD CROSS B/H UNITY BLDG.BANGALORE560027,7596000.00
484,2011-2012,Karnataka,094420793,Friends Camphill India,7 Kesavraj Layout Off Cambrdge Rd Ulsoor BangaloreKarnataka-,1497591.49
485,2011-2012,Karnataka,094460051,Friends Charitable Trust,"Christian House 
Village/PostBackchowdi Tq. 
BidarBidar585403",4714975.00
486,2011-2012,Karnataka,094421451,FRIENDS OF SICK ASSOCIATION,4th Floor Kempfort Building 97 Old Airport RoadBangalore560017,0.00
487,2011-2012,Karnataka,094421179,FSL India Field Services and inter-cultural Learning,No.453 1st Floor 15th CrossLakkasandra Wilson Garden560030,16958882.00
488,2011-2012,Karnataka,094421123,Full Gospel Church In India Trust,No.14/1 2nd CrossITC Colony Main Road JeevganahalliBangalore  Karnataka-560005,1503766.00
489,2011-2012,Karnataka,094450030,Full Gospel Ministry Trust,Full Gospel Church of Christ Netaji Nagar Tunga Bhadra DamBellary Karnataka-583225,0.00
490,2011-2012,Karnataka,094421290,Functional Vocational Training and Research Society,19 3rd Cross Hutchins Road St. Thomas Town PostBangalore560084,48251675.00
491,2011-2012,Karnataka,094590144,G S B Bankers Educational & Welfare Trust,No.2250 Mukunda Sadana JIB Road Cross MysoreKarnataka-570005,4433.00
492,2011-2012,Karnataka,094600059,Gaden Jangtse Dhora Khangtsen Buddhist Cultural Society,Lama Camp No.1 PO: Tibetan Colony Mundgod KarwarUTTARA KANNADA  Karnataka-581411,14627353.00
493,2011-2012,Karnataka,094600017,Gaden Jangtse Norling College,Lama Camp No. 1PO Tibetan Colony   Jaltiballi Mundgod North KannaraKarnataka-581411,6023456.85
494,2011-2012,Karnataka,094600026,Gaden Shartse Handicraft Centre,Tibetan Colony Uttara KannadaKarnataka-581411,0.00
495,2011-2012,Karnataka,094600025,Gaden Shartse Norling College Buddhist Cultural Association,LC 1 Tibetan Colony Uttar KannadaKarnataka-581411,306643.34
496,2011-2012,Karnataka,094600058,Gajang Kongpo Buddhist Cultural & Welfare Association,Lama Camp No.1 PO: Tibetan Colony Mundgod KarwarUTTARA KANNADA  Karnataka-581411,637170.00
497,2011-2012,Karnataka,094600071,GAJANG MEDICAL SOCIETY,GADEN JANGTSE DRATSANG LAMA CAMP NO. 1POST TIBETAN COLONY581411,5444563.00
498,2011-2012,Karnataka,094600051,Gajang Tsawa Himalayan Buddhist Cultural Association,Gajang Tsawa Khangtsen Lama Camp No.1po:tibetan ColonyKarwaruttara Kannadakarnataka-581411,16566564.00
499,2011-2012,Karnataka,094360011,GARDEN CITY JEEVITHA ANATHASHARAMA,PRUTHVI NIVASMANJUNATHA LAYOUT BANK COLONYANANDAPURA MAIN ROAD T.C. PALYA K.R. PURAMBANGLORE560036,152644.00
500,2011-2012,Karnataka,094420854,Gateway International,"No. 29-34 Trinity Christina Layout
Gubbi Road KothanurBangalore560077",971648.00
501,2011-2012,Karnataka,094421029,GATEWAY MINISTRIES,No.28 Trinity Christina LayoutGubbi Road Kothanur560077,5000844.25
502,2011-2012,Karnataka,094420946,Gaulbert Bhavan-Centre for Spiritual Renewal,Thambuchettipalaya Krishanrajapuram BangaloreKarnataka-560036,21806000.00
503,2011-2012,Karnataka,094540036,Gayatri Urban and Rural development Society,11-168/2 BrahampurGulbarga  Karnataka-585103,0.00
504,2011-2012,Karnataka,094420587,Gerizm Rehabilitation Trust,Ejipura Vivek Nagar BangaloreKarnataka-560047,10015287.75
505,2011-2012,Karnataka,094420705,Ghousia Industrial & Engineering Trust,Hosur Road BangaloreKarnataka-560029,0.00
506,2011-2012,Karnataka,094421219,Gilead Ministries,No.74/19-20Trinity Paradise9th Cross10thMainMaruthi LayoutHennur crossBangalorekarnataka-560043,668920.20
507,2011-2012,Karnataka,094420957,Giovannean Charitable Trust,St.johns Valleymylasandrabegur Po BangaloreKarnataka-560068,2557394.00
508,2011-2012,Karnataka,094421299,GLOBAL VISION TRUST INTERNATIONAL,69/70 LAKSHMINARAYANA LAYOUT5TH MAIN ROAD3RD CROSSMUNNEKOLALUMARTHAHALLIBANGALORE560037,233001.75
509,2011-2012,Karnataka,094420859,Globe Eye Foundation,Siddhi Eyecare Centre 38/1  C.m.h. Roadindiranagar            Bangalore-560038,98232.00
510,2011-2012,Karnataka,094421431,Gloria Educational and Charitable Trust,No6 3rd floor 9th main road 2nd block jayanagarBangalore560011,0.00
511,2011-2012,Karnataka,094490023,Gnana Jyothi Education and Social Welfare Society,Nrupatunga Extn. Ganesha Krupa near R.T.O.office ChitradurgaKarnataka-577501,0.00
512,2011-2012,Karnataka,094421373,GNANODAYA SHIVAJYOTHI TRUST (R),# 462 10TH CROSS 80 FEET ROAD GIRINAGAR 2ND PHASEBANGALORE560085,0.00
513,2011-2012,Karnataka,094421466,GOD OF COMPASSION MINISTRIES,25 A Oil Mill Road Narayanappa street  LingarajapuramBangalore560084,0.00
514,2011-2012,Karnataka,094420136,Godavari Delta Steward Association,10 Hall Road Bangalore Karnataka. -560005,380000.00
515,2011-2012,Karnataka,094520010,Good News Welfare Society,Kalghatgi Dharwad Karnataka-581204,289478.00
516,2011-2012,Karnataka,094590031,Good Shepherd Convent,Laskar Mohalla  Mysore Karnataka.-,2755665.81
517,2011-2012,Karnataka,094590208,GOOD SHEPHERD MISSION,276 D 20th main 1st stageJ P  NAGAR570008,0.00
518,2011-2012,Karnataka,094420033,Good Shepherd Society,Good Shepherd Convent Museum Rd BangaloreKarnataka-560025,34100878.94
519,2011-2012,Karnataka,094570234,GOODNEWSCOMPREHENSIVECHARITABLETRUST,#92josephcottagemaruthinagarBEMLpoKGFkolargoldfields563115,0.00
520,2011-2012,Karnataka,094420159,Goodwill International Association,No.2 7th cross Bazar street Neelsandra Bangalore.-560047,2071831.00
521,2011-2012,Karnataka,094630171,Govanithasharaya Trust,Dwaraka Kodial Guthu East Kodial Bail Mangalore(DK)Karnataka-575003,24190.00
522,2011-2012,Karnataka,094680003,Gowrishankar Human Welfare Association,Kushtagi KoppalKarnataka-584121,0.00
523,2011-2012,Karnataka,094421275,Grace Baptist Church Trust,No.46th Cross Pukhraj LayoutBannerghatta Road.Bangalore560030,2217229.00
524,2011-2012,Karnataka,094421326,Grace Child Care and Community Development,NO.192 7TH CROSS  1st STAGE PILLANNAST. THOMAS TOWN  POST560084,28580.00
525,2011-2012,Karnataka,094421419,Grace Fellowship Charitable Trust,No.24 Old No. 535 Ejipura Main Road 8th Cross Viveknagar PostBangalore560047,326253.00
526,2011-2012,Karnataka,094420410,Grace Gospel Mission,No.1122 Kuppureddy Compound 5th A Cross Road Triveni RoadYaswantpur Bangalore. Karnataka-,8640387.38
527,2011-2012,Karnataka,094440057,Gram Parivarthan Kendra,3820 Kotwal Galli BelgaumKarnataka.-590002,0.00
528,2011-2012,Karnataka,094520065,GRAMA SHIKSHANA CHARITY FOUNDATION,PARASAPUR VILLAGEHUBLI580024,0.00
529,2011-2012,Karnataka,094570024,GRAMA VIKAS,"Honnsetthalli Village
Yalgondahalli Post Mulbagal Taluk Pin code-563 127
Kolar District KARNATAKA.Mulbagal563127",13717453.02
530,2011-2012,Karnataka,094490009,Grameen Abhivridhii Mattu Adhyana Trust,Vani Nilaya 3rd Cross VP Extn Chitrtadurga Karnataka-577501,0.00
531,2011-2012,Karnataka,094420768,Grameena Abyudaya Sea Samsthe,IV Ward Court Road Rojipura Doddabalapur BangaloreKarnataka-561203,2692250.00
532,2011-2012,Karnataka,094570136,Grameena Mahila Okkuta,Honnsetthalli Yelagondahalli P.O. Mulbagal TalukKolar Karnataka.-563127,1262585.00
533,2011-2012,Karnataka,094370009,GREAT JOY IN THE CITY MINISTRIES,20 Sunanda Building1st MainChikkabidarakalluTumkur RoadBangalore-560073Bangalore560073,0.00
534,2011-2012,Karnataka,094420796,Green Foundation,"No36 1st Floor 1st Main 2nd Cross 
Ashwathnagar RMV 2nd stage 
Behind Government School 
Bengaluru 560094
KarnatakaBENGALURU560094",4838880.00
535,2011-2012,Karnataka,094600046,Green India Trust,Sai Krupa JN Rd Nr Patil  Nrsn Home Dandeli Uttar KannaraKarnataka-,2603897.00
536,2011-2012,Karnataka,094420069,Green Pastures Educaqtion Trust,"2155East End ""C"" Main Road   Northbrowen JayanagarBangalore Karnataka.-560069",100703.00
537,2011-2012,Karnataka,094490036,GROUP FOR ORGANIZING AND DEVELOPMENT SOCIETY,S.N COMPLEXUPSTAIRBESIDE VIDHYA VIKAS SCHOOLCHITRADURGA577501,0.00
538,2011-2012,Karnataka,094590069,Group For Urban & Rural Development,19/A1Cross II Stage Vishweshwar Nagar Mysore Karnataka-570008,0.00
539,2011-2012,Karnataka,094421319,GROWTH IN FRATERNITY TRUST,106 2ND E CROSS OMBR LAYOUT CHICKBANASAWADIBANGALORE560033,0.00
540,2011-2012,Karnataka,094580008,Gulabi Sadana,R.M.Halli Chinakurli Pandavapura MandyaKarnataka-571455,326081.07
541,2011-2012,Karnataka,094540005,Gulbarga Boys Hostel,Methodist Church Compound Gulbarga Karnataka-585102,360072.00
542,2011-2012,Karnataka,094590078,Gundlapet Parish Society,Our Lady Of Lourdes Church GundlapetMysore 571111-,82800.00
543,2011-2012,Karnataka,094570233,GVM Foundation,Chinnaganapalli Somanathapur Post Bagepalli tqChikballpur561207,0.00
544,2011-2012,Karnataka,094590091,Gydrodmed Tantric University Society,P.O.  Gurupura Teh.Hunsur  Distt.  MysoreKarnataka-571188,4826023.00
545,2011-2012,Karnataka,094420765,Habitat for Humanity India,164K.B.H. Colony 17th 'C' Main Road KoramangalaBangalore Karnataka-560095,0.00
546,2011-2012,Karnataka,094590148,Hadhong Khangtsen Buddist Cultural Society Sera Jey Lama University,Po: Bylakuppe Mysore Karnataka-571104 -,0.00
547,2011-2012,Karnataka,094630033,Harekala Landless Poor & Marginal Farmers Development Society,Kisan Nagar Harekala Mangalore Dakshin KanaraKarnataka-,0.00
548,2011-2012,Karnataka,094550013,Harsita Alur Yojane,Kabbinahalli Hardanahalli Post H.N Pura Taluk HassanKarnataka-573213,0.00
549,2011-2012,Karnataka,094420998,Harvest India,NO.37 ESTHER HARMONY N NAGENAHALLI KOTHANUR P O  BANGALORE - 560 077BANGALORE560077,0.00
550,2011-2012,Karnataka,094421017,Harvest International Ministries,238Dayanandanagar Srirampuram BangaloreKarnataka-560021,539756.00
551,2011-2012,Karnataka,094630149,Hasta Shilpa Trust,50 Anantnagar Manipal UdipiKarnataka.-,277476.00
552,2011-2012,Karnataka,094690008,Hattiangady Sri Siddhivinayaka Kshetra Development Trust,Sumukha BuildingHattiangady Kundapura taluk UdupiKarnataka-576283,130586.00
553,2011-2012,Karnataka,094421261,Have A Heart Foundation,No. 14 Bachammal RoadCox Town560005,3305607.00
554,2011-2012,Karnataka,094420748,HBS Hospital Trust,No.58 Cockburn Road Bangalore Karnataka-,0.00
555,2011-2012,Karnataka,094420919,Healing Stripes Trust,NO.60 AND 62 JP LOTUS FLAT NO.102 IST CROSS 3RD STREET IST BLOCK PRAKRUTHI TOWNSHIP BABUSABPALYA KALYANANAGAR POST BANGALORE 560 043BANGALORE560043,446535.00
556,2011-2012,Karnataka,094490026,Health Environment And Socio Economic Literacy Project,Vedavathi Nagar Hiriyur Taluk ChitradurgaKarnataka-572143,109850.00
557,2011-2012,Karnataka,094421432,HEALTH INDIA,489 4TH MAIN A BLOCK 2ND STAGE MILK COLONY MALLESWARAM WESTBANGALORE560055,0.00
558,2011-2012,Karnataka,094590209,Heardsfoundation(Health Environment Education and Rural development service foundation),T.A.P.C.M.S.Building Near Post OfficePeriyapatna571107,0.00
559,2011-2012,Karnataka,094420412,Heart of Jesus Society,40/2C Wellington StreetRichmond Town560025,13361496.00
560,2011-2012,Karnataka,094421008,Help a Child and Woman of India,1005 Kacharkanahalli1005 Kacharkanahalli560084,11185554.01
561,2011-2012,Karnataka,094421054,Help us Build Ministries,No.72 Type III 12th Block Nimhans Qtrs BangaloreKarnataka-560011,1189823.00
562,2011-2012,Karnataka,094630205,HELPERS OF MOUNT ROSARY TRUST,ALANGARMOODBIDRI574227,0.00
563,2011-2012,Karnataka,094421030,Helping Hand Trust,Sadbhavana PBN 5602 Sanitorium CampusRajajajinagarI Block Bangalore Karnataka-560010,646507.00
564,2011-2012,Karnataka,094421048,Helping Hand Welfare Society,Sunshine Home Kalkere Village Hormavu Post BangaloreKarnataka-560043,143216621.84
565,2011-2012,Karnataka,094421390,HELPING HANDS INDIA,Post Box. 512 Frazer TownBangalore560005,0.00
566,2011-2012,Karnataka,094420848,Helping Hands India Trust,1/19St. Thomas Town Post Lingarajapuram BangaloreKarnataka.-560084,1619740.00
567,2011-2012,Karnataka,094421306,HELPLINE CHARITABLE TRUST,126 30Th Main 6th Phase  JP NagarBagalore560078,65475.00
568,2011-2012,Karnataka,094420935,Helps International,No. 4 A Block 1st Cross BRR Layout Bear R K Plaza DoDDA BanaswadiBangalore560043,193450.00
569,2011-2012,Karnataka,094421328,HEMOPHILIA SOCIETY BANGALORE CHAPTER,No. 115/1-2 Shivneri Cunningham RoadBangalore560052,632433.40
570,2011-2012,Karnataka,094420926,Hengasara Hakkina Sangha,36 Ground Floor 11th A Main13 Cross 5th Block Jaynagar560041,1280531.00
571,2011-2012,Karnataka,094421188,HID Forum,No 21-4 Prakriya 2nd Cross 1st A MainAtmananda Colony  Sultan Palya RT Nagar Post560032,2911501.74
572,2011-2012,Karnataka,094600009,Himalayan Indian Buddhist Students Welfare Association,Deoung Monastic Univ Po Tibetan Cly Mundgod Uttara KannaraKarnataka-581411,2847731.00
573,2011-2012,Karnataka,094420215,Hindu Seva Pratishthana,Ajitashree 8/28Bull Temple Road560004,2527618.75
574,2011-2012,Karnataka,094421400,HIPC TRUST,No.143 Avanti Building 3rd Main road 1st block Koramangala Bangalore-560034Bangalore560034,431540.87
575,2011-2012,Karnataka,094421377,HIPPOCAMPUS READING FOUNDATION,No 525 16th Main 3rd Block KoramangalaBangalore560034,1246533.00
576,2011-2012,Karnataka,094590073,Holy Cross Convent & Hospital,Kamagare Kollegal Taluk Mysore Karnataka-571443,268357.00
577,2011-2012,Karnataka,094480017,Holy Cross Hospital,Baskal ChikmagalurKarnataka-577132,844675.00
578,2011-2012,Karnataka,094421256,Holy Spirit Ministries,RR No 7 Weeh 2779 Opp Divya Academic School Kodigehalli Main RoadAyyappa Nagar K R Puram PO Bangaluru560036,0.00
