770,2011-2012,Karnataka,094420157,Katharina Kasper Social Service Society,38/4 Davis Road BangaloreKarnataka.-560084,44342702.00
771,2011-2012,Karnataka,094420158,Katherina Kesper Leprosy Control Scheme,16 Hutchins Rd Cook Town  BangaloreKarnataka-560005,504500.00
772,2011-2012,Karnataka,094421258,Kaveri Nadu Vidya Samsthe,No.6/2Kadukaenahalli Mahadevpura post Nelamangala Taluk Banglore Rural Dist. Bangalore-562123 Karnataka StateIndiaBangalore562123,0.00
773,2011-2012,Karnataka,094420910,Kerygma,No.153 Aashirvaad 3rd Main 6th Cross Ramaiah Layout Kamanahalli Bangalore-560084Bangalore560084,4486053.37
774,2011-2012,Karnataka,094421342,Kesari Trust,#013A Blockkomarla brigade residencyuttarahalli main roadBANGALORE560061,0.00
775,2011-2012,Karnataka,094630137,Keshav Smrithi Samavardhana Samiti,Pratap Nagar MangaloreKarnataka-575003,0.00
776,2011-2012,Karnataka,094421189,Keshava Seva Samithi,# 447 24th Main BTM Layout 2nd Stage BangaloreKarnataka-560076,0.00
777,2011-2012,Karnataka,094560014,KGF Don Bosco Society,St. Joseph's Church KGFKarnataka.-,756324.59
778,2011-2012,Karnataka,094570110,KGF Womens Association,Kolar Karnataka -,1152200.00
779,2011-2012,Karnataka,094540023,Khaja Education Society,Rauza Buzurg Gulbarga Karnataka-585104,0.00
780,2011-2012,Karnataka,094440026,Khanapur Girls Home Trust,PB No. 5  BelgaumKarnataka-591302,30000.00
781,2011-2012,Karnataka,094420895,Kirubai  Project,675/3 Block 8 Cross1st Stage Hbr Layout BangalaoreKarnataka-560043,5263681.00
782,2011-2012,Karnataka,094440117,KITTUR RANI CHANNAMMA MEMORIAL COMMITTEE,KITTURBAILHONGAL591115,0.00
783,2011-2012,Karnataka,094570049,KNH Account Siac of Methodist Church in Southern Asia,Mission Compound  KolarKarnataka-563101,0.00
784,2011-2012,Karnataka,094400018,Kolache Pradeshada Parisara Parivathane Mattu Halligala Abhiviruddi Samste,1879/21 1st Main Cross A Block Shekarappa Nagara R M C Link RoadDavanagere577003,0.00
785,2011-2012,Karnataka,094420145,Kollegal Girls Home Trust,5 (3) John Armstrong RoadRichards Town560005,3925457.00
786,2011-2012,Karnataka,094590030,Kollegal Parish Society,St Francis of Assisi Church Kollega Chamarajnagar MysoreKarnataka-571440,0.00
787,2011-2012,Karnataka,094420528,Koramangala Kannada & T.N. Primary School,Koramangala Rajendra Nagar Bangalore Karnataka.-560034,0.00
788,2011-2012,Karnataka,094400002,Koshis Handicapped & Disabled Welfare Educational Association,No.1444/1 9th Cross K. T J NagarDavangere Karnataka-577002,0.00
789,2011-2012,Karnataka,094421085,Kripa Trust,#26 Santosh Nilaya Byreshwara LayoutHennur BandeBangalore Karnataka-560043,13970530.00
790,2011-2012,Karnataka,094590054,Kripalaya Institute of Religious Studies,Bodadi  MysoreKarnataka-570006,3277502.00
791,2011-2012,Karnataka,094620030,Krishi Prayoga Pariwara,Krishinivasa Kuaruvalli Thirthahalli ShimogaKarnataka-577432,239544.00
792,2011-2012,Karnataka,094510016,Krist Seva Ashram,Vill Nokya PO Edathora South KodaguKarnataka-571254,1339735.67
793,2011-2012,Karnataka,094600038,Kruger Foundation for Child Aid,Sri Krishna NivasKARWAR581301,5268197.00
794,2011-2012,Karnataka,094421128,Krupa Kendra Trust,No. 2 1st Cross Sai Layout White Field BangloreKarnataka-560066,270093.86
795,2011-2012,Karnataka,094421420,KRUPA SOCIETY,PEACE HAVEN NO.21 5TH CROSS HUTCHINS ROADBANGALORE560084,786537.00
796,2011-2012,Karnataka,094590137,Krupalaya Trust,Alanahalli Sidhartha Nagar MysoreKarnataka-,0.00
797,2011-2012,Karnataka,094640026,Kumadvati Rural Development Society,No.32 Pld Bank Road. K.R Extn. Madhiujri Tumkur Karnataka-572132,0.00
798,2011-2012,Karnataka,094420595,Kutumba,26/5 Heer Chand Layout Cox Town  BangaloreKarnataka.-,718533.54
799,2011-2012,Karnataka,094421214,L&L Bhagwandas Sirwani Charitable Trust,No.203 Double Road Indiranagar Indiranagar II Stage BangaloreKarnataka-560038,978833.00
800,2011-2012,Karnataka,094590165,La Salette Nikethan Trust,La Salette NiketanMardur village Kasaba Hobli Hunsur Taluk Mysore Karnataka-571105,8658658.40
801,2011-2012,Karnataka,094630124,Lady Hill Society,Lady Hill Convent Ashok Nagar MangaloreKarnataka-575006,6037448.00
802,2011-2012,Karnataka,094421411,Lakshmi Rural Development Society,No 329 MEI Layout Hesaragatta Main Road Bagalagunte Nagasadra PostBangalore560073,0.00
803,2011-2012,Karnataka,094460066,Lal Bhadure Education Society,Sunder Nilaya Plot no-15 rampure colony B.V.B college roadBidar585401,0.00
804,2011-2012,Karnataka,094421273,LATTER GLORY MINISTRIES TRUST,No. 98 3rd Cross BDS Layout Dr Shivaramkaranth Nagar Main RoadBangalore560077,101006.00
805,2011-2012,Karnataka,094420603,Lavigerie Sola Study House,PB 1 Bommasandra Ind Estate PO BangaloreKarnataka.-562158,14702220.00
806,2011-2012,Karnataka,094450001,Leading Organisation for Rural Development,Sanjay Gandhi Nagar BellaryKarnataka-583104,0.00
807,2011-2012,Karnataka,094440017,Lefayette Hospital,Nipani BelgaumKarnataka-591237,2875602.44
808,2011-2012,Karnataka,094440114,LEOMEL SOCIETY FOR THE CARE OF THE DYING AND THE DESTITUTE,NO.10 COURT STREET CAMPBELGAUM590001,201165.95
809,2011-2012,Karnataka,094421268,LIFE CHALLENGE TRUST,NO.745LOGOS STREET RAMASWAMY PALYAKAMMANAHALLI MAIN RAODBANGALORE560033,2547309.00
810,2011-2012,Karnataka,094421231,Life for India,No.48Ragavappa Road BangaloreKarnataka-560033,37550.00
811,2011-2012,Karnataka,094421343,LIFE IN JESUS CHRIST PRAYER MISSION TRUST,"CONTONMENT BRANCH
NO 125 INFANTRY ROAD NHEAR MEDINOVA CENTRE BANGALOREBANGALORE560001",0.00
812,2011-2012,Karnataka,094630135,Link  Anti Addiction citizens committee,Sukh Nivas Britto Road Falnir Mangalore Karnataka-575001,0.00
813,2011-2012,Karnataka,094420321,Lions Club of Bangalore West Trust,No.5 Lions Eye Hospital Road(Off. J C Road)Bangalore560002,176244.48
814,2011-2012,Karnataka,094420320,Littel Sisters of the Poor,15 Hosur Road BangaloreKarnataka-,2342225.00
815,2011-2012,Karnataka,094421059,Little Flower  Service Society,Pushpa Sadan Kengeri Mysore Road BangalaoreKarnataka-560060,107937.00
816,2011-2012,Karnataka,094480004,Little Flower Church,N.R Pura  Chickmagalur Karnataka-577134,7010058.00
817,2011-2012,Karnataka,094420266,Little Sisters of Jesus Yeshu Ashram,Kammanhalli St Thomas Town BangaloreKarnataka-560084,454496.00
818,2011-2012,Karnataka,094630065,Little Sisters of the Poor,Christu Raj NivasNo.80 Maroli Kulshekar Post Mangalore  Dakshin Kannada Karnataka-575005,558010.00
819,2011-2012,Karnataka,094420262,Little Sisters of the Poor Home for Aged,No.80 Maroki Kuleshekar Mangalore Karnataka-575005,214848.00
820,2011-2012,Karnataka,094590011,Little Sisters Of The Poor Home For Aged,Mysore Karnataka -,70737.00
821,2011-2012,Karnataka,094421269,Living Hope Association,No.30 S1 Pravirs residency KHB road sultan palayaR.T. Nagar560032,1219449.00
822,2011-2012,Karnataka,094420883,Living Word Outreach,No.30 Krishna Reddy Layoutii Main Iii Crosshoramavu Main RoadBangalore Karnataka-560043,0.00
823,2011-2012,Karnataka,094420918,Liza's Home,No.63millers Road BangaloreKarnataka-560046,68055.00
824,2011-2012,Karnataka,094630192,LOBO TEACHERS FOUNDATION,DOOR NO. 15-13-785 JOS-VILLA KADRI COCONUT GARDEN ROADMANGALORE575002,0.00
825,2011-2012,Karnataka,094420445,Look Unto Jesus Ministries,No. 180 G Block Sahakar NagarBangalore560092,3508182.00
826,2011-2012,Karnataka,094600076,LOSELING ALTRUISTIC MEDICAL ASSOCIATION,LAMA CAMP NO II TIBETAN COLONYTATTIHALLI MUNDGOD581411,4802861.00
827,2011-2012,Karnataka,094540014,Lou Ann Long Methodist Girls Hostel, GulbargaKarnataka-,553496.25
828,2011-2012,Karnataka,094620003,Lourd Matha Church,Nagavally Kargal Shimoga Karnataka-577421,263493.25
829,2011-2012,Karnataka,094421132,Lovedale Foundation,No.91 1st Cross Nanjappa Gardens Kalyan Nagar P.O. BangaloreKarnataka-560043,979949.00
830,2011-2012,Karnataka,094460008,Lucile Colony Girsls,Hostel      Bidar Karnataa -,595574.00
831,2011-2012,Karnataka,094590205,M A A TRUST,PLATINUM JUBILEE AUDITORIUM        J K GROUNDSMYSORE570001,7339.00
832,2011-2012,Karnataka,094420982,M/s Imdad-E-Nisa Trust,No.32 Coles Road Frazer Town  BangaloreKarnataka-560005,438300.00
833,2011-2012,Karnataka,094421314,MABEN INTERNATIONAL FOUNDATION,No 65 1st Cross BDS Gardens Geddalahalli Kothanur P OBangalore560077,24328.00
834,2011-2012,Karnataka,094620036,Madeenath-Ul-Uloom Education Trust,Shikaripur JayanagarPO No.6 Shikaripur ShimogaKarnataka-577427,105385809.34
835,2011-2012,Karnataka,094420941,Mahabodhi  Maitri Mandala,14Kalidasa Road  Gandhinagar Bangalore Karnataka-560009,24691140.00
836,2011-2012,Karnataka,094630097,Mahatama Gandhi Memorial College Trust,Udupi Dakshin KannadaKarnataka-576102,44513.64
837,2011-2012,Karnataka,094640086,Mahathma Gandhi Rural Development And Youth Welfare Centre,Gowri Nilaya 2nd Floor 8th Cross Ashok Nagar TumkurTumkur572103,0.00
838,2011-2012,Karnataka,094440075,Mahila Abhivruddhi Mattu Samrakshana Samasthe,House No.480 patel Building Ghataprabha BelgaumKarnataka-591306,2116564.69
839,2011-2012,Karnataka,094420898,MAHILA DAKSHATA SAMITI KARNATAKA,CA4 BEL HBCS Layout 1st Block 1st Main 13th CrossVidyaranyapura560097,1268346.00
840,2011-2012,Karnataka,094420804,Mahila Seva Samaja,No.80 KR Road Bangalore.Karnataka-,0.00
841,2011-2012,Karnataka,094630126,Maithri Trust,Maithrihomenityanand NgDerlakatta   Mangalore Dakshin KannaraKarnataka-,2032982.00
842,2011-2012,Karnataka,094421333,Makkala Jagriti,30/1 8th Main Road MalleswaramBangalore560003,2588306.00
843,2011-2012,Karnataka,094620043,Malanad Social Service Society,Yojana Mandir Jubilee Nagar Godikoppa ShimogaKarnataka-577204,6234575.34
844,2011-2012,Karnataka,094580001,Malavalli Boys Home Trust,PB 2 Boys Home Malavalli 7(4) John Armstrong RoadBangalore Karnataka-560005,883207.24
845,2011-2012,Karnataka,094600060,Malenadu Education and Rural Development Society,Golikoppa. PO: Arasapur TQ. Sirsi Uttara KannadaKarnataka-581402,0.00
846,2011-2012,Karnataka,094420773,Mamatha Makkala Mandira,2 BDA Rd Muneswara Temple Rd  Nagarabhai 1st Phase Bangalore.Karnataka-,0.00
847,2011-2012,Karnataka,094420845,Manasa Centre for Development and Social Action,"MANASA Centre for Development and Social Action
 No.35 Anjanappa Complex Hennur Main Road
 Lingarajapuram St. Thomas Town.Bangalore560084",4741378.16
848,2011-2012,Karnataka,094630151,Manasa Rehabilitation and Training Centre,Pamboor Padubelle UduppiKarnataka.-,365123.63
849,2011-2012,Karnataka,094420749,Manava Seva Kendra,37/28th Cross Swimming Pool Extn Malleswaram BangaloreKarnataka-,0.00
850,2011-2012,Karnataka,094630178,Mandd Sobhann,Kalaangann Makale Shaktinagar Mangalore Dakshina KannadaKarnataka-575016,65805.00
851,2011-2012,Karnataka,094630086,Mangala Sewa Samithi,Balalsamrakshana Kendra Mangalore  Dakshin KannadaKarnataka-574159,119281.00
852,2011-2012,Karnataka,094630114,Mangalore Province of Congregation Sisters,St Raymonds Convent Vamanjur Mangalore Dakshina Kannada Karnataka-,3006351.00
853,2011-2012,Karnataka,094630073,Mangla Jyothi Integrated School,Mangalore Dakshina KannaraKarnataka-,4072014.28
854,2011-2012,Karnataka,094590025,Mangla Mandali,C/o St. Thomas Church Bandalli Po MysoreKarnataka-571439,0.00
855,2011-2012,Karnataka,094460044,Manigiri Welfare Trust,Maniknagar Humnabad BidarKarnataka-585353,0.00
856,2011-2012,Karnataka,094630148,Manipal Academy of Higher Education,University Building Madhav Nagar Manipal  UdupiKarnataka-,18899013.76
857,2011-2012,Karnataka,094690014,MANIPAL FOUNDATION,UNIVERSITY BUILDING MADHAV NAGARMANIPAL576104,0.00
858,2011-2012,Karnataka,094420598,Manush,NO 160 AMULYA FARMKYALASANAHALLI KOTHANUR POSTBangalore560077,3652776.00
859,2011-2012,Karnataka,094600075,MANUVIKASA,KARJAGI  PO BALUR SIDDAPUR TALUK UTTAR KANNADA DISTRICTSIDDAPUR581340,0.00
860,2011-2012,Karnataka,094420892,Maranatha Theological And Educational Trust,SakalavarapostBannerghatta Road,7207443.41
861,2011-2012,Karnataka,094540084,Margadarshi Society,"Plot No. 100/A Siddeshswar Nilaya 
Opp: Jai Bheem Auto Stand Ghatage Layout Road
CIB Colony Shakti NagarGULBARGA585103",0.00
862,2011-2012,Karnataka,094420709,Margdarshi The Association for Physically Challenged,47/1 Hulkul ComplexLalbagh Road560027,6058.00
863,2011-2012,Karnataka,094420992,Maria Kriipalaya Trust,Via Halengai Pakshikere Thokur PO Mangalore Karnataka-574146,7360252.00
864,2011-2012,Karnataka,094630118,Maria Kripa Society,Girls Centre Madanthyar  Dakshin KannadaKarnataka-574224,11238914.00
865,2011-2012,Karnataka,094630198,MARIA MANDIR TRUST,D.M.CONVENTKADABA574221,321700.00
866,2011-2012,Karnataka,094420307,Maria Niketan St Mary's Orphanage,2nd Cross Da Costa Layout St.Thomas Town Bangalore Karnataka-,184000.00
867,2011-2012,Karnataka,094620028,Maria Social Service Society,St.mary's Malankara Church Vinobanagara1st StageShimoga  Karnataka-577204,7420330.00
868,2011-2012,Karnataka,094630011,Marialayam Social Centre,Noojibathila  Dakshin KannaraKarnataka-,70000.00
869,2011-2012,Karnataka,094420463,Marianist Trust,P.B. 2549 No. 15 Curlee Street Richmond Town BangaloreKarnataka-560025,45953569.81
870,2011-2012,Karnataka,094420387,Marilac Study House,PO S.O S Bannerghatta Road Bangalore Karnataka-560076,1809604.00
871,2011-2012,Karnataka,094400023,MARSS-K (Organisation for Social Development),Training Research and Evaluation Centre #Regional Office 2nd Floor Bongale Drug House Building SH Main Road Harihar577601,0.00
872,2011-2012,Karnataka,094590037,Martahalli Parish Society,Marthahalli MysoreKarnataka-,192420.00
873,2011-2012,Karnataka,094420506,Mathew Memorial Society,122 Laxmana Murthy Nagar P.O Ramamurthy Nagar BangaloreKarnataka.-560016,0.00
874,2011-2012,Karnataka,094620040,Mathru Chaya-Sarvadharm Anathashram,No.47MIG 2nd Stage(Near Ganapathi Tample) Gopala-ShimogaKarnataka-577202,0.00
875,2011-2012,Karnataka,094421105,MATHRU EDUCATIONAL TRUST FOR THE BLIND,CA SITE #14 6TH A CROSS 5TH PHASE NEW TOWN YELAHANKA BANGALOREBANGALORE560106,3271780.00
876,2011-2012,Karnataka,094420522,Medical Mission Secular Institute,NO.7 Spencer Road BangaloreKarnataka-560005,602314.00
877,2011-2012,Karnataka,094420253,Medico Pastoral Association,47 Pottery Road Fraser Town BangaloreKarnataka.-560005,316002.11
878,2011-2012,Karnataka,094420911,Meenakshi Roof Over Roofless Trust,G-6emeraldwilson Manor Apartments 13th Crosswilson GardenBangalore Karnataka-560027,1436697.00
879,2011-2012,Karnataka,094440108,MEGA ASSOCIATION,4370/A1 CHAVAT GALLIBELGAUM590002,0.00
880,2011-2012,Karnataka,094510026,Mercana Parish Society,St. Michael's Church Madikeri Kodagu Karnataka-512001,0.00
881,2011-2012,Karnataka,094421354,Mercy Foundation Trust,No.131 12th Main Bandepalya  Garvebhavi palya  Hosur main RoadBangalore560068,0.00
882,2011-2012,Karnataka,094460004,Methodist Boys Hostel, Bidar Karnataka-585401,803208.00
883,2011-2012,Karnataka,094570013,Methodist Girls Composite Junior College,Kolar Karnataka -,0.00
884,2011-2012,Karnataka,094570014,Methodist Girls Composite Junior College,Kolar Town KolarKarnataka-563101,26094.62
885,2011-2012,Karnataka,094610001,Methodist Girls Hostel,Mission Compound Raichur Karnataka-584101,566132.00
886,2011-2012,Karnataka,094630044,Milagers Church,Hampankatta Milgres Mangalore Dakshin KannadaKarnataka-575001,0.00
887,2011-2012,Karnataka,094630016,Milagers Housing Society,Milgres Church Mangalore  Dakshin KannadaKarnataka-575001,0.00
888,2011-2012,Karnataka,094590115,Mira Aditi Centre,Sarasatipuram62 Ist Cross 4th Stage Mysore Karnataka-570009,1156378.00
889,2011-2012,Karnataka,094570232,MIRACULOUS VICTORY MINISTRY TRUST,Eaden Garden  Chigirapura village  Kammasandra Post via Oorgaumpet post Bethamangala Hobli Bangarapet Taluk  Kolar Dist  KarnatakaBethamangala563116,0.00
890,2011-2012,Karnataka,094480038,MISSION ONE MILLION,EMMANUEL CHILDRENS HOME HOSEMANE RANGANA HALLITARIKERI577144,724409.33
891,2011-2012,Karnataka,094420754,Mithra Foundation,290/7 Venkataramiah Lay Out Ramamurthy Nagar Road BangaloreKarnataka-,2137509.00
892,2011-2012,Karnataka,094420627,Mithra Jyothi,CA Site No. P-22 18th Cross 31st Main Sector-1 HSR LayoutBehind NIFT College560102,2629025.00
893,2011-2012,Karnataka,094580030,Mob Rural Health Centre,Room No.15 Govt. General Hospital MandyaKarnataka-571401,4146024.00
894,2011-2012,Karnataka,094420682,Mobility India,A.P.H. Campus Hennur Road St. Thomas Town BangaloreKarnataka-560084,32326325.12
895,2011-2012,Karnataka,094421468,Mohsin Shariff Educational and Charitable Trust,No 269  14th Cross  CMH Road  Indiranagar 2nd StageBangalore560038,0.00
896,2011-2012,Karnataka,094590092,Monstary of St. Joseph and Teresa,Bogadi MysoreKarnataka-570006,8843.00
897,2011-2012,Karnataka,094420295,Montfort Cottege Society,O.C.D. Madras Rd Indira Nagar BangaloreKarnataka-560038,1436736.00
898,2011-2012,Karnataka,094420223,Montfort Fathers Society,Mariya Bhavan Dharmaram College  BangaloreKarnataka-560024,14375109.00
899,2011-2012,Karnataka,094420132,Montfort Sisters,13 (old5/10) 7th Cross B. Street Jayabharat Nagar Banasvadi RoadBangalore Karnataka.-560033,3070262.00
900,2011-2012,Karnataka,094420641,Montfortian Society,109 Charles Campbeli Rd Cox Town BangaloreKarnataka-560005,3376014.00
901,2011-2012,Karnataka,094421425,Moogambigai Charitable and Educational Trust,#6 Appa Reddy Complex 1st Floor Upstairs of Corporation bank 5th Cross Mysore Road New GuddadahalliBangalore560026,1405031.00
902,2011-2012,Karnataka,094420290,Moria Seva Sangha,No.12 Rest House Road Bangalore Karnataka-560001,272650.00
903,2011-2012,Karnataka,094421144,Mother of Good Health Educational Society,Halagevaderahally BEML Layout Rajarajeshwari Nagar BangaloreKarnataka-560098,2383000.00
904,2011-2012,Karnataka,094421154,Mother Tekla Charitable Trust,No.10 Brunton Road BangaloreKarnataka-560025,697046.00
905,2011-2012,Karnataka,094630174,Mother Teresa Memorial Education Trust,Mission compound Balmatta Mangalore Dakshina KannadaKarnataka-575002,2948803.00
906,2011-2012,Karnataka,094450043,MOTHER THERESA RURAL DEVELOPMENT TRUST (R),Plot No.82/2-B 22 nd ward B.J. Extension Lal Bahaddur Shstri Nagar Near Balliza HostelBellaryRoad Anthasayana Gudi(post) Hospet583201,0.00
907,2011-2012,Karnataka,094570186,Mount Carmel Mission School,Kamalapura Thondebhavi Gouribidanur Taluk Kolar Dist.Karnataka-561213,72245.00
908,2011-2012,Karnataka,094630078,Mount Rosary Charitable Institutions,Alamgar Moodbidri Dakshin KannaraKarnataka-,12721609.00
909,2011-2012,Karnataka,094420077,Movement For a Better World,NO.31Madras S. Officer's Colony Banaswadi RoadBangalore Karnataka.-560033,0.00
910,2011-2012,Karnataka,094420654,Movement for Alternatives and Youth Awareness (MAYA),25/1-4 9th Cross J.P. Nagar2nd Phase560078,93606830.57
911,2011-2012,Karnataka,094590068,Muddanahalli Parish Society,St. James Church PO KM MysoreKarnataka-570005,1788597.00
912,2011-2012,Karnataka,094600052,Muktha Youth Women and Child Welfare Trust,Prabath Nagar Honnavar Uttara KannadaKarnataka-581334,1623733.08
913,2011-2012,Karnataka,094640056,Multipurpose Organisation for Training Health Education and Rehabitation,MOTHER Campus Near Koladappaleshwara Temple II Stage MadhavanagaraSira572137,0.00
914,2011-2012,Karnataka,094421187,Munnarakkunnu Trust,545 Banagiri Nagar Banashankari 3rd StageBangalore Karnataka-560085,1858287.93
915,2011-2012,Karnataka,094590001,Mysore Diocesan  Society,Bishop's House BN RoadMysore Karnataka-570001,18709738.56
916,2011-2012,Karnataka,094590005,Mysore Diocesan Education Society,St. Joseph Complex Jayalakshmipuram Mysore Karnataka-570012,0.00
917,2011-2012,Karnataka,094590121,Mysore Don Bosco Society,Parsianahundi Mananthawadi Road Mysore Karnataka-578008,2170250.00
918,2011-2012,Karnataka,094590122,Mysore Notre Dame  Sisters Society,9 IVth Main Jayalakshmipuram Mysore Karnataka-570012,0.00
919,2011-2012,Karnataka,094590181,Mysore Pallottine Educational Research and Development Society,Pallottiaram Kalwadi Gate Post= Rayanakere Distt.=MysoreKarnataka-570008,17673893.00
920,2011-2012,Karnataka,094420566,Mythri Sarva Seva Samithi,1300 D 1st Cross 1st Main HAL 3rd Stage New ThippasandraBangalore Karnataka.-560075,4444018.00
921,2011-2012,Karnataka,094420725,N.M Academy,National First Grade College Bhoopasandra 2nd Cross HebbalBangalore  Karnataka-560094,8335695.65
922,2011-2012,Karnataka,094590041,Naganahalli Parish Society,Sacred Heart Church HD Kote Mysore  Karnataka.-,0.00
923,2011-2012,Karnataka,094630133,Nagarika Seva Trust,Guruvayanakere  Dakshin Kannada Karnataka.-574217,0.00
924,2011-2012,Karnataka,094421278,Narayana Hrudayalaya Foundation,12th Floor SN Towers No.25/2 MG Road BangaloreBangalore560001,635029.00
925,2011-2012,Karnataka,094421406,Narayana Nethralaya Foundation,121/c Chord Road Rajajinagar I R  Block BangaloreBangalore560010,106966.00
926,2011-2012,Karnataka,094640053,Narendra Foundation Siddapura,Pavagada Taluk TumkurKarnataka-572141,1279122.00
927,2011-2012,Karnataka,094540083,National Banjara Education Society Gulbarga,1st Floor Chikana Shaith Building Shivanagar Aland RoadGulbarga585101,0.00
928,2011-2012,Karnataka,094420018,National Biblical Catechetical and Liturgical Centre,Post Bag No-8426 Hutchins Road2nd Cross560084,2419278.00
929,2011-2012,Karnataka,094420540,National Centre For Mangement Dev. In A.& Rural Dev.,Co-operative Trg.college 67 Padmanabhan Bas. Ii StationBangalore Karnataka.-560020,0.00
930,2011-2012,Karnataka,094420369,National Education Society of Karnataka,Basavanagodi BangaloreKarnataka-,48278.00
931,2011-2012,Karnataka,094421485,NATIONAL ENTREPRENEURSHIP NETWORK,Tower-3 Sixth Floor SJR-I Park EPIP Zone-1 Hoodi Village Krishnarajapurahobli Whitefield RoadBangalore560066,0.00
932,2011-2012,Karnataka,094420614,National Institute of Advanced Studies,Indian Institue of Science Campus BangaloreKarnataka-560012,6841729.00
933,2011-2012,Karnataka,094420643,National Law School of India University,Nagurbhavi BangaloreKarnataka.-560072,7808321.67
934,2011-2012,Karnataka,094590169,Nature Conservation Foundation,1311 Amritha 12th A Main VIjayanagar 1st StageMysore570017,21277051.00
935,2011-2012,Karnataka,094420832,Nava Chetana,No.F 3 Villa Ranka Colony Bilekahalli Bannerghatta RoadBangalore560076,0.00
936,2011-2012,Karnataka,094480027,Nava Jeevan Charitable Society,Nava Jeevan Seva Kendra Kodi Camp Tarikere ChikmagalurKarnataka-577228,2557275.00
937,2011-2012,Karnataka,094450035,Nava Jeevana Rehabilitation Centre for the Disabled,"""Cluny Convent"" Cantonment BellaryKarnataka-583104",813321.00
938,2011-2012,Karnataka,094421297,NAVA KARNATAKA SOCIAL SERVICE TRUST,130 Thangamalai Nagar Vinayaka Tent D.J.Halli BangaloreBangalore560045,0.00
939,2011-2012,Karnataka,094421441,NAVA SPOORTHI KENDRA TRUST,COOKSON ROAD THOMAS TOWN P.O LIGUORI BHAVAN NO.8 JOHN ARMSTRONG ROADBANGALORE560084,0.00
940,2011-2012,Karnataka,094570192,Navachaithnya Urban and Rural Development Society,Jangamakote(P)Jangamakote cross Sidlagatta(T) KolarKarnataka-563144,961414.00
941,2011-2012,Karnataka,094610039,Navajeevana Grameena Abhivriddhi Samsthe,Begumpur PetMudgal Lingasagur taluka584125,0.00
942,2011-2012,Karnataka,094590198,NAVAJYOTHI TRUST,PRESENTATION VIDHYA BHAVAN SHIVAJI MAIN ROAD N.R.MOHALLAMYSORE570007,14190398.00
943,2011-2012,Karnataka,094460018,Navjeevan Community Development Society,Golekhana  BidarKarnataka -,8231840.00
944,2011-2012,Karnataka,094670004,Navodaya Educational and Environment Development Service(NEEDS),Mali Compound Shivabasava nagar HaveriKarnataka-581110,900285.00
945,2011-2012,Karnataka,094360003,Navodaya Mahila Abhivruddi Swayam Sewa Samsthe,C/os.t.angadi Buildinghousing Colony BagalkotKarnataka-587101,0.00
946,2011-2012,Karnataka,094421428,NAVODAYA TRUST,No 192  Amarta Nagar  2nd cross  4th main  Choodasandra Road  3 rd Phase Amarthanagar  KasavanaHalli Huskur postBANGALORE560099,24560077.00
947,2011-2012,Karnataka,094421397,NAYANA FOUNDATION,No.78 3rd Main Road HebbalBangalore560024,0.00
948,2011-2012,Karnataka,094570027,Neel Bagh Trust,Vikasana Doddakallasandra BangaloreKarnataka-560052,946510.65
949,2011-2012,Karnataka,094420963,Neerekshe,25laxmipathy Layoutkariyanpalaya  Lingarajapuram BangalaoreKarnataka-560084,2405336.63
950,2011-2012,Karnataka,094421463,NELINDCO FOUNDATION,No.5 33rd Cross 4th T Block JayanagarBangalore560041,1100000.00
951,2011-2012,Karnataka,094570118,NEO Education and Economic Development Society,Sourimani Nilayam 3rd Cross Road Pipe Line Robertsonpet K.G.F.Dist: Kolar Karnataka-563122,0.00
952,2011-2012,Karnataka,094440115,Neravu Society,Ap Channammana Kitturu  Ta  Bailhongal  Dist  Belgaum Karnataka StateBelgaum591115,0.00
953,2011-2012,Karnataka,094420082,Nettur Technical Training Foundation,23/24 II Phase Peenya Industrial Area560058,0.00
954,2011-2012,Karnataka,094421096,New Ark Mission of India,Home of Hope Byrathi Bende Hennur Bangaore Main Road Kannur postBangalore562149,14107134.67
955,2011-2012,Karnataka,094670005,New Creation Gospel Ministries Society,PO Box No.2 Hanagal HaveriKarnataka-581104,92094.00
956,2011-2012,Karnataka,094450026,New Creation Ministries,No.64Jayanagar Cantonment BellaryKarnataka-583104,12139928.90
957,2011-2012,Karnataka,094420798,New Entity for Social Action,93/2Charles Campbell Rd Cox Town BangaloreKarnataka.-,0.00
958,2011-2012,Karnataka,094421126,New Horizen Trust for the Disabled,170 -1 Behind Surya BakeryCSI Colony Road Kothanur560070,0.00
959,2011-2012,Karnataka,094420616,New Life Fellowship Trust,84/3 3rd Floor UCF CentreHennur Main Road Lingrajpuram560084,2664009.91
960,2011-2012,Karnataka,094570181,New Life Peace Foundation,3 Station BlockNear Coromandel Rl Stn. K.G.F.563 118 Kolar DistrictCoromandel Post Karnataka-563118,0.00
961,2011-2012,Karnataka,094420608,Newlife Computer Institute,Logos Centre Horamavu AgaraHennur Road560043,21237317.00
962,2011-2012,Karnataka,094421025,Nightingales Medical Trust,3351st Block R.T. Nagar Main Road BangaloreKarnataka-560032,2120460.00
963,2011-2012,Karnataka,094590145,Nisarga Foundation,Shivaji Road H.D.Kote H.D.Kote TalukMysore Karnataka-571114,3472553.00
964,2011-2012,Karnataka,094600072,Nisarga Trust( R ) SIRSI,NadigalliSirsiNorth Kanara(Uttara Kannada)SIRSI581401,0.00
