454,2011-2012,Kerala,052900262,Family Apostolate Centre,Catholic Bishops House  Trichur Kerala-680005,0.00
455,2011-2012,Kerala,052900322,Family Apostolic Training & Research Institute,Arnos Nagar Velur P.o Trichur Kerala-680601,0.00
456,2011-2012,Kerala,052880002,Farook College Managing Committee, Farook College P.o.Calicut- 673 632-,654164.00
457,2011-2012,Kerala,052990001,Fathers House International,Thevgumthottathi-i Thottaman P. O. Ranny Kerala -,0.00
458,2011-2012,Kerala,052950014,Fathima Convent,Pariapuram MalappuramKerala-679321,220305.33
459,2011-2012,Kerala,052870259,Fathima Matha Ashram, NagampadamKottayam - 686 001-,4292060.00
460,2011-2012,Kerala,052850022,Fatima Convent,Koilparambil Fort Kochi ErnakulamKerala-682001,1468477.00
461,2011-2012,Kerala,052900155,Fatima Convent, Chowannur P.o.Trichur - 680 503-,0.00
462,2011-2012,Kerala,052930093,Fatima Convent, NeendakaraKollam-691 582-,0.00
463,2011-2012,Kerala,052980031,Fatima Mata Ashram, KalpettaWayanad - 673 121-,234771.00
464,2011-2012,Kerala,052850290,Fc Sister Of Mary St Elizabeth Convent,Kattiparambu Kannamali Po CochinKerala-682008,0.00
465,2011-2012,Kerala,052850378,Federation Of Organisation For Research & Development,Vennala Po ErnakulamKerala-,0.00
466,2011-2012,Kerala,052870275,Fellowship Indpndnt.full Gospel C India, Veloor P.o.Kottayam - 686 003-,690300.30
467,2011-2012,Kerala,052930062,Fervent Daughter Of Srs.S.H. Jesus, Punnaveli P.o.mallappallyPathanamthitta-,0.00
468,2011-2012,Kerala,052930015,Fishermen Community Development Program, PallithottamKollam - 691 006-,271500.00
469,2011-2012,Kerala,052930162,Fishermen Welfare Society,M.c 94/xxii Port KollamKollam Kerala-691007,0.00
470,2011-2012,Kerala,052890096,Flory and Agricultural Trust of Kerala,Room No.3R.V.Clinic RoadPalakkad.Palakkad678001,0.00
471,2011-2012,Kerala,052950077,Focus India Trust,P.B.No. 6 Chungathara P.O. nilamburNilambur679334,4151774.96
472,2011-2012,Kerala,052850313,Formation Centre  Mother Carmel Convent, Kalamessary P.o.Ernakulam 683 104-,3354625.00
473,2011-2012,Kerala,052810117,Forum For Rural Environment,C.c.s.b. Road AlleppeyKerala-,0.00
474,2011-2012,Kerala,052900168,Fr J Vadakkethal Brothers Charities,Mmb Generalate Trichur 5Kerala State-,0.00
475,2011-2012,Kerala,052900011,Fr. Family Apostolate Diocese Of Trichur,Nirmalayam West Fort Trichur  Kerala-680004,1896357.34
476,2011-2012,Kerala,052900342,Fr. Justine Vocationary Trust,Thalore Ollur Trichur Kerala -680306,3198907.96
477,2011-2012,Kerala,052850436,Fr.lvarghese Thaniyath Charitable Trust,Thaniath Thuruthipuram P.o.Earnakulamkerala.-680667,10028201.00
478,2011-2012,Kerala,052830043,Francis Clarist Convent,St Joseph Province Thalipanamba Po KannurKerala-670141,2694886.85
479,2011-2012,Kerala,052930111,Franciscan  Sisters of  The Immaculate Heart of  Mary Convent,Palathara ThattamalaKollam691020,1573112.40
480,2011-2012,Kerala,052900068,FRANCISCAN ASSOCIATION,"FRANCISCAN ASSOCIATION
ASSISI REHABILITATION CENTRE
ST FRANCIS NAGAR
WADAKKANCHERY R.S.P.O
THRISSUR 680623
THRISSUR
KERALA
INDIATHRISSUR680623",704535.00
481,2011-2012,Kerala,052910021,Franciscan Brothers Jm Orphanage Instt., Nalanchira P.o.Trivandrum 695 015-,4585900.00
482,2011-2012,Kerala,052870181,Franciscan Centre, 686524,0.00
483,2011-2012,Kerala,052850019,Franciscan Clarist Congregation,Portiuncula Asokapuram Alwaye ErnakulamKerala-683101,0.00
484,2011-2012,Kerala,052850365,Franciscan Clarist Congregation,Nirmala Bhavan MuvattupuzhaErnakulm-,20568047.31
485,2011-2012,Kerala,052870291,Franciscan Clarist Congregation,Alphonsa Jyothy Province F.c.provincial HousearuvithuraKottayam Kerala.-,20328228.23
486,2011-2012,Kerala,052900069,Franciscan Family Apostolate,Cathedral Junction West IrinjalakudaTrichur - 680 121-,1182518.99
487,2011-2012,Kerala,052850460,Franciscan Immaculatine Sisters,XXIII346 A Palamuttam Edacochin CochinErnakulam (Kerala)-682006,7300501.11
488,2011-2012,Kerala,052870337,Franciscan Missionaries of Service,Kanakkary P.O.Kottayam686632,12152247.00
489,2011-2012,Kerala,052870348,FRANCISCAN MISSIONARY OF ST. CLARE TRUST,FRANCISCAN MISSIONARY OF ST. CLARE CONVENT THIRUVANCHOOR AYARKUNNAM PANCHAYATHTHIRUVANCHOOR VILLAGE686037,0.00
490,2011-2012,Kerala,052870065,Franciscan Sisters Of All Saints,Assisi Bhavan  Kottayam - 686 002-,10879879.23
491,2011-2012,Kerala,052870309,Franciscan Sisters of Holy Annunciation,AIMCOMBU Kakanad Post PalaiKottayam Kerala-686653,963984.00
492,2011-2012,Kerala,052850214,Franciscan Sisters Of Mary,St Francis Xaviers Church Kaloor Cochin Ernakulam Kerala-682017,3120334.11
493,2011-2012,Kerala,052910168,Franciscan Sisters Of Mary Convent of Our Lady of Lourdes,Lourdepuram Kanjiramkukam Po TrivandrumKerala-695524,1154735.00
494,2011-2012,Kerala,052900352,Franciscan Sisters of St. Elizabeth,Franciscan Sisters of St. Elizabeth Convent Madaplathuruth MoothakunnN. Paravur Trichur Kerala-683516,4925503.00
495,2011-2012,Kerala,052900361,Franciscan Sisters of the Sacred Hearts Convent,Mundoor(PO) Munddor ThrissurKerala-680541,5471288.00
496,2011-2012,Kerala,052850045,Fransiscan Srs. Mary Our Ladys Convent, Palluruthy CochinErnakulam - 682 005-,2185796.00
497,2011-2012,Kerala,052960010,Friends in India Social Trust,Paceline Puthenvayal Tilliery KollamKerala-691001,2748730.00
498,2011-2012,Kerala,052850233,FRIENDSHIP HOUSE,"ALWAYE 
ERNAKULAM
KERALA - 683101ALUVA683101",0.00
499,2011-2012,Kerala,052810041,Gagultha Monastery,Champakulam AlapuzhaAlleppey            -688505,2762971.41
500,2011-2012,Kerala,052900089,Galilee Institute Of Psychology,Marthoma Hospital Azhikode TrichurKerala-680666,0.00
501,2011-2012,Kerala,052900304,Galillee,Chiyyaram ThrisurKerala-680026,1000000.00
502,2011-2012,Kerala,052960023,GANDHI BHAVAN INTERNATIONAL TRUST,PB-NO-39PATHANAPURAM689695,0.00
503,2011-2012,Kerala,052810125,Gandhi Samarak Grama Seva Kendram,S.l.puram P.o. AlappuzhaKerala.-688523,3568472.52
504,2011-2012,Kerala,052830124,Gandhi Smaraka Grama Seva Kendram,Karadka - P.o.  Muliyar  ViaKasargod  Kerala-671542,0.00
505,2011-2012,Kerala,052890101,GANGOTHRI CHARITABLE CULTURAL AND EDUCATIONAL TRUST,REGISTRED OFFICE NEW VILLAGE NEMMARA POSTPALAKKAD DISTRICT678508,0.00
506,2011-2012,Kerala,052850266,General Gospel Fund,Pb No.6 Angamaly EranakulamKerala-,5303729.00
507,2011-2012,Kerala,052930123,George Mathen Medical Mission Hospital,Mallappally East Po Pathanamthitta Kerala-,0.00
508,2011-2012,Kerala,052830165,GETHSEMANE CHARITABLE TRUST,CHERUPUZHA P.O.KANNUR670511,157645.00
509,2011-2012,Kerala,052870055,Gethsemene Ashram,Palambra KanjirappallyKottayam - 686 518-,0.00
510,2011-2012,Kerala,052960026,GILEAD GOSPEL MINISTRIES  INDIA,THEKKEMURIYIL GILEAD KARAMKODE POSTKOLLAM691579,643417.00
511,2011-2012,Kerala,052930230,Gilgal Ashwasa Bhawan Charitable Trust,Ebenezer Pengattu Post Box No. 14 Eraviperoor P.O. ThiruvallaPathanamthitta Kerala-689542,940070.00
512,2011-2012,Kerala,052870030,Girl's Town, Kozhuvanal P.o. PalaKottayam Kerala-686523,805938.06
513,2011-2012,Kerala,052810051,Gleaner's Of Church,Bethania House  Ezhupunnao.p.o.Alleppeykerala-,0.00
514,2011-2012,Kerala,052810140,Global Educational Net (GENET),Thamath Bhavan Komana PB No. 11 AmbalapuzhaAlappuzha688561,0.00
515,2011-2012,Kerala,052910362,GLOBAL KERALA INITIATIVE KERALEEYAM,AMOOLYAMT.C.9/2574/1F-STREETELANKOM GARDENSVELLYAMBALAMSASTHAMANGALAM P.OTRIVANDRUM695010,0.00
516,2011-2012,Kerala,052910363,GLOBAL LIGHTHOUSE CHARITABLE SOCIETY,KARIALIL ESTATE MANNANTHALA P.OTRIVANDRUM695015,482026.00
517,2011-2012,Kerala,052870278,Good News Charitable & Education Society,Educational Society Kottayam -,4688509.00
518,2011-2012,Kerala,052870352,GOOD NEWS CHARITABLE TRUST,VELLOOR P. O.KOTTAYAM686501,10819681.00
519,2011-2012,Kerala,052850362,Good News For Asia,Thevra Cochin ErnakulamKerala-,5168456.00
520,2011-2012,Kerala,052810133,Good Samaritan Charitable Trust,Josco Building Jasco Junction Iranikudy Post PandalamAlappuzha Kerala-689515,0.00
521,2011-2012,Kerala,052980112,Good Sheperd Hospital Society,Vythiri WayanadKerala-673576,0.00
522,2011-2012,Kerala,052830150,Good Shepherd Major Seminary,Kunnoth KiliyantharaKannur (Kerala)-670706,9600943.26
523,2011-2012,Kerala,052870115,Good Shepherd Minor Seminary, Karoor PalaiKottayam - 686 575-,2437894.00
524,2011-2012,Kerala,052870078,Good Shephered Monastery,  Kottayam - 686 001-,184674.00
525,2011-2012,Kerala,052850116,Gospel Aid Ministries,Pb No. 616 Alwaye ErnakulamKerala-683102,164502.00
526,2011-2012,Kerala,052930083,Gospel Centre,Nedumpuram Tiruvalla Kerala-689578,603331.00
527,2011-2012,Kerala,052870327,Gospel for India,Building No.575 Pampady Velloor PO KottayamKerala-686501,4749632.00
528,2011-2012,Kerala,052850117,Gospel In Action Fellowship India, PerumbavoorErnakulam - 683 542-,8588705.00
529,2011-2012,Kerala,052980146,Grace And Compassion Benedectines Society,St. Scholastics Convent MakkiyaduWynad Kerala-,407493.91
530,2011-2012,Kerala,052910360,GRACE MINISTRIES OF INDIA,NANTHANCODE THIRUVANANTHAPURAMTHIRUVANANTHAPURAM695003,95281.00
531,2011-2012,Kerala,052910357,GRAMA JYOTHI NATIONAL INSTITUTE FOR DIFFERENTLY ABLED,Grama Jyothi National Institute For The Differently Abled Pazhakutty.P.O. Nedumangad ThiruvanathapuramNedumangad695561,655045.00
532,2011-2012,Kerala,052910176,Grama Seva Bhavan, Changa P.o. AryanadTrivandrum - 695 542-,0.00
533,2011-2012,Kerala,052870335,Grama Vikasana Seva Samiti,K 12/94 Kurichithanam POKottayam686634,0.00
534,2011-2012,Kerala,052810120,Gramaniketan,Gramanikethan Kannady P.o. AlleppeyKerala -688507,0.00
535,2011-2012,Kerala,052910297,Gramodharana Vanitha Samajam,Perumulloor Ooruttambalam ThiruvananthapuramKerala-695507,0.00
536,2011-2012,Kerala,052870105,Granny Grandad Scheme Kottayam Social Service Society,Thellakam Po KottayamKerala-686016,493961.00
537,2011-2012,Kerala,052850336,Guardian Angel Care Charitable Society,Airpuram KezhumainuErnakulam  Kerala-,1629703.00
538,2011-2012,Kerala,052910245,Handloom Weavers Development Society,Kuzhivilakatha BalaramapuraTrivandrum - 695 501-,0.00
539,2011-2012,Kerala,052850007,Handmaids Of the Secred Heart of Jesus Society,Sneha Nilayam Special School Kakkanad Cochin ErnakulamKerala-682030,1174989.00
540,2011-2012,Kerala,052910293,Harvest Ministries International,Harvest Mission House Kudappanakunnu P.o. Trivandrum (kerala)-560046,4819730.00
541,2011-2012,Kerala,052910251,Health Action By People,318 Prasanth Nagar Medical CollegeTrivandrum 695-,4925523.00
542,2011-2012,Kerala,052880172,HEALTH DIALOGUE KOZHIKODE,EXTENSION SERVICE OF LISSAH COLLEGE KAITHAPOYIL OZANAM BHAVAN P.B.NO.1512 MEDICAL COLLEGE P.OKOZHIKODE673008,0.00
543,2011-2012,Kerala,052910153,Health For One Million,Arch Bishop's House PattomTrivandrum Kerala-695004,819761.00
544,2011-2012,Kerala,052850519,Helping Oppressed Peoples Emancipation (HOPE),XXX/402 Opp. Chakravarthy HostelKothamangalam686691,43722.74
545,2011-2012,Kerala,052880053,Hidayathul Anam Trust, Ramanattukara P.o.Kozhikode- 673-,0.00
546,2011-2012,Kerala,052950058,Hidayathul Muslimeen Yatheem Khana Sangh,Pandikkad Road Manjerim P.o.Malappuram-,10000.00
547,2011-2012,Kerala,052940069,Highrange Development Society,MARIYAPURAM P.O IDUKKI- 685602MARIYAPURAM685602,6094343.00
548,2011-2012,Kerala,052980142,Hilda Trust,Pb No.90 Kottakkunnu Sulthan BatheryWayanad Kerala-,350966.00
549,2011-2012,Kerala,052890088,Himayathul Islam Charitable Trust,Karinganad Vilayoor Post PalakkadKerala-679309,0.00
550,2011-2012,Kerala,052900172,Holy Child Convent,Snehagiri Po Kuruvilassery TrichurKerala-680735,17087.00
551,2011-2012,Kerala,052830104,Holy Family Bhawan Day Care Centre,Po Pathanpara KannurKerala-,100205.54
552,2011-2012,Kerala,052850098,Holy Family Convent,S.m.nagar S.vellarappilly P.o.Ernakulam - 683 580-,0.00
553,2011-2012,Kerala,052900057,Holy Family Convent,Edakulam  Thrissur Distt. Kerala -,0.00
554,2011-2012,Kerala,052900309,Holy Family Convent,Pulakattukara ChittisseryThrissure Distt. Keralaq.-,0.00
555,2011-2012,Kerala,052900273,Holy Family Creche,   -,0.00
556,2011-2012,Kerala,052900190,Holy Family Generalate,Po Mannuthy TrichurKerala-680654,3365159.00
557,2011-2012,Kerala,052850085,Holy Fsamily Monastery,Carmelite Provincial House Carmel JunctionErnakulm - 18-,0.00
558,2011-2012,Kerala,052870073,Holy Ghost Mission Hospital, KottayamKerala-,0.00
559,2011-2012,Kerala,052850416,Holy Marys Convent,Holy Mary's Convent Kumbalam Po ErnakulamKerala-,0.00
560,2011-2012,Kerala,052870124,Holy Queens Province Of Cmc Pro. House, ChanganacherryKottayam - 686 101-,1257609.93
561,2011-2012,Kerala,052900021,Holy Spirit Convent,  Trichur - 680 005-,736666.59
562,2011-2012,Kerala,052870125,Holy Spirit Minor Seminary (M.C.B.S.),Cherupushpa Nagar Kollad P.o.Kottayam 686 029-,0.00
563,2011-2012,Kerala,052930008,Holy Spirit Sisters Tholassary, Kollam P.o.Tiruvalla - 689 101-,2394684.68
564,2011-2012,Kerala,052900221,Holy Trinity Ashram,Chiyyaram Aranattukana Laloor TrichurKerala-680618,39863394.00
565,2011-2012,Kerala,052910161,Holy Trinity Centre For D C,Moac TrivandrumKerala-,20082.00
566,2011-2012,Kerala,052880111,Homage,A.r. Camp Road ThamannaCalicut - 673 012-,0.00
567,2011-2012,Kerala,052910128,Home For The Suffering,Jessy Nivas NanthencodeTrivandrum - 695 003-,1449760.00
568,2011-2012,Kerala,052930104,Home Missionary Council Bethal Bible Col, PunalurThiruvalla - 691 305-,284213.00
569,2011-2012,Kerala,052910233,Home Of Love,Ayyappankavu Mulayam TrichurKerala-,0.00
570,2011-2012,Kerala,052870281,Home Of Peace,House for Physically Handicapped Children Diocese of Kanjirapally Kanjirapally-686507Kanjirapally686507,964110.90
571,2011-2012,Kerala,052850011,Home Science College, AngamalyErnakulm - 683 573-,392395.39
572,2011-2012,Kerala,052810121,Hope Community Village,Beach Road AlleppeyKerala -,3797178.00
573,2011-2012,Kerala,052830094,Hope For All  Charities, PayagadiKannur-,0.00
574,2011-2012,Kerala,052870077,Hospitaler Sister's Fo Mercy,Mercy Hospital ChengalamKottayam - 686 585-,0.00
575,2011-2012,Kerala,052850410,House Of Mary Immaculate,S.m.m.i. House Vadakkumpuram P.o.Ernakulam  Kerala -683521,0.00
576,2011-2012,Kerala,052850023,House Of Providence,Providence RoadCochin,656421.00
577,2011-2012,Kerala,052900157,House Of Providence,Irinjalakuda TrichurKerala-680121,23871.00
578,2011-2012,Kerala,052960004,Human De. Resource & Research Centre,Legal Aid Centre Near Civil StationDistt. Kollam Kerala-691013,0.00
579,2011-2012,Kerala,052930236,IARF Coordinating Council for South Asia,Seeds India Building Punnakadu POKozhencherry689652,1423487.00
580,2011-2012,Kerala,052900326,Ideal Educational Society,Po; Chittilappally Thrissur-680 551Kerala-,0.00
581,2011-2012,Kerala,052980002,Ikya Niketan Social Centre,Meppady Kalpetta WayanadKerala-673577,84450.00
582,2011-2012,Kerala,052870038,Immaculate Heart Of Mary Hospital,Ihm Hospital Bharananganam KottayamKerala-686578,2818812.00
583,2011-2012,Kerala,052830053,Immaculate Heasrt Of Mary Convent, KannurKerala-,0.00
584,2011-2012,Kerala,052900314,Immacullate Conception Convent, Mathilakam P.o.irnjalakudaTrichur - 680 685-,0.00
585,2011-2012,Kerala,052900134,Immacullate Heart Monastery, Yarandarapilly P.o.Trichur - 680 303-,115409.00
586,2011-2012,Kerala,052870058,Ind Gospel Churches & A M,   -,12039205.00
587,2011-2012,Kerala,052930126,Independent Baptist Church,Chathannoor Karamcode P.o.Kollam 691 579-,2722154.00
588,2011-2012,Kerala,052870319,India Center for Social Change,Mary BhavanNalunnakkal PO Vakathanam KottayamKerala-686538,2244534.47
589,2011-2012,Kerala,052850453,India Gospel Ministries,Ashokapuram AlwayeErnakulam (kerala)-683101,4619405.00
590,2011-2012,Kerala,052930204,India Gospel Team,Chemangattil Bldg Erumakad Po Edayaranmula PathanamthittaKerala-689532,118602.00
591,2011-2012,Kerala,052870062,India Vision And India Bible College Mnt, KottayamKerala-,13449919.00
592,2011-2012,Kerala,052910276,Indian Christan Research Orgnisation,No 18/14632 Kunnapruzha  Aramada P.o.  Trivandraum Kerala -695032,9004761.00
593,2011-2012,Kerala,052930127,Indian Christian Gospel Mission,Khadesh Mandiram Mallappally P.o.Pathanamthitta - 689 585-,808353.54
594,2011-2012,Kerala,052810138,INDIAN CHRISTIAN MISSION,P.O. PALLITHODE CHERUNGALTHURAVOOR688584,920543.00
595,2011-2012,Kerala,052910283,Indian Clinical Epidemiology Network,Clinical Epidemiology Unit Medical CollegeThiruvananthapuram Kerala-695011,9742551.00
596,2011-2012,Kerala,052850080,Indian Evangelical Trust,Xli/ 257 I.s. Press Road Kochi Ernakulam Kerala-682018,3082049.36
597,2011-2012,Kerala,052910309,Indian Institute of Scientific Heritage,Ushus Estate Road  Poppasum Code TrivendrumKerala-695018,171685.00
598,2011-2012,Kerala,052930028,Indian Pentecostal Church Of God,Kumbanadu PathanamthittaKerala-,74538531.50
599,2011-2012,Kerala,052870147,Indian Province of the Claretian Congregation,Claret Bhavan Kuravilangad KottayamKerala-686633,38684086.00
600,2011-2012,Kerala,052910373,INDIRA GANDHI NATIONAL FOUNDATION,162 Gandhi NagarVazhuthacaud695014,0.00
601,2011-2012,Kerala,052810018,Indo American Club,Chengannur AlleppeyAlleppey Kerala-689121,1257907.00
602,2011-2012,Kerala,052850493,INDOCERT,Bldg. No. IV 314 Thottumugham P.O.Aluva683105,180000.00
603,2011-2012,Kerala,052870282,Infact(information For  Action,Kizhathadiyoor P.o Palai Dist: Kottayam Kerala-686574,0.00
604,2011-2012,Kerala,052870006,Infant Jesus Bala Bhavan,Cherpunkal Po KottayamKerala-686584,193420.91
605,2011-2012,Kerala,052830016,Infant Jesus Convent, Kacherikkadavu P.o.kottupuzhaKannur-670 706-,0.00
606,2011-2012,Kerala,052850296,Infant Jesus Convent,Chellnam CochinErnakulm - 8-,0.00
607,2011-2012,Kerala,052850260,Infant Jesus Convent Orphanage,Ochanthuruth Kochi ErnakulamKerala-682508,0.00
608,2011-2012,Kerala,052850333,Infant Jesus Home Institute,Paduvapuram Karukutty  ErnakulamKerala-683582,251024.48
609,2011-2012,Kerala,052900097,Infant Jesus Orphange, EngandiyoorTrichur - 680 615-,583800.64
610,2011-2012,Kerala,052830153,Insight Christian Guidance Centre,DoorPSP I/527 Muckattikavu RoadThanthodeIrittyKannur-Kerala-670703,220389.00
611,2011-2012,Kerala,052870356,Institute for the Development of Social Medical and Management Science IDSMMS,Joseph Itty  Mulanjyil Building   Narkathodu Road  PuthuppallyKottayam686011,0.00
612,2011-2012,Kerala,052920007,Institute of Applied Dermatology,Regd. office - MP 16-575 A  IAD JunctionUliyathadka Madhur Road671124,250239.53
613,2011-2012,Kerala,052850344,Institute Of Sisters Nazareth,Paduapuram Karukutty  ErnakulamKerala-683582,194063.89
614,2011-2012,Kerala,052850202,Institute Of St. Catherine,Thammanam Vyttila  Kochi ErnakulamKerala-682032,0.00
615,2011-2012,Kerala,052850415,Instt. Of Small Enterprises & Dev.,33/1668-c Vennalam Cochin Kochi P.o.Ernakulm - 682 028-,0.00
616,2011-2012,Kerala,052870207,Integrated Rural Development Society,Kuravilangad Nazareth Hill Po KottayamKerala-686633,0.00
617,2011-2012,Kerala,052870288,Inter Collegiate Prayer Fellowship,Doctors Tower 3rd Floor ChanganacherryKottayam.686 101-,7249123.46
618,2011-2012,Kerala,052930189,Inter Full Gospel Evangelistic Society,12B International Garden Gate Manjadi PO  Thiruvalla689105,3512362.62
619,2011-2012,Kerala,052940059,Intercession India Trust,Bldg.no.309kalkundal Village Udumbanchola ErattayarIdukki Kerala-,10450256.00
620,2011-2012,Kerala,052870310,International Gospel Church,Madel Bldg. Pakkil Post KottayamKerala-686012,1348299.00
621,2011-2012,Kerala,052850153,International Medical Association,Shenoy Road Kaloor KochiErnakulam - 682 017 Kerala-,3762120.00
622,2011-2012,Kerala,052980170,INTERNATIONAL MEDITATION SOCIETY OF WAYANAD INDIA,PARIYARAMNORTH KALPETTA PO673122,0.00
623,2011-2012,Kerala,052960011,International New Life Trust,New Life Biblical Seminary Chetuvakkal P.O. AyurKOLLAM  Kerala-691533,4840147.00
624,2011-2012,Kerala,052870307,IPC educational & Welfare Society,PoBox No 3 XV/358 Puthupally P.O. Near Mandiram Kalunku KottayamKerala-686011,5753862.00
625,2011-2012,Kerala,052810071,Irene Home,Alleppey Bazar P.o. Alleppey   -688012,1021115.72
626,2011-2012,Kerala,052900049,Irinjalakuda Don Bosco Society,Irinjalakuda Don Bosco Society IrinjalakudaKerala-680121,0.00
627,2011-2012,Kerala,052830130,Irrikkur Managing Committee,Po Irrikur KannurKerala-,0.00
628,2011-2012,Kerala,052850412,Irshadiyya Charitable Trust,Darul Irsshad Pareekkanni Koovalloore P.o.Ernakulam - 686 671-,191525.45
629,2011-2012,Kerala,052910378,Isa Viswa Prajnana Trust,Isalayam - AnayaraTrivandrum695029,0.00
630,2011-2012,Kerala,052880034,Islahiya Association,Chennamangallur-PO Mukkam-Via CalicutKerala-673602,22374486.93
631,2011-2012,Kerala,052890058,Islahiya Orphanage, P.o. AnjadiPalakkad - 679 552-,120000.00
632,2011-2012,Kerala,052900204,Islamic Cultural Association, Vadakkekadp.o.nhamanghatTrichur-679 563-,0.00
633,2011-2012,Kerala,052880058,Islamic Educational Movement, Feroke Petta P.o.Kozhikode - 673 631-,1096080.10
634,2011-2012,Kerala,052870347,ISLAMIC GUIDANCE TRUST SOCIETY(REGD),AL MANAR EDUCATIONAL COMPLEXPO ERATTUPETTA KOTTAYAMERATTUPETTA686121,0.00
635,2011-2012,Kerala,052950069,Islamic Mission Trust,Santhapuram P.B.No. 1 Po Pattikkad PerinthalmannaMalappuram (Kerala)-679325,11432995.38
636,2011-2012,Kerala,052880038,Islamic Welfare Trust,PO Omassery KozhikodeKerala-673572,28328693.16
637,2011-2012,Kerala,052880045,Islamic Youth Centre Trust,Bank Road  Kozhikode-,86763.00
638,2011-2012,Kerala,052880072,Islamiya Arabic College Association, Sivapuram P.o.vattoli BazarKozhikode-,10000.00
639,2011-2012,Kerala,052880003,J D T Islam Orphanage Committee,Pb 1702 Jamaith Hill  Calicut Kerala-673012,34150467.26
640,2011-2012,Kerala,052980166,J.D.MCLEOD MEMORIAL CHARITABLE TRUST,POOMALA P.O.SULTHAN BATHERY673592,0.00
641,2011-2012,Kerala,052900355,Jagadgura Educational Cultural and Charitable Trust,Vyasamandiram Chalakudy ThrissurKerala-680307,0.00
642,2011-2012,Kerala,052890015,Jai Chrito Province House,Mother Of Carmel Society PalakkadKerala-678004,2915973.18
643,2011-2012,Kerala,052940074,Jai Matha Province Idukki,Jaimatha Adoration Provincialate Kuthirakkallu Mariapuram P.O Idukki -236620Kuthirakkallu685602,4317168.00
644,2011-2012,Kerala,052890034,Jam-iyyathussa Fiyyen Charitable Society, Karinganad P.o. VilayurPalakkad - 679 309-,539000.00
645,2011-2012,Kerala,052930175,Jameyathu Ihiya-u-thurasulislamia Commtt,Edathara Kalanjoor P.o.Quilon --,0.00
646,2011-2012,Kerala,052950076,Jami Yyathul Mustharshidheen Charitable Trust,Islamic Residential High School Edayur(PO) MalappuramKerala-676554,906205.00
647,2011-2012,Kerala,052830027,Jamia Zahra, Mokeri P.o. PanoorKannur - 670 692-,0.00
648,2011-2012,Kerala,052980122,Jana Sankhya,P.b.- 35 MananthavadyWayanad - 670 645-,0.00
649,2011-2012,Kerala,052900324,Jananeethi,PB No.8Mannuthy POThottappady ThrissurKerala-680651,1107702.00
650,2011-2012,Kerala,052850419,Jancy Centre For Special Education,Eroor Po Kochi ErnakulamKerala.-,452308.00
651,2011-2012,Kerala,052870301,Japamala Bhavan Trust,Amayannoor KottayamKerala-686025,7268200.00
652,2011-2012,Kerala,052980021,Jaya Matha Ashram, Kartikulam P.o.Wayanad - 670 646-,3021492.27
653,2011-2012,Kerala,052850038,Jeevadan Convent(daughters Of Charity Of,Most Precious Blood Neeleewem P.o. KaladyErnakulam 683 584-,2402864.37
654,2011-2012,Kerala,052910291,Jeevan Jyothi Charitable Trust,Bishops House  VellayambalamThiruvananthapuram (kerala)-695003,10060932.00
655,2011-2012,Kerala,052870300,Jeevan Jyothi Seva Bharati Society,Poovanthuruthu P.o. KaduvakulamKottayam Distt. (kerala)-686012,698386.51
656,2011-2012,Kerala,052850481,Jeevan Vikas Trust,Pallotti Alayam Nethaji Road Aluva ErnakulamKerala-683101,3922193.00
657,2011-2012,Kerala,052830154,Jeevana Samskriti,Talap KannurKerala-670002,0.00
658,2011-2012,Kerala,052850479,Jeevodaya Provincial House,U.C. College P.O. Town/city:- AluvaDistt.:- Ernakulam Kerala-683102,1123141.14
659,2011-2012,Kerala,052830045,Jesus And Mary Kerala Society, KolayadKannur - 670 643-,132000.00
660,2011-2012,Kerala,052930176,Jesus Name Pentecostal Church In India, Peringande P.o. AdoorKannur - 691 528-,0.00
661,2011-2012,Kerala,052910336,Jesus the Love Ministries Trust,Jyothi Nilayam Mundakal Murukkumpuzha PostThiruvananthapuram Kerala-695302,0.00
662,2011-2012,Kerala,052850284,John Paul-ii Seminarian's Fund,St.josephs Pontifical Seminary AlwayeErnakulam - 683 102-,0.00
663,2011-2012,Kerala,052980154,Joint Voluntary Action For Legal Alternatives,Mandad Kalpetta North WayanadKerala-673122,0.00
664,2011-2012,Kerala,052850255,Josegiri Ashram,Attara Mookkannur P.o.Erankulam - 683 577-,0.00
665,2011-2012,Kerala,052830085,Josegiri Hospital, Thalasserry P.o.Kannur - 670 101-,0.00
666,2011-2012,Kerala,052910248,Joseph Memorial Mahila Samajam,Elavanikkara TrivandrumKerala-,0.00
667,2011-2012,Kerala,052870133,Josephine Sister's St. Joseph's Home, Villoonni P.o.arpookaraKottayam-,16448.00
668,2011-2012,Kerala,052810050,Jubilee Memorial Orphanage St. T.c.convent,Pazhayangady AlappuzhaAlleppey-688001,221280.00
669,2011-2012,Kerala,052900036,Jubillee Mission Hospital, TrichurKerala-680005,13660528.00
670,2011-2012,Kerala,052810067,Juharon Marthoma Metro Jubilee Mandiram,Jubliee Mendiram EdathuaTiruvalla-,203328.00
671,2011-2012,Kerala,052940050,Jyothi Bhavan Society, MoolamattomIdukki - 685 589-,663233.00
672,2011-2012,Kerala,052940034,Jyothi Bhavan Trust,Moolamattom  Idukki 685 589-,1882233.00
673,2011-2012,Kerala,052980167,JYOTHI NIVAS CHARITABLE SOCIETY,VAZHUVATTA MUTTIL SOUTH VILLAGEVAITHIRI TALUK673122,234166.00
674,2011-2012,Kerala,052850197,Jyothir Bhawan Instt. Of Spirituality, KalamasserryErnakulam - 683 104-,1264067.74
675,2011-2012,Kerala,052850450,Jyothirgamaya,College Road Muvattupuzha Ernakulam Distt.Kerala-686661,6526958.00
676,2011-2012,Kerala,052850338,Jyothy Bala Bhavan,Ayavana Po Muvattupuzha ErnakulamKerala-686676,266749.01
677,2011-2012,Kerala,052930059,K E Abraham Foundation,Hebron Hebrankuram Kumbanad Thiruvalla Kerala-689547,30827048.00
