1130,2011-2012,Kerala,052910242,Regional Cancer Centre Society,Medical College Campus Pb No.241Trivandrum Kerala-,10764688.00
1131,2011-2012,Kerala,052950055,Rehab. Foundation,P.o.box-48 Melakkam Manjeri MalapuramKerala-,275715.00
1132,2011-2012,Kerala,052940078,Relief and Life Society,Nadukani Karippalangadu P.O. Kulamavu IdukkiKerala-685601,0.00
1133,2011-2012,Kerala,052850331,Religious Handmaids Of S H Of Jesus,Snehanilayam KakkanadCochin - 30-,28232.00
1134,2011-2012,Kerala,052850494,Reparatrix Sisters of the Sacred Heart,Isabella De Rosis Convent Thevarkad Koonammavu VarapuzhaErnakulam Kerala-683517,12756728.00
1135,2011-2012,Kerala,052880006,Roman Catholic Diocese Of Calicut,Bishops House KozhikodeKerala-,15699343.25
1136,2011-2012,Kerala,052980030,Roman Catholic Diocese Of Mananthvdy,Bishop's House Mananthavady P.o.Distt. Wayanad Kerala-670645,26218931.52
1137,2011-2012,Kerala,052830019,Roman Catholic Diocese Of Tellichery,Bishops House Cannanore Kerala-,66718814.28
1138,2011-2012,Kerala,052900333,Rosary Hill Society, ThrissurKerala-,2344879.00
1139,2011-2012,Kerala,052880031,Rouzathul Uloom Arabic College Mang.comm,Farook College KozhikodeCalicut - 673 632-,0.00
1140,2011-2012,Kerala,052980141,Rural Agency For Social And Technological Advancement,Kambalakkad P.o. Via- Kalpetta District-  Wayanad  Kerala-673121,1054000.00
1141,2011-2012,Kerala,052910210,Rural Womens Development Society,Christal mandiramParassala P O695502,0.00
1142,2011-2012,Kerala,052850132,S H Adoration Province, KalamasseryErnakulam - 683 104-,42780.47
1143,2011-2012,Kerala,052880019,S H Carmelite Conventst Marys Province, Thiruvampady P.o.Kozhikode - 673 603-,839859.47
1144,2011-2012,Kerala,052830037,S H Congregation(sacred Heart Congregation),St. Joseph's Province S.h.convent Thondiyil P.o.Peravoor Kannur Kerala.-670678,1303648.69
1145,2011-2012,Kerala,052850277,S H Congregsation,Jyothi Province Kothamangalam`Kerala.-686691,6929049.25
1146,2011-2012,Kerala,052850357,S H Hospital,Arakuzha Muvattupazha ErnakulamKerala-686672,22040.00
1147,2011-2012,Kerala,052870230,S H Medical Centre,Nagampadam Kottayam686001-,0.00
1148,2011-2012,Kerala,052870066,S H Monastery,Chethipuzha Kurisummood P.o.changancherryKottayam - 686 104-,111100.00
1149,2011-2012,Kerala,052980027,S H Region Carmelite Convent,Nadavayal MananthavadyWayanad - 670 721-,329732.79
1150,2011-2012,Kerala,052850090,S. H.Provincial House,Rajagiri P.O. KalamasserryEranakulamKerala-683104,1597997.92
1151,2011-2012,Kerala,052850225,S.D.Generalate,Thottumughqam AluvaErnakulam Distt. Kerala.-,18490231.84
1152,2011-2012,Kerala,052900060,S.h Congregation Vimala Province,Pochimattom Parathodu P.o.Kottayam - 686 512-,578344.04
1153,2011-2012,Kerala,052880105,S.h. Congregntionsh Provincial House, Asokapuram P.o.Calicut-,749944.95
1154,2011-2012,Kerala,052830138,Sachidanada Prakruthi Kshethram Trust, Pottenpalave P.o.naduvil(via)Kannur 670 582-,538450.00
1155,2011-2012,Kerala,052850018,Sacred  H eart Provincial House,Clarapuram - Aluva Kerala -683101,114008.38
1156,2011-2012,Kerala,052850293,Sacred Heart Balanagar, MookkannurErnakulam-,960000.00
1157,2011-2012,Kerala,052830017,Sacred Heart Childrens Home, KottiyoorKannur - 670 674-,185782.52
1158,2011-2012,Kerala,052900281,Sacred Heart Church, PerincheryTrichur Kerala-,0.00
1159,2011-2012,Kerala,052940051,Sacred Heart Convent,Kulamavu Po IdukkiKerala-685601,446150.00
1160,2011-2012,Kerala,052870084,Sacred Heart Conventst Mathews Pro.hous, ChanganacheryKottayam-,117323.03
1161,2011-2012,Kerala,052810029,Sacred Heart General Hospital,Green Gardens CherthalaAlappuzha Kerala-688524,121000.00
1162,2011-2012,Kerala,052870136,Sacred Heart Generalate, Manganam P.o.vidyanagarKottayam - 686 018-,628059.27
1163,2011-2012,Kerala,052870154,Sacred Heart Hospital,Chakkampuzha PalaiKerala-,0.00
1164,2011-2012,Kerala,052940042,Sacred Heart Hospital,Paynkulam Mallacompu Po Thodupuzha Idukki Kerala-,4695.00
1165,2011-2012,Kerala,052900071,Sacred Heart Mission Hospital,Pullur Po Irinjalakuda TrichurKerala-680683,0.00
1166,2011-2012,Kerala,052850210,Sacred Heart Monastery,Thevara CochinKerala-,0.00
1167,2011-2012,Kerala,052870091,Sacred Heart Mount Monastery, S.h. Mount P.o.Kottayam - 686 006-,4264453.69
1168,2011-2012,Kerala,052830064,Sacred Heart Of Medical Trust Of St J.P.,Christhu Raj Hospital Nirmalagiri P.o.Kannur 670 701-,0.00
1169,2011-2012,Kerala,052870014,Sacred Heart Orphanage,Poovarany Po KottayamKerala-686577,238405.51
1170,2011-2012,Kerala,052880023,Sacred Heart Orphanage Carmelite Convent, Thiruavampady P.o.Kozhikode - 673 603-,843678.16
1171,2011-2012,Kerala,052850230,Sacred Heart Philosophy College,Monastery Lane AlwayeErnakulam - 683 101-,1666316.00
1172,2011-2012,Kerala,052850241,Sacred Heart Poor House,Perumpadappu Kochi ErnakulamKerala-682006,10516.00
1173,2011-2012,Kerala,052870172,Sacred Heart Province,Palai  KottayamKerala-686575,124441.71
1174,2011-2012,Kerala,052850078,Sadhu Sevana Sabha,Mallussery Vattaparambu P.o. AngamelyErnakulam - 683 579-,595480.00
1175,2011-2012,Kerala,052940041,Sahayagiri Health Care Society,Olamattom Thodupuzha P.OIdukki685584,2861.00
1176,2011-2012,Kerala,052910207,SAHAYI Centre For Collective Learning And Action,Santhi Complex Valiyapadom Vilanthara.P.O. West KalladaKOLLAM690521,0.00
1177,2011-2012,Kerala,052850186,Sahrudaya Services And Charities,Sh Provincial House Rajagiri P.o.kalamasseryErnakulam Kerala-683104,164276.00
1178,2011-2012,Kerala,052930231,Sahyadri Leprosy Eradication Trust,XII/752 Valliaparambilpady Pazhanvangadi P.O. RanniPathanamthitta Dist. Kerala-689673,0.00
1179,2011-2012,Kerala,052910308,Saint Vincent Charitable Trust,Navajeevan Home for Boys Vellanad POThiruvananthapuram (Kerala)-695543,3589214.00
1180,2011-2012,Kerala,052850107,Saint Vincent Pallottine Convent, CochinKerala-,12823585.00
1181,2011-2012,Kerala,052910301,Sakhi,T.c. 27/2323 Convent Road ThiruvananthapuramKerala-695001,1773078.00
1182,2011-2012,Kerala,052880128,Salafi Charitable Trust,Narikkuni Town KozhikodeKerala.-,11400490.51
1183,2011-2012,Kerala,052880176,SALAFIYYA ASSOCIATION MEPPAYUR,SALAFI CAMPUS  PB No 01 MEPPAYUR POSTKOZHIKODE673524,50000.00
1184,2011-2012,Kerala,052930025,Salem Orphanage, Manjadi P.o.Thiruvalla - 5-,0.00
1185,2011-2012,Kerala,052870293,Salvatorian Sisters Institute,Villoonni Kottayam Kerala  -,12347628.00
1186,2011-2012,Kerala,052870161,Samagra Vikas Social Service Society,   -,840760.00
1187,2011-2012,Kerala,052850446,Samanvaya Theologate Trust,Karikkamuri(p.b.no.1056) Cochin Ernakulam Kerala-682011,10899930.53
1188,2011-2012,Kerala,052870320,Samaritan Educational and Charitable Society,587/VIII. Doctors Tower Changanacherry KottayamKerala-686101,0.00
1189,2011-2012,Kerala,052850239,Samaritan Hospital, ErnakulamKerala-,5771684.00
1190,2011-2012,Kerala,052950032,Samastha Kerala Fund,Chelari Thenipalam  MalappuramKerala-,0.00
1191,2011-2012,Kerala,052830042,Samastha Kerala Jam Eythul Ulma (skju),   -,348391.00
1192,2011-2012,Kerala,052950031,Samastha Kerala Jamiyyathul Muallimeen,Centre Council (s K J M ) Thenhipalam P.o.Malappuram-,0.00
1193,2011-2012,Kerala,052810129,Samhathi,Ashramam Junction Avalookunnu P.o.Alleppey (kerala)-688006,12746091.00
1194,2011-2012,Kerala,052910213,Samoohaya Kshema Vanitha Samajam,Mullilavuvila Kudayal Po Vellarada ThiruvanthpurKerala-695505,0.00
1195,2011-2012,Kerala,052850492,Samridhy,Social Service Society Vazahappilly Mudavoor PostMuvattupuzha Erankulam Kerala-686669,4904281.25
1196,2011-2012,Kerala,052830144,Samskriti,P. Box No.3 Priyaram P.o.   Distt. Kannur Kerala -670502,0.00
1197,2011-2012,Kerala,052850291,San Juan Bhavan,Apostalic Bm College ErnakulamKerala-682021,2737920.00
1198,2011-2012,Kerala,052880171,SANATHANA DIVYAKARUNYA VIDYAPEETHAM,PB. NO. 5 THAMARASSERY P.O.KOZHIKODE673573,56817.00
1199,2011-2012,Kerala,052870295,Sanjivani Charitable Society,Chelacombu Karukachal  Kottayam Kerala  -686540,1566600.00
1200,2011-2012,Kerala,052900276,Sanjo Bhavan Orphanage,Kuzhikkattukaonam Madaibuonam Po TrichurKerala-,171080.42
1201,2011-2012,Kerala,052850258,Sanjo Bhawan,(Sisters of St. Joseph of St. Marks Vengoor AngamalyErrnakulam Distt. Kerala.-685591,6842013.00
1202,2011-2012,Kerala,052850182,Sanjoe Hospital,Perumvaboor ErnakulamKerala-683542,0.00
1203,2011-2012,Kerala,052900169,Sanjos Ashram, ManalurTrichur - 680 617-,60589.91
1204,2011-2012,Kerala,052850371,Sannidhana Ashram M.c.b.s.prayer House, Jllithode MalayattoorErnakulam - 683 587-,32683.64
1205,2011-2012,Kerala,052850320,Santa Teresa Convent,Angamaly Kerala -,3325873.00
1206,2011-2012,Kerala,052850163,Santhi Bhavan Educaion,Eda Cochin 6 Dt ErnakulamKerala-,0.00
1207,2011-2012,Kerala,052850196,Santhi Bhavan Orphanage,Guild Of Charity AngamaliErnakulam - 683 572-,0.00
1208,2011-2012,Kerala,052880014,Santhi Bhavan Social Centre,Malaparamba Po CalicutKerala-673009,9341532.00
1209,2011-2012,Kerala,052900037,Santhi Bhavan Social Centre Of Physically Handicapped,Chalakudy TrichurKerala-680307,0.00
1210,2011-2012,Kerala,052880135,Santhi Charitable Society,Shanthi Bhawan 30/1071-A  Kozhikode Kerala  -673008,8509290.00
1211,2011-2012,Kerala,052890007,Santhi Nilayam (samaritan Sisters),Kozhipara Po Elipara PalghatKerala-,0.00
1212,2011-2012,Kerala,052850367,Santhidham Society Srs. Holy Spirit, Chunangumvelly AlwayeErnakulam - 683 105-,1684531.00
1213,2011-2012,Kerala,052910179,Santhigiri Ashramam,Koliyadode Po VenjaramooduTrivandrum Kerala-,47728.00
1214,2011-2012,Kerala,052940053,SANTHIGIRI REHABILITATION INSTITUTE,Vazhithala ThodupuzhaIdukki - 685 583-,5813415.12
1215,2011-2012,Kerala,052850536,SANTHIGIRI TRUST,11/488 EDATHALA NORTH (P.O.)ALWAYE683564,394186.00
1216,2011-2012,Kerala,052910239,Santhigram,Chowara Kazhuvur Po: PulluvilaTrivandrum - 695 526-,1491194.00
1217,2011-2012,Kerala,052850538,SANTHIMARGAM SOCIAL WELFARE SERVICE SOCIETY,NAD EDATHALA ROAD SANTHIGIRIKALAMASSERY683563,60000.00
1218,2011-2012,Kerala,052900272,Santhome Orphanage, ChoondalTrichur Kerala-680502,0.00
1219,2011-2012,Kerala,052830030,Santhosh Bhavan Orphanage, Vayattuparamb NaduvilKannur - 670 582-,170627.48
1220,2011-2012,Kerala,052830010,Santhosh Bhavan Social Centre,Ramathally Payyannoor KannurKerala-670308,0.00
1221,2011-2012,Kerala,052830003,Santhoshalayam Social Centre,Kuttoor Po KannurKerala-670306,0.00
1222,2011-2012,Kerala,052830052,Saranalayam Social Centre,Edakom Chapparapadave Po KannurKerala-670581,0.00
1223,2011-2012,Kerala,052960003,Sarrathika Sahodarya Samithi,Vadakkumbhagam Ward  North Of Velankanni Shrine Kollam Kerala-,84609.00
1224,2011-2012,Kerala,052900278,Sarto Sadanam,Karanchira Po Kottoor TrichurKerala-680702,376978.21
1225,2011-2012,Kerala,052920010,Satchidananda Charitable Medical Trust,Ramnagar Post Anandashram Kanhangad KasaragodKerala-671531,2853824.36
1226,2011-2012,Kerala,052910265,Sathyan Memorial Arts And Sports Club,Undappara Poochal P.o ThiruvanandapuramKerala.-,0.00
1227,2011-2012,Kerala,052810049,Sava Samajam Childrens Home,Cherthala Pattanakad P.o. CherthalaAlleppeykerala-,282063.00
1228,2011-2012,Kerala,052850308,Save A Family Plan Cochin Soc. Ser. Soc., CochinKerala-,4459010.00
1229,2011-2012,Kerala,052850028,Save A Family Plan India,Aiswaryagram Parappuram KanjoorKerala-683593,207535068.00
1230,2011-2012,Kerala,052900002,Save A Family Plandiocese Of Tri,Caholic Bishops House TrichurKerala-,4330825.00
1231,2011-2012,Kerala,052830101,Savio Boys Town,Kilianthara KunnothKannur - 670 706-,5943527.71
1232,2011-2012,Kerala,052900269,Savio Home Orphanage, ManakodyTrichur Kerala-680017,419466.38
1233,2011-2012,Kerala,052900247,Schoenstatt Secular Insitute,South Bazar Irinjalakuda  TrichurKerala-680121,0.00
1234,2011-2012,Kerala,052930002,School For Partially Hesaring,Manakala- P.o. Adoor Pathanamthitta-distKerala -691551,4236.00
1235,2011-2012,Kerala,052870179,School For The Deaf And Blind,Assisi Mount NeerparavadakaraKottayam - 686 605-,1619820.50
1236,2011-2012,Kerala,052910372,SCHOOL OF SANTHI,96 M.P. APPAN NAGAR VAZHUTHACAUDTHIRUVANANTHAPURAM695014,0.00
1237,2011-2012,Kerala,052900343,School Sisters Of St. Francis,Lourdepuram Thrissur-5Kerala-,3926480.00
1238,2011-2012,Kerala,052980119,Secana Sadanam Social Service Centre, Ripow P.o. MeppadyWayanad - 673 597-,0.00
1239,2011-2012,Kerala,052870080,Sector Asia Medical Mission Srs.society,,451874.00
1240,2011-2012,Kerala,052910122,Secular Institute Of Voluntas Dei India Region Bethel,Azhakulam Vizhinjam TrivandrumKerala-,3861076.00
1241,2011-2012,Kerala,052930208,SEIREI ASHA BHAVAN, Valacodu P.o. PunalurKollam - 691 331-,337029.00
1242,2011-2012,Kerala,052910033,Self Employed Womens Association,Pco Centrespencer Junction  Trivandrum-,909158.00
1243,2011-2012,Kerala,052890019,Seraphic Provincial House,24/376 West Fort Palakkad Kerala-678001,10455677.00
1244,2011-2012,Kerala,052900048,Seraphic Social Centre,Vellikulangara Thrissur Distt.Kerala-,0.00
1245,2011-2012,Kerala,052870357,SERENITY HOME,PAMPOLYELIKKULAM686577,131410.43
1246,2011-2012,Kerala,052870270,Servants Of Jesus Christ Welfare Sociey,Timnath Serah EraviperoorTiruvalla - 689 542-,6847944.98
1247,2011-2012,Kerala,052930020,Seva Nilayam Social Centre,Koduman Po PathanamthittaKerala-691555,0.00
1248,2011-2012,Kerala,052870283,Sevagram Trust Othy,Pothy Thalayola Parambu P.o.Kottayam - 686 605-,1369627.00
1249,2011-2012,Kerala,052900357,Sevanagiri Sevanalaya,PO-Annalloor Mala ThrissurKerala-680731,0.00
1250,2011-2012,Kerala,052980013,Sevena Bhavan Social Centre, WayanadKerala-,0.00
1251,2011-2012,Kerala,052870200,Shalom Christian Education & Service Trust,Shalom Bunglow Vadavathoor Po KottayamKerala-686010,973514.00
1252,2011-2012,Kerala,052850534,SHANTHI BHAVAN SOCIETY,ASHOKAPURAM POSTALWAYE (ALUVA)683101,2628913.00
1253,2011-2012,Kerala,052900099,Shanthi Bhawan Convent, KannamkulangaraTrichur - 680 007-,0.00
1254,2011-2012,Kerala,052830018,Shanthi Nilayam Social Centre,Pilathara Po KannurKerala-670501,0.00
1255,2011-2012,Kerala,052870054,Shanti Bhavan Balika Mandiram,Erattupetta Aruvithura Po KottayamKerala-686122,271256.44
1256,2011-2012,Kerala,052930112,Sharon Bible College,Sharon House  Tiruvalla - 689 101-,1284753.00
1257,2011-2012,Kerala,052930072,Sharon Fellowship Church,  Tiruvalla - 689 101-,529172.00
1258,2011-2012,Kerala,052850443,Shilpa Society For The Mentally Handicapped,21/1252-a Palluruthy CochinErnakulam Kerala-682006,246340.50
1259,2011-2012,Kerala,052910246,Shree Chitra Tiruna Institute For Medical Sciences & Technology, Trivandrum.Kerala-,12734997.41
1260,2011-2012,Kerala,052910327,Shree Rama Dasa Mission,Sree Neelakantapuram Chenkottukonam Thundathil P.O.Thiruvananthapuram Kerala-695581,0.00
1261,2011-2012,Kerala,052980133,SHREYAS,P.b.no.-7 Solthan Bathery District Wayanad Kerala-673592,13080422.00
1262,2011-2012,Kerala,052910269,Shri Sathya Sai Orphanage Trust,T.c. A/1108 Ajith Bulding Sasthamangalam ThiruvanathapuramKerala -,825891.00
1263,2011-2012,Kerala,052870343,SHRI. P.R.S PILLAY MEMORIAL BALVIKAS TRUST,OPP. HINDUSTAN LATEXPEROORKADA690005,0.00
1264,2011-2012,Kerala,052900319,Silent  Valley Residential Voational Training Centre For Deaf Women,Paravattani ThrissuirKerala-680005,132200.00
1265,2011-2012,Kerala,052880016,Silver Holly Ashram & School,Paroppady MarykunnuCalicut - 673 012-,0.00
1266,2011-2012,Kerala,052830050,Simha Bhawan Social Centre,Matha Mangalam KannurKerala-670306,0.00
1267,2011-2012,Kerala,052880113,Sirajul Huda Educational,Complex Kozhikode KeralaPin: 673 508-,14643645.77
1268,2011-2012,Kerala,052810128,Sisodia Educational  Medical & Charitable Society,Kallakadavu P.o. Kollakadav AlleppyKerala-690509,0.00
1269,2011-2012,Kerala,052850250,Sister  Of Mary Immaculate  Of Bishop Morrow - Kalmassery,Changampuzhangar P.o. Dist- Kochi Kerala -682033,1400000.00
1270,2011-2012,Kerala,052830060,Sister Of Adoration Of Blessed Sacrament,Josegiri Provincial House ThalasseryKannur - 670 101-,1368049.82
1271,2011-2012,Kerala,052850093,Sister Of St Elizabeth,Preshitha Bhavan Thottumugham P.O.Alwaye Kerala.-683105,191858.00
1272,2011-2012,Kerala,052900201,Sister Of St Peter Claver, Olarikkara P.o. PullazhiTrichur - 680 012-,0.00
1273,2011-2012,Kerala,052850017,Sister Of St.josephs Cottalengo Little H,House Divine Providence Beach Road Fort KochiErnakulam - 682 001-,1238926.00
1274,2011-2012,Kerala,052850399,Sisters Charity Our Lady Of God & Pepetual Succour,Bmc Road Thrikkakara Po  CochinKerala-682021,513426.00
1275,2011-2012,Kerala,052850462,Sisters of Holy Nativity,Infant Jesus Convent Building Perumpadappu CochinErnakulam Distt. (Kerala)-682006,1335780.00
1276,2011-2012,Kerala,052930105,Sisters Of Imitation Of Christ,Province of Thiruvalla Bethany Convent Thiruvalla Kerala-689115,82698.00
1277,2011-2012,Kerala,052850530,SISTERS OF IMITATION OF CHRIST MUVATTUPUZHA PROVINCE,BETHANY SISTERS PROVINCIALATEERNAKULAM686667,661250.00
1278,2011-2012,Kerala,052810061,Sisters Of Mary Immaculate Of Bishop Morrow- Poomkavn,Pathirapally P.o. Alleppy                 District- Alapuzha Kerala-688521,1000000.00
1279,2011-2012,Kerala,052850457,Sisters Of Mercy Of The Holy Cross,Holy Cross Institute  Thrikkakara CochinErnakulam (kerala)-682021,6545433.36
1280,2011-2012,Kerala,052850483,Sisters of our Lady of consolation,Consolata Convent Building Kumbalanghi CochinErnakulam kerala-682007,4637453.00
1281,2011-2012,Kerala,052850522,Sisters of St. Mary Magdalene Postel,Our Lady of Mercy ConventKuttikattukara Kadungalloor683504,5307518.00
1282,2011-2012,Kerala,052890006,Sisters Of St.francis Of Assisi Bhavan,Palghat Kerala -,13537422.00
1283,2011-2012,Kerala,052850319,Sisters Of The Destitute St Marys Pro.,Chunagamvely AluvaErnakulam - 683 105-,8965069.27
1284,2011-2012,Kerala,052930238,SISTERS OF THE IMITATION OF CHRIST PATHANAMTHITTA PROVINCE,BETHANY PROVINCIAL HOUSE NANNUVAKAD PATHANAMTHITTAPATHANAMTHITTA689645,6707142.10
1285,2011-2012,Kerala,052960016,Sisters Servants of the poor(Cusmano Bhavan),Elampal PO Vilakudy Village Pinapple Junction PunalurKollam Kerala-691322,347591.00
1286,2011-2012,Kerala,052850329,Sisu Bhavan Sisters Of Nazareth,Paduapuram Po ErnakulamKerala-683582,641809.16
1287,2011-2012,Kerala,052910173,Sivananda Yoga Vedanta Dhanwantari Asrm,Kerala   -,36948072.50
1288,2011-2012,Kerala,052890071,Skdi Orphanage Committee,Skdi Orphanage P. O. - Vallapuzha Palakkad Kerala  -679336,0.00
1289,2011-2012,Kerala,052900026,Slum Service Centre,Kuriachira TrichurKerala-,754833.00
1290,2011-2012,Kerala,052870148,Sneha Bhavan,Bharananaganam Po KottayamKerala-686578,297531.37
1291,2011-2012,Kerala,052870280,Sneha Bhavan, Gandhinagar P.o.Kottayam - 686 008-,923798.26
1292,2011-2012,Kerala,052900149,Sneha Bhavan Convent, Poomkunnam P.o.Trichur - 680 002-,0.00
1293,2011-2012,Kerala,052980011,Sneha Bhavan Social Centre,S. Battery Chethalayam P.o.Wayanad - 673 592-,0.00
1294,2011-2012,Kerala,052830143,Sneha Bhawan,St. Stephens Charitable Society  Aryangad Alachery P. O. Distt. Kannur Kerala -,0.00
1295,2011-2012,Kerala,052910197,Sneha Deepam Society,Pullampalil KumarapuramTrivandrum - 695 011-,536637.00
1296,2011-2012,Kerala,052830007,Sneha Niketan Social Centre,Dinesevanasabha Pattuvam Taliparamba  Kannur Distt.Kerala-670143,2906224.00
1297,2011-2012,Kerala,052910241,Sneha Nikethan,Ottasekharamangalam TrivandrumKerala-695125,455218.00
1298,2011-2012,Kerala,052870060,Sneha Sadan Orphanage,Kaduthuruthy Arunoottimangallam Po KottayamKerala-686604,197534.35
1299,2011-2012,Kerala,052940061,Sneha Trust,Padamugham P.o.  Idukki Kerala  -,135281.00
1300,2011-2012,Kerala,052980155,Snehabhavan,Chettappalam-Vemom P.O. MananthavadyWayanad Distt. (Kerala)-670645,1311675.00
1301,2011-2012,Kerala,052900350,Snehadepthy Charitable Trust,Congregation of Samaritan Sisters Mannuthy Post ThrissurKerala-680651,4203882.00
1302,2011-2012,Kerala,052870029,SNEHAGIRI INSTITUTIONS, Kroor P.o. PalaKottatym-,2330142.35
1303,2011-2012,Kerala,052870028,Snehagiri Missionary Sister's, Karoor P.o. PalaKottayam - 686 575-,7586599.17
1304,2011-2012,Kerala,052900090,Snehagiri Society, Kuruvilessery P.o.Trichur - 680 735-,519899.00
1305,2011-2012,Kerala,052850198,Snehalayam Srs.of Destitute,Malayankeezhu KothamangalamErnakulam --,3172.00
1306,2011-2012,Kerala,052900156,Snehalayan Boys Home,Peechi Pattikkad Po TrichurKerala-680652,309997.54
1307,2011-2012,Kerala,052900334,Sneharam Charitable Society,Manalur P.o ThrissurKerala.-,419920.00
1308,2011-2012,Kerala,052910189,Sneharam Social Welfare & Chart. Society,Rgd. Office Sneharam AnjengoKerala-,0.00
1309,2011-2012,Kerala,052900305,Social  Centre Housing,Diocese Of Trichur  TrichurKerala-,0.00
1310,2011-2012,Kerala,052900080,Social Action,Arch Diocese of Trichur  Trichur Kerala-680005,0.00
1311,2011-2012,Kerala,052900055,Social Action Forum,"SOCIAL ACTION FORUM
CATHEDRAL JUNCTION WEST
IRINJALAKUDA 680121IRINJALAKUDA680121",6370087.00
1312,2011-2012,Kerala,052950079,SOCIAL ADVANCEMENT FOUNDATION OF INDIA (SAFI),RASIA NAGAR VAZHAYOOR EAST P.O.VAZHAYOOR673633,18315283.60
1313,2011-2012,Kerala,052880151,Social Network for Education Research and Human Action(SNEHA),31/617Ist Floor V.O. Road VadakaraKozhikode-Kerala-673101,0.00
1314,2011-2012,Kerala,052910279,Social Organisation For Mental Health Action,Ur-8 Uppalam Road Trivandrum Kerala-475650,2492903.00
1315,2011-2012,Kerala,052980044,Social Service Centre Dio Of Bathery,Pb 7 Sultan Battery MananthavadyWayanad - 670 645-,1456353.00
1316,2011-2012,Kerala,052880114,Social Service Centre(Centre for Overall Development),P.B.No.33 Matha Towers ThamarasseryKozhikode673573,3490714.00
1317,2011-2012,Kerala,052900140,Social Service Deptt D M Provincial Hous, PatturaikkalTrichur - 680 001-,9739.00
1318,2011-2012,Kerala,052810039,Social Welfare Society,Society Building Thathampally P.o.Alleppey            -688013,0.00
1319,2011-2012,Kerala,052890075,Social Welfare Society,Kizhakkethara Pallavur Via KunisseryPalakkad (Kerala)-678688,0.00
1320,2011-2012,Kerala,052850217,Social Welfare Technical School  Association,Aluva Ernakulam Distt. Kerala -683101,0.00
1321,2011-2012,Kerala,052810142,SOCIETY FOR ECONOMIC AND ENVRIONMENTAL DEVELOPMET,S L PuramAlappuzha688523,0.00
1322,2011-2012,Kerala,052870304,Society for Empowerment of the Learning Disabled,Building No.315 Ward-II St John of  God CentreVelloor P.O. PampadyPanchayatKottayam-Kerala-686501,4905458.00
1323,2011-2012,Kerala,052890072,Society For Rehabilitation Of The Poor & The Handicappcl,Rehb Ceuse Mangalam - Post Lakkidi (via) Distt.  Palakkad Kerala -,1264455.00
1324,2011-2012,Kerala,052910299,Society For Unity And Integral Progress,Unity House Chittazha Vattappara (p.o.)Thiruvananthapuram (kerala)-695028,4882051.00
1325,2011-2012,Kerala,052940071,Society Of  St. Joseph,Nirmala BhavanSABS Provincial House Thodupuzha - 685584Thodupuzha685584,13420110.07
1326,2011-2012,Kerala,052880046,Society Of Bridgettines,Bridgettine Convent Calicut -673012,50160.00
1327,2011-2012,Kerala,052830028,Society Of Daughter's Of  St. Camillus,Chungakunnu P.o. Via Kottiyoor Dist. Kannur         Kerala-670651,82358.00
1328,2011-2012,Kerala,052910037,Society Of Daughters Of Mary,Maria Bhavan Kudappanakkunu P.o.Trivandrum - Kerala Tamilnadu-695043,684000.00
1329,2011-2012,Kerala,052980052,Society Of Daughters Of St. Camillus,Varampatta Po WyanadKerala-673575,30716270.17
1330,2011-2012,Kerala,052910076,Society Of Intgrated Dev.of Rural People,Kadavattaram Neyyattinkara Post Trivandrum District Kerala. -,0.00
1331,2011-2012,Kerala,052830056,Society Of Kristu Dasis,Thonichal Nallornadu WyanadKerala-,3948022.24
1332,2011-2012,Kerala,052900219,SOCIETY OF NIRMALA DASIKAL,Nirmala Generalate Ayyappankavu P O MulayamThrissur680751,808414.00
1333,2011-2012,Kerala,052880005,Society Of Prentation Sisters,  Kerala-,8698866.00
1334,2011-2012,Kerala,052880036,Society Of Sisters Of Charity,Holy Redeemer Convent Malaparamba CalicutKerala-673009,29056276.00
1335,2011-2012,Kerala,052980056,Society Of Sisters Of Redemption, Ripow P.o. MeppadyWayanad - 673 597-,45000.00
1336,2011-2012,Kerala,052890063,SOCIETY OF SISTERS OF ST JOSEPH,Palghat  Kerala-,2064724.00
1337,2011-2012,Kerala,052930080,Society Of Sisters Of The Holy Cross Provinciate,Hospital Road Kollam Kerala -691001,11631556.34
1338,2011-2012,Kerala,052880055,Society Of Srs.of Charitylourde Convent, Sellera MalaparambaCalicut - 673 009-,2877377.58
1339,2011-2012,Kerala,052850171,Society Of St Catherines Convent, EdakochiKochi- 682 006-,24565.00
1340,2011-2012,Kerala,052870228,Society Of St.Thomas,Christavashram Manganam- P.o.Kottayam Kerala-686018,957520.00
1341,2011-2012,Kerala,052880102,Society Of The Dimesse Sisters Daughters of Mary Immaculate,Mavoor Calicut Kerala -673661,11018824.00
1342,2011-2012,Kerala,052890077,Society of the Sisters of St. Francis,St. Francis Convent Asokapuram AluvaPalakkad (Kerala)-680101,11155810.00
1343,2011-2012,Kerala,052880009,Society Of Venerini Sesters,   -,7205204.00
1344,2011-2012,Kerala,052850304,Society St. Vincent Depaul St Joseph Hospital,Poovathussery Parakkadavu ErnalukamKerala-683579,0.00
1345,2011-2012,Kerala,052870185,Society St.vincent De Paul Cent.council,St.thomas Press Bludg. Palai P.o.Kottayam  686 575-,2024572.00
1346,2011-2012,Kerala,052830011,Society Ursuline Con.of Mary Immculate,  Kannur-670001,3959353.00
1347,2011-2012,Kerala,052920014,SOCIO ECONOMIC DEVELOPMENT SOCIETY SEDS,KMC 17 35D MONACHA UPPILIKAI P OKANHANGAD671314,0.00
1348,2011-2012,Kerala,052910238,Socio Economic Unit Foundation,Tc.16/309easwarvilasam Road Thycaud P.o.Trivandrum - 695 014-,1161113.68
1349,2011-2012,Kerala,052880066,Socio Religious Centre, MalaparambaCalicut - 673 009-,0.00
1350,2011-2012,Kerala,052850474,Socity  Of  Vimla,Nirmala Bhavan MuvattupuzhaErankulam  Kerala-686661,942200.00
1351,2011-2012,Kerala,052850184,Socy. For Relief Work For Poor Family,   -,13859971.00
1352,2011-2012,Kerala,052930117,Sodari Bhavan,Near Shankar Hospital KadanmukkuKollam-,136962.00
1353,2011-2012,Kerala,052940054,Solaidarity Movement Of India Cen.Commt., Kanjikuzhy P.o.Idukki - 685 602-,0.00
