1456,2015-2016,Andhra Pradesh,010120059,Society for Health Education & Development,Madakasirem Anantpur DistAndhra Pradesh -515301,9469.00
1457,2015-2016,Andhra Pradesh,010180076,Society for Health Agricultural Development & Education,Kovvurugudem Chintalapudi West Godavri Dist.Andhra Pradesh-534460,555592.00
1458,2015-2016,Andhra Pradesh,010140083,Society For Help & Action For the Rural Poor,22-976 Muriganipalle M.K. Battu(Post) K.Batta (P)Chittoor -,450000.00
1459,2015-2016,Andhra Pradesh,010330068,society for help entire lower and rural people,D.No.8-217-1 Rajeev Nagar Lawyerpet extONGOLE523002,13682754.70
1460,2015-2016,Andhra Pradesh,010190233,Society for Helping Action for Rural Poor,Door No.-22-7-33AMotupallivary St. Kothapet TenaliGuntur District (Andhra Pradesh)-522201,20841.00
1461,2015-2016,Andhra Pradesh,010170115,Society for Helpless & Economically Backward Area,Skheba Tuni Distt. East Godavari  Andhra Pradesh-533401,18535726.91
1462,2015-2016,Andhra Pradesh,010140208,Society For Human Advancement & Rural Education,Tirupati Rural Mandal Chiguruvada Vill. & P.O.Distt. Chittoor A.P.-,3156449.00
1463,2015-2016,Andhra Pradesh,010140386,Society for Human Rights and Social Development,9-57 Amaravathi Nagar TiruptatiAndhra Pradesh-517502,0.00
1464,2015-2016,Andhra Pradesh,010350174,Society for Human Science & Service,35 Daspalla Hills VisakhapatnamAndhra Pradesh-530003,1619205.00
1465,2015-2016,Andhra Pradesh,010350022,Society for Integrated Development through Environmental Awakening),Flat No. 4c Maharaja Towers   R.K. Mission Road VishakapatnamAndhra Pradesh-530003,0.00
1466,2015-2016,Andhra Pradesh,010170131,Society for Integrated Rural Development,D.No. 11-3-4/1 C.B.M. Compound RamachandrapuramEast Godavari Distt. (A.P.)-533255,0.00
1467,2015-2016,Andhra Pradesh,010190179,Society for Integrated Rural Development,15-12-68 Venkatrao Nagar GunturAP-522001,9928902.00
1468,2015-2016,Andhra Pradesh,010120122,Society for Integrated Rural Improvement,5-164A- 4th Road AnantapurAndhra Pradesh-,0.00
1469,2015-2016,Andhra Pradesh,010350130,Society for Love in Action,D.No.38-31-65 Green Gardens Marripalem VisakhapatnamAndhra Pradesh-530018,0.00
1470,2015-2016,Andhra Pradesh,010350226,SOCIETY FOR MOBILISATION AND INTEGRATED LIVELIHOOD PROMOTION AND EDUCATION (SMILE),Karrivari street AnakapalliVisakhapatnam dist531002,0.00
1471,2015-2016,Andhra Pradesh,010370036,Society for Multiply Action And Rural Technology,Chappabutchammapeta (Post) Makkuva MandalamVizianagaram Distt.-535547,0.00
1472,2015-2016,Andhra Pradesh,010330033,Society for National  Intergartion  through Rural  Development,RAILPET P.B.NO-  24 ONGOLEDistrict- PRAKASAM  Andhra Pradesh-523001,15656642.00
1473,2015-2016,Andhra Pradesh,010180129,Society for Noble Service to Poor,Annadevarapeta PO Tallapudi Mandal West GodavariAP-,0.00
1474,2015-2016,Andhra Pradesh,010370060,Society for Nurture Education Health Activities,Door No. 517 Gotlam Village S.O.Cantonment VizianagaramAndhra Pradesh-535003,17976216.31
1475,2015-2016,Andhra Pradesh,010350148,Society for Operation Minimum Need - India,5B RK's Sai Sadhan 6-18-1/14 East Point ColonyVisakhapatnam (Andhra Pradesh)-,4470623.00
1476,2015-2016,Andhra Pradesh,010270084,Society For Peace Rural Education & Awareness Development,Plot No.39 Telecom Nagar Nandyal Road B. Camp ROADDistt. Kurnool Andhra Pradesh-518002,0.00
1477,2015-2016,Andhra Pradesh,010120131,Society for People Education and Economic Development,Vil. Nalluru Roddam Mandal  Anantapur Andhra Pradesh -,0.00
1478,2015-2016,Andhra Pradesh,010310297,Society for Peoples Education and Economic Change,Opp. Government HospitalIndukurpet524314,796211.00
1479,2015-2016,Andhra Pradesh,010120144,Society for Rayalaseema Integrated Rural Education and Development,D No 5/4B Backside of Old MDO OfficeYenumulapalli VillagePuttapathi Mandal515134,0.00
1480,2015-2016,Andhra Pradesh,010270124,Society for Rural & Eco Development,H.No.2-79-B Nethaji Nagar Atmakur Kurnool Distt.Andhra Pradesh.-518422,0.00
1481,2015-2016,Andhra Pradesh,010170223,Society for rural Agriculturists and Mass awareness,Door NO. 4-1 Town/City:Alamuru Distt: east GodavariAndhra Pradesh-533233,0.00
1482,2015-2016,Andhra Pradesh,010310202,Society for Rural and Environment Development,Behind S.V.Praja Yidyasala Atmakur Nellore (A.P.) -534322,0.00
1483,2015-2016,Andhra Pradesh,010270009,Society for Rural Development,Nossam Koilkuntal Distt. Kurnool A.P. -,3559061.00
1484,2015-2016,Andhra Pradesh,010310096,Society For Rural Development,Church Street Josephret Via- Saivepalli Distt. NelloreAndhra Pradesh -524321,1106283.62
1485,2015-2016,Andhra Pradesh,010120045,Society for Rural Improvement,8/103 Court Road  AnantapurAndhra Pradesh -515001,0.00
1486,2015-2016,Andhra Pradesh,010140099,Society For Rural Integration,V. Vandla Palli Nadini Kodrig A Post Via. Chetlopalli Gurram  Konda Vayalpadu Chittoor A.P.-,0.00
1487,2015-2016,Andhra Pradesh,010140185,Society For Rural Resource Emprovement,Santhampalle Shivaramapuram KuppamVia.Chittoor-DistAndhra Pradesh-517425,2813070.00
1488,2015-2016,Andhra Pradesh,010140424,Society for Social Service,20-1-299/C Maruthi NagarKorlaguntaTirupati517501,0.00
1489,2015-2016,Andhra Pradesh,010270275,SOCIETY FOR SOCIAL TRANSFORMATION,46  162  BUDHAWARPETKURNOOL518002,656722.66
1490,2015-2016,Andhra Pradesh,010350227,SOCIETY FOR THE REDEEMED CHRISTIAN CHURCH OF GOD,38 31 65 Green Gardens MarripalemVisakhapatnam530018,0.00
1491,2015-2016,Andhra Pradesh,010370067,Society for Tribal Assurance and rural Technology,ViswanathapuramPachipenta Mandal Distt: VizianagaramAndhra Pradesh-535591,0.00
1492,2015-2016,Andhra Pradesh,010190337,Society for Upliftment of People Participation on Rural Transformation,Near Masjid Old Muslim Village Karlapalem (PO and Mandal)Guntur (A.P.)-522111,0.00
1493,2015-2016,Andhra Pradesh,010190177,Society for Upliftment of Rural Education,5-67-9 5/20 BrodipetGunturGuntur522002,517958.00
1494,2015-2016,Andhra Pradesh,010140230,Society for Urban & Rural Economic Socio-Habitation,V&PO Venkatapuram Gangadhara Nellore Mandal ChittoorAP-517125,957913.00
1495,2015-2016,Andhra Pradesh,010190381,Society For Welfare HIV Infected People (SHIP),D # 11-543 Amaravathi Road Opp. XXX Soap CompanyGorantla Guntur Andhra Pradesh522002,0.00
1496,2015-2016,Andhra Pradesh,010370078,Society for Welfare of ongoing rural development,Pradeepnagar colony kurupamParvathipuram535524,0.00
1497,2015-2016,Andhra Pradesh,010190370,Society for Women and Rural Development,H.NO. 15-4-124 3rd Manipuram Distt: GunturAndhra Pradesh-522001,705885.00
1498,2015-2016,Andhra Pradesh,010140441,Society for Women Empowerment,Kasthurikandriga Village Vemuru post Tirupati Rural mandalTirupati Rural517503,253098.00
1499,2015-2016,Andhra Pradesh,010260009,Society of Franscan Sisters of Mary,Maris Stella College Vijayawada Distt. KrishnaAndhra Pradesh.-,0.00
1500,2015-2016,Andhra Pradesh,010140042,Society of Friars Minor St. Louis Friary,Palmaner CKhittoor DistrictAndhra Pradesh.-,5908159.00
1501,2015-2016,Andhra Pradesh,010310005,Society of Jesus Mary & Joseph,St. Mary's Convent Santhapet Nellore A.P. -,0.00
1502,2015-2016,Andhra Pradesh,010330004,Society of Jesus Mary & Joseph,St. Xavier's Convent Omgole Distt. PrakasamA.P.-,0.00
1503,2015-2016,Andhra Pradesh,010270011,Society of Jesus Mary and Joseph,Sacred Heart Convent  KurnoolAndhra Pradesh -,1490760.00
1504,2015-2016,Andhra Pradesh,010270038,Society of Jesus Mary and Joseph Our Lady of Lourdes Convent,Our Lady of Lourdes Convent Koilkuntla Distt. Kurnool A.P. -,0.00
1505,2015-2016,Andhra Pradesh,010310006,Society of Jesus Mary Joseph,LSaint Joseph's Convent Dargamita Distt. NelloreA.P.-,0.00
1506,2015-2016,Andhra Pradesh,010350178,Society of Living Faith Ministries,D.No.2-89 B.C.Colony Tallapalem Kasimkota MandalamVisakhapatnam (A.P.)-531031,0.00
1507,2015-2016,Andhra Pradesh,010330154,Society of Reach the Unreached through Literature & Assistance,Near Mohan Hall PO Box No.7 Kandukuru PrakasamAndhra Pradesh-523105,0.00
1508,2015-2016,Andhra Pradesh,010260146,Society of Science Students,18/196-1 Vidyanagar Colony Nuzvid KrishnaAP-521201,0.00
1509,2015-2016,Andhra Pradesh,010190244,Society of the Congregation of the Sisters of the Cross of Chavanod,Door No. 4-9-1/1 Ist Line  Patelnagar BapatalaGuntur (A.P.)-522101,9164863.81
1510,2015-2016,Andhra Pradesh,010190011,Society of the Divine Word,Seminary Narasaraopet Ravipodu Road Post Box No.19Distt. Guntur A.P.-,0.00
1511,2015-2016,Andhra Pradesh,010180149,Society of the Emmanuel Evangelical interior Ministries Social Organisation,Door n0.13-2-1 Christian Peta Narasapur West GodavariAndhra Pradesh-534275,262308.00
1512,2015-2016,Andhra Pradesh,010170243,SOCIETY OF THE LUTHERAN MISSION OF SALVATION OF INDIA,101 Municipal Colony RajahmundryEast GodavariEast Godavari533105,13404309.00
1513,2015-2016,Andhra Pradesh,010350027,SOCIETY OF THE SISTERS OF ST JOSEPH OF ANNECY,"ST JOSEPH CONVENT
 WALTAIR R S 
VISAKHAPATNAM 
ANDHRA PRADESHVISAKHAPATNAM530002",6349976.54
1514,2015-2016,Andhra Pradesh,010310244,SOCIETY ON ACTION VILLAGE EDUCATION GUIDING ENVIRONMENT (SAVEGE),25-3-1653 2ND STREET BESIDE UNITED CHURCH GOWTAMI NAGARNellore524004,0.00
1515,2015-2016,Andhra Pradesh,010310040,Society Promoting Enlightment and Knowledge in Development Incorporated Action,H/281 Tipparajumari Street Distt. Nellore A.P. -,0.00
1516,2015-2016,Andhra Pradesh,010170271,SOCIETY TO EMPOWER WOMEN ACTION ( SEWA ),5-27-1/1 BANK COLONYTUNI533401,5449661.00
1517,2015-2016,Andhra Pradesh,010330193,Socio Economic and Cultural Upliftment through Rural Enlightenment,Tarlupadu RoadMARKAPUR523316,0.00
1518,2015-2016,Andhra Pradesh,010190479,SOCIO ECONOMIC AND RURAL DEVELOPMENT SOCIETY,PEDAKAKANIPOST AND MANDALGUNTUR522509,0.00
1519,2015-2016,Andhra Pradesh,010180105,Socio Economic Educational Development Society (SEEDS),4-94 Vidyanagar Eluru West GodavariAP-543007,0.00
1520,2015-2016,Andhra Pradesh,010370040,Sodhana,Anjaneyapuram Cheepurupalli Vizianagaram Andhra Pradesh -535128,1876615.00
1521,2015-2016,Andhra Pradesh,010190245,Sonia Harijana Girijana Mahila Samkshema Seva Sangham,AT:Agrajaram1st lineGuntur Andhra pradesh -522004,0.00
1522,2015-2016,Andhra Pradesh,010140051,South Andhra Lutheran Church,Chittoor District Andhra Pradesh.517507 -511507,0.00
1523,2015-2016,Andhra Pradesh,010190252,Sow The Seed,D.No.8-22-93Sita Nagar Guntur Andhra Pradesh -522201,3494887.00
1524,2015-2016,Andhra Pradesh,010180270,Spandana Organisation,D No 1-34 2nd Street Sai Rupa Estate Palangi Village Undrajavaram MandalamUndrajavaram534216,1267404.00
1525,2015-2016,Andhra Pradesh,010270176,Spandana Youth Welfare Association,H.No.10-20(2) Baba Nagar Village Kanala Post Nandyal MandalKurnool District (A.P.)-,0.00
1526,2015-2016,Andhra Pradesh,010180239,SPIRIT AND LIFE MINISTRIES,BEULAH VELPUR ROADTANUKU534211,2630007.00
1527,2015-2016,Andhra Pradesh,010180281,SPOORTHI RURAL DEVELOPMENT AND YOUTH WELFARE ORGANIZATION,KSR STREET OPP SOHINI TOWERS VIJAYA VIHAR CENTRE RR PETELURU534002,0.00
1528,2015-2016,Andhra Pradesh,010270057,Sr. Parameshwari Education Society,K.G. Road Athakur            Distt. Kurnool Andhra Pradesh  -518422,1205550.00
1529,2015-2016,Andhra Pradesh,010170088,Sravanti Association for Rural and Tribal Development,Door No.86-2-5/1 Pragathi MargJ.N. Road Rajahmundry533103,0.00
1530,2015-2016,Andhra Pradesh,010180261,SREE KASTURIBAYI MAHILA SAMAJAMU,6-4-4 GOWRI CLINIC STREETNIDADAVOLE534301,2794079.00
1531,2015-2016,Andhra Pradesh,010160414,SREE LAKSHMI JABBIREDDY CHARITABLE TRUST,OBULAVARIPALLI(POST) OBULAVARIPALLI(MANDAL)KADAPA(DISTRICT)516108,0.00
1532,2015-2016,Andhra Pradesh,010160391,Sree Padma Rani Mary Mahila Mandali,3/117-1 Surendra Nagar Badvel Kadapa DistrictAndhra Pradesh-516227,172274.00
1533,2015-2016,Andhra Pradesh,010160271,Sree Sakthi Mahila Mandali,7-166N.G.O.Colony Cuddapah Andhra Pradesh -516002,0.00
1534,2015-2016,Andhra Pradesh,010260297,Sree Sundara Hanuman Dharmika Parishath,D.No.W/9-22 Kothuru TadepalliVijayawada520012,62085.67
1535,2015-2016,Andhra Pradesh,010120107,Sree Venkateswara Convent Education Society,D.No.12-5-41 Ubbayappa Street Fort Hindupur Dist AnantpurAndhra Pradesh-515201,0.00
1536,2015-2016,Andhra Pradesh,010140254,Sree Vidyanikethan Educational Trust,Sri Sainath Nagar A.RangampetChandragiri Mandal CHITTOOR  Distt-517102,0.00
1537,2015-2016,Andhra Pradesh,010140370,Sri Bhuvaneswari Mahila Mandali,Thummalagunta Vill & Po Tirupati Rural MandalChittoor (Andhra Pradesh)-517502,0.00
1538,2015-2016,Andhra Pradesh,010270082,Sri Chaithanya Kala Mandali,46/801 D 'A' Camp KurnoolAP-518002,0.00
1539,2015-2016,Andhra Pradesh,010190208,SRI DAKSHINYA BHAVA SAMITHI,3-2-12 Madhavi Nilaya IIIrd Lane Old Pattabhipuram GunturAP-522006,8122998.00
1540,2015-2016,Andhra Pradesh,010260361,SRI DEVI ARYA VYSYA MAHILA SEVA MANDALI,DNO1-16- BHIMALAPURAMACHANTA MANDAL534266,0.00
1541,2015-2016,Andhra Pradesh,010190428,Sri Ekula Nagaiah Memorial Disabled Service Society,D.No. 6-1 Brahmanapalli Piduguralla Mandal Guntur DistrictPiduguralla522437,0.00
1542,2015-2016,Andhra Pradesh,010160359,Sri Gosula Educational Society,Utukur(V. & Po) C.K.Dinne Cuddapah(DT)Andhra Pradesh-516003,0.00
1543,2015-2016,Andhra Pradesh,010140420,SRI HARI ASSOCIATION FOR RURAL PROGRAMMES,6-6-530 IRLA NAGARTIRUPATI517501,252115.00
1544,2015-2016,Andhra Pradesh,010160326,Sri Jyothirmai Seva Sangam,Payasam Palli (V&P) Veerapunayuni Palli MandalCuddapah (Andhra Pradesh)-516339,0.00
1545,2015-2016,Andhra Pradesh,010160408,Sri K. Pitchireddy Educational & Welfare Society,D.No. 6/83 Khathib Street Vempali Distt: CuddapahAndhra pradesh-516329,9415766.41
1546,2015-2016,Andhra Pradesh,010350168,Sri Kanaka Durga Mahila Mandali,Mulagapudi Village Natvaram Mandal VisakhapatnamAndhra Pradesh-531115,0.00
1547,2015-2016,Andhra Pradesh,010260110,Sri Krishna Chaitanya Vidyavihar Children Trust,Sri A.K. Rao Santosh Bhavan Opp. Press ClubGandhinagar Vijayawada-520003,4598600.97
1548,2015-2016,Andhra Pradesh,010160463,Sri Krishnadevaraya Yuvajana  Seva Sangham,6 297 Opp Maian Post Office MG Road Railway KodurRailway Kodur516101,0.00
1549,2015-2016,Andhra Pradesh,010310294,SRI MANIDWEEPA MAHA SAMSTHAN TRUST,PENCHALAKONA GONUPALLI RAPUR MANDALHYDERABAD524414,25128292.00
1550,2015-2016,Andhra Pradesh,010190385,SRI MARY INTEGRATION AND RURAL DEVELOPMENT SOCIETY,PLOT NO. 203 ANNAPA REDDY TOWERS ANJANEYAPETGUNTUR522007,48066.01
1551,2015-2016,Andhra Pradesh,010270226,SRI PRIYADARSHINI MAHILA MANDALI,D.No.50/837 DEVA NAGARKURNOOL518002,0.00
1552,2015-2016,Andhra Pradesh,010270285,SRI RAGHAVENDRA SWAMY MUTT,Sri Raghavendra Swamy MuttMantralayam518345,616462.67
1553,2015-2016,Andhra Pradesh,010270134,Sri Raja Rajeswari Rural Development Society,28-1470C; near Vijayabhandu cotton Mills Rly. feeder Rd. NandyalKurnool Andhra Pradesh-518502,0.00
1554,2015-2016,Andhra Pradesh,010180186,Sri Ram Educational Society,D.No. 1-19-1/1 Santhi Nagar 2nd Ward NidadavoleWest Godavari (A.P.)-534301,0.00
1555,2015-2016,Andhra Pradesh,010170277,Sri Ram Foundation,Sri Ram Nilayam 2-35-15/2 Perrraju petKAKINADA533003,0.00
1556,2015-2016,Andhra Pradesh,010330132,Sri Ramaduta Swamy Asramam,Venugopala Nagar Chevuru Post Gudluru MandalamPrakasam (Andhra Pradesh)-,1125827.55
1557,2015-2016,Andhra Pradesh,010170094,Sri Ramakrishna Math,Ramakrishna Vivekananda Nagar East Godavari Distt.       Rajahmundary Andhra Pradesh -,0.00
1558,2015-2016,Andhra Pradesh,010190352,Sri Ramakrishna Seva Samiti,Vijayalakshmi Puram Bapatla GunturAndhra Pradesh-522101,293174.00
1559,2015-2016,Andhra Pradesh,010350142,Sri Ramanuja Philosophical Foundation,MIG - II 97 Sector - 3 M.V.P. ColonyVisakhapatnam (A.P.)-530017,287502.93
1560,2015-2016,Andhra Pradesh,010180224,Sri Ravi Teja Educational and Infected Children Welfare Society,Tangellamudi Cheruvu GattuELURU534005,50000.00
1561,2015-2016,Andhra Pradesh,010120288,Sri Sai Amrutha Astrology Yoga Trust,Mamillakunta Cross Bangalore RoadKothacheruvu Post515133,0.00
1562,2015-2016,Andhra Pradesh,010160467,SRI SAI EDUCATIONAL SOCIETY,MUSAPETRAYACHOTI516270,0.00
1563,2015-2016,Andhra Pradesh,010120270,SRI SAI KRUPA EDUCATIONAL AND CULTURAL ACTIVITIES SOCIETY,D.NO.4-123A KARNATANAGEPALLI VILLAGE PUTTAPARTHI MANDAL ANANTAPUR DISTRICT ANDHRA PRADESH.PUTTAPARTHI515134,0.00
1564,2015-2016,Andhra Pradesh,010170124,Sri Sai Satya Krishna Deenajana Sevasharam,Bavajipeta Gokavaram Mandal East Godavari Distt.A P-,0.00
1565,2015-2016,Andhra Pradesh,010120273,Sri Sai Vidyaniketan Educational society,Pedda Bazar Opp Rama TemplePuttaparthy515134,3712893.00
1566,2015-2016,Andhra Pradesh,010120067,Sri Sathya Sai Books & Publication Trust, Anantpur DistAndhra Pradesh -515134,1297338.00
1567,2015-2016,Andhra Pradesh,010120020,Sri Sathya Sai Central Trust,Prasanthi Nilayam  Dist: AnantapurAndhra Pradesh -515134,427897000.00
1568,2015-2016,Andhra Pradesh,010120019,Sri Sathya Sai Institute of Higher Learning,Prasamthi Nilayam District- AnantpurAndhra Pradesh-,142316129.00
1569,2015-2016,Andhra Pradesh,010120284,SRI SATHYA SAI MEDIA FOUNDATION,Prashanthi digital StudioPrashanthi Nilayam515134,344959.00
1570,2015-2016,Andhra Pradesh,010330161,Sri Satya Sai Dharmika Seva Samastha,7-458 Mangamuru Road Ongole Prakasam (A.P.) -523002,28275.00
1571,2015-2016,Andhra Pradesh,010260391,SRI SATYA SAI DHYANAMANDALI CHARITABLE TRUST,29-28-23   DASARI VARI STREET   SURYARAOPETAVIJAYAWADA520002,2000.00
1572,2015-2016,Andhra Pradesh,010190425,SRI SHIRIDI SAI SEVA TRUST,REGD.OFFICE - D.NO.26-32-37 MATHRU KRUPA 6TH LINE A.T.AGRAHARAMGUNTUR522004,60100.00
1573,2015-2016,Andhra Pradesh,010190062,Sri Sri Sri Hanumath Kali Vara Prasad Babu Trust,Babu Vignana Mandir Sri Kali  GardensNamburPedakakaniMandalGuntur Andhra Pradesh-522508,3538236.18
1574,2015-2016,Andhra Pradesh,010170289,SRI VEERA VENKATA SATYANARAYANA SWAMY VARI DEVASTHANAM,ANNAVARAMANNAVARAM533406,0.00
1575,2015-2016,Andhra Pradesh,010140284,Sri Venkateswara Anadha Seva Sadan,Door no. 28-404B Ramnagar Colony ChittoorAndhra Pradesh-517002,252312.00
1576,2015-2016,Andhra Pradesh,010190312,Sri Venkateswara Charitable Trust,Sri Venkateswara Nilayam 7-9-18 Kakumanuvari Street NarsaraopetGuntur (Andhra Pradesh)-522601,152222.00
1577,2015-2016,Andhra Pradesh,010180287,SRI VENKATESWARA INSTITUTE OF RESEARCH AND REHABILITATION FOR THE DISABLED,POPULARLY KNOWN AS VIRRD   NEAR TEMPLEDWARAKATIRUMALA534426,0.00
1578,2015-2016,Andhra Pradesh,010350060,Sri Venkateswara Yuvajana Sangham,P.O- Kovvuru Rolugunta (Mandal) Tq. Narsipatnam VisakhapatnamA.P.-531114,0.00
1579,2015-2016,Andhra Pradesh,010350033,Sri Vidya Trust,18-74-38 Bhadravathi Marg Distt..Visakhapatnam  Andhra Pradesh.-,18752.00
1580,2015-2016,Andhra Pradesh,010160478,SRI VIJAYA SEVA SAMITHI,8-259-4B BISMILLA NAGAR KADAPA KADAPA DT ANDHRA PRADESHKADAPA516002,0.00
1581,2015-2016,Andhra Pradesh,010270148,Sri Vinayaka Rural Development and Educational Society,H. No. 4/62A Gudur PO and Mdl KurnoolAndhra Pradesh-518466,0.00
1582,2015-2016,Andhra Pradesh,010140337,Sri Vinayaka Yuvajana Sangam,Door No. 16-167 Swamymastri Street Chittoor DistrictAndhra Pradesh-517001,0.00
1583,2015-2016,Andhra Pradesh,010170257,SRIMATH UPANISHAD SIDDANTHA ACHARYA PEETHAM,D.NO. 268 G. VEMAVARAMTALLAREVU (MANDAL)533461,347366.00
1584,2015-2016,Andhra Pradesh,010140422,Srinivasa Educational Academy (SEA),R.V.S. Nagar Tirupathi RoadChittoor517127,0.00
1585,2015-2016,Andhra Pradesh,010260358,SRINIVASA SWACHANDA SANGHIKA SANKSHEMA SEVA SAHAKARA SAMSTHA,DNo 39-139-1 Fifth Road DVR ColonyNandigama521185,0.00
1586,2015-2016,Andhra Pradesh,010140265,Srinivasa Urban and Rural Youth Association,18-1-727/D Bhavani Nagar TirupatiChittoor (A.P.)-517501,0.00
1587,2015-2016,Andhra Pradesh,010330188,srisairuraldevelopmentsociety,Thangellakhasimstreetnearbvstheatreongoleprakasamdistrictongole523001,0.00
1588,2015-2016,Andhra Pradesh,010350154,Srujana Welfare Association,D. No. 16-179Gunisetty Vari Street Chodavaram VisakhapatnamAndhra Pradesh-531036,0.00
1589,2015-2016,Andhra Pradesh,010190181,ST Annes Convent School and Health Centre,ValiveruTenali522211,2580237.00
1590,2015-2016,Andhra Pradesh,010190024,ST JOSEPHS CONVENT,"ST JOSEPHS CONVENT
LOYOLA NAGAR
NALLAPADUGUNTUR522005",543650.00
1591,2015-2016,Andhra Pradesh,010330147,St Pauls Educational Development Committee,Narvara RoadGiddalur,6077.00
1592,2015-2016,Andhra Pradesh,010310131,St Xaviers Educational Society,5/6 Hospital Road Muthukur NelloreAndhra Pradesh-524344,433642.00
1593,2015-2016,Andhra Pradesh,010260218,St. Aloysius Gonzaga Socio-Educational and Cultural Development Society,Gunadala Post Vijayawada Krishna DistrictAndhra Pradesh-520004,701411.00
1594,2015-2016,Andhra Pradesh,010260115,St. Ann's Educational Society,Prasanth Bhawan Carmel Nagar Gundala Vijayawada  Distt. Krishna Andhra Pradesh -,44494814.67
1595,2015-2016,Andhra Pradesh,010350071,St. Ann's Society,D.No.7-17-867 Kirlampudi Layout VisakhapatnamAP-530023,12359503.00
1596,2015-2016,Andhra Pradesh,010260150,St. Anne's Society,Guntupally Vijaywada KrishnaAP-521241,8240134.00
1597,2015-2016,Andhra Pradesh,010270006,St. Anthony's Orphanage,R.C.Mission Adomi Distt. Kurnool A.P. -,2737714.00
1598,2015-2016,Andhra Pradesh,010160398,St. Anthony's Trust,D.No.6/121 Reddy Nagar Porumamilla KadapaAndhra Pradesh-516193,977426.00
1599,2015-2016,Andhra Pradesh,010160076,St. Antony's Industrial Institute Association,Railway Station Road CuddapahAndhra Pradesh-516001,0.00
1600,2015-2016,Andhra Pradesh,010180180,St. Augustine Social Service Society,Augustine Sadan Pedapadu P.o. Eluru TalukWest GodavariAndhra Pradesh-534437,0.00
1601,2015-2016,Andhra Pradesh,010190055,St. Charles Social Service Association,St. Charles Convent Chlakaluripet Distt. GunturA.P.-,146000.00
1602,2015-2016,Andhra Pradesh,010120249,St. John's Residential School,Marianagar Oddupally Atmakur(Mandal) Distt: AnantapurAndhra Pradesh-515751,1430747.00
1603,2015-2016,Andhra Pradesh,010370025,St. Jon's Regional Seminary Society,Kondadaba Kottavalasa VizianagaramAP-531183,609901.00
1604,2015-2016,Andhra Pradesh,010180091,St. Joseph Leprosy Rehabiliation Centre, West GodavariAP-534301,327439.00
1605,2015-2016,Andhra Pradesh,010160080,St. Joseph's Convent & School,Sathyapuram Proddatur Dist: Cuddapah Andhra Pradesh-,0.00
1606,2015-2016,Andhra Pradesh,010160151,St. Paul Children's Home,Ref. No.142/1987 Kala-Sapad Distt. Cuddapah A.P. -,0.00
1607,2015-2016,Andhra Pradesh,010190293,St. Paul's Socio-Educational Society,H. O. No. 1-864 Krishna Reddy  Colony Chilakaluri PetaGuntur Andhra Pradesh-522616,0.00
1608,2015-2016,Andhra Pradesh,010160152,St. Peter's Day Care Centre,Regn. No.141/1987 Kaladapad Distt. CuddapahA.P.-,0.00
1609,2015-2016,Andhra Pradesh,010330028,St. Vincent Convent,Medar Netla Adantu Taluk Distt. Prakasam A.P. -,0.00
1610,2015-2016,Andhra Pradesh,010180293,St.Johnswelfaresociety,D.No. 6-73 Vissakoderu Palakoderu MandalWEST GODAVARI534244,0.00
1611,2015-2016,Andhra Pradesh,010190407,ST.JOSEPHS FOUNDATION,4-138 Ankireddy PalemGuntur522005,3731150.50
1612,2015-2016,Andhra Pradesh,010350179,St.Luke's Minority Educational Society,D.No.2-30-13 MIG 1/B-13 Sector-6 MVP ColonyVisakhapatnam (A.P.)-530017,312741.00
1613,2015-2016,Andhra Pradesh,010270233,STANLEY EDUCATIONAL SOCIETY,43/127 ECM SCHOOL COMPOUNDKURNOOL518004,0.00
1614,2015-2016,Andhra Pradesh,010180010,Star of Hope Hospital Eye Service,Akividu Distt. West Godavari A.P. -,5391414.00
1615,2015-2016,Andhra Pradesh,010270046,Star Youth Association,17-178-17/1 Besides Telephone Excha Distt. Kurnool A.P.-,2009037.96
1616,2015-2016,Andhra Pradesh,010270214,Steawards Association for Gospel and Education Service Society,H.No.131/26 GnanapuramNandyal518502,0.00
1617,2015-2016,Andhra Pradesh,010370062,Sthree Vikas Society,Uttaravalli Sugar Factory Building Uttaravalli Merakamudidam MandalVizianagaram (Andhra Pradesh)-,0.00
1618,2015-2016,Andhra Pradesh,010170110,Streams for Deserts Welfare Association,D.No.5-1-45 S. Thota Pithapuram East GodavariAP-533450,347620.87
1619,2015-2016,Andhra Pradesh,010140308,Stree Sakthi Sanghatana,6-8-1037 2nd Floor NGOs Colony K.T.road TirupatiChittoor (Andhra Pradesh)-517507,0.00
1620,2015-2016,Andhra Pradesh,010120083,Stree Sanghshema Trust,Rampuram Vill Penukonda Tq. P.B.No.2 AnantpurAndhra Pradesh-515110,0.00
1621,2015-2016,Andhra Pradesh,010260352,SUDHEEKSHAN FOUNDATION,13-101/1 TF-2 Srinivasa Residency Tulasi Nagar Main Road Ashok Nagar Area Vijayawada520007,163736.00
1622,2015-2016,Andhra Pradesh,010160419,Sukeerthi Educational and Economical Development Society,# 4/288 Shanthi nagarYerraguntla516309,10095.00
1623,2015-2016,Andhra Pradesh,010180276,Sunils Social Services Home,D No 7-286 -1 Canal RoadSAMISRAGUDEM534302,0.00
1624,2015-2016,Andhra Pradesh,010170294,SUNLIGHT EDUCATIONAL SOCIETY,APHB COLONY - MIG 34SRIKAKULAM532001,0.00
1625,2015-2016,Andhra Pradesh,010140289,Sunrise Social Development Society,1-199Ramar Koil street Kattamanchi ChittoorAndhra Pradesh-517001,0.00
1626,2015-2016,Andhra Pradesh,010180284,Suore Ospedelliare Della Misericordia Health Service Society,Door No 1 113 KottaramachandrapuramKannapuram Post534311,3208923.00
1627,2015-2016,Andhra Pradesh,010190403,Suraksha Old Age Health Society,2-2-26 Thadiboyanavari Street Gandhi nagarTenali522201,0.00
1628,2015-2016,Andhra Pradesh,010330137,Swaantana Seva Samithi,# 9-1 Reddygari Street Ulavapadu Prakasam DistrictAndhra Pradesh-523292,462144.56
1629,2015-2016,Andhra Pradesh,010170265,swamys aides foundation and educational service,26-15-7 Kambala PetaRajahmundry533103,0.00
1630,2015-2016,Andhra Pradesh,010170212,Swarajya Abhyudaya Seva Samithi,Plot No.57Ismail NagarSamalkot East Godavari DistrictAndhra Pradesh-533440,1247527.00
1631,2015-2016,Andhra Pradesh,010310292,Swarna Bharat Trust,VenkatachalamVenkatachalam Mandal524320,0.00
1632,2015-2016,Andhra Pradesh,010190219,Swarna Educational Development Soceity,D.no.20-26-115 Chinaravuru Tenali Guntur Distt.A P-522201,0.00
