1128,2015-2016,Kerala,052870014,Sacred Heart Orphanage,Poovarany Po KottayamKerala-686577,0.00
1129,2015-2016,Kerala,052880023,Sacred Heart Orphanage Carmelite Convent, Thiruavampady P.o.Kozhikode - 673 603-,0.00
1130,2015-2016,Kerala,052850230,Sacred Heart Philosophy College,Monastery Lane AlwayeErnakulam - 683 101-,2481065.00
1131,2015-2016,Kerala,052850241,Sacred Heart Poor House,Perumpadappu Kochi ErnakulamKerala-682006,0.00
1132,2015-2016,Kerala,052870172,Sacred Heart Province,Palai  KottayamKerala-686575,0.00
1133,2015-2016,Kerala,052850078,Sadhu Sevana Sabha,Mallussery Vattaparambu P.o. AngamelyErnakulam - 683 579-,0.00
1134,2015-2016,Kerala,052940041,Sahayagiri Health Care Society,Olamattom Thodupuzha P.OIdukki685584,343371.57
1135,2015-2016,Kerala,052910207,SAHAYI Centre For Collective Learning And Action,Santhi Complex Valiyapadom Vilanthara.P.O. West KalladaKOLLAM690521,0.00
1136,2015-2016,Kerala,052850186,Sahrudaya Services And Charities,Sh Provincial House Rajagiri P.o.kalamasseryErnakulam Kerala-683104,96948.25
1137,2015-2016,Kerala,052930231,Sahyadri Leprosy Eradication Trust,XII/752 Valliaparambilpady Pazhanvangadi P.O. RanniPathanamthitta Dist. Kerala-689673,0.00
1138,2015-2016,Kerala,052900376,SAI SANJEEVANI CHARITABLE TRUST,ATHIKKAL BUILDINGSGURUVAYOOR680101,0.00
1139,2015-2016,Kerala,052850568,SAINT PAULS CHARITABLE TRUST,PATTIMATTOM POERNAKULAM683562,0.00
1140,2015-2016,Kerala,052910308,Saint Vincent Charitable Trust,Navajeevan Home for Boys Vellanad POThiruvananthapuram (Kerala)-695543,3895402.00
1141,2015-2016,Kerala,052850107,Saint Vincent Pallottine Convent, CochinKerala-,10046057.00
1142,2015-2016,Kerala,052910301,Sakhi,T.c. 27/2323 Convent Road ThiruvananthapuramKerala-695001,2535350.00
1143,2015-2016,Kerala,052880128,Salafi Charitable Trust,Narikkuni Town KozhikodeKerala.-,101112529.00
1144,2015-2016,Kerala,052880176,SALAFIYYA ASSOCIATION MEPPAYUR,SALAFI CAMPUS  PB No 01 MEPPAYUR POSTKOZHIKODE673524,0.00
1145,2015-2016,Kerala,052870293,Salvatorian Sisters Institute,Villoonni Kottayam Kerala  -,5695499.00
1146,2015-2016,Kerala,052870161,Samagra Vikas Social Service Society,   -,7668567.00
1147,2015-2016,Kerala,052850446,Samanvaya Theologate Trust,Karikkamuri(p.b.no.1056) Cochin Ernakulam Kerala-682011,1185636.00
1148,2015-2016,Kerala,052850239,Samaritan Hospital, ErnakulamKerala-,3665085.00
1149,2015-2016,Kerala,052950032,Samastha Kerala Fund,Chelari Thenipalam  MalappuramKerala-,0.00
1150,2015-2016,Kerala,052830042,Samastha Kerala Jam Eythul Ulma (skju),   -,17120.00
1151,2015-2016,Kerala,052950031,Samastha Kerala Jamiyyathul Muallimeen,Centre Council (s K J M ) Thenhipalam P.o.Malappuram-,0.00
1152,2015-2016,Kerala,052810129,Samhathi,Ashramam Junction Avalookunnu P.o.Alleppey (kerala)-688006,13156563.04
1153,2015-2016,Kerala,052850492,Samridhy,Social Service Society Vazahappilly Mudavoor PostMuvattupuzha Erankulam Kerala-686669,7649784.00
1154,2015-2016,Kerala,052830144,Samskriti,P. Box No.3 Priyaram P.o.   Distt. Kannur Kerala -670502,477220.00
1155,2015-2016,Kerala,052850291,San Juan Bhavan,Apostalic Bm College ErnakulamKerala-682021,610235.00
1156,2015-2016,Kerala,052880171,SANATHANA DIVYAKARUNYA VIDYAPEETHAM,PB. NO. 5 THAMARASSERY P.O.KOZHIKODE673573,0.00
1157,2015-2016,Kerala,052870295,Sanjivani Charitable Society,Chelacombu Karukachal  Kottayam Kerala  -686540,400953.00
1158,2015-2016,Kerala,052900276,Sanjo Bhavan Orphanage,Kuzhikkattukaonam Madaibuonam Po TrichurKerala-,0.00
1159,2015-2016,Kerala,052850258,Sanjo Bhawan,(Sisters of St. Joseph of St. Marks Vengoor AngamalyErrnakulam Distt. Kerala.-685591,31478456.00
1160,2015-2016,Kerala,052850182,Sanjoe Hospital,Perumvaboor ErnakulamKerala-683542,1048531.00
1161,2015-2016,Kerala,052880180,SANJOE PRATHIKSHA BHAVAN SOCIAL SERVICE SOCIETY,THONDIMMAL  DOOR NO T P 1  74A   MUKKAM POSTKOZHIKODE673602,0.00
1162,2015-2016,Kerala,052900169,Sanjos Ashram, ManalurTrichur - 680 617-,218320.22
1163,2015-2016,Kerala,052850371,Sannidhana Ashram M.c.b.s.prayer House, Jllithode MalayattoorErnakulam - 683 587-,723217.65
1164,2015-2016,Kerala,052960030,SANTA MARIA CONVENT,Perumpuzha PostKeralapuram691504,0.00
1165,2015-2016,Kerala,052850320,Santa Teresa Convent,Angamaly Kerala -,2617321.58
1166,2015-2016,Kerala,052880014,Santhi Bhavan Social Centre,Malaparamba Po CalicutKerala-673009,8908999.20
1167,2015-2016,Kerala,052900037,Santhi Bhavan Social Centre Of Physically Handicapped,Chalakudy TrichurKerala-680307,0.00
1168,2015-2016,Kerala,052880135,Santhi Charitable Society,Shanthi Bhawan 30/1071-A  Kozhikode Kerala  -673008,0.00
1169,2015-2016,Kerala,052910361,SANTHI MANDIRAM,KP X683 KIZHAKKEKONAM VATTAPPARA P.OTHIRUVANANTHAPURAM695028,0.00
1170,2015-2016,Kerala,052900372,SANTHI MEDICAL INFORMATION CENTRE,KOTTAPADI POST GURUVAYOORTHRISSUR686505,230000.00
1171,2015-2016,Kerala,052890007,Santhi Nilayam (samaritan Sisters),Kozhipara Po Elipara PalghatKerala-,0.00
1172,2015-2016,Kerala,052850367,Santhidham Society Srs. Holy Spirit, Chunangumvelly AlwayeErnakulam - 683 105-,2517167.00
1173,2015-2016,Kerala,052910179,Santhigiri Ashramam,Koliyadode Po VenjaramooduTrivandrum Kerala-,0.00
1174,2015-2016,Kerala,052940053,SANTHIGIRI REHABILITATION INSTITUTE,Vazhithala ThodupuzhaIdukki - 685 583-,1005267.00
1175,2015-2016,Kerala,052850536,SANTHIGIRI TRUST,11/488 EDATHALA NORTH (P.O.)ALWAYE683564,82843.00
1176,2015-2016,Kerala,052910239,Santhigram,Chowara Kazhuvur Po: PulluvilaTrivandrum - 695 526-,2602750.00
1177,2015-2016,Kerala,052850538,SANTHIMARGAM SOCIAL WELFARE SERVICE SOCIETY,NAD EDATHALA ROAD SANTHIGIRIKALAMASSERY683563,74915.73
1178,2015-2016,Kerala,052900272,Santhome Orphanage, ChoondalTrichur Kerala-680502,0.00
1179,2015-2016,Kerala,052830030,Santhosh Bhavan Orphanage, Vayattuparamb NaduvilKannur - 670 582-,0.00
1180,2015-2016,Kerala,052830010,Santhosh Bhavan Social Centre,Ramathally Payyannoor KannurKerala-670308,0.00
1181,2015-2016,Kerala,052830003,Santhoshalayam Social Centre,Kuttoor Po KannurKerala-670306,0.00
1182,2015-2016,Kerala,052830052,Saranalayam Social Centre,Edakom Chapparapadave Po KannurKerala-670581,0.00
1183,2015-2016,Kerala,052960003,Sarrathika Sahodarya Samithi,Vadakkumbhagam Ward  North Of Velankanni Shrine Kollam Kerala-,9000.00
1184,2015-2016,Kerala,052920010,Satchidananda Charitable Medical Trust,Ramnagar Post Anandashram Kanhangad KasaragodKerala-671531,0.00
1185,2015-2016,Kerala,052910265,Sathyan Memorial Arts And Sports Club,Undappara Poochal P.o ThiruvanandapuramKerala.-,0.00
1186,2015-2016,Kerala,052850308,Save A Family Plan Cochin Soc. Ser. Soc., CochinKerala-,0.00
1187,2015-2016,Kerala,052850028,Save A Family Plan India,Aiswaryagram Parappuram KanjoorKerala-683593,192920144.00
1188,2015-2016,Kerala,052900002,Save A Family Plandiocese Of Tri,Caholic Bishops House TrichurKerala-,0.00
1189,2015-2016,Kerala,052830101,Savio Boys Town,Kilianthara KunnothKannur - 670 706-,1002621.12
1190,2015-2016,Kerala,052900269,Savio Home Orphanage, ManakodyTrichur Kerala-680017,0.00
1191,2015-2016,Kerala,052900247,Schoenstatt Secular Insitute,South Bazar Irinjalakuda  TrichurKerala-680121,0.00
1192,2015-2016,Kerala,052850550,Schoenstatt Study House,Post No 618 U C CollegeAluva683102,4730513.00
1193,2015-2016,Kerala,052930002,School For Partially Hesaring,Manakala- P.o. Adoor Pathanamthitta-distKerala -691551,0.00
1194,2015-2016,Kerala,052870179,School For The Deaf And Blind,Assisi Mount NeerparavadakaraKottayam - 686 605-,461366.00
1195,2015-2016,Kerala,052910372,SCHOOL OF SANTHI,96 M.P. APPAN NAGAR VAZHUTHACAUDTHIRUVANANTHAPURAM695014,0.00
1196,2015-2016,Kerala,052900343,School Sisters Of St. Francis,Lourdepuram Thrissur-5Kerala-,0.00
1197,2015-2016,Kerala,052910389,SEBASTIAN INDIAN SOCIAL PROJECTS,SISP Centre Kovalam Junction Kovalam postThiruvananthapuram695527,10242709.00
1198,2015-2016,Kerala,052980119,Secana Sadanam Social Service Centre, Ripow P.o. MeppadyWayanad - 673 597-,15000.00
1199,2015-2016,Kerala,052870080,Sector Asia Medical Mission Srs.society,,2779594.00
1200,2015-2016,Kerala,052910122,Secular Institute Of Voluntas Dei India Region Bethel,Azhakulam Vizhinjam TrivandrumKerala-,3788201.50
1201,2015-2016,Kerala,052930208,SEIREI ASHA BHAVAN, Valacodu P.o. PunalurKollam - 691 331-,694248.00
1202,2015-2016,Kerala,052910033,Self Employed Womens Association,Pco Centrespencer Junction  Trivandrum-,2237938.00
1203,2015-2016,Kerala,052890019,Seraphic Provincial House,24/376 West Fort Palakkad Kerala-678001,6398029.00
1204,2015-2016,Kerala,052900048,Seraphic Social Centre,Vellikulangara Thrissur Distt.Kerala-,0.00
1205,2015-2016,Kerala,052870357,SERENITY HOME,PAMPOLYELIKKULAM686577,44145.00
1206,2015-2016,Kerala,052870270,Servants Of Jesus Christ Welfare Sociey,Timnath Serah EraviperoorTiruvalla - 689 542-,27828776.35
1207,2015-2016,Kerala,052930020,Seva Nilayam Social Centre,Koduman Po PathanamthittaKerala-691555,0.00
1208,2015-2016,Kerala,052870283,Sevagram Trust Othy,Pothy Thalayola Parambu P.o.Kottayam - 686 605-,492075.00
1209,2015-2016,Kerala,052900357,Sevanagiri Sevanalaya,PO-Annalloor Mala ThrissurKerala-680731,8640.00
1210,2015-2016,Kerala,052930222,Seven Seas Socio Economic Development Society,Methu Pezhumkal (p.o.) MlanthandamPathanamthitta (kerala)-689691,0.00
1211,2015-2016,Kerala,052980013,Sevena Bhavan Social Centre, WayanadKerala-,0.00
1212,2015-2016,Kerala,052930251,SHALOM  KARUNYA TRUST,CHENGAROOR .P.O NELLIMOODUMALLAPPALLY689594,16448.66
1213,2015-2016,Kerala,052960036,SHALOM BENEVOLENT FOUNDATION,SHALOM HOUSE  OPPOSITE SANKERS HOSPITALKOLLAM691001,1735178.00
1214,2015-2016,Kerala,052870200,Shalom Christian Education & Service Trust,Shalom Bunglow Vadavathoor Po KottayamKerala-686010,1075642.00
1215,2015-2016,Kerala,052850534,SHANTHI BHAVAN SOCIETY,ASHOKAPURAM POSTALWAYE (ALUVA)683101,30560161.00
1216,2015-2016,Kerala,052900099,Shanthi Bhawan Convent, KannamkulangaraTrichur - 680 007-,0.00
1217,2015-2016,Kerala,052830018,Shanthi Nilayam Social Centre,Pilathara Po KannurKerala-670501,0.00
1218,2015-2016,Kerala,052940089,Share And Care Foundation,H No XVI 13 Mangattukavala Opp Indian OilThodupuzha685585,0.00
1219,2015-2016,Kerala,052930112,Sharon Bible College,Sharon House  Tiruvalla - 689 101-,1565999.00
1220,2015-2016,Kerala,052930072,Sharon Fellowship Church,  Tiruvalla - 689 101-,5743014.00
1221,2015-2016,Kerala,052980171,SHARON MISSION INDIA,THODUVETTY PUTHENKUNNU P.O.SULTHAN BATHERY673592,4788108.00
1222,2015-2016,Kerala,052910246,Shree Chitra Tiruna Institute For Medical Sciences & Technology, Trivandrum.Kerala-,13859063.47
1223,2015-2016,Kerala,052910327,Shree Rama Dasa Mission,Sree Neelakantapuram Chenkottukonam Thundathil P.O.Thiruvananthapuram Kerala-695581,0.00
1224,2015-2016,Kerala,052980133,SHREYAS,P.b.no.-7 Solthan Bathery District Wayanad Kerala-673592,769750.00
1225,2015-2016,Kerala,052910269,Shri Sathya Sai Orphanage Trust,T.c. A/1108 Ajith Bulding Sasthamangalam ThiruvanathapuramKerala -,1787649.00
1226,2015-2016,Kerala,052880016,Silver Holly Ashram & School,Paroppady MarykunnuCalicut - 673 012-,0.00
1227,2015-2016,Kerala,052830050,Simha Bhawan Social Centre,Matha Mangalam KannurKerala-670306,0.00
1228,2015-2016,Kerala,052880113,Sirajul Huda Educational,Complex Kozhikode KeralaPin: 673 508-,18099993.38
1229,2015-2016,Kerala,052810128,Sisodia Educational  Medical & Charitable Society,Kallakadavu P.o. Kollakadav AlleppyKerala-690509,0.00
1230,2015-2016,Kerala,052850250,Sister  Of Mary Immaculate  Of Bishop Morrow - Kalmassery,Changampuzhangar P.o. Dist- Kochi Kerala -682033,0.00
1231,2015-2016,Kerala,052830060,Sister Of Adoration Of Blessed Sacrament,Josegiri Provincial House ThalasseryKannur - 670 101-,0.00
1232,2015-2016,Kerala,052850093,Sister Of St Elizabeth,Preshitha Bhavan Thottumugham P.O.Alwaye Kerala.-683105,8350022.00
1233,2015-2016,Kerala,052900201,Sister Of St Peter Claver, Olarikkara P.o. PullazhiTrichur - 680 012-,0.00
1234,2015-2016,Kerala,052850017,Sister Of St.josephs Cottalengo Little H,House Divine Providence Beach Road Fort KochiErnakulam - 682 001-,1286314.00
1235,2015-2016,Kerala,052850399,Sisters Charity Our Lady Of God & Pepetual Succour,Bmc Road Thrikkakara Po  CochinKerala-682021,0.00
1236,2015-2016,Kerala,052910390,SISTERS OF CHARITY OF ST JEANNE ANTIDE THOURET  TRUST,MARADI KANTHALLOOR PLAMOOTTUKADA POSTTRIVANDRUM695128,1189962.00
1237,2015-2016,Kerala,052850462,Sisters of Holy Nativity,Infant Jesus Convent Building Perumpadappu CochinErnakulam Distt. (Kerala)-682006,2924336.84
1238,2015-2016,Kerala,052930105,Sisters Of Imitation Of Christ,Province of Thiruvalla Bethany Convent Thiruvalla Kerala-689115,0.00
1239,2015-2016,Kerala,052850530,SISTERS OF IMITATION OF CHRIST MUVATTUPUZHA PROVINCE,BETHANY SISTERS PROVINCIALATEERNAKULAM686667,1075591.00
1240,2015-2016,Kerala,052810061,Sisters Of Mary Immaculate Of Bishop Morrow- Poomkavn,Pathirapally P.o. Alleppy                 District- Alapuzha Kerala-688521,0.00
1241,2015-2016,Kerala,052850457,Sisters Of Mercy Of The Holy Cross,Holy Cross Institute  Thrikkakara CochinErnakulam (kerala)-682021,0.00
1242,2015-2016,Kerala,052850483,Sisters of our Lady of consolation,Consolata Convent Building Kumbalanghi CochinErnakulam kerala-682007,8583402.00
1243,2015-2016,Kerala,052830170,SISTERS OF ST JAMES CONVENT AZHIKODE,BLDG NO AP XVII  621 Three Road Azhikode postkannur670009,724707.00
1244,2015-2016,Kerala,052850522,Sisters of St. Mary Magdalene Postel,Our Lady of Mercy ConventKuttikattukara Kadungalloor683504,3940121.00
1245,2015-2016,Kerala,052890006,Sisters Of St.francis Of Assisi Bhavan,Palghat Kerala -,17572913.52
1246,2015-2016,Kerala,052850319,Sisters Of The Destitute St Marys Pro.,Chunagamvely AluvaErnakulam - 683 105-,15794994.00
1247,2015-2016,Kerala,052930238,SISTERS OF THE IMITATION OF CHRIST PATHANAMTHITTA PROVINCE,BETHANY PROVINCIAL HOUSE NANNUVAKAD PATHANAMTHITTAPATHANAMTHITTA689645,11382705.40
1248,2015-2016,Kerala,052960016,Sisters Servants of the poor(Cusmano Bhavan),Elampal PO Vilakudy Village Pinapple Junction PunalurKollam Kerala-691322,121500.00
1249,2015-2016,Kerala,052850329,Sisu Bhavan Sisters Of Nazareth,Paduapuram Po ErnakulamKerala-683582,497886.00
1250,2015-2016,Kerala,052910173,Sivananda Yoga Vedanta Dhanwantari Asrm,Kerala   -,40001478.73
1251,2015-2016,Kerala,052890071,Skdi Orphanage Committee,Skdi Orphanage P. O. - Vallapuzha Palakkad Kerala  -679336,0.00
1252,2015-2016,Kerala,052900026,Slum Service Centre,Kuriachira TrichurKerala-,0.00
1253,2015-2016,Kerala,052870148,Sneha Bhavan,Bharananaganam Po KottayamKerala-686578,162339.00
1254,2015-2016,Kerala,052870280,Sneha Bhavan, Gandhinagar P.o.Kottayam - 686 008-,1475174.00
1255,2015-2016,Kerala,052900149,Sneha Bhavan Convent, Poomkunnam P.o.Trichur - 680 002-,93603.85
1256,2015-2016,Kerala,052980011,Sneha Bhavan Social Centre,S. Battery Chethalayam P.o.Wayanad - 673 592-,0.00
1257,2015-2016,Kerala,052830143,Sneha Bhawan,St. Stephens Charitable Society  Aryangad Alachery P. O. Distt. Kannur Kerala -,0.00
1258,2015-2016,Kerala,052910197,Sneha Deepam Society,Pullampalil KumarapuramTrivandrum - 695 011-,581400.00
1259,2015-2016,Kerala,052830007,Sneha Niketan Social Centre,Dinesevanasabha Pattuvam Taliparamba  Kannur Distt.Kerala-670143,11169573.00
1260,2015-2016,Kerala,052870060,Sneha Sadan Orphanage,Kaduthuruthy Arunoottimangallam Po KottayamKerala-686604,0.00
1261,2015-2016,Kerala,052940061,Sneha Trust,Padamugham P.o.  Idukki Kerala  -,115742.00
1262,2015-2016,Kerala,052980155,Snehabhavan,Chettappalam-Vemom P.O. MananthavadyWayanad Distt. (Kerala)-670645,659230.00
1263,2015-2016,Kerala,052900350,Snehadepthy Charitable Trust,Congregation of Samaritan Sisters Mannuthy Post ThrissurKerala-680651,2825370.00
1264,2015-2016,Kerala,052870029,SNEHAGIRI INSTITUTIONS, Kroor P.o. PalaKottatym-,655915.40
1265,2015-2016,Kerala,052870028,Snehagiri Missionary Sister's, Karoor P.o. PalaKottayam - 686 575-,31513601.63
1266,2015-2016,Kerala,052900090,Snehagiri Society, Kuruvilessery P.o.Trichur - 680 735-,106746.00
1267,2015-2016,Kerala,052850552,SNEHAJYOTHI CHARITABLE SOCIETY,PULLUVAZHY POSTPERUMBAVOOR683541,329085.50
1268,2015-2016,Kerala,052850198,Snehalayam Srs.of Destitute,Malayankeezhu KothamangalamErnakulam --,16063.00
1269,2015-2016,Kerala,052900156,Snehalayan Boys Home,Peechi Pattikkad Po TrichurKerala-680652,199056.44
1270,2015-2016,Kerala,052900334,Sneharam Charitable Society,Manalur P.o ThrissurKerala.-,304742.00
1271,2015-2016,Kerala,052910189,Sneharam Social Welfare & Chart. Society,Rgd. Office Sneharam AnjengoKerala-,12000.00
1272,2015-2016,Kerala,052960034,SNEHATHEERAM CHARITABLE SOCIETY,SNEHATHEERAM VILAKUDY POSTKOLLAM691508,694676.65
1273,2015-2016,Kerala,052900305,Social  Centre Housing,Diocese Of Trichur  TrichurKerala-,0.00
1274,2015-2016,Kerala,052900080,Social Action,Arch Diocese of Trichur  Trichur Kerala-680005,0.00
1275,2015-2016,Kerala,052900055,Social Action Forum,"SOCIAL ACTION FORUM
CATHEDRAL JUNCTION WEST
IRINJALAKUDA 680121IRINJALAKUDA680121",6517000.00
1276,2015-2016,Kerala,052950079,SOCIAL ADVANCEMENT FOUNDATION OF INDIA (SAFI),RASIA NAGAR VAZHAYOOR EAST P.O.VAZHAYOOR673633,0.00
1277,2015-2016,Kerala,052880151,Social Network for Education Research and Human Action(SNEHA),31/617Ist Floor V.O. Road VadakaraKozhikode-Kerala-673101,0.00
1278,2015-2016,Kerala,052910279,Social Organisation For Mental Health Action,Ur-8 Uppalam Road Trivandrum Kerala-475650,0.00
1279,2015-2016,Kerala,052980044,Social Service Centre Dio Of Bathery,Pb 7 Sultan Battery MananthavadyWayanad - 670 645-,14135534.00
1280,2015-2016,Kerala,052880114,Social Service Centre(Centre for Overall Development),P.B.No.33 Matha Towers ThamarasseryKozhikode673573,566371.00
1281,2015-2016,Kerala,052900140,Social Service Deptt D M Provincial Hous, PatturaikkalTrichur - 680 001-,0.00
1282,2015-2016,Kerala,052810039,Social Welfare Society,Society Building Thathampally P.o.Alleppey            -688013,5182896.00
1283,2015-2016,Kerala,052850217,Social Welfare Technical School  Association,Aluva Ernakulam Distt. Kerala -683101,0.00
1284,2015-2016,Kerala,052870304,Society for Empowerment of the Learning Disabled,Building No.315 Ward-II St John of  God CentreVelloor P.O. PampadyPanchayatKottayam-Kerala-686501,3649757.06
1285,2015-2016,Kerala,052910381,SOCIETY FOR PROMOTING ALTERNATE COMPUTING AND EMPLOYMENT,C II ELANKOM GARDENS VELLEYAMBALAM SASTHAMANGALAM POTRIVANDRUM695510,42926.00
1286,2015-2016,Kerala,052890072,Society For Rehabilitation Of The Poor & The Handicappcl,Rehb Ceuse Mangalam - Post Lakkidi (via) Distt.  Palakkad Kerala -,427953.00
1287,2015-2016,Kerala,052910299,Society For Unity And Integral Progress,Unity House Chittazha Vattappara (p.o.)Thiruvananthapuram (kerala)-695028,6139063.00
1288,2015-2016,Kerala,052940071,Society Of  St. Joseph,Nirmala BhavanSABS Provincial House Thodupuzha - 685584Thodupuzha685584,13922000.00
1289,2015-2016,Kerala,052880046,Society Of Bridgettines,Bridgettine Convent Calicut -673012,123225.00
1290,2015-2016,Kerala,052830028,Society Of Daughter's Of  St. Camillus,Chungakunnu P.o. Via Kottiyoor Dist. Kannur         Kerala-670651,168424.00
1291,2015-2016,Kerala,052910037,Society Of Daughters Of Mary,Maria Bhavan Kudappanakkunu P.o.Trivandrum - Kerala Tamilnadu-695043,0.00
1292,2015-2016,Kerala,052980052,Society Of Daughters Of St. Camillus,Varampatta Po WyanadKerala-673575,2929371.00
1293,2015-2016,Kerala,052910076,Society Of Intgrated Dev.of Rural People,Kadavattaram Neyyattinkara Post Trivandrum District Kerala. -,0.00
1294,2015-2016,Kerala,052830056,Society Of Kristu Dasis,Thonichal Nallornadu WyanadKerala-,14911259.00
1295,2015-2016,Kerala,052900219,SOCIETY OF NIRMALA DASIKAL,Nirmala Generalate Ayyappankavu P O MulayamThrissur680751,65871.00
1296,2015-2016,Kerala,052880005,Society Of Prentation Sisters,  Kerala-,5931948.00
1297,2015-2016,Kerala,052880036,Society Of Sisters Of Charity,Holy Redeemer Convent Malaparamba CalicutKerala-673009,17596420.16
1298,2015-2016,Kerala,052980056,Society Of Sisters Of Redemption, Ripow P.o. MeppadyWayanad - 673 597-,11015.00
1299,2015-2016,Kerala,052890063,SOCIETY OF SISTERS OF ST JOSEPH,Palghat  Kerala-,17249732.00
1300,2015-2016,Kerala,052930080,Society Of Sisters Of The Holy Cross Provinciate,Hospital Road Kollam Kerala -691001,15807658.70
1301,2015-2016,Kerala,052880055,Society Of Srs.of Charitylourde Convent, Sellera MalaparambaCalicut - 673 009-,582887.00
1302,2015-2016,Kerala,052850171,Society Of St Catherines Convent, EdakochiKochi- 682 006-,63746.00
1303,2015-2016,Kerala,052870228,Society Of St.Thomas,Christavashram Manganam- P.o.Kottayam Kerala-686018,982545.00
1304,2015-2016,Kerala,052880102,Society Of The Dimesse Sisters Daughters of Mary Immaculate,Mavoor Calicut Kerala -673661,9455274.00
1305,2015-2016,Kerala,052890077,Society of the Sisters of St. Francis,St. Francis Convent Asokapuram AluvaPalakkad (Kerala)-680101,7079128.00
1306,2015-2016,Kerala,052880009,Society Of Venerini Sesters,   -,6397146.00
1307,2015-2016,Kerala,052850304,Society St. Vincent Depaul St Joseph Hospital,Poovathussery Parakkadavu ErnalukamKerala-683579,0.00
1308,2015-2016,Kerala,052830011,Society Ursuline Con.of Mary Immculate,  Kannur-670001,56854.00
1309,2015-2016,Kerala,052910238,Socio Economic Unit Foundation,Tc.16/309easwarvilasam Road Thycaud P.o.Trivandrum - 695 014-,0.00
1310,2015-2016,Kerala,052880066,Socio Religious Centre, MalaparambaCalicut - 673 009-,10461.36
1311,2015-2016,Kerala,052850474,Socity  Of  Vimla,Nirmala Bhavan MuvattupuzhaErankulam  Kerala-686661,722190.00
1312,2015-2016,Kerala,052850184,Socy. For Relief Work For Poor Family,   -,14456690.00
1313,2015-2016,Kerala,052930117,Sodari Bhavan,Near Shankar Hospital KadanmukkuKollam-,214998.40
1314,2015-2016,Kerala,052900373,SOLACE,TC 2 1862 PARAKKOT LANE THIRUVAMBADY POTHRISSUR680022,682300.00
1315,2015-2016,Kerala,052940054,Solaidarity Movement Of India Cen.Commt., Kanjikuzhy P.o.Idukki - 685 602-,0.00
1316,2015-2016,Kerala,052910368,SOUL WINNING FELLOWSHIP,VANNIYACODUPARASALATHIRUVANANDHAPURAM695502,1920708.00
1317,2015-2016,Kerala,052910008,South India Federation Of Fisherman Societies,Tc 20/875 Karamana Po ThiruvananthpuramKerala-,510248.20
1318,2015-2016,Kerala,052910223,South Travancore Agency For Rural Development,J.m.m. Centre Mannanthala ThiruvananthapuramKerala-695015,24871184.02
1319,2015-2016,Kerala,052930096,South West India Mdcl. & Edu.ellowship, TeepanyTiruvalla-,6754878.00
1320,2015-2016,Kerala,052880093,Southern Province Congregation Of Srs.of,Little Flower Of Bethany Po Cheavyur CalicutCalicut - 673 017a-,27188.00
1321,2015-2016,Kerala,052880174,Sports and Education Promotion Trust,Arun ViharKozhikode673004,0.00
1322,2015-2016,Kerala,052850249,Sree Narayana Sevika Samajam,Sree Narayanagiri ThottummughamAluva - 5-,3313291.46
1323,2015-2016,Kerala,052850523,SREEDHAREEYAM AYURVEDIC RESEARCH AND DEVELOPMENT INSTITUTE,NELLIAKATTUMANA KIZHAKOMBU P.OKOOTHATTUKULAM686662,0.00
1324,2015-2016,Kerala,052870279,Sreyas Vanitha Samajam,Sanketham Koonamthanam Cheeramchira P.o.changanacheryKottayam - 686 106-,0.00
1325,2015-2016,Kerala,052960018,Sri Balabhattarakeswara Asrama Samithi,Panmana Asramam Panmana PO Karunagapalli KollamKerala-691583,2727078.44
1326,2015-2016,Kerala,052910383,SRI MULAM SHASHTIPURTHI SMARAKA HINDU MAHILA MANDIRAM,TC 38 2134 OPP SBT HEAD OFFICE POOJAPPURATHIRUVANANTHAPURAM695012,753892.00
1327,2015-2016,Kerala,052850168,Sri Ramakrishna Advaita Ashram, Kaldy P.o.Ernakulam - 688 574-,111640.00
1328,2015-2016,Kerala,052930180,Sri Ramakrishna Ashrama,Thukalassery Thiruvalla Po Pathanthetta Kerala-689101,136941.00
1329,2015-2016,Kerala,052910154,Sri Ramakrishna Ashrama Charitable Hospital,SasthamangalamTrivandrum695010,25252.97
1330,2015-2016,Kerala,052900073,Sri Ramakrishna Math, P.o. PuaranattukaraTrichur - 680 551-,180248.00
1331,2015-2016,Kerala,052880067,Sri Ramkrishna Math Mission,Quilandy P.o. MelurCalicut - 673 319-,267602.00
1332,2015-2016,Kerala,052900104,Sri Sarada Math, Puranattukara P.o.Trichur - 680 551-,381672.00
1333,2015-2016,Kerala,052910347,Sri Sivasakthi charitable Trust,CP 15/255 Chenkal PO Neyyattinkara talukTrivandrum Kerala-695132,0.00
1334,2015-2016,Kerala,052890066,Sri Society For Rural Improvement,Mithila Near Chinmaya Mission  P.o.box-  2 KollengodeDistrict- Palakkad Kerala-678506,0.00
1335,2015-2016,Kerala,052930157,Sri Vidya Samiti,Nangirethu Malakkara  QuilonKerala-,39890159.00
1336,2015-2016,Kerala,052910371,SRIRAMA CHRITABLE TRUST,SRIPATHI VEERABHADRA GARDENS PATTOM PALACE P.OTHIRUVANANTHAPURAM695004,0.00
1337,2015-2016,Kerala,052910074,Srs Of St Joseph Cottlengo, Karumkulamputhiyathura P.o.Thiruvananthapuram-695 572-,0.00
1338,2015-2016,Kerala,052870160,Srs Of The Imiitation Of Christ Bethany,Srs Generalate Vadavathoor P.o.Kottayam - 686 010-,66225.54
1339,2015-2016,Kerala,052910088,Srs.of Imitation Christ bethary Convent,  Trivandrum - 695 015-,24419332.68
1340,2015-2016,Kerala,052880095,Srs.of Missioners Of Christst.pauls Con,Vent And Balikabhavan PuduppadiKozhikode-,362168.00
1341,2015-2016,Kerala,052980073,St  Mary's Church,Vimalanagar P.O. Thavanjal MananthavadyWayanad Kerala -670645,0.00
1342,2015-2016,Kerala,052880119,St  Thomas Province Little Flower Congregation of CST Fathers,St. Thomas Bhavan  Chelevoor Kerala-,40498153.30
1343,2015-2016,Kerala,052900270,St  Xaviers Orphanage,Kodakara TrichurKerala-680684,0.00
1344,2015-2016,Kerala,052900370,ST . JOSEPHS CONVENT,PAZHUKKARAANNALLUR P.O680731,0.00
1345,2015-2016,Kerala,052830038,St Angella Home,Sneha Nikethan Pattuvam KannurKerala-670143,0.00
1346,2015-2016,Kerala,052900052,ST ANNES CHARITABLE INSTITUTE,West Fort  Thrissur - 680 004-,0.00
1347,2015-2016,Kerala,052870132,St Annes Monastery, KurianadKottayam - 686 636-,0.00
1348,2015-2016,Kerala,052850564,ST ANNES SOCIETY,ST THOMAS PROVINCIAL HOUSE OKKAL P.O THANNIPUZHAERNAKULAM683550,8702034.00
1349,2015-2016,Kerala,052850347,St Anns Carmelite Convent,Thirumardy Po ErnakulamKerala-686687,0.00
