900,2015-2016,Kerala,052870044,Mercy Home,Chethipuzha Kurisummoodu P.o.Changanacheery Kottayam-,1938637.20
901,2015-2016,Kerala,052890065,Mercy Home Charitable Society For The,Aged Destitute Behind Mercy CollegePalakkad-678 006-,0.00
902,2015-2016,Kerala,052880149,Mercy Home India,Farook College (Post) FerokeKozhikkode-Kerala-673632,73118.00
903,2015-2016,Kerala,052900267,Mercy Home Orphanage,Mala TrichurKerala-687732,0.00
904,2015-2016,Kerala,052870097,MERCY HOME THIDANADU,Thidanadu KottayamKerala-686123,204175.00
905,2015-2016,Kerala,052830035,Mercy Hospital,Sreekandpuram Payyavoor Po KannurKerala-670633,0.00
906,2015-2016,Kerala,052870082,Mercy Hosptial, Pothy ThalayolaparambKottayam - 686 605-,0.00
907,2015-2016,Kerala,052880033,Mercy Orphange, Kulathuvayal Kayanna P.o.Kozhikode - 673 526-,0.00
908,2015-2016,Kerala,052870095,Minor Seminary Of The Claretian Congn, KuravilangadKottayam-,15658691.00
909,2015-2016,Kerala,052850192,Missionaries Of Incarnation,St Josephs Convent Nazreth Cochin Ernakulam Kerala-682002,2834675.00
910,2015-2016,Kerala,052850459,Missionaries of Our Lady of La Salette,La Salette Bhavan  P.O. ParakadavuErnakulam (Kerala)-683579,3894191.00
911,2015-2016,Kerala,052870145,Missionary Orientation Centre,Vidyanagar Manganam P.o.Kottayam - 686 018-,0.00
912,2015-2016,Kerala,052930013,Missionary Sister's Of St. Teresa,Cherupushpa Nivas Convent Industrial Estate P.o.Kollam - 691 589-,15532445.63
913,2015-2016,Kerala,052880122,Missionary Sisters Of Mary Immaculate,Mary Matha Province St. Mary's Convent ParoppadyMary Kunna Post Kozhikode-,575016.07
914,2015-2016,Kerala,052870092,Missionary Society St.pius Xth Sh Mount.,  Kottayam - 686 006-,5754658.00
915,2015-2016,Kerala,052960029,MISSIONERY SERVANTS OF THE POOR,Cusmano Nivas TholicoduKollam691315,10536684.14
916,2015-2016,Kerala,052930226,Missions India,Navajeevodayam Centre Manjadi P.O. TiruvallaKerala-689105,10194638.12
917,2015-2016,Kerala,052960027,Mithra Vidhyalaya Educational Charitable Society,Reg No Q 486 2000 Patharam P O Sooranadu SouthKollam690567,0.00
918,2015-2016,Kerala,052850467,Mithran,Mithram Rehabilitation Complex KanjirikkappillyAarakkunnam P.O.Ernakulam-Kerala-682313,389112.00
919,2015-2016,Kerala,052870180,Mitra Niketan Social Service Society,Mitra Niketan Hospital Vagmon P.o.Kottayam - 685 503-,694755.00
920,2015-2016,Kerala,052910003,Mitraniketan,   -,7348511.40
921,2015-2016,Kerala,052980175,MODERN EDUCATIONAL AND CHARITABLE TRUST,C M COMPLEX TELLICHERY ROAD P O MANANTHAVADYWAYANAD670645,1000000.00
922,2015-2016,Kerala,052850439,Monastery Of Our Lady Of Mercy,Edacochin Cochin Ernakulamkerala -682006,10783210.00
923,2015-2016,Kerala,052960024,MONSIGNOR KAYAVIL WELFARE FOUNDATION,CATHOLIC CENTRE FATIMA COLLEGE CAMPUSKOLLAM691001,61385.91
924,2015-2016,Kerala,052940063,Mother And Child Foundation,Mailacombu P.o. ThodupuzhaIdukki (kerala)-685584,3975724.97
925,2015-2016,Kerala,052870241,Mother Anna Convent, Mammood P.o.Kottayam - 686 553-,60600.00
926,2015-2016,Kerala,052920006,Mother Krishnabai Rural Development Trust,Ramnagar Post Anandashram KanhangadKasaragod Kerala-671531,3039510.00
927,2015-2016,Kerala,052870137,Mother Savina Study House,Rubber Board P.O. Puthuppally KottayamKerala.-686009,906227.00
928,2015-2016,Kerala,052850229,Mothers Association,St. Martin Centre AngamalyKerala-683573,0.00
929,2015-2016,Kerala,052830118,Mount Carmel Ashran, PeravoorKannur - 670 673-,2171129.00
930,2015-2016,Kerala,052810105,Mount Carmel Bhavan,Vadackal P.o. Alappuzha Alleppey -688003,214977.00
931,2015-2016,Kerala,052850272,Mount Carmel Convent,Chathiath Pachalam Po Cochin ErnakulamKerala-682012,855649.00
932,2015-2016,Kerala,052890021,Mount Carmel Orphanage,Jellippaha Attappady  PalakkadKerala-678582,0.00
933,2015-2016,Kerala,052980038,Mount Mary Convent, Mananthavady  P.o.Wayanad - 670 645-,0.00
934,2015-2016,Kerala,052900177,Movement Of Islam Trust,Kodungallur Eriyad P.o.Trichur 680-,0.00
935,2015-2016,Kerala,052880035,Mujahid Educsation Trust,17/194 Am Square Complex Pb.60 Pavamani RoadCalicut - 673 001-,0.00
936,2015-2016,Kerala,052880071,Mukkam Muslim Orphanage Committee, Mukkom P.o.Kozhikode Kerala-673602,51078472.00
937,2015-2016,Kerala,052870163,Mundakapadam Mandiram,Kottayam 686 018 Kerala -,331534.00
938,2015-2016,Kerala,052940036,Mundakkayam Medical Trust Hospital, MundakkayamIdukki - 686 513-,1456545.00
939,2015-2016,Kerala,052880008,Muslim Educational Society Regd., CalicutKerala-673001,134192.00
940,2015-2016,Kerala,052880156,Muslim Relief Commitee,Thechiyad Kallurutty P.O. Thiruvambady KozhikodeKerala-673603,2237251.34
941,2015-2016,Kerala,052880001,Muslim Service Society,Cherooty Road Post Box No. 182Calicut  Kerala-673001,0.00
942,2015-2016,Kerala,052890082,Muthalamada Sneham Charitable Trust,Puthen House Kambrathechalla Muthalamada Post Palakkad DistKerala-678507,0.00
943,2015-2016,Kerala,052830136,Muthimmathul Muslimeen Edu. Centre,Muhimmath Nagar Puthige P.o.Kasaragod - 671 321-,597334.00
944,2015-2016,Kerala,052850508,Muvattupuzha Islamic Education Trust,Market PO Muvattupuzha ErnakulamKerala-686673,218998.55
945,2015-2016,Kerala,052880137,Mythri Charitable Trust,24/1894 A Sri Kripa P.O. MankaveCALICUT673007,0.00
946,2015-2016,Kerala,052810136,Naduvathul Islam Vaduthala,Nadvath Nagar PO Alappuzha Kerala -688559,0.00
947,2015-2016,Kerala,052850502,Naipunnya International,Major Archbishops House Campus Broadway CochinErnakulam Kerala-682031,1294518.84
948,2015-2016,Kerala,052910345,Namaste Wings to Fly,"Kulakode
Vellanad P.O
Trivandrum
695543Trivandrum695543",35511850.00
949,2015-2016,Kerala,052850480,Nansen Environment Research Centre(India),1st Floor KUFOS Amenity Centre PanangadPanangad682504,5745865.06
950,2015-2016,Kerala,052900331,NARAYANASHRAMA TAPOVANAM,VENGINISSERY PARALAM(P.O)PARALAM680563,14501683.79
951,2015-2016,Kerala,052950007,Nasrathul Islam Trust, TirurkadMalappuram - 679 351-,25000.00
952,2015-2016,Kerala,052880140,National Agency For Social Research & Development,Door No. 33/4026 Malaparamba Kozhikode Distt.Kerala-673009,0.00
953,2015-2016,Kerala,052950074,National Educational and Charitable Trust,PB No.531 Area code (PO) MalappuramKerala-673639,0.00
954,2015-2016,Kerala,052880127,National Solidarity Foundation,R.7 Floor No.3kanchas Opp. Indoor StadiumKozhikode Kerala-,0.00
955,2015-2016,Kerala,052910185,National Womens Welfare Centre( N.w.w.c),Vanitha Bhavan Ariyancode OttasekharamangalamTvm. Kerala 695 125-,0.00
956,2015-2016,Kerala,052910318,Nava Dersini Mahila Samajam,Janardhanpuram Ottasekharamangalam OttasekharamangalamThiruvananthapuram Kerala-695125,0.00
957,2015-2016,Kerala,052940085,NAVA JYOTHI BENEDICTINE MONASTERY,NALLATHANNY MURINJAPUZHA P.O.MURINJAPUZHA685532,377721.00
958,2015-2016,Kerala,052850567,NAVABHARATH FOUNDATION,V6 -29C UNICHIRA POOKATUPADY ROAD THRIKKAKARA P OERNAKULAM682021,0.00
959,2015-2016,Kerala,052930007,Navachethara, Menjadi P.o.Tiruvalla - 689 105-,0.00
960,2015-2016,Kerala,052850517,NAVADARSAN PUBLIC CHARITABLE TRUST,DNO 41 3993B IS PRESS ROAD KOCHI ERNAKULAM KERALAKOCHI682018,0.00
961,2015-2016,Kerala,052910305,Navadharsan Social Welfare Centre,Thellukuzhi Keezharoor (p.o.) KeezharoorThiruvananthapuram (kerala)-695130,0.00
962,2015-2016,Kerala,052940086,NAVAJYOTHI PROVINCE IDUKKI,SH PROVINCIAL HOUSERAJAMUDY P O685604,8648392.86
963,2015-2016,Kerala,052900025,Navajyothi Provincial House,Olarikkara Po Pullazhi TrichurKerala-680012,0.00
964,2015-2016,Kerala,052830119,Nazareth Bhavan Convent, Kunnoth P.o.killiyantharaKannur - 670 706-,12163323.12
965,2015-2016,Kerala,052810044,Nazareth Carmel House,Muhamma Alappuzha P.o.Alleppey kerala   -688525,9975.36
966,2015-2016,Kerala,052850356,Nazareth Medical Society,Paduapuram KarnkuttyErnakulam - 683 582-,4050482.00
967,2015-2016,Kerala,052850279,Nazareth Social Centre,Karukutty Angamaly  ErnakulamKerala-683576,141806.00
968,2015-2016,Kerala,052980098,Nazarethe Home, Chundakara Pallikunnu P.o.Wayanad - 673 121-,0.00
969,2015-2016,Kerala,052890051,Nazereth Bavan Orphanage, Agali P.o. AttappadyPalakkad - 678 581-,0.00
970,2015-2016,Kerala,052980172,NEETHI VEDHI,NEETHI VEDHISUDHIKKAVALAKAKKAVAYAL P.OKALPETTA NORTH673122,5159580.00
971,2015-2016,Kerala,052930241,NEW GENERATION MINISTRIES,THANNINILKUNNATHIL VALLIYAKKARA HOUSE  OOTTUPARA POKONNI689691,1065919.66
972,2015-2016,Kerala,052870083,New India Church Of God,Bhthesda Nagar Chingavanam KottayamKerala-686531,169938966.83
973,2015-2016,Kerala,052910063,New India Evangelistic Association,Zion MannanthalaTrivandrum695015,126517273.48
974,2015-2016,Kerala,052810146,NEW LIFE CHRISTIAN MINISTRIES TRUST,Light House  Keerikkadu PostPathiyoorkala690508,5075290.00
975,2015-2016,Kerala,052910271,Neyattinkara Integral Development Society,Vazhuthoor Neyyattinkara  ThiruvanthapuramKerala -,5257606.22
976,2015-2016,Kerala,052900261,Nfp Family Apostolate Centre,Arch Bishops House  Trichur - 680 005-,0.00
977,2015-2016,Kerala,052930196,Nilackal St Thomas Church,Devaloloam Po  KottayamKerala-686038,0.00
978,2015-2016,Kerala,052950056,Nilambur Yatheem Khana,Nilambur MalapuramKerala-,0.00
979,2015-2016,Kerala,052930038,NIRANAM MARAMON DIOCESE,Niranam Maramam Diocese Poolatheen P.o.Tiruvalla - 689 101-,100000.00
980,2015-2016,Kerala,052940082,Nirmal Rani Province Idukki,FCC Nirmalrani Provincial House Murickassery P.O Idukki Dist Kerala -685604Murickassery685604,12335658.00
981,2015-2016,Kerala,052900353,Nirmal Rani Province of Adoration Congregation,Nirmal Rani Provincialate Chettupuzha Post ThrissurKerala-680621,105565.00
982,2015-2016,Kerala,052880065,Nirmala Hospital Society,Nirmala Hospital Marikunnu P.o.Calicut 673 012-,6171252.00
983,2015-2016,Kerala,052980157,Nirmala Mahila Samajam,Pallikunnu.P.O. WayanadKerala-673121,5345712.36
984,2015-2016,Kerala,052870032,Nirmala Orphanage Assumption Convent,Padinjarekara Vallakom Vaikom P.o.Kottayam - 686 146-,0.00
985,2015-2016,Kerala,052850424,Nirmala Province Of Medical Sisters Of St. Joseph,Kakkanadu Thrikkakara South ErnakulamKerala-682030,11111.00
986,2015-2016,Kerala,052980127,NIRMALA PROVINCE OF THE SACRED HEART CONGREGATION,NIRMALA PROVINCE OF SACRED HEART CONGREGATION  DWARAKA  PB NO.33  NALLOORNADU P.O.MANANTHAVADY670645,0.00
987,2015-2016,Kerala,052850361,Nirmala Sadan School Mentaly Retd.childr, MuvattupuzhaErnakulam - 686 661-,0.00
988,2015-2016,Kerala,052850529,NIRMALA SOCIETY FOR MEDICAL CARE,NIRMALA BHAVANMUVATTUPUZHA686661,795233.00
989,2015-2016,Kerala,052930108,Nirmalagiri Novitiate House,Nellypally Punalur P.o.Kollam - 691 305-,534343.91
990,2015-2016,Kerala,052830005,Nirmalayam Social Centre,Madai KannurKerala-670304,0.00
991,2015-2016,Kerala,052910011,Nirmalyaam Centre,Monvila Kulathoor P.o.Trivandrum - 695 583-,0.00
992,2015-2016,Kerala,052900102,Nivruthi Bhavan Convent,West Mundathicode Po Waddakenchery TrichurKerala-680623,0.00
993,2015-2016,Kerala,052950049,Nooriyya Yathem Khana Committee,Pattikkad Valamboor P.o.Malappuram-,0.00
994,2015-2016,Kerala,052890093,NOORUL HUDA CHARITABLE TRUST,PEZHUMKARA MEPPARAMBAPALAKKAD678006,189733.40
995,2015-2016,Kerala,052830133,Noorul Islam Orphanage Committee,Po Alampadi  KasargodKerala-671123,0.00
996,2015-2016,Kerala,052940081,Noorul Islam Trust,Al-Azhar CampusPerumpillichira PO-Thodupuzha ThodupuzhaIdukki Kerala-685605,0.00
997,2015-2016,Kerala,052980015,Norbert House,Kuzhinilam MananthavadyWayanad Kerala-670645,15045340.65
998,2015-2016,Kerala,052930037,Norbertine Fathers, Eravipuram P.o.Kollam - 691 011-,3881444.00
999,2015-2016,Kerala,052850280,Nursing Srs.of Our Lady Dolour's Convent, PerumpadappuKochi-,13021711.00
1000,2015-2016,Kerala,052910018,O C D Malabar Province,  Kerala-,45820443.95
1001,2015-2016,Kerala,052870238,Oblate Missionaries Of Mary Immaculate,Matha House ChanganacherryKottayam - 686 101-,0.00
1002,2015-2016,Kerala,052910290,Oblate Welfare Society,Sacred Heart Convent Vilayikulam Near F.c.i. KazhakuttomThiruvananthapuram (kerala)-695582,1689238.00
1003,2015-2016,Kerala,052900042,Oblates Of St Joseph,   -,32623619.00
1004,2015-2016,Kerala,052850004,Oblsate Sisters St. Agens Convent,Convent Pandikudy Cochin Kerala. -682002,4102323.00
1005,2015-2016,Kerala,052880126,Offer,19/1385 East KallaiKozhikode Kerala-,173894983.56
1006,2015-2016,Kerala,052850463,Order of St. Augustine,St. Augustine's Study House Maripuram ThakkattukaraAlwayeThaikkattukara Post Ernakulam-683106,2538914.00
1007,2015-2016,Kerala,052870017,Orthodox Thelogical Seminary,P.b.-98  Kottayam - 686 001-,3920850.00
1008,2015-2016,Kerala,052890102,Ottapalam Welfare Trust,ThottakaraOttapalam679102,0.00
1009,2015-2016,Kerala,052850369,Our Lady Of Rogate Ashram, Ernakulam Dist.Kerala-,20861056.00
1010,2015-2016,Kerala,052930011,Our Lady Peace Home For The Blind & Deaf, Enathu P.o.Pathanamthitta 691 526-,6358616.99
1011,2015-2016,Kerala,052890036,P.C. M Medical Centre,Kalladikode Po Palakkad DistKerala-678596,0.00
1012,2015-2016,Kerala,052850556,PACHOMIOS EDUCATIONAL AND CHARITABLE ENLIGHTEMENT FOUNDATION,ST GEORGE ORTHODOX KARMELKUNNU CHURCH  MULAKULAM NORTH P OPIRAVOM686664,0.00
1013,2015-2016,Kerala,052900077,Padua Hospital,Puthenpeedika TrichurKerala-,0.00
1014,2015-2016,Kerala,052880123,Pain & Palliactive Care Society, Medical College P.o.Calicut - 673 008-,379860.05
1015,2015-2016,Kerala,052960031,PAIN AND PALLIATIVE CARE TRUST,HARISREE MAKKATTU KANNIMELCHERYKOLLAM691003,0.00
1016,2015-2016,Kerala,052870117,Palai Social Welfare Society,Shalom Pastoral Centre Palai P.O.Kottayam Kerala.-686575,0.00
1017,2015-2016,Kerala,052890054,Palghat Mujaheedin A C Committee,Paril Palakkad Kerala-678612,0.00
1018,2015-2016,Kerala,052850487,Pallium India Trust,"65/PJRRA ""SHANTI"" Pothujanam LaneKumarapuram Trivandrum695011",11046928.85
1019,2015-2016,Kerala,052910015,Pallottgiri Society,Pallottgiri ThiruvanthpuramKerala-,10464297.00
1020,2015-2016,Kerala,052850417,Palluruthy Auxilium Society,Auxilium Centre Palluruthy  Kochi ErnakulamKerala -682006,6642189.17
1021,2015-2016,Kerala,052950029,Panakkad Pokoya Thangal Memorial Y Khana, Cherur P.o. VengaraMallapuram - 676-,0.00
1022,2015-2016,Kerala,052910387,PANKAJAKASTHURI HERBAL RESEARCH FOUNDATION,Kasthuri PoovachalThiruvananthapuram695575,0.00
1023,2015-2016,Kerala,052980144,Parathottam Karshaka Vikasana Samithi,Varayal P.o Thalapuzha WynadKerala-,0.00
1024,2015-2016,Kerala,052850314,Parimala Mar Gregorius Memorial Trust,Thalacode MulanthuruthyErnakulam - 682 314-,1507973.50
1025,2015-2016,Kerala,052900239,Parteeksha Bhavan,Irinjalakuda Trichur Kerala -,1754715.00
1026,2015-2016,Kerala,052930079,Parumala Seminary,Parumala Mannar Thiruvalla Kerala -689626,1965627.00
1027,2015-2016,Kerala,052850451,Passionist Sisters Of St. Paul Of The Cross,Passionist Sisters Pavithratma  Nivas Cheranelloor- KochiErnakulam (kerala)-,6351836.00
1028,2015-2016,Kerala,052980087,Pastoral Centre,Dwaraka Mananthavady  Wayanad - 670 645-,0.00
1029,2015-2016,Kerala,052850155,Pastoral Orientation Centre,P.b.no.-2251 Palariuattom KochiErnakulam - 682 025-,464712.36
1030,2015-2016,Kerala,052880177,PATANJALI YOGA RESEARCH CENTRE,S J TOWER OPP PLANETARIUM JAFFARKHAN COLONYCALICUT673006,56253.31
1031,2015-2016,Kerala,052850180,Patengemeinschaft For Hungry Children,Ombalayil Bldg Kolenchery Po ErnakulamKerala-682311,26938126.00
1032,2015-2016,Kerala,052870328,Patmos Ministries India,1st floorThazhchayil Buildings T.B. Road ChanganacherryKottayam Kerala-686101,59946831.07
1033,2015-2016,Kerala,052900252,Pavana Service Society,Tricheur  Dt Kerala -,0.00
1034,2015-2016,Kerala,052900210,Pavanathma Provincial House, KallettumkaraTrichur Kerala-680683,2029944.00
1035,2015-2016,Kerala,052830167,PAVANATMA SYRO MALABAR CAPUCHIN VICE PROVINCE,PAVANATMA VICE-PROVINCE SEVASARAMMELE CHOVVA PO670006,28393760.25
1036,2015-2016,Kerala,052850199,Pavanthama Province Carmelites,Kothamagalam Kozhipilly  ErnakulamKerala-686691,0.00
1037,2015-2016,Kerala,052830102,Payyavoor Community Development Project,Payyavoor Po KannurKerala-670633,1603872.00
1038,2015-2016,Kerala,052930035,Pazhakulam Social Service Society,Pazhakulam P.O. Adoor PathanamthittaKerala-691527,0.00
1039,2015-2016,Kerala,052940010,Peermade Development Society,P.B.No.11 Peermade Idukki Distt. Kerala. -685531,15793421.00
1040,2015-2016,Kerala,052850288,Peniel Missionary Fellowship,Penielpuram Keezhillam P.o.Ernakulam - 683 541-,6841495.00
1041,2015-2016,Kerala,052810024,Pentecost Church Of God,Fellowship Centre Thazhakapa P.o.mavelikaraAlleppey Kerala-,1414576.42
1042,2015-2016,Kerala,052930193,Pentecost Educational Society,Kombanattu Po  PathanamthittaKerala.-,0.00
1043,2015-2016,Kerala,052910162,Pentecostal Children's Education Fund, Kumbanad P.o.Tiruvalla - 689 547-,519263.00
1044,2015-2016,Kerala,052870353,PENUEL IMMANUEL CHARITABLE TRUST,DIVYA KARUNYA NAGARTHAMPALAKADUKANJIRAPPALLY686506,0.00
1045,2015-2016,Kerala,052960035,People for Animals Kollam,MRA 11 MundakkalKollam691001,45974.50
1046,2015-2016,Kerala,052890037,Peoples Service Society,Chakkanthara PallakkadKerala-,2500000.00
1047,2015-2016,Kerala,052900375,PERINGOTTUKARA ASSOCIATION UAE CHAPTER,PERINGOTTUKARATHRISSUR680565,186675.00
1048,2015-2016,Kerala,052850170,Perumbavoor St Thomas Orphanage, Iringole P.o.perumbavoorErnakulam - 683 548-,107521.00
1049,2015-2016,Kerala,052810143,PIARIST FATHERS,CALASANZ BHAVAN HOUSE NO 1-440 D AROOR CHERTHALA TALUKALLEPPEY688534,26942734.00
1050,2015-2016,Kerala,052810145,PIARIST SISTERS,HOUSE NO IV  287  ERAMALLOOR CHERTHALA ALLEPPEYALLEPPEY688537,10987498.42
1051,2015-2016,Kerala,052850208,Pius Gardens,Ayiroorpadom KothamangalamErnakulam - 686 692-,18182527.96
1052,2015-2016,Kerala,052830033,Pius Home Orphanage,Payyavoor Po  KannurKerala-670633,0.00
1053,2015-2016,Kerala,052910324,PLANET KERALA (Participatory Learning and Action Network),St. Mary's Building Complex Pattom P.O. ThiruvananthapuramKerala-695004,0.00
1054,2015-2016,Kerala,052850083,Poor Clares Assisi Monastery, AluvaErnakulam - 683 101-,0.00
1055,2015-2016,Kerala,052930095,Poor Clares Of Perpetual Adoration,Adoration Monastery  Kollam - 691 001-,65444.00
1056,2015-2016,Kerala,052810006,Poor Leprosy Hospital,Green Gardens Cherthala AlllapuzhaAlleppey  kerala       -688524,283326.00
1057,2015-2016,Kerala,052900298,Pope Paul Mercy Home,Santhivanam Peringandoor P.o.Trichur Kerala-680581,0.00
1058,2015-2016,Kerala,052930206,Power Evangelism Mission,Mulamoottil M.c. House  Thiruvalla-,1634189.90
1059,2015-2016,Kerala,052930243,POWER VISION CHARITABLE TRUST,PURAMATTOM P OTHIRUVALLA689543,586604.00
1060,2015-2016,Kerala,052810084,Praise Centre And Bible School,West Fort  MavelikkaraAlleppey          -690101,817925.00
1061,2015-2016,Kerala,052900325,Prajyothi Niketan For Resarch Training,Pratheeksharam Pudukad Thrissur Distt. Kerala -,0.00
1062,2015-2016,Kerala,052850330,PRATHEEKSHA REHABILITATION CENTRE FOR HANDICAPPED,Nellimattom Kothamangalam ErnakulamKerala-,105842.00
1063,2015-2016,Kerala,052910261,Prathibha Poshini,1-6 Dwaraka Jawahar Nagar ThiruvananthapuramKerala.-,13043.00
1064,2015-2016,Kerala,052850535,PRATHIKSHA,S2 G2 KB Park VattekunnuEdappally North682024,1096541.61
1065,2015-2016,Kerala,052870064,Preparatory College Cherupushpashram,   -,0.00
1066,2015-2016,Kerala,052850267,Preshitharam Congregation,   -,15968926.61
1067,2015-2016,Kerala,052850440,Priest Of The Scared Heart India,Dehon Bhawan S.kumbalanghy ErnakulamKerala-682007,25055611.00
1068,2015-2016,Kerala,052870099,Prison Fellowship India,P.o. Box 11 Vadavathoor P.o. KottayamKerala-686010,25516739.91
1069,2015-2016,Kerala,052870284,Priyadarsini Charitable Society,Chamakala Po: KothanallurDist. Kottayam-,0.00
1070,2015-2016,Kerala,052910356,PROTSAHAN,Divakaramandiram Ayurveda College West RoadThiruvananthapuram695001,0.00
1071,2015-2016,Kerala,052870272,Providence  Charity Trust,Providence Clinic Pala  P.o.Kottyam-686575,0.00
1072,2015-2016,Kerala,052900007,Providence Convent, Mullassery P.o.Trichur - 680 509-,0.00
1073,2015-2016,Kerala,052890041,Providence Home,Malampuzha PalakkadKerala-678651,0.00
1074,2015-2016,Kerala,052870229,Provincialate,Sisters of the Destitute   St Josephs ProvinceChethipuzha  Kurisummood PO      Changanasserry686104,11205745.00
1075,2015-2016,Kerala,052930174,Punalur Social Service Society,St Marys Church PuanalurQuilon Dt. Kerala-,4807168.00
1076,2015-2016,Kerala,052930250,PUSHPAGIRI MEDICAL SOCIETY,XI/38 PUSHPAGIRI MEDICAL COLLEGE HOSPITALTHIRUVALLA689101,15190433.52
1077,2015-2016,Kerala,052810040,Queen Of Apostles Society,St. Joseph's Convent Charummood Alleppey Distt.Kerala-690505,2501405.60
1078,2015-2016,Kerala,052930010,Quilon Don Bosco Society Stephens Church, ThopeQuilon - 619 006-,0.00
1079,2015-2016,Kerala,052930029,Quilon Social Service Society,Fatima Road  Dist- Kollam State- Kerala-691013,10849716.08
1080,2015-2016,Kerala,052880081,Rahmaniyya Arabic College  Committee,Katameri P.O. Katameri Badagara Kozikode Distt.Kerala-,1273750.00
1081,2015-2016,Kerala,052850222,Rajagiri College Of Social Science,P.O. Rajagiri Kalamassery Ernakulam Distt.  Kerala.-683104,0.00
1082,2015-2016,Kerala,052850501,Rajagiri Outreach Service Society,Rajagiri PO.Kalamassery Kochi ErnakulamKerala-683104,2410542.21
1083,2015-2016,Kerala,052950082,Rajiv Youth Foundation,Near GLPSVayaparapadiManjeri676121,0.00
1084,2015-2016,Kerala,052850381,Raksha, CochinKerla-,217215.00
1085,2015-2016,Kerala,052850434,Ramakrishna Math, 682019,0.00
1086,2015-2016,Kerala,052870269,Ramakrishna Math,,161834.00
1087,2015-2016,Kerala,052880116,Ramakrishna Mission Seva Ashram, KozhikodeCalicut - 673 018-,0.00
1088,2015-2016,Kerala,052870009,Rch Diocese Of Changanacherry,Changanacherry Kerala  686 101 -,27961687.64
1089,2015-2016,Kerala,052910242,Regional Cancer Centre Society,Medical College Campus Pb No.241Trivandrum Kerala-,10991152.53
1090,2015-2016,Kerala,052950055,Rehab. Foundation,P.o.box-48 Melakkam Manjeri MalapuramKerala-,50000.00
1091,2015-2016,Kerala,052940078,Relief and Life Society,Nadukani Karippalangadu P.O. Kulamavu IdukkiKerala-685601,0.00
1092,2015-2016,Kerala,052850331,Religious Handmaids Of S H Of Jesus,Snehanilayam KakkanadCochin - 30-,2999073.00
1093,2015-2016,Kerala,052850494,Reparatrix Sisters of the Sacred Heart,Isabella De Rosis Convent Thevarkad Koonammavu VarapuzhaErnakulam Kerala-683517,1690135.00
1094,2015-2016,Kerala,052850559,ROGATIONIST EDUCATIONAL AND CHARITABLE TRUST,ROGATE ASHRAMWEST DESOMALUVAERNAKULAM683102,20436795.00
1095,2015-2016,Kerala,052880006,Roman Catholic Diocese Of Calicut,Bishops House KozhikodeKerala-,19225943.73
1096,2015-2016,Kerala,052980030,Roman Catholic Diocese Of Mananthvdy,Bishop's House Mananthavady P.o.Distt. Wayanad Kerala-670645,27348405.69
1097,2015-2016,Kerala,052830019,Roman Catholic Diocese Of Tellichery,Bishops House Cannanore Kerala-,44575546.47
1098,2015-2016,Kerala,052900333,Rosary Hill Society, ThrissurKerala-,992750.00
1099,2015-2016,Kerala,052880031,Rouzathul Uloom Arabic College Mang.comm,Farook College KozhikodeCalicut - 673 632-,0.00
1100,2015-2016,Kerala,052980141,Rural Agency For Social And Technological Advancement,Kambalakkad P.o. Via- Kalpetta District-  Wayanad  Kerala-673121,296952.00
1101,2015-2016,Kerala,052850132,S H Adoration Province, KalamasseryErnakulam - 683 104-,47235.55
1102,2015-2016,Kerala,052880019,S H Carmelite Conventst Marys Province, Thiruvampady P.o.Kozhikode - 673 603-,0.00
1103,2015-2016,Kerala,052830037,S H Congregation(sacred Heart Congregation),St. Joseph's Province S.h.convent Thondiyil P.o.Peravoor Kannur Kerala.-670678,1021363.34
1104,2015-2016,Kerala,052850277,S H Congregsation,Jyothi Province Kothamangalam`Kerala.-686691,3326361.00
1105,2015-2016,Kerala,052850357,S H Hospital,Arakuzha Muvattupazha ErnakulamKerala-686672,0.00
1106,2015-2016,Kerala,052870230,S H Medical Centre,Nagampadam Kottayam686001-,0.00
1107,2015-2016,Kerala,052870066,S H Monastery,Chethipuzha Kurisummood P.o.changancherryKottayam - 686 104-,9976263.00
1108,2015-2016,Kerala,052980027,S H Region Carmelite Convent,Nadavayal MananthavadyWayanad - 670 721-,0.00
1109,2015-2016,Kerala,052850090,S. H.Provincial House,Rajagiri P.O. KalamasserryEranakulamKerala-683104,3844723.00
1110,2015-2016,Kerala,052850225,S.D.Generalate,Thottumughqam AluvaErnakulam Distt. Kerala.-,11667200.15
1111,2015-2016,Kerala,052900060,S.h Congregation Vimala Province,Pochimattom Parathodu P.o.Kottayam - 686 512-,345032.03
1112,2015-2016,Kerala,052880105,S.h. Congregntionsh Provincial House, Asokapuram P.o.Calicut-,0.00
1113,2015-2016,Kerala,052830138,Sachidanada Prakruthi Kshethram Trust, Pottenpalave P.o.naduvil(via)Kannur 670 582-,34690.00
1114,2015-2016,Kerala,052850018,Sacred  H eart Provincial House,Clarapuram - Aluva Kerala -683101,0.00
1115,2015-2016,Kerala,052850293,Sacred Heart Balanagar, MookkannurErnakulam-,0.00
1116,2015-2016,Kerala,052830017,Sacred Heart Childrens Home, KottiyoorKannur - 670 674-,0.00
1117,2015-2016,Kerala,052900281,Sacred Heart Church, PerincheryTrichur Kerala-,0.00
1118,2015-2016,Kerala,052940051,Sacred Heart Convent,Kulamavu Po IdukkiKerala-685601,0.00
1119,2015-2016,Kerala,052870084,Sacred Heart Conventst Mathews Pro.hous, ChanganacheryKottayam-,365965.00
1120,2015-2016,Kerala,052810029,Sacred Heart General Hospital,Green Gardens CherthalaAlappuzha Kerala-688524,0.00
1121,2015-2016,Kerala,052870136,Sacred Heart Generalate, Manganam P.o.vidyanagarKottayam - 686 018-,95435.00
1122,2015-2016,Kerala,052870154,Sacred Heart Hospital,Chakkampuzha PalaiKerala-,0.00
1123,2015-2016,Kerala,052940042,Sacred Heart Hospital,Paynkulam Mallacompu Po Thodupuzha Idukki Kerala-,14820.00
1124,2015-2016,Kerala,052900071,Sacred Heart Mission Hospital,Pullur Po Irinjalakuda TrichurKerala-680683,0.00
1125,2015-2016,Kerala,052850210,Sacred Heart Monastery,Thevara CochinKerala-,0.00
1126,2015-2016,Kerala,052870091,Sacred Heart Mount Monastery, S.h. Mount P.o.Kottayam - 686 006-,2729723.08
1127,2015-2016,Kerala,052830064,Sacred Heart Of Medical Trust Of St J.P.,Christhu Raj Hospital Nirmalagiri P.o.Kannur 670 701-,0.00
