769,2012-2013,Karnataka,094560014,KGF Don Bosco Society,St. Joseph's Church KGFKarnataka.-,540674.00
770,2012-2013,Karnataka,094570110,KGF Womens Association,Kolar Karnataka -,1240000.00
771,2012-2013,Karnataka,094540023,Khaja Education Society,Rauza Buzurg Gulbarga Karnataka-585104,13162400.00
772,2012-2013,Karnataka,094440026,Khanapur Girls Home Trust,PB No. 5  BelgaumKarnataka-591302,30000.00
773,2012-2013,Karnataka,094421507,KIDNEY CLINICS AND RESEARCH CENTERS INTERNATIONAL,SRI GANESH NIVAS 630 62 CROSS V BLOCK RAJAJINAGARBANGALORE560010,541367.04
774,2012-2013,Karnataka,094420895,Kirubai  Project,675/3 Block 8 Cross1st Stage Hbr Layout BangalaoreKarnataka-560043,7174630.00
775,2012-2013,Karnataka,094570049,KNH Account Siac of Methodist Church in Southern Asia,Mission Compound  KolarKarnataka-563101,0.00
776,2012-2013,Karnataka,094400018,Kolache Pradeshada Parisara Parivathane Mattu Halligala Abhiviruddi Samste,1879/21 1st Main Cross A Block Shekarappa Nagara R M C Link RoadDavanagere577003,0.00
777,2012-2013,Karnataka,094420145,Kollegal Girls Home Trust,5 (3) John Armstrong RoadRichards Town560005,3454793.00
778,2012-2013,Karnataka,094590030,Kollegal Parish Society,St Francis of Assisi Church Kollega Chamarajnagar MysoreKarnataka-571440,0.00
779,2012-2013,Karnataka,094420528,Koramangala Kannada & T.N. Primary School,Koramangala Rajendra Nagar Bangalore Karnataka.-560034,0.00
780,2012-2013,Karnataka,094400002,Koshis Handicapped & Disabled Welfare Educational Association,No.1444/1 9th Cross K. T J NagarDavangere Karnataka-577002,0.00
781,2012-2013,Karnataka,094421085,Kripa Trust,#26 Santosh Nilaya Byreshwara LayoutHennur BandeBangalore Karnataka-560043,9681306.00
782,2012-2013,Karnataka,094590054,Kripalaya Institute of Religious Studies,Bodadi  MysoreKarnataka-570006,2044393.00
783,2012-2013,Karnataka,094620030,Krishi Prayoga Pariwara,Krishinivasa Kuaruvalli Thirthahalli ShimogaKarnataka-577432,0.00
784,2012-2013,Karnataka,094510016,Krist Seva Ashram,Vill Nokya PO Edathora South KodaguKarnataka-571254,0.00
785,2012-2013,Karnataka,094600038,Kruger Foundation for Child Aid,Sri Krishna NivasKARWAR581301,6192600.00
786,2012-2013,Karnataka,094421128,Krupa Kendra Trust,No. 2 1st Cross Sai Layout White Field BangloreKarnataka-560066,470728.10
787,2012-2013,Karnataka,094421420,KRUPA SOCIETY,PEACE HAVEN NO.21 5TH CROSS HUTCHINS ROADBANGALORE560084,2938804.00
788,2012-2013,Karnataka,094590137,Krupalaya Trust,Alanahalli Sidhartha Nagar MysoreKarnataka-,0.00
789,2012-2013,Karnataka,094490044,krupashreemahilamandali r,kalamarahally hulikunte post challakere talukchitradurga dist577501,0.00
790,2012-2013,Karnataka,094640026,Kumadvati Rural Development Society,No.32 Pld Bank Road. K.R Extn. Madhiujri Tumkur Karnataka-572132,0.00
791,2012-2013,Karnataka,094420595,Kutumba,26/5 Heer Chand Layout Cox Town  BangaloreKarnataka.-,1084701.00
792,2012-2013,Karnataka,094421214,L&L Bhagwandas Sirwani Charitable Trust,No.203 Double Road Indiranagar Indiranagar II Stage BangaloreKarnataka-560038,101930.00
793,2012-2013,Karnataka,094590165,La Salette Nikethan Trust,La Salette NiketanMardur village Kasaba Hobli Hunsur Taluk Mysore Karnataka-571105,8010576.00
794,2012-2013,Karnataka,094630124,Lady Hill Society,Lady Hill Convent Ashok Nagar MangaloreKarnataka-575006,6252189.00
795,2012-2013,Karnataka,094421411,Lakshmi Rural Development Society,No 329 MEI Layout Hesaragatta Main Road Bagalagunte Nagasadra PostBangalore560073,0.00
796,2012-2013,Karnataka,094421273,LATTER GLORY MINISTRIES TRUST,No. 98 3rd Cross BDS Layout Dr Shivaramkaranth Nagar Main RoadBangalore560077,0.00
797,2012-2013,Karnataka,094420603,Lavigerie Sola Study House,PB 1 Bommasandra Ind Estate PO BangaloreKarnataka.-562158,22290803.00
798,2012-2013,Karnataka,094450001,Leading Organisation for Rural Development,Sanjay Gandhi Nagar BellaryKarnataka-583104,0.00
799,2012-2013,Karnataka,094440017,Lefayette Hospital,Nipani BelgaumKarnataka-591237,0.00
800,2012-2013,Karnataka,094440114,LEOMEL SOCIETY FOR THE CARE OF THE DYING AND THE DESTITUTE,NO.10 COURT STREET CAMPBELGAUM590001,753624.39
801,2012-2013,Karnataka,094421268,LIFE CHALLENGE TRUST,NO.745LOGOS STREET RAMASWAMY PALYAKAMMANAHALLI MAIN RAODBANGALORE560033,4473594.00
802,2012-2013,Karnataka,094421231,Life for India,No.48Ragavappa Road BangaloreKarnataka-560033,76600.00
803,2012-2013,Karnataka,094421343,LIFE IN JESUS CHRIST PRAYER MISSION TRUST,"CONTONMENT BRANCH
NO 125 INFANTRY ROAD NHEAR MEDINOVA CENTRE BANGALOREBANGALORE560001",0.00
804,2012-2013,Karnataka,094630135,Link  Anti Addiction citizens committee,Sukh Nivas Britto Road Falnir Mangalore Karnataka-575001,0.00
805,2012-2013,Karnataka,094420321,Lions Club of Bangalore West Trust,No.5 Lions Eye Hospital Road(Off. J C Road)Bangalore560002,0.00
806,2012-2013,Karnataka,094600079,LIONS HUMANITARIAN SERVICE TRUST(R),LIONS REVANKAR CHARITABLE EYE HOSPITALVIDYAGIRBUGGON ROADKUMTA 581343KUMTA581343,1809798.00
807,2012-2013,Karnataka,094420320,Littel Sisters of the Poor,15 Hosur Road BangaloreKarnataka-,1150159.00
808,2012-2013,Karnataka,094421059,Little Flower  Service Society,Pushpa Sadan Kengeri Mysore Road BangalaoreKarnataka-560060,3064004.00
809,2012-2013,Karnataka,094480004,Little Flower Church,N.R Pura  Chickmagalur Karnataka-577134,2219697.00
810,2012-2013,Karnataka,094420266,Little Sisters of Jesus Yeshu Ashram,Kammanhalli St Thomas Town BangaloreKarnataka-560084,339355.00
811,2012-2013,Karnataka,094630065,Little Sisters of the Poor,Christu Raj NivasNo.80 Maroli Kulshekar Post Mangalore  Dakshin Kannada Karnataka-575005,205775.00
812,2012-2013,Karnataka,094420262,Little Sisters of the Poor Home for Aged,No.80 Maroki Kuleshekar Mangalore Karnataka-575005,1285478.00
813,2012-2013,Karnataka,094590011,Little Sisters Of The Poor Home For Aged,Mysore Karnataka -,275363.00
814,2012-2013,Karnataka,094421269,Living Hope Association,No.30 S1 Pravirs residency KHB road sultan palayaR.T. Nagar560032,2247639.00
815,2012-2013,Karnataka,094420883,Living Word Outreach,No.30 Krishna Reddy Layoutii Main Iii Crosshoramavu Main RoadBangalore Karnataka-560043,5368.00
816,2012-2013,Karnataka,094630192,LOBO TEACHERS FOUNDATION,DOOR NO. 15-13-785 JOS-VILLA KADRI COCONUT GARDEN ROADMANGALORE575002,0.00
817,2012-2013,Karnataka,094420445,Look Unto Jesus Ministries,No. 180 G Block Sahakar NagarBangalore560092,4991618.00
818,2012-2013,Karnataka,094600076,LOSELING ALTRUISTIC MEDICAL ASSOCIATION,LAMA CAMP NO II TIBETAN COLONYTATTIHALLI MUNDGOD581411,28311325.00
819,2012-2013,Karnataka,094540014,Lou Ann Long Methodist Girls Hostel, GulbargaKarnataka-,448904.15
820,2012-2013,Karnataka,094620003,Lourd Matha Church,Nagavally Kargal Shimoga Karnataka-577421,114290.42
821,2012-2013,Karnataka,094421132,Lovedale Foundation,No.91 1st Cross Nanjappa Gardens Kalyan Nagar P.O. BangaloreKarnataka-560043,1880445.00
822,2012-2013,Karnataka,094460008,Lucile Colony Girsls,Hostel      Bidar Karnataa -,791616.00
823,2012-2013,Karnataka,094590205,M A A TRUST,PLATINUM JUBILEE AUDITORIUM        J K GROUNDSMYSORE570001,106611.00
824,2012-2013,Karnataka,094420982,M/s Imdad-E-Nisa Trust,No.32 Coles Road Frazer Town  BangaloreKarnataka-560005,510720.00
825,2012-2013,Karnataka,094421314,MABEN INTERNATIONAL FOUNDATION,No 65 1st Cross BDS Gardens Geddalahalli Kothanur P OBangalore560077,67250.00
826,2012-2013,Karnataka,094620036,Madeenath-Ul-Uloom Education Trust,Shikaripur JayanagarPO No.6 Shikaripur ShimogaKarnataka-577427,133391624.77
827,2012-2013,Karnataka,094420941,Mahabodhi  Maitri Mandala,14Kalidasa Road  Gandhinagar Bangalore Karnataka-560009,50195003.00
828,2012-2013,Karnataka,094630097,Mahatama Gandhi Memorial College Trust,Udupi Dakshin KannadaKarnataka-576102,53709.00
829,2012-2013,Karnataka,094640086,Mahathma Gandhi Rural Development And Youth Welfare Centre,Gowri Nilaya 2nd Floor 8th Cross Ashok Nagar TumkurTumkur572103,0.00
830,2012-2013,Karnataka,094440075,Mahila Abhivruddhi Mattu Samrakshana Samasthe,House No.480 patel Building Ghataprabha BelgaumKarnataka-591306,3192614.42
831,2012-2013,Karnataka,094420898,MAHILA DAKSHATA SAMITI KARNATAKA,CA4 BEL HBCS Layout 1st Block 1st Main 13th CrossVidyaranyapura560097,434290.70
832,2012-2013,Karnataka,094420804,Mahila Seva Samaja,No.80 KR Road Bangalore.Karnataka-,5743993.00
833,2012-2013,Karnataka,094630126,Maithri Trust,Maithrihomenityanand NgDerlakatta   Mangalore Dakshin KannaraKarnataka-,0.00
834,2012-2013,Karnataka,094421333,Makkala Jagriti,30/1 8th Main Road MalleswaramBangalore560003,4063058.00
835,2012-2013,Karnataka,094620043,Malanad Social Service Society,Yojana Mandir Jubilee Nagar Godikoppa ShimogaKarnataka-577204,6565388.87
836,2012-2013,Karnataka,094580001,Malavalli Boys Home Trust,PB 2 Boys Home Malavalli 7(4) John Armstrong RoadBangalore Karnataka-560005,1079960.56
837,2012-2013,Karnataka,094600060,Malenadu Education and Rural Development Society,Golikoppa. PO: Arasapur TQ. Sirsi Uttara KannadaKarnataka-581402,4.00
838,2012-2013,Karnataka,094420773,Mamatha Makkala Mandira,2 BDA Rd Muneswara Temple Rd  Nagarabhai 1st Phase Bangalore.Karnataka-,0.00
839,2012-2013,Karnataka,094420845,Manasa Centre for Development and Social Action,"MANASA Centre for Development and Social Action
 No.35 Anjanappa Complex Hennur Main Road
 Lingarajapuram St. Thomas Town.Bangalore560084",9153970.34
840,2012-2013,Karnataka,094630151,Manasa Rehabilitation and Training Centre,Pamboor Padubelle UduppiKarnataka.-,280765.89
841,2012-2013,Karnataka,094421227,Manav charities,Rajendra 66 Kamagondanahalli Jalahalli West BangaloreKarnataka-560015,0.00
842,2012-2013,Karnataka,094630178,Mandd Sobhann,Kalaangann Makale Shaktinagar Mangalore Dakshina KannadaKarnataka-575016,0.00
843,2012-2013,Karnataka,094630086,Mangala Sewa Samithi,Balalsamrakshana Kendra Mangalore  Dakshin KannadaKarnataka-574159,58213.00
844,2012-2013,Karnataka,094630114,Mangalore Province of Congregation Sisters,St Raymonds Convent Vamanjur Mangalore Dakshina Kannada Karnataka-,1445000.00
845,2012-2013,Karnataka,094630073,Mangla Jyothi Integrated School,Mangalore Dakshina KannaraKarnataka-,4179327.19
846,2012-2013,Karnataka,094630148,Manipal Academy of Higher Education,University Building Madhav Nagar Manipal  UdupiKarnataka-,22465727.71
847,2012-2013,Karnataka,094690014,MANIPAL FOUNDATION,UNIVERSITY BUILDING MADHAV NAGARMANIPAL576104,11441765.53
848,2012-2013,Karnataka,094420598,Manush,NO 160 AMULYA FARMKYALASANAHALLI KOTHANUR POSTBangalore560077,4505267.00
849,2012-2013,Karnataka,094600075,MANUVIKASA,KARJAGI  PO BALUR SIDDAPUR TALUK UTTAR KANNADA DISTRICTSIDDAPUR581340,1202086.00
850,2012-2013,Karnataka,094420892,Maranatha Theological And Educational Trust,SakalavarapostBannerghatta Road,3645921.82
851,2012-2013,Karnataka,094540084,Margadarshi Society,"Plot No. 100/A Siddeshswar Nilaya 
Opp: Jai Bheem Auto Stand Ghatage Layout Road
CIB Colony Shakti NagarGULBARGA585103",0.00
852,2012-2013,Karnataka,094420709,Margdarshi The Association for Physically Challenged,47/1 Hulkul ComplexLalbagh Road560027,48064.00
853,2012-2013,Karnataka,094420992,Maria Kriipalaya Trust,Via Halengai Pakshikere Thokur PO Mangalore Karnataka-574146,2787297.00
854,2012-2013,Karnataka,094630118,Maria Kripa Society,Girls Centre Madanthyar  Dakshin KannadaKarnataka-574224,7561100.00
855,2012-2013,Karnataka,094630198,MARIA MANDIR TRUST,D.M.CONVENTKADABA574221,172553.00
856,2012-2013,Karnataka,094420307,Maria Niketan St Mary's Orphanage,2nd Cross Da Costa Layout St.Thomas Town Bangalore Karnataka-,379717.00
857,2012-2013,Karnataka,094620028,Maria Social Service Society,St.mary's Malankara Church Vinobanagara1st StageShimoga  Karnataka-577204,4950642.00
858,2012-2013,Karnataka,094630011,Marialayam Social Centre,Noojibathila  Dakshin KannaraKarnataka-,55000.00
859,2012-2013,Karnataka,094420463,Marianist Trust,P.B. 2549 No. 15 Curlee Street Richmond Town BangaloreKarnataka-560025,40077720.26
860,2012-2013,Karnataka,094420387,Marilac Study House,PO S.O S Bannerghatta Road Bangalore Karnataka-560076,1006901.00
861,2012-2013,Karnataka,094400023,MARSS-K (Organisation for Social Development),Training Research and Evaluation Centre #Regional Office 2nd Floor Bongale Drug House Building SH Main Road Harihar577601,0.00
862,2012-2013,Karnataka,094590037,Martahalli Parish Society,Marthahalli MysoreKarnataka-,549325.00
863,2012-2013,Karnataka,094570241,Matha educational Trust,Konehalli village somayajila halli post Srinivasapura talukSrinivasapura563135,0.00
864,2012-2013,Karnataka,094420506,Mathew Memorial Society,122 Laxmana Murthy Nagar P.O Ramamurthy Nagar BangaloreKarnataka.-560016,0.00
865,2012-2013,Karnataka,094421105,MATHRU EDUCATIONAL TRUST FOR THE BLIND,CA SITE #14 6TH A CROSS 5TH PHASE NEW TOWN YELAHANKA BANGALOREBANGALORE560106,1647729.00
866,2012-2013,Karnataka,094420522,Medical Mission Secular Institute,NO.7 Spencer Road BangaloreKarnataka-560005,308954.00
867,2012-2013,Karnataka,094420253,Medico Pastoral Association,47 Pottery Road Fraser Town BangaloreKarnataka.-560005,285673.00
868,2012-2013,Karnataka,094420911,Meenakshi Roof Over Roofless Trust,G-6emeraldwilson Manor Apartments 13th Crosswilson GardenBangalore Karnataka-560027,1436995.00
869,2012-2013,Karnataka,094510026,Mercana Parish Society,St. Michael's Church Madikeri Kodagu Karnataka-512001,0.00
870,2012-2013,Karnataka,094421354,Mercy Foundation Trust,No.131 12th Main Bandepalya  Garvebhavi palya  Hosur main RoadBangalore560068,0.00
871,2012-2013,Karnataka,094460004,Methodist Boys Hostel, Bidar Karnataka-585401,821469.00
872,2012-2013,Karnataka,094570039,Methodist Girls  Hostel, Kolar Karnataka-563101,0.00
873,2012-2013,Karnataka,094570013,Methodist Girls Composite Junior College,Kolar Karnataka -,0.00
874,2012-2013,Karnataka,094570014,Methodist Girls Composite Junior College,Kolar Town KolarKarnataka-563101,17378.57
875,2012-2013,Karnataka,094610001,Methodist Girls Hostel,Mission Compound Raichur Karnataka-584101,766883.00
876,2012-2013,Karnataka,094570040,Methodist Girls Hostel World Child Fund,Methodist Girls Composite Jnr Colg KolarKarnataka-563101,167961.00
877,2012-2013,Karnataka,094570042,Methodist Girls Tech Hostel,Kolar Dt. K.k. -,0.00
878,2012-2013,Karnataka,094630044,Milagers Church,Hampankatta Milgres Mangalore Dakshin KannadaKarnataka-575001,0.00
879,2012-2013,Karnataka,094630016,Milagers Housing Society,Milgres Church Mangalore  Dakshin KannadaKarnataka-575001,0.00
880,2012-2013,Karnataka,094590115,Mira Aditi Centre,Sarasatipuram62 Ist Cross 4th Stage Mysore Karnataka-570009,2301489.00
881,2012-2013,Karnataka,094570232,MIRACULOUS VICTORY MINISTRY TRUST,Eaden Garden  Chigirapura village  Kammasandra Post via Oorgaumpet post Bethamangala Hobli Bangarapet Taluk  Kolar Dist  KarnatakaBethamangala563116,0.00
882,2012-2013,Karnataka,094480038,MISSION ONE MILLION,EMMANUEL CHILDRENS HOME HOSEMANE RANGANA HALLITARIKERI577144,1119532.43
883,2012-2013,Karnataka,094420754,Mithra Foundation,290/7 Venkataramiah Lay Out Ramamurthy Nagar Road BangaloreKarnataka-,2784742.00
884,2012-2013,Karnataka,094420627,Mithra Jyothi,CA Site No. P-22 18th Cross 31st Main Sector-1 HSR LayoutBehind NIFT College560102,30887927.00
885,2012-2013,Karnataka,094580030,Mob Rural Health Centre,Room No.15 Govt. General Hospital MandyaKarnataka-571401,3395527.00
886,2012-2013,Karnataka,094420682,Mobility India,A.P.H. Campus Hennur Road St. Thomas Town BangaloreKarnataka-560084,41251813.88
887,2012-2013,Karnataka,094590092,Monstary of St. Joseph and Teresa,Bogadi MysoreKarnataka-570006,13162.00
888,2012-2013,Karnataka,094420295,Montfort Cottege Society,O.C.D. Madras Rd Indira Nagar BangaloreKarnataka-560038,0.00
889,2012-2013,Karnataka,094420223,Montfort Fathers Society,Mariya Bhavan Dharmaram College  BangaloreKarnataka-560024,14571951.00
890,2012-2013,Karnataka,094420132,Montfort Sisters,13 (old5/10) 7th Cross B. Street Jayabharat Nagar Banasvadi RoadBangalore Karnataka.-560033,2834757.00
891,2012-2013,Karnataka,094420641,Montfortian Society,109 Charles Campbeli Rd Cox Town BangaloreKarnataka-560005,34120784.00
892,2012-2013,Karnataka,094420290,Moria Seva Sangha,No.12 Rest House Road Bangalore Karnataka-560001,424602.00
893,2012-2013,Karnataka,094421144,Mother of Good Health Educational Society,Halagevaderahally BEML Layout Rajarajeshwari Nagar BangaloreKarnataka-560098,4939700.00
894,2012-2013,Karnataka,094421154,Mother Tekla Charitable Trust,No.10 Brunton Road BangaloreKarnataka-560025,797825.00
895,2012-2013,Karnataka,094630174,Mother Teresa Memorial Education Trust,Mission compound Balmatta Mangalore Dakshina KannadaKarnataka-575002,5751447.00
896,2012-2013,Karnataka,094450043,MOTHER THERESA RURAL DEVELOPMENT TRUST (R),Plot No.82/2-B 22 nd ward B.J. Extension Lal Bahaddur Shstri Nagar Near Balliza HostelBellaryRoad Anthasayana Gudi(post) Hospet583201,0.00
897,2012-2013,Karnataka,094570186,Mount Carmel Mission School,Kamalapura Thondebhavi Gouribidanur Taluk Kolar Dist.Karnataka-561213,53360.00
898,2012-2013,Karnataka,094630078,Mount Rosary Charitable Institutions,Alamgar Moodbidri Dakshin KannaraKarnataka-,10431353.00
899,2012-2013,Karnataka,094420077,Movement For a Better World,NO.31Madras S. Officer's Colony Banaswadi RoadBangalore Karnataka.-560033,312334.00
900,2012-2013,Karnataka,094420654,Movement for Alternatives and Youth Awareness (MAYA),25/1-4 9th Cross J.P. Nagar2nd Phase560078,20433703.00
901,2012-2013,Karnataka,094570038,Mthodist Girls Vocational School,Kolar Karnataka -,0.00
902,2012-2013,Karnataka,094590068,Muddanahalli Parish Society,St. James Church PO KM MysoreKarnataka-570005,1500961.00
903,2012-2013,Karnataka,094600052,Muktha Youth Women and Child Welfare Trust,Prabath Nagar Honnavar Uttara KannadaKarnataka-581334,6361381.70
904,2012-2013,Karnataka,094640056,Multipurpose Organisation for Training Health Education and Rehabitation,MOTHER Campus Near Koladappaleshwara Temple II Stage MadhavanagaraSira572137,0.00
905,2012-2013,Karnataka,094421187,Munnarakkunnu Trust,545 Banagiri Nagar Banashankari 3rd StageBangalore Karnataka-560085,3519494.94
906,2012-2013,Karnataka,094590215,Myrada Kaveri Pradeshika Samsthe,Sargur Road HandpostH D Kote Taluk571114,8546026.00
907,2012-2013,Karnataka,094590001,Mysore Diocesan  Society,Bishop's House BN RoadMysore Karnataka-570001,25471381.95
908,2012-2013,Karnataka,094590121,Mysore Don Bosco Society,Parsianahundi Mananthawadi Road Mysore Karnataka-578008,8082600.00
909,2012-2013,Karnataka,094590122,Mysore Notre Dame  Sisters Society,9 IVth Main Jayalakshmipuram Mysore Karnataka-570012,0.00
910,2012-2013,Karnataka,094590181,Mysore Pallottine Educational Research and Development Society,Pallottiaram Kalwadi Gate Post= Rayanakere Distt.=MysoreKarnataka-570008,5939754.00
911,2012-2013,Karnataka,094420566,Mythri Sarva Seva Samithi,1300 D 1st Cross 1st Main HAL 3rd Stage New ThippasandraBangalore Karnataka.-560075,11984236.00
912,2012-2013,Karnataka,094420725,N.M Academy,National First Grade College Bhoopasandra 2nd Cross HebbalBangalore  Karnataka-560094,5714557.34
913,2012-2013,Karnataka,094590041,Naganahalli Parish Society,Sacred Heart Church HD Kote Mysore  Karnataka.-,0.00
914,2012-2013,Karnataka,094630133,Nagarika Seva Trust,Guruvayanakere  Dakshin Kannada Karnataka.-574217,0.00
915,2012-2013,Karnataka,094421278,Narayana Hrudayalaya Foundation,12th Floor SN Towers No.25/2 MG Road BangaloreBangalore560001,6282756.00
916,2012-2013,Karnataka,094421406,Narayana Nethralaya Foundation,121/c Chord Road Rajajinagar I R  Block BangaloreBangalore560010,1050499.00
917,2012-2013,Karnataka,094640053,Narendra Foundation Siddapura,Pavagada Taluk TumkurKarnataka-572141,35040.00
918,2012-2013,Karnataka,094540083,National Banjara Education Society Gulbarga,1st Floor Chikana Shaith Building Shivanagar Aland RoadGulbarga585101,0.00
919,2012-2013,Karnataka,094420018,National Biblical Catechetical and Liturgical Centre,Post Bag No-8426 Hutchins Road2nd Cross560084,918582.00
920,2012-2013,Karnataka,094420369,National Education Society of Karnataka,Basavanagodi BangaloreKarnataka-,0.00
921,2012-2013,Karnataka,094421485,NATIONAL ENTREPRENEURSHIP NETWORK,Tower-3 Sixth Floor SJR-I Park EPIP Zone-1 Hoodi Village Krishnarajapurahobli Whitefield RoadBangalore560066,52126021.00
922,2012-2013,Karnataka,094420614,National Institute of Advanced Studies,Indian Institue of Science Campus BangaloreKarnataka-560012,6780644.00
923,2012-2013,Karnataka,094420643,National Law School of India University,Nagurbhavi BangaloreKarnataka.-560072,13837284.60
924,2012-2013,Karnataka,094590169,Nature Conservation Foundation,1311 Amritha 12th A Main VIjayanagar 1st StageMysore570017,24166372.13
925,2012-2013,Karnataka,094420832,Nava Chetana,No.F 3 Villa Ranka Colony Bilekahalli Bannerghatta RoadBangalore560076,0.00
926,2012-2013,Karnataka,094480027,Nava Jeevan Charitable Society,Nava Jeevan Seva Kendra Kodi Camp Tarikere ChikmagalurKarnataka-577228,2668396.00
927,2012-2013,Karnataka,094450035,Nava Jeevana Rehabilitation Centre for the Disabled,"""Cluny Convent"" Cantonment BellaryKarnataka-583104",382227.00
928,2012-2013,Karnataka,094421297,NAVA KARNATAKA SOCIAL SERVICE TRUST,130 Thangamalai Nagar Vinayaka Tent D.J.Halli BangaloreBangalore560045,0.00
929,2012-2013,Karnataka,094421441,NAVA SPOORTHI KENDRA TRUST,COOKSON ROAD THOMAS TOWN P.O LIGUORI BHAVAN NO.8 JOHN ARMSTRONG ROADBANGALORE560084,0.00
930,2012-2013,Karnataka,094670010,NAVACHETANA FOUNDATION,POONA BANGALORE ROAD SHIRUR COMPLEXHAVERI581110,0.00
931,2012-2013,Karnataka,094610039,Navajeevana Grameena Abhivriddhi Samsthe,Begumpur PetMudgal Lingasagur taluka584125,0.00
932,2012-2013,Karnataka,094590198,NAVAJYOTHI TRUST,PRESENTATION VIDHYA BHAVAN SHIVAJI MAIN ROAD N.R.MOHALLAMYSORE570007,8455212.00
933,2012-2013,Karnataka,094460018,Navjeevan Community Development Society,Golekhana  BidarKarnataka -,19396457.00
934,2012-2013,Karnataka,094670004,Navodaya Educational and Environment Development Service(NEEDS),Mali Compound Shivabasava nagar HaveriKarnataka-581110,328774.00
935,2012-2013,Karnataka,094360003,Navodaya Mahila Abhivruddi Swayam Sewa Samsthe,C/os.t.angadi Buildinghousing Colony BagalkotKarnataka-587101,0.00
936,2012-2013,Karnataka,094421428,NAVODAYA TRUST,No 192  Amarta Nagar  2nd cross  4th main  Choodasandra Road  3 rd Phase Amarthanagar  KasavanaHalli Huskur postBANGALORE560099,0.00
937,2012-2013,Karnataka,094421498,Navya Disha,avalahalli anjanapura post jpnagar 9th phaseBangalore560062,2290912.00
938,2012-2013,Karnataka,094421397,NAYANA FOUNDATION,No.78 3rd Main Road HebbalBangalore560024,0.00
939,2012-2013,Karnataka,094570027,Neel Bagh Trust,Vikasana Doddakallasandra BangaloreKarnataka-560052,212989.00
940,2012-2013,Karnataka,094420963,Neerekshe,25laxmipathy Layoutkariyanpalaya  Lingarajapuram BangalaoreKarnataka-560084,2699319.10
941,2012-2013,Karnataka,094421463,NELINDCO FOUNDATION,No.5 33rd Cross 4th T Block JayanagarBangalore560041,122209.00
942,2012-2013,Karnataka,094440115,Neravu Society,Ap Channammana Kitturu  Ta  Bailhongal  Dist  Belgaum Karnataka StateBelgaum591115,0.00
943,2012-2013,Karnataka,094420082,Nettur Technical Training Foundation,23/24 II Phase Peenya Industrial Area560058,0.00
944,2012-2013,Karnataka,094421096,New Ark Mission of India,Home of Hope Byrathi Bende Hennur Bangaore Main Road Kannur postBangalore562149,14886165.65
945,2012-2013,Karnataka,094670005,New Creation Gospel Ministries Society,PO Box No.2 Hanagal HaveriKarnataka-581104,79684.00
946,2012-2013,Karnataka,094450026,New Creation Ministries,No.64Jayanagar Cantonment BellaryKarnataka-583104,2676199.71
947,2012-2013,Karnataka,094420798,New Entity for Social Action,93/2Charles Campbell Rd Cox Town BangaloreKarnataka.-,175000.00
948,2012-2013,Karnataka,094421126,New Horizen Trust for the Disabled,170 -1 Behind Surya BakeryCSI Colony Road Kothanur560070,1199163.00
949,2012-2013,Karnataka,094420616,New Life Fellowship Trust,84/3 3rd Floor UCF CentreHennur Main Road Lingrajpuram560084,3080404.01
950,2012-2013,Karnataka,094570181,New Life Peace Foundation,3 Station BlockNear Coromandel Rl Stn. K.G.F.563 118 Kolar DistrictCoromandel Post Karnataka-563118,0.00
951,2012-2013,Karnataka,094420608,Newlife Computer Institute,Logos Centre Horamavu AgaraHennur Road560043,19966918.00
952,2012-2013,Karnataka,094421025,Nightingales Medical Trust,3351st Block R.T. Nagar Main Road BangaloreKarnataka-560032,427185.95
953,2012-2013,Karnataka,094421511,NIRIKSHEA CHARITABLE TRUST,"No. 1 1st Floor 2nd B Main 
OMBR Layout ChikkabanaswadiBENGALURU560043",481136.85
954,2012-2013,Karnataka,094590145,Nisarga Foundation,Shivaji Road H.D.Kote H.D.Kote TalukMysore Karnataka-571114,2935000.00
955,2012-2013,Karnataka,094600072,Nisarga Trust( R ) SIRSI,NadigalliSirsiNorth Kanara(Uttara Kannada)SIRSI581401,0.00
956,2012-2013,Karnataka,094630087,NITTE Education Trust,7th Floor Rambhavan Complex Kodialbail MangaloreKarnataka-575003,46202764.00
957,2012-2013,Karnataka,094570227,Niveditha Gramabhivruddi Sangha,#56Varalakshmi NilayaKambadhalliMelur PostSidlaghatta Taluk.Chickballapur District.562102,0.00
958,2012-2013,Karnataka,094570244,Noble Mother Theresa educational and charitable trust,Bullens complex Nest to Saravana Gas  Oorgaum Post KGFKOLAR GOLD FIELDS563120,0.00
959,2012-2013,Karnataka,094460059,Noor Education Trust,Noor Colony Hyderabad RoadBidar585401,0.00
960,2012-2013,Karnataka,094420422,Norbertime Father's,Norbert Bhawan Doddagubi Bangalore Karnataka-562134,46518154.00
961,2012-2013,Karnataka,094480037,NORBERTINE FATHERS,ST.NORBERT NILAYA SIMSEN.R.PURA577134,2915531.00
962,2012-2013,Karnataka,094600039,North Karnataka Jesuit Educational & Charitable Society,St. Rita Church Mundgod Uttara Kannada DistKarnataka-581349,14102637.92
963,2012-2013,Karnataka,094420956,Novo Nordisk Education Foundation,32 47-50 EPIP Area WhitefieldBangalore560066,98331183.00
964,2012-2013,Karnataka,094421004,NU Trust,Chinmaya Apartments No.1  Puttanna Road BasavanagudiBangalore Karnataka-560004,0.00
