S.No,Year,State,Registration No,Association name,Address,Amount of FC Received
1,2014-2015,Arunachal Pradesh,310540005,Abotani Ashram Welfare Association,Naharlagun  Arunachal Pradesh -791110,0.00
2,2014-2015,Arunachal Pradesh,310570004,AGENCY FOR CULTURE HUMAN RESOURCES AND ENVIRONMENT DEVELOPMENT( A C H R E D),C/o Literature CentreKhonsa786630,0.00
3,2014-2015,Arunachal Pradesh,310570002,ALOMBRO MAYU YAKU CHI AMEY AROGA AMYAA,mayu II RoingLower Dibang Valley792110,0.00
4,2014-2015,Arunachal Pradesh,310540042,ARUNACHAL GRACE OF GREEN SOCIETY,D N Road Po RK Mission Vivek Vihar ItanagarItanagar791113,0.00
5,2014-2015,Arunachal Pradesh,310570006,Arunachal Orphan Care Society,Namphuk Nalla PO-Kharsang Dist-ChanglangMiao792122,0.00
6,2014-2015,Arunachal Pradesh,310560008,BOUM KAKIR MISSION,BRIDGE POINT CHIMPUITANAGAR791113,0.00
7,2014-2015,Arunachal Pradesh,310540034,Catholic Church Welfare Society,Naharlagun Papum Pare Arunachal Pradesh -791110,6689012.00
8,2014-2015,Arunachal Pradesh,310580004,CHAYANG MISSION,CHAYAANG TAJOEAST KAMENG790102,0.00
9,2014-2015,Arunachal Pradesh,310560006,DIOCESE OF ITANAGAR,Bishops House MOWB IIItanagar Papum Pare791111,19912305.00
10,2014-2015,Arunachal Pradesh,310570007,DIOCESE OF MIAO,BISHOPS HOUSEMIAO CHANGLANG792122,28512147.32
11,2014-2015,Arunachal Pradesh,310610002,Essomi Foundation,Enzengo Roing Lower Dibang ValleyArunachal Pradesh-792110,0.00
12,2014-2015,Arunachal Pradesh,310540007,Future Generation,Vivek BuildingVivek Vihar H-Sector ItanagarPapumparaArunachal Pradesh-791113,1808463.00
13,2014-2015,Arunachal Pradesh,310590003,Indigenous Mission,Dumporijo Box-1 PO Daporijo Upper SubansiriArunachal Pradesh-791122,0.00
14,2014-2015,Arunachal Pradesh,310560005,ITANAGAR DIOCESAN EMPOWERMENT ASSOCIATION (IDEA),Bishops House MOWB IIItanagar Papum Pare791111,0.00
15,2014-2015,Arunachal Pradesh,310580001,Kameng Social Service Society,St. Joseph's School / St Joseph's Hospital New SeppaEast Kameng (Arunachal Pradesh)-791102,1690008.00
16,2014-2015,Arunachal Pradesh,310580006,Kameng Welfare Society,YangseyNaharlagun790102,0.00
17,2014-2015,Arunachal Pradesh,310590005,Kasturba Welfare Society,P.o-TalihaUpper Subansiri791122,0.00
18,2014-2015,Arunachal Pradesh,310540024,Mangyanam (Hope) Arunachal Pradesh,Don Bosco Centre Tigodo Village Yupia Papum Pare DistrictArunachal Pradesh-791110,9770594.00
19,2014-2015,Arunachal Pradesh,310540032,Manjushree Charitable Society,Manjushree Vidyapeeth Orphanage Tashi Jong TawangArunachal Pradesh-790104,88066822.00
20,2014-2015,Arunachal Pradesh,310540039,MEDO WELFARE SOCIETY,YM Building Near State Library E-SectorItanagar791111,0.00
21,2014-2015,Arunachal Pradesh,310530004,MON PAPLUNG JANGCHU CHOEKORLING KAGYU SOCIETY,JANG PO JANG PSTAWANG790105,2844985.00
22,2014-2015,Arunachal Pradesh,310540012,Nani Sala Foundation,Arunachal Front Building Post Box N0.202NaharlagunPapumpare Aarunachal Pradesh-791110,0.00
23,2014-2015,Arunachal Pradesh,310570003,New Era Society,Namphainong HBCA Mission Centre PO-Namphai-I Distt- ChanglangMiao792122,1691513.00
24,2014-2015,Arunachal Pradesh,310570005,NEWMAN EDUCATIONAL SOCIETY,NEOTAN VILLAGEMIAO CHANGLANG792122,9134562.40
25,2014-2015,Arunachal Pradesh,310540031,Nyishi Baptist Church Council,Model Village Naharlagun PapumpareArunchal Pradesh-791111,5883117.00
26,2014-2015,Arunachal Pradesh,310540002,Oju Welfare Association,Naharlagun  Arunachal Pradesh-,0.00
27,2014-2015,Arunachal Pradesh,310600003,PEMA MANI CHARITABLE TRUST,NYINGMA GONPATUTING792061,8778000.00
28,2014-2015,Arunachal Pradesh,310540010,R.K. Mossang Memorial Society,P.O. Jairampur ChanglangArunachal Pradesh-792121,0.00
29,2014-2015,Arunachal Pradesh,310550001,Ramakrishna Mission, Vivek NagarWest Siang -791001,547171.00
30,2014-2015,Arunachal Pradesh,310570001,Ramakrishna Mission, Narottam NagarTirap-786629,0.00
31,2014-2015,Arunachal Pradesh,310540003,Ramakrishna Mission Hospital,RamaKrishna Mission Hospital P.O ItanagarArunachal Pradesh.-791113,4425395.00
32,2014-2015,Arunachal Pradesh,310550003,SAINT FRANCIS DE SALES COLLEGE SOCIETY,S.F.S. COLLEGEAALO791001,645372.00
33,2014-2015,Arunachal Pradesh,310540018,Salesians of Don Bosco,Don Bosco Jully Itanagar PapumpareArunachal Pradesh-791111,1917000.00
34,2014-2015,Arunachal Pradesh,310540004,SEVA KENDRA ARUNACHAL EAST, Borduria TirapArunachal Pradesh-786630,4810177.68
35,2014-2015,Arunachal Pradesh,310560001,Subansiri Kristu Kiran Society, 791120,5649736.00
36,2014-2015,Arunachal Pradesh,310560007,TAJE MEMORIAL MULTIPURPOSE SOCIETY,GOHPUR TINALIITANAGAR791111,0.00
37,2014-2015,Arunachal Pradesh,020750007,Tangsa Baptist Churches Association,P.O. Jagun TinsukiaAssam-792122,4252657.00
38,2014-2015,Arunachal Pradesh,310540043,Tarhuk Samaj,Village Kopila Post Office Damin District Kurung KumeyDamin791118,0.00
39,2014-2015,Arunachal Pradesh,310540001,Tibetan Multipurpose Cooperative Society,P.O.Tindglong  Dist. Lohit Arunachal Pradesh-,2020088.00
