S.No,Year,State,Registration No,Association name,Address,Amount of FC Received
1,2014-2015,Jammu & Kashmir,152750032,AGAPE KASHMIR TRUST,SAVERA Opposite B ED College Pornibal Shivpura Batwara PostSrinagar190004,67585.83
2,2014-2015,Jammu & Kashmir,152710061,ALL LADAKH GONPA ASSOCIATION,GONPA COMPLEX-LEHLEH194101,0.00
3,2014-2015,Jammu & Kashmir,152710030,All Ladakh Social Welfare Society,Housing Colony Group B/H.No. 167 LehJ & K-194101,0.00
4,2014-2015,Jammu & Kashmir,152670037,BHARTIYA LOK SANGEET KALA SANSTHAN,4-124 Old SBI Lane Pamposh Colony JanipurJammu180007,0.00
5,2014-2015,Jammu & Kashmir,152680015,Border Area Development Organization Kargil,Akwoou Corpleu Main Rood Poyen KargilPoyen194103,11122534.00
6,2014-2015,Jammu & Kashmir,152750004,Catholic Social Service Society,Seva Niketan Kunjwani Bye Pass JammuJammu & Kashmir-,60885896.08
7,2014-2015,Jammu & Kashmir,152710036,Centre for Sustainable Development and Food Security in Ladakh,PO Box No.53 Serdung House Chubi-Leh Ladakh(Jammu and Kashmir)-194101,6063161.00
8,2014-2015,Jammu & Kashmir,152750028,CHILD NURTURE AND REIELF KASHMIR CHINAR Kashmir,Guru Lane Opposite Ply Emporium Barzulla SrinagarSrinagar190005,7370191.00
9,2014-2015,Jammu & Kashmir,152710018,Child Welfare Society,P.B.No. 135 Leh LadakhJammu & Kashmir-194101,21447.00
10,2014-2015,Jammu & Kashmir,152710014,Chumur Cultural And Welfare Society,Chumur Gompa  C/o Hotel Lingzi East Leh - LadakhJammu & Kashmir-194101,10304728.00
11,2014-2015,Jammu & Kashmir,152670024,CMI Service Society,Yesupal Ashram 7A Sector 4 Extn Trikutanagar JammuJammu and Kashmir-180012,1297250.00
12,2014-2015,Jammu & Kashmir,152750003,Dar-Ul- Fazl Childrens Home,P.O Box 54 Manali Dist: KulluHimachal Pradesh -175131,16458839.40
13,2014-2015,Jammu & Kashmir,152670008,Diocese of Jammu - Srinagar St. Mary's Church, Jammu CanttJammu & Kashmir-,18144726.50
14,2014-2015,Jammu & Kashmir,152710032,Drigung Dharma Foundation,Phyang District LehJammu and Kashmir-194101,0.00
15,2014-2015,Jammu & Kashmir,152710045,Drikung Kagyu Cultural and Welfare Society,Gaon GonpaPheyang194101,7221823.00
16,2014-2015,Jammu & Kashmir,152710054,Druk Pema Karpo Educational Society,Hemis ComplexLeh194101,15021263.26
17,2014-2015,Jammu & Kashmir,152760001,Emmanuel Mission Hostel, RamnagarJ&K-182122,282499.09
18,2014-2015,Jammu & Kashmir,152750023,Global Green Peace,15/1 Poloview SrinagarJammu and Kashmir-190001,0.00
19,2014-2015,Jammu & Kashmir,152750036,GREEN WORLD WELFARE SOCIETY,Nowhatta Haka BazarSrinagar190002,0.00
20,2014-2015,Jammu & Kashmir,152710031,Gyudzin Tantric Monastery (Phey),Phey PO Box No. 85 Leh Ladakh DistrictJammu and Kashmir-194101,4086266.00
21,2014-2015,Jammu & Kashmir,152760010,HARE KRISHNA FOOD FOR LIFE,SRILA PRABHUPADA ASHRAMUDHAMPUR182101,1046390.00
22,2014-2015,Jammu & Kashmir,152750014,Help Foundation,16-A Gogji Bagh Srinagar(Kashmir)Jammu &  Kashmir-190008,12991371.85
23,2014-2015,Jammu & Kashmir,152740004,Himalayan Voice,Ward No.7 RajouriJammu and Kashmir-185131,0.00
24,2014-2015,Jammu & Kashmir,152710022,His Holiness The Cyalwa Karumpu Welfare Society,P.o Box No.81 CPO Leh LadakhJ&K-,3052723.00
25,2014-2015,Jammu & Kashmir,152610003,Human Welfare Foundation,310 Room No. Lone Building K.P. RoadAnantnag192101,10566962.00
26,2014-2015,Jammu & Kashmir,152750031,Human Welfare Organisation,H. No. 171 Balgarden Nursingh Garh Karan-Nagar Srinagar-190009(J and K)Srinagar190009,0.00
27,2014-2015,Jammu & Kashmir,152750037,Human Welfare Voluntary Organisation,427-1/D GOVT HOUSING COLOY BEMINASRINAGAR190010,1755609.00
28,2014-2015,Jammu & Kashmir,152610005,HUMANITY WELFARE ORGANIZATION HELP LINE,National Highway Road BijbeharaAnantnag192124,1664371.00
29,2014-2015,Jammu & Kashmir,152710039,Imamiya Mission Educational and Social Welfare Society,Chuchot PO Box No.32Leh Ladakh194101,0.00
30,2014-2015,Jammu & Kashmir,152750006,Iqbal Memorial Trust,Iqbalabad Bemina  SrinagarJammu & Kashmir-,9404027.13
31,2014-2015,Jammu & Kashmir,152640002,ISLAMIC RELIEF AND RESEARCH TRUST KASHMIR,ALAMDAR BAGH GOPALPORACHADOORA191113,21970202.00
32,2014-2015,Jammu & Kashmir,152730002,ISLAMIC UNIVERSITY OF SCIENCE AND TECHNOLOGY,ONE UNIVERSITY AVENUE AWANTIPORAPULWAMA192122,0.00
33,2014-2015,Jammu & Kashmir,152750018,J & K Yateem Foundation,8- Top Floor Auqaf Building Budshah Chowk SgrSrinagar (J&K)-190001,17475902.48
34,2014-2015,Jammu & Kashmir,152750024,J and K Habakhatoon Foundation,103-Hotel Mazda BoulevardNehru Park190001,0.00
35,2014-2015,Jammu & Kashmir,152760008,J&K Destitute Handicapped Welfare Association,Khan Ramnagar UdhampurJ&K.-,0.00
36,2014-2015,Jammu & Kashmir,152750012,Jammu  & Kashmir  Yateem Trust  Srinagar,Red Cross Road Maisooma SrinagarJammu & Kashmir -190001,48353938.70
37,2014-2015,Jammu & Kashmir,152670010,Jammu & Kashmir Presentation Society,Gandhi Nagar JammuJammu & Kashmir-,0.00
38,2014-2015,Jammu & Kashmir,152670015,Jammu & Kashmir Women Society,70 (a) 2 - A Extn Gandhi Nagar Jammu Jammu & Kashmir-180004,0.00
39,2014-2015,Jammu & Kashmir,152670017,Jay  Kay Women Welfare Society,299 Nai Basti Satwari Jammu Cantt Jammu TawiJ & K-,2921500.00
40,2014-2015,Jammu & Kashmir,152750030,JK DEVELOPMENTAL ACTION GROUP JK DAG,DHAR SEED FARM COLONY ALONG THE BUND SHIVPORA BATWARASRINAGAR190004,0.00
41,2014-2015,Jammu & Kashmir,152610001,John Bishop Memorial Hospital,Sarnal AnantnagJ&K-,0.00
42,2014-2015,Jammu & Kashmir,152680010,Kargil Development Project,Greenland Campus Near TRC Kargil (J&K) -194103,5731039.00
43,2014-2015,Jammu & Kashmir,152680008,Kargil Educational Society,Main Bazar- Kargil KargilJammu & Kashmir-194103,1890000.00
44,2014-2015,Jammu & Kashmir,152710050,KARMA DUPGYUD CHOELING CULTURAL AND WELARE ASSOCIATION,P.O BOX 10LEH LADAKH194101,2138286.00
45,2014-2015,Jammu & Kashmir,152680011,Karsha Gonpa Cultural & Welfare Society,Karsha Zanskar BPO Padum Kargil (Jammu and Kashmir) -194102,0.00
46,2014-2015,Jammu & Kashmir,152750038,KARWANI ISLAMI,HO ShaheedgunjSrinagar190001,0.00
47,2014-2015,Jammu & Kashmir,152760002,Kashmir Evangelical Fellowship, UdhampurJammu & Kashmir-182101,21056244.10
48,2014-2015,Jammu & Kashmir,152750034,KASHMIR FRIENDS WELFARE SOCIETY FOR DISABLED,Shah MohallaNawab Bazar Srinagar190002,5057570.33
49,2014-2015,Jammu & Kashmir,152610004,Kashmir Research Institute of Education and Solar Technology,P.O. Box 68 HPOAnantnag192101,0.00
50,2014-2015,Jammu & Kashmir,152670016,Krist  Jyoti Social  Welfare Society,Chak Manga Samba Jammu TawiJammu & Kashmir-,0.00
51,2014-2015,Jammu & Kashmir,152710024,Ladakh Buddhist Association,Chokhang Vehara Leh-LadakhJammu and Kashmir-194101,26565153.00
52,2014-2015,Jammu & Kashmir,152710007,Ladakh Ecological Developmental Group,Karzoo  Leh - LadakhJammu & Kashmir-194101,1340294.00
53,2014-2015,Jammu & Kashmir,152710042,LADAKH EFTERSKOLE WELFARE SOCIETY,PHAYANG LEH LADAKHLEH194101,780725.00
54,2014-2015,Jammu & Kashmir,152710013,Ladakh Environment and Health Organisation,Himalya Hostel Complex Leh - LadakhJammu & Kashmir-,1035436.00
55,2014-2015,Jammu & Kashmir,152710019,Ladakh Heart Foundation,PO-Box No. 150 Polo Ground Leh Ladakh Jammu & Kashmir-194101,982717.00
56,2014-2015,Jammu & Kashmir,152710047,Ladakh Institute of Prevention,Dambuchan Leh-Ladakh Pin 194101Leh194101,509700.00
57,2014-2015,Jammu & Kashmir,152710023,Ladakh Nuns Association,C/O G.H. Airport Road Lower Skara Leh LadakhJammu & Kashmir-194101,4319017.00
58,2014-2015,Jammu & Kashmir,152710049,Ladakh Organic Farmers Foundation,Chuchot Shamma Leh LadakhChuchot194104,972480.00
59,2014-2015,Jammu & Kashmir,152710034,Ladakh Society for Traditional Medicines,Rizong Labrang Leh PO Box 97 Ladakh (J & K) -,634461.68
60,2014-2015,Jammu & Kashmir,152710040,LAMAURU CULTURAL AND WELFARE SOCIETY,URU GONPA LADAKHLEH194106,2969050.00
61,2014-2015,Jammu & Kashmir,152710059,LAMDON CHILDREN WELFARE SOCIETY  NUBRA LEH,DISKET NUBRALEH194101,3929072.00
62,2014-2015,Jammu & Kashmir,152680013,Lamdon Model High School,Padum Zanskar Kargil (Ladakh) PadumJammu and Kashmir-194302,8898529.00
63,2014-2015,Jammu & Kashmir,152710025,Lamdon Model Senior Secondary School,P.O.Box No.1 Leh-LadakhJammu & Kashmir-194101,18764243.11
64,2014-2015,Jammu & Kashmir,152680016,Lamdon Social Welfare Society,WakhaMulbekh941909,5092417.48
65,2014-2015,Jammu & Kashmir,152710008,Lamdon Social Welfare Society,P. Box 1 Leh Ladakh Jammu & Kashmir-194101,2716231.00
66,2014-2015,Jammu & Kashmir,152710011,Leh Nutrition Project,Housing Colony  P. Box  59 Leh Ladakh Jammu & Kashmir-194101,3437444.00
67,2014-2015,Jammu & Kashmir,152710052,Leh Old Town Initiative,Lakrook House Upper StalamLeh194101,2710652.29
68,2014-2015,Jammu & Kashmir,152710029,Lha-Rje Sorig Foundation,Sumoor-Nubra Leh LadakhJammu and Kashmir-194101,410337.00
69,2014-2015,Jammu & Kashmir,152710035,Lingshed Area Development Foundation,Amchi Health Centre Lingshed Vill Khaltsi Block LehLadakh (Jammu and Kashmir)-,3603865.00
70,2014-2015,Jammu & Kashmir,152710026,Lingshed Nunnery Welfare Society,Lingshed Labrang Opposite New Bus  LehJammu & Kashmir-194101,2161332.00
71,2014-2015,Jammu & Kashmir,152710006,Lions Club of Leh, Leh Ladakh Jammu & Kashmir-,1248216.00
72,2014-2015,Jammu & Kashmir,152680004,Lungnag Youth Association,Raru Padum Zanskar KargilJ&K-,3528985.00
73,2014-2015,Jammu & Kashmir,152710017,Mahabodhi Intermational Meditation Centre,P.Box 22 Devachan Leh - LadakhJammu & Kashmir-194101,41723715.00
74,2014-2015,Jammu & Kashmir,152680014,Marpa Ling Lamdon Model School Zanskar,Strongday Zanskar PadumKargil194302,5579450.00
75,2014-2015,Jammu & Kashmir,152690003,MATA VANKHANDI PUBLIC CHARITABLE TRUST,VPO NAHUSEHRA MAHANPUR TEHSIL BASOHLIKATHUWA184202,0.00
76,2014-2015,Jammu & Kashmir,152670006,Model Institute of Education and Research,B.C. Road Jammu  Jammu & Kashmir-180001,914032.00
77,2014-2015,Jammu & Kashmir,152710004,Moravian Mission School,P.Box. - 7 Leh LadakhJammu & Kashmir-194101,5264371.00
78,2014-2015,Jammu & Kashmir,152750016,Mother Women Welfare Organisation,H. No. 6 Kursu Rajbagh SrinagarJammu & Kashmir-190008,0.00
79,2014-2015,Jammu & Kashmir,152670034,MOULANA ALI MIYAN NADWI EDUCATIONAL AND CHARITABLE TRUST JAMMU,AISHA NAGAR BATHINDIJAMMU181152,5192309.51
80,2014-2015,Jammu & Kashmir,152710060,munsel society,opp fire station agling rodleh194101,2762152.11
81,2014-2015,Jammu & Kashmir,152680012,Mutahhary Educational Society Kargil,Behind LAHDC Office MPS Bldg. Kargil Jammu and Kashmir -194103,0.00
82,2014-2015,Jammu & Kashmir,152740003,National Development Foundation,House No.6 Sector A Opp. Parshotam BhawanSubashnagar,11795297.00
83,2014-2015,Jammu & Kashmir,152670031,NATIONAL INDUSTRIAL TRAINING AND CONSULTANCY(NITCO),Arya Kanya VidalayaPurani Mandi180001,0.00
84,2014-2015,Jammu & Kashmir,152750035,Neat NGOs Education and Trainings,P.O.Box 810 GPO Srinagar KashmirSrinagar190001,0.00
85,2014-2015,Jammu & Kashmir,152710053,New Millennium Education Foundation Ladakh,Murtse Dambochan Agling LehLeh194101,9243880.00
86,2014-2015,Jammu & Kashmir,152710055,NGARI INSTITUTE OF BUDDHIST DIALECTICS,Saboo Do SkyidchanLEH194101,8418242.00
87,2014-2015,Jammu & Kashmir,152670004,North India Pentecostal Fellowship,R.S. Pura Jammu Jammu & Kashmir-181102,1190852.00
88,2014-2015,Jammu & Kashmir,152750021,Office of the Chief Executive Officer Shri Amarnathji Shrine Board,Raj Bhavan Srinagar Jammu and Kashmir -180001,0.00
89,2014-2015,Jammu & Kashmir,152710046,Pegon Phagspa Nastan Bakula Institute,Pethub Gonpa P.O Box No. 115 Distt. Leh - Ladakh-194101Leh194101,1344573.00
90,2014-2015,Jammu & Kashmir,152760011,PENETRATION AND RESTORATION MINISTRIES,YISU BHAVANRAM NAGAR P O182122,1018341.65
91,2014-2015,Jammu & Kashmir,152750033,PEOPLES SOCIAL AND CULTURAL SOCIETY,12-13 B 3rd Floor Sulaiman Complex DalgateSrinagar190001,0.00
92,2014-2015,Jammu & Kashmir,152680018,Phukthar Gonpas Cultural and Welfare Society,Phukthar Labrang P. O Padum LadakhKargil194101,0.00
93,2014-2015,Jammu & Kashmir,152670028,PIR PANCHAL,h no 40 gandhi chowk lane subash nagar jammujammu180005,18253.00
94,2014-2015,Jammu & Kashmir,152630002,Qudsiyya Health Care and Education Trust,Mazbugh Near Fruit MandiSopore193201,0.00
95,2014-2015,Jammu & Kashmir,152670019,Ramakrishna Mission,Udhowala PO Aqualpur JammuJammu & Kashmir-180002,123464.00
96,2014-2015,Jammu & Kashmir,152680009,Rangdum Gonpa Cultural and Welfare Society,Rangdum Labrang Near Polo Ground Leh LadakhKargil (J&K)-194101,1090374.00
97,2014-2015,Jammu & Kashmir,152710020,Rizong Cultural And Welfare Society,Lanlcing Leh- LadakhJ&K-,1182098.00
98,2014-2015,Jammu & Kashmir,152750029,S.R. INSTITUTE OF DEVELOPMENT,Room No. -6 NGO Complex Opp.-Masjid Bilal Ram BagSrinagar190015,12744301.48
99,2014-2015,Jammu & Kashmir,152710043,Sacred Educational Society of Ladakh (SESOL),Murtsey Colony - Near FRLLeh - Ladakh194101,263708.00
100,2014-2015,Jammu & Kashmir,152670029,SAHYOG INDIA,3 / 56 – A DAULAT BHAWANR. S. PURA181102,3019000.00
101,2014-2015,Jammu & Kashmir,152750008,Salfia Muslim Educational Resesarch Trust,J&K Jamiat Manzil Barbar Shah SrinagarJ&K-,23574.00
102,2014-2015,Jammu & Kashmir,152670013,Sapna Grameen Udyog,H/o Colony Ward No1 Bishnah Jammu TawiJ&K-181132,1740600.00
103,2014-2015,Jammu & Kashmir,152710048,Servant of the Society Club,Malpak Complex LehLeh Ladakh194101,849200.00
104,2014-2015,Jammu & Kashmir,152670027,Sewa Bharti,Ved Mandir AmphalaJammu180005,1317520.00
105,2014-2015,Jammu & Kashmir,152750026,She Hope Society For Women Enterpuners,Wayil Ganderbal Kashmir IndiaGanderbal191201,22398802.00
106,2014-2015,Jammu & Kashmir,152670038,Shri Durga Dass Sharma Memorial Society,258 Sector 01 Channi Himmat Housing ColonyJammu180015,0.00
107,2014-2015,Jammu & Kashmir,152760009,Shri Mata Vaishno Devi Shrine Board,Katra Udhampur (Jammu and Kashmir) -,11918670.23
108,2014-2015,Jammu & Kashmir,152710057,SHRI NALANDA DHARMA CENTRE,JAMYANG SCHOOL MURTSE COLONYLEH LADAKH194101,4399573.00
109,2014-2015,Jammu & Kashmir,152670020,Shri Ved Mandir Committee,Ambphala  JammuJammu and Kashmir-180001,2414189.00
110,2014-2015,Jammu & Kashmir,152710021,Siddhartha Cultural and Welfare Society,Chorkor Stok  Leh - Ladakh Jammu & Kashmir-,10921508.00
111,2014-2015,Jammu & Kashmir,152680006,Social Education & Cultural Preservation & Development Society,Karsha Yulsum Zanskar(P.O. Padum Zanskar)Distt.-Kargil Ladakh J  & K-194103,3110173.00
112,2014-2015,Jammu & Kashmir,152630001,Society of the Franciscan Sisters of Mary,St. Josephs Hospital  Baramulla Jammu & Kashmir-,0.00
113,2014-2015,Jammu & Kashmir,152640003,Spring Buds Educational Trust,Near Railway Flyover Narkura Road OmpuraBudgam191111,0.00
114,2014-2015,Jammu & Kashmir,152670018,St. Joseph' Health Centre,Akhnoor Jammu Dt J & K States AkhnoorDistt. -Jammu (Jammu & Kashmir)-181201,597540.00
115,2014-2015,Jammu & Kashmir,152710012,Students Educational And Cultural Movement Of Ladakh,Phorkal Labrang Leh - Ladakh Jammu & Kashmir.-,1899496.00
116,2014-2015,Jammu & Kashmir,152710037,Thagchokling Charitable Organisation,Village-Ney PO/Teh-Leh LehJammu & Kashmir-194101,1130059.00
117,2014-2015,Jammu & Kashmir,152670033,The Bethel Charitable Trust,HN 423  Qasim NagarBhu Fort  Jammu180001,20595519.93
118,2014-2015,Jammu & Kashmir,152750025,The New Kashmir Womens and Child Welfare Society,Bazar Batamaloo SrinagarSrinagar190001,0.00
119,2014-2015,Jammu & Kashmir,152750022,The NGOs Coordination Federation J and K,88-Shah-i-Hamdan LaneOmerabad II190012,0.00
120,2014-2015,Jammu & Kashmir,152710016,Thiksay Cultural Welfare Society,Thiksay Gonpa LehJ&K-,413472.00
121,2014-2015,Jammu & Kashmir,152710044,TINGANG TSALKAR GONPA SABHA TIMESGAM,B.P.O TINGMOSGANG DISTT LEHLEH194101,19417.00
122,2014-2015,Jammu & Kashmir,152710062,VILLAGE EDUCATION COMMITTEE,SPITUKLEH194101,0.00
123,2014-2015,Jammu & Kashmir,152670030,VOICE Volunteers Organisation for International Cooperation and Equality,H/o JALALABAD NEAR RELIANCE TOWER SUNJWAN ROAD JAMMU.JAMMU180011,0.00
124,2014-2015,Jammu & Kashmir,152750010,Voluntary Medicare Society, SrinagarJ&K-,7464593.99
125,2014-2015,Jammu & Kashmir,152610006,VOLUNTARY ORGANISATION ON ENVIRONMENTAL AND SOCIA ECONOMIC PLANNING,Taj Building opp D C OfficeAnnantnag192101,0.00
126,2014-2015,Jammu & Kashmir,152710041,Womens Alliance of Ladakh,Chubi Sankar RoadLeh-Ladakh194101,246096.00
