765,2014-2015,Tamil Nadu,076040382,DEVELOPMENT EDUCATION AND ACTION FOR RELIEF (DEAR FOUNDATION),ROOM NO.1 1ST FLOOR RR COMPLEX VAYALUR ROAD PUTHURTRICHIRAPPALLI620017,0.00
766,2014-2015,Tamil Nadu,075820196,Development Education And Welfare Institute,14 Ex-servicemens Enclave Selaiyur ChennaiTn-600044,0.00
767,2014-2015,Tamil Nadu,076020024,Development Education Centre,No.67/4/6Village Street ThiruvottiyurThiruvallurTamilnadu-600019,30647.00
768,2014-2015,Tamil Nadu,075890335,Development Education Empowerement Peoples Action Movement Trust,No.220 A M.R.T. NagarSivagiripatt Palani DindigulTamilnadu-624601,0.00
769,2014-2015,Tamil Nadu,075870128,DEVELOPMENT EDUCATION ENVIRONMENT PARTY AND AWARENESS MOVEMENT,SANTHI NILAYAM GIRLS SCHOOL BUS STOPHARUR PO AND TK636903,0.00
770,2014-2015,Tamil Nadu,076050053,Development Education For Rural Masses,Avudayarpatti Village Vallathirakkottai PostPudukkottai-622303,0.00
771,2014-2015,Tamil Nadu,075820181,Development Educational Trust India,Pandur    Village & P.o. & Via Kadambathm TiruvallurChengalput Mgr  Tamil Nadu-631203,0.00
772,2014-2015,Tamil Nadu,076050119,Development for Education Service and Poor People Organisation (DESPPO TRUST),264Ambethkarnagar Gandhi Road AlangudiPost Alangudi TalukAlangudi622301,0.00
773,2014-2015,Tamil Nadu,075930008,Development for Rural Opressed People's Service Society,12 Annai Illam Valluvar Street Anna Nagar Karaikudi SivagangaiSivagangai Distt. (TamilNadu)-630002,748000.00
774,2014-2015,Tamil Nadu,075890413,DEVELOPMENT INTEGRATION AND EDUCATION TRUST,4 KARUVATTUKARA STREETVEDASANDUR624710,0.00
775,2014-2015,Tamil Nadu,076040224,Development Of Deucation And Environment Movements,242/asooran Nagar Savariyar Koil StreettharanallurTruchy Tamil Nadu-620008,909200.00
776,2014-2015,Tamil Nadu,076040381,DEVELOPMENT OF EDUCATION AND ENVIRONMENT PROTECTION (DEEP) TRUST,No.6/1 MANNARPURAM MAIN ROADTRICHY620020,0.00
777,2014-2015,Tamil Nadu,075890301,Development Of Education And Environment Trust,2-7-4 E.b. Colony NilakottaiDindigul Distt. (tamil Nadu)-624208,1643264.00
778,2014-2015,Tamil Nadu,075940448,Development of Education and Social Awareness Movement,"4/202
KATTASOLAIPATTI
VELLALUR POST
MELUR TALUKMADURAI625109",0.00
779,2014-2015,Tamil Nadu,075930019,Development of rural and Urban Community Trust,No.337 Periasamy StreetMin Nagar Tiruppathur SivagangaiTamilnadu-630211,0.00
780,2014-2015,Tamil Nadu,075890418,Development Of Rural Education Agriculture and Multipurpose Service Trust,2/54B 2nd Ward N.PanjampattyDindigul624303,0.00
781,2014-2015,Tamil Nadu,076160010,Development of Village Education,2/44 Nochikulam PO Box No. 1 Ananthapuram ViaThoothukudi (TamilNadu)-628701,5322000.00
782,2014-2015,Tamil Nadu,075950021,Development of Women and childrens Trust,15/1E Raja RiceMill II Street Chinnamanur TheniTamilnadu-625515,0.00
783,2014-2015,Tamil Nadu,076040196,Development Organisatioin For Women Trst,17 Arulnayagam Street Gandhi Nagar CrawfordTrichy-,0.00
784,2014-2015,Tamil Nadu,075950018,Development Organisation for Rural Association,11-501-A/G3Mukkandha Street Opp.Fire StationAundipattiTheniTamilnadu-625512,0.00
785,2014-2015,Tamil Nadu,076030288,Development Organisation for the Poor,158Puthugramam Street Amabasamudram TirunelveliTamilnadu-627401,0.00
786,2014-2015,Tamil Nadu,075890221,Development Organisation For Women,Poosaripatty  BatlagunduDindigul Ann Tamil Nadu-624202,0.00
787,2014-2015,Tamil Nadu,075900401,Development Promotion Group,Joseph Centre 60 3rd Street Officers ColonyMehta Nagar Amainthakarai600029,21924950.00
788,2014-2015,Tamil Nadu,076030196,Devotte   India Rural Reconstruction & Technology Transfer,Tiranstonation  27/a Saron Tiruvanmalai Tamil Nadu-606602,605480.00
789,2014-2015,Tamil Nadu,075820234,Dewi Saraswathi India Trust,Plot No.11r.v. Street Alagesa NagarchengalpattuKancheepuram Tamil Nadu-603001,15528452.00
790,2014-2015,Tamil Nadu,075940407,Dhan Development of Humane Action Foundation,1A Vaidyanathapuram EastKennet Cross Road625016,115324770.00
791,2014-2015,Tamil Nadu,075950003,Dhanam Trust,56V O C  Nagar Gayathri Mat. Hr. Sec School RoadChinnamanur Theni T N-625515,5000.00
792,2014-2015,Tamil Nadu,076080067,Dhanan Chezhian Trust,Kamaraj NagarKunnathur Village Arni Tk. TiruvannamalaiTamilnadu-,0.00
793,2014-2015,Tamil Nadu,075870044,Dharmapuri Sacred Heart Diocesan Trust,Bishop's House Nethaji Bypass Road Dharmapuri.T N-636701,15912781.78
794,2014-2015,Tamil Nadu,075870043,Dharmapuri Social Service Society,Kolping House SF No 202 26 ErangattukottaiAnnasagaram P O636704,3002601.00
795,2014-2015,Tamil Nadu,075900310,Dhyana Ashram,13 Madha Church Road  Chennai-600028,304700.00
796,2014-2015,Tamil Nadu,075940506,Dil Se Trust,1/145 AlathurThirumalpuram625014,212310.00
797,2014-2015,Tamil Nadu,075890433,DINDIGUL AIDS CONTROL SOCIETY  DACS,Anbagam  5   481 Kanmaninagar Near Treasury Colony NandhavanapattiDindigul624001,604185.00
798,2014-2015,Tamil Nadu,075890294,Dindigul Auxilium Salesian Sisters Society,West Marianathapuram Dindigul Tamilnadu. -624003,1149543.71
799,2014-2015,Tamil Nadu,075890341,Dindigul Catholic Diocesan Society,P.B.No.6 Valan NagarMullipadi B.K. Pudur624005,25549325.86
800,2014-2015,Tamil Nadu,075890414,Dindigul District HIV Positive Society,D. No. 9/27 New Agraharam Ram Auto Backside Palani RoadDindigul624001,0.00
801,2014-2015,Tamil Nadu,075940180,Dindigul Multipurpose Social Service Society,John Paul Complex P B No. 77 Nehruji NagarDindigul Tamil Nadu-624001,12659766.41
802,2014-2015,Tamil Nadu,075840005,Diocese Of Marthandam,Bishop's House Christurajapuram  Martandam Kanyakumari.T N-629165,35888027.60
803,2014-2015,Tamil Nadu,075850333,Diocese of Ramanathapuram of the Syro Malabar Church,Catholic Bishops House Holy Trinity Cathedral Trichy Road RamanathapuramCoimbatore641045,984724.00
804,2014-2015,Tamil Nadu,075960028,Diocese Of Tanjore Society,PO Box No.204 Bishop House Voc Road ThanjavurTamil Nadu-613007,23600127.82
805,2014-2015,Tamil Nadu,075840003,Diocese Of Thuckalay,Bishop's House. P.b.no. 12 ThuckalayKanyakumari T N-629175,32226942.19
806,2014-2015,Tamil Nadu,075980063,Diocese Of Vellore Society,Bishop's House  No. 34 Officer's Line Vellore Tamil Nadu-632001,17487691.74
807,2014-2015,Tamil Nadu,076020052,Discipleship and Leadership Ministries,64 3rd Main Road Pasumpon Nagar Kallikuppam ThiruvallurTamilnadu-600005,1076704.00
808,2014-2015,Tamil Nadu,075901312,Dishaa Charitable Trust,F2 Navins Pushpa No 15A Old No 6  Kamatchipuram 1st Street Postal Colony West MambalamChennai600033,1119943.82
809,2014-2015,Tamil Nadu,075890228,Distt.  Rural Development Organisation,Vannampatti SempattyDindigul T.k. Mannch Thirumakai-624707,0.00
810,2014-2015,Tamil Nadu,075970115,DIVINE CHARITABLE PRISON MINISTRIES SOCIETY,95 1A GREEN FIELDSOOTY643001,10156.00
811,2014-2015,Tamil Nadu,076040391,DIVINE CHILD TRUST,No.4 BANKERS COLONY BHARATHIAR SALAI KUMARAN NAGARTIRUCHIRAPALLI620017,56754.00
812,2014-2015,Tamil Nadu,075900941,Divine Light Movement Charitable Trust,38-C Solaiamman Koil Street AyanavaramChennai (TamilNadu)-600023,0.00
813,2014-2015,Tamil Nadu,075980298,DIVINE MARY EDUCATIONAL AND ENVIRONMENTAL TRUST,NO. 19 INDIRA NAGAR CHETTIAPANUR POSTVANIYAMBADI635751,0.00
814,2014-2015,Tamil Nadu,075890339,Divine Trust,9/279Arockiam nagar A-Vellodu DindigulTamilnadu-624307,0.00
815,2014-2015,Tamil Nadu,075900686,Divine Word Trust,Hill Topp.o.box-1304 St.thomas MountChennaikancheepuram Tamil Nadu-600016,561275.00
816,2014-2015,Tamil Nadu,075850022,Divyodaya Religious And Charitable Trust,63(48) Geetha Hall Road CoimbatoreTn-641048,0.00
817,2014-2015,Tamil Nadu,075900729,Dms Trust,"NEW NO 11 OLD NO.6 FIRST FLOOR 
KAVIGNAYAR BHARATHI DASAN ROAD ALWARPET
CHENNAI 600018CHENNAI600018",203182.00
818,2014-2015,Tamil Nadu,076000075,Doctor Typhagne Memorial Charitable Trust,Smmi Convent Staff Quarters ArisipalayamSalem Distt. (tamil Nadu)-636009,12487218.00
819,2014-2015,Tamil Nadu,076030011,Dohnavur Fellowship,Dohnavur TirunelveliTamil Nadu-627102,24524297.85
820,2014-2015,Tamil Nadu,075980030,Dominic Savio Orphanage Society,Pbi Tirupattur Tn -,709273.00
821,2014-2015,Tamil Nadu,075900467,Don Bosco Anbu Illam Social Service Society,25 Kulandai Street Park Town ChennaiTamil Nadu-600003,4410281.00
822,2014-2015,Tamil Nadu,076040296,Don Bosco Boys Home Society,Don Bosco I.t.i. N. Kuttapattu Ramji Nagar P.o.Tiruchirapalli (tamil Nadu)-620009,763501.00
823,2014-2015,Tamil Nadu,075900671,Don Bosco Foundation,The Citael 18 Landons Road KilpaukChennai.-600010,0.00
824,2014-2015,Tamil Nadu,076040410,DON BOSCO MEDIA INITIATIVES FOR DEVELOPMENT EMPOWERMENT AND AWARENESS DB MIDEA,DON BOSCO KARUNYA NAGAR ROAD MANIKANDAMTIRUCHIRAPALLI620012,480292.00
825,2014-2015,Tamil Nadu,075850293,DON BOSCO NILAYAM FOR EDUCATION AND SOCIAL TRANSFORMATION    NEST,Don Bosco Nest Muthanampalayam Road Nallur PostTiruppur641606,0.00
826,2014-2015,Tamil Nadu,075880021,DON BOSCO THARANGAM TRUST,ECR ROAD KAZHIAPPANALLUR VILLAGETHARANGAMPADI TALUK609307,0.00
827,2014-2015,Tamil Nadu,076030144,Don Bosco Tribal Development Society, 635703,482133.00
828,2014-2015,Tamil Nadu,075901154,DON BOSCO VAZHIKAATI EDUCATIONAL AND CHARITABLE SOCIETY,46 Siruvallur Road PeramburChennai600011,0.00
829,2014-2015,Tamil Nadu,076000124,Doors of India Charitable Trust,2/33 A 1 Nadu Street KondalampattySalem636010,8608.76
830,2014-2015,Tamil Nadu,076030337,DORAIRAJ AND JUBILEE TUCKER TRUST,1 B S R Puram ReddiarpattiTirunelveli627051,153180.00
831,2014-2015,Tamil Nadu,075940339,Downtrodden And Poor People Charitable Medical Educational And Welfare Trust,T. Pudupatti Post Thirumangalam Madurai Tamil Nadu-625704,6389778.00
832,2014-2015,Tamil Nadu,075960130,Dr Gordon Memorial Trust,541 Mission Alamara Street    ManambuchavadiThanjavur613001,0.00
833,2014-2015,Tamil Nadu,075901321,Dr Mani Children Heart Foundation,955 13th Main Road  Annanagar WestChennai600040,183450.00
834,2014-2015,Tamil Nadu,075940430,Dr S.V.K. Foundation,"NO.4/219 MUGALAPALLI GATE
THUMMANAPALLI HOSUR TAULKKRISHNAGIRI DISTRICTHOSUR635105",13261.60
835,2014-2015,Tamil Nadu,076050052,Dr. Ambedkar Women & Child Regeneration Development Trust,6- A Nallamal Chatram Road Annavasal .Puddukottai T N-622101,855969.70
836,2014-2015,Tamil Nadu,075970120,DR. MRS. FRANCIS MEMORIAL COMMUNITY CARE FOUNDATION,NO. 57 YMCA COMPOUND MOUNT ROAD COONOORNILGIRIS643102,28952.92
837,2014-2015,Tamil Nadu,075840099,DR. NALLATHAMBI EDUCATION AND HEALTH FOUNDATION,KANAGAPPAPURAM ANJUGRAMAMKANYAKUMARI629401,2381576.00
838,2014-2015,Tamil Nadu,075900426,Dr.dathu Rao Memorial Charitable Trust,E-76/1 12th West Street Kamraj Nagar ThiruvanmiyurChennai-600041,40256202.80
839,2014-2015,Tamil Nadu,075901382,Dr.John Joseph Foundation,No.10 New Mandapam Road KilpaukChennai600010,40832.00
840,2014-2015,Tamil Nadu,075840069,Dr.Kumar and Kathleen Charitable Community Health Trust,1 Sannathi StreetA.G.Hospital and Research Center Nagercoil.629001,16187207.78
841,2014-2015,Tamil Nadu,075980322,Dr.Peter Charitable Trust,90.Kumaran NagarSedukarai.PoGudiyatham632602,0.00
842,2014-2015,Tamil Nadu,075901076,DSM Foundation Trust,No.11 Agaram Road East Tambaram ChennaiTamilnadu-600059,550210.00
843,2014-2015,Tamil Nadu,075940241,Duraisamy Generous Social Educational Association,Vilvarayanallur Madurantakkam Pakkam Post Via ChengaiAnna District-,25631.00
844,2014-2015,Tamil Nadu,075901315,DVARA RESEARCH FOUNDATION,NO 1 10TH FLOOR IITM RESEARCH PARK KANAGAM VILLAGE TARAMANICHENNAI600113,896768.00
845,2014-2015,Tamil Nadu,075900553,Dying Seed Ministries,No.2/52 Ananda Vinayagar Koil Street AyanavaramChennai600023,237692.00
846,2014-2015,Tamil Nadu,075870033,E. K. R.  Kalvi Sangam,Keeraipatti  Harur Subramani  NagarDharamapuri Tamil Nadu-,0.00
847,2014-2015,Tamil Nadu,075900058,Eastern Province Of Sisters Of St. Charle, PeramburChennai -600011,3503582.00
848,2014-2015,Tamil Nadu,076100045,EBENEZER ASSOCIATION FOR SOCIAL TECHNICAL EDUCATIONAL REACHOUTS FOR THE RURAL POOR,43V.O.C.StreetKrishnapuram.GINGEE604202,0.00
849,2014-2015,Tamil Nadu,075901254,EBENEZER MINISTRIES,No.245 GST Road Kadaperi TambaramChennai 600045600045,1663432.00
850,2014-2015,Tamil Nadu,075890417,EBENEZER RURAL DEVELOPMENT TRUST,8-4-85D Batlagundu Road Near Telephone Exchange NilakottaiDindigul624208,0.00
851,2014-2015,Tamil Nadu,076090018,Ebenezer Share and Care Trust,3/70A West GateSawyerpuram628251,3186158.00
852,2014-2015,Tamil Nadu,076000104,Ebenezer Women Welfare Sangam,Teachers QuartersMundagampady VillageOndykadai PostYercaudSalem Tamilnadu-636602,0.00
853,2014-2015,Tamil Nadu,075900394,Ebenzer Home Of Social Outreaches, Anna NagarChennai-600040,10280868.60
854,2014-2015,Tamil Nadu,075900204,Echo Of Hill Call Evangelistic Programme, ChepaukChennai-,995168.40
855,2014-2015,Tamil Nadu,075900986,Echo of His Call Educational Trust,OldNo.18New No.10Mohammed Abdullah II Street ChepaukChennai Tamilnadu-600005,500.00
856,2014-2015,Tamil Nadu,075820361,ECHO OF HIS CALL MINISTRIES,NO.10 MOHAMMED ABDULLAH IIND STREET CHEPAUKCHENNAI600005,3431405.96
857,2014-2015,Tamil Nadu,075900523,Eci Inter Church  Aid & Service Association,14 Waddeels Road KilpaukChennai-600010,7597367.17
858,2014-2015,Tamil Nadu,075900131,Eclof India Public Charitabele  Trust,Periamet Chennai -600003,0.00
859,2014-2015,Tamil Nadu,075940597,Ecoland Foundation,211/5 RM complexKarungalakudi625101,0.00
860,2014-2015,Tamil Nadu,076000042,Econwel Orthopaedic Centre,Tharamangalam Taluk OmalurDistt. Salem Tamil Nadu.-636502,173943.00
861,2014-2015,Tamil Nadu,075890331,Eden Trust,Church of Eden shanarpatty DindigulTamilnadu-624304,0.00
862,2014-2015,Tamil Nadu,075970122,EDHKWEHLYNAWD BOTANICAL REFUGE  EBR CENTRE TRUST,C/O.DENTAL CLINIC HOSPITAL ROADOOTACAMUND643001,0.00
863,2014-2015,Tamil Nadu,075940204,Education & Community Health Organisation Trust,Nagamani Saw Mill  Main Road M. Vadipatti Po DindigulTamil Nadu -624211,0.00
864,2014-2015,Tamil Nadu,075940255,Education Agriculture Research and Trade for Human-Earth Society,Officers Town ExtensionMelakudi Rd Nagamalai Pudukottai MaduraiTamilnadu-625019,104595359.00
865,2014-2015,Tamil Nadu,076100053,EDUCATION AND RURAL DEVELOPMENT SOCIETY,2/77 SENGADU VALAVANUR POST VILLUPURAM TALUK VILLUPURAM  DISTRICTVILLUPURAM605108,0.00
866,2014-2015,Tamil Nadu,075940452,Education Communication and Development Trust,2/5A Mamarathupatti Road Usilampatti Post/TalukMadurai (TamilNadu)-625532,633500.00
867,2014-2015,Tamil Nadu,075960040,Education for Integrated Social Action,"""Ave Maria"" 46 Victoria ColonyEaswary NagarThanjavur613004",644690.00
868,2014-2015,Tamil Nadu,075900212,Educational & Development Services,93 Pantheon Road EgmoreChennai Tamil Nadu-600008,400000.00
869,2014-2015,Tamil Nadu,075820168,Educational & Upliftment Society For Rural Downtrodden,No. 6 Rc School St. Gandhi Nagar Madurutkam ChenglepatTn-,0.00
870,2014-2015,Tamil Nadu,075890045,Educational And Economic Development Scheme,Pullu Vilai  ParakkaiPost  Kanya Kumari629601,0.00
871,2014-2015,Tamil Nadu,075940409,Educational Trust Of India,36 Jeeva Street Bethaniapuram Madurai. -625016,0.00
872,2014-2015,Tamil Nadu,075940414,Edward Antonyammal Educational Trust,St. Marys Matriculation School S. Alangulam Anaiyur PostmaduraiTamil Nadu-625017,294771.00
873,2014-2015,Tamil Nadu,076060056,Eezee Educational and Charitable Trust,No.86-ADharapuram Road Kangayam ErodeTamilnadu-638701,2576455.52
874,2014-2015,Tamil Nadu,075901403,Ekam Foundation,Old No 16/ New No 19 JayalakshmipuramChennai600034,8100471.56
875,2014-2015,Tamil Nadu,076060050,Ekklesia Educational and Charitable Trust,No.195 Dharapuram Road Kangayam Erode DistrictTamilnadu-638701,1057443.84
876,2014-2015,Tamil Nadu,075940284,Ekta,Bethel Nagar Bible Bhavan StreetBypass Road Ponmeni625010,5886455.00
877,2014-2015,Tamil Nadu,075900855,El Shadai Charitable Trust,Plot No.1-Door No.1 Kamraj NagarChennai (TamilNadu)-600096,4954302.62
878,2014-2015,Tamil Nadu,075850296,EL. SHADDAI MISSIONS,Site No. 4 and 5 Shakthi Avenue Extension Tank Road GN Mills POCoimbatore641029,0.00
879,2014-2015,Tamil Nadu,075850200,Elijah Ministries of India Charitable Trust,No.6/F2Bharathi Nagar Anamalai Pollachi TalukCoimbatoreTamilnadu-642104,0.00
880,2014-2015,Tamil Nadu,075910023,ELIM CHARITABLE TRUST,II/163/5 KANYAKOILMEDU ANDRAPATTI KUPPANDAMPALAYAM POSTTIRUCHENGODU637205,2867273.00
881,2014-2015,Tamil Nadu,075940497,Elim Missionary Movemewnt,3-1/1Appadurai Nagar1st Street Kodal Nagar MaduraiTamilnadu-625018,892564.00
882,2014-2015,Tamil Nadu,075820289,Elkanah Educational and Disabled Childrens Orphanage Trust,No.15 Othawadai Cross Street Mamallapuram KanchipuramTamilnadu-603104,116049.80
883,2014-2015,Tamil Nadu,075980240,Ellen Memorial Board Of Education And Social Welfare,Vadacherry Post Vaniyambadi (via) Vellore Distt.Tamil Nadu-635754,488605.00
884,2014-2015,Tamil Nadu,075900153,Ellen Sharma Memorial Trust,11/12 Dr. Radhakrishnan Road 7th Lane MylaporeChennai-600004,27054438.51
885,2014-2015,Tamil Nadu,076160017,ELSHADAI JEBATHOTTAM TRUST,"NO 4/23 ELSHADAI JEBETHOTTAM 
MANI NAGAR UDANGUDI MAIN ROAD 
ELSHADAI NAGR 
PALLAKURUCHI POST SATANKULAMTHOOTHUKUDI628703",0.00
886,2014-2015,Tamil Nadu,075901145,Elshaddai Educational And Charitable Trust,No. 26 MGR Main Road Panaiyur KuppamPanaiyur600119,0.00
887,2014-2015,Tamil Nadu,075901124,Elshaddai Ministries Trust,No.58 Nawab Habbibula Nagar Mudichur ChennaiTamilnadu-600048,1200624.17
888,2014-2015,Tamil Nadu,075900829,Elysiom,3 Thangavelu Street T. NagarChennai (tamil Nadu)-600017,0.00
889,2014-2015,Tamil Nadu,075900019,Emanuel Methodist Church,48-50 Jermiad Road Chennai -600007,0.00
890,2014-2015,Tamil Nadu,075850311,EMBRACE A VILLAGE,NO 3 41 A3 AMAR JOTHI COLONY BHARATHIYAR UNIVERSITY VADAVALLICOIMBATORE641046,23477880.00
891,2014-2015,Tamil Nadu,075900656,Emma Trust,Amla Bhawan Rudra Road Chennai  -600014,21963005.48
892,2014-2015,Tamil Nadu,076030339,EMMANUAL CHARITABLE AND EDUCATION TRUST,28-B/1 STATE BANK COLONY MELAGARAMTENKASI627818,4115079.00
893,2014-2015,Tamil Nadu,075820146,Emmanual School & Project,Pudur  AmbahurChennai Tamil Nadu-600053,220905.50
894,2014-2015,Tamil Nadu,075970040,Emmanuel Blind Relief Society,8f Woodcote Road Post Boc No. 47 CoonoorNiligiris-,1360379.00
895,2014-2015,Tamil Nadu,075850111,Emmanuel Gospel Mission Family For Orphans,47-gshanthi Nagar MettupalayamCoimboetore Tamil Nadu-641301,757230.00
896,2014-2015,Tamil Nadu,075940544,EMMANUEL TRSUT,"NO 16
B R K NAGAR
KADACHANENDAL
KATHAKINARU(PO)MADURAI625107",0.00
897,2014-2015,Tamil Nadu,075900195,Emmaus Bible School,12 E.v.k. Sampath Rod VeperyChennai -600007,1049603.40
898,2014-2015,Tamil Nadu,075900042,Emmaus Community Welfare Fund,G-3Bal Apts No 9Nathamuni St. Shenoy NagarChennai Tamil Nadu.-600030,14710271.00
899,2014-2015,Tamil Nadu,076030269,Empower,E-1123rd Cross Streetmaharaja NagartirunelveliTamilnadu-627011,0.00
900,2014-2015,Tamil Nadu,075890255,Empowerment Of The Needy Trust,562 C5 M S Rd VettornimadamNagercoil  Kanyakumari629001,0.00
901,2014-2015,Tamil Nadu,076030179,Environment Education Economic Development Society,Gopi Nagar Nr Vel Nagar Thiruvannamalai TirunelveliTn-,359860.00
902,2014-2015,Tamil Nadu,076080122,ENVIRONMENTAL AND SOCIAL PROJECTS FOR RURAL IMPROVEMENT TRUST(ESPRIT),METTU STREET NALLAVANPALAYAM VILLAGETIRUVANNAMALAI606603,0.00
903,2014-2015,Tamil Nadu,075890143,Ephphantha Instt For The Deaf,NagercoilKanyakumari629001,0.00
904,2014-2015,Tamil Nadu,075940320,Ephphatha Mission,No.1 Old Post Office Road S S ColonyMadurai-,436080.00
905,2014-2015,Tamil Nadu,075901093,Epidemiological Research Center,New No.27 Canal Road Kilpauk Garden colony ChennaiTamilnadu-600010,13145988.00
906,2014-2015,Tamil Nadu,075901327,Equitas Development Intitiative Trust,601 6th Floor Phase-I Spencer Plaza 769 Anna Salai Mount RoadChennai600002,45992310.00
907,2014-2015,Tamil Nadu,075900088,Esoteric School Of Theosophy, AdyarChennai-,0.00
908,2014-2015,Tamil Nadu,076030325,ESR Charitable Trust,82 Santore North Street Chinthamani-puliangudiTirunelveli627855,0.00
909,2014-2015,Tamil Nadu,075901203,ETERNAL LIFE TRUST,A. P. 1227 77th Street 12th Sector K. K. Nagar (West)Chennai600078,0.00
910,2014-2015,Tamil Nadu,075850199,Eternal Redeemers Trust,No.675-APonnai Gounder Street near North Coimbatore FlyoverCoimbatore Tamilnadu-641002,0.00
911,2014-2015,Tamil Nadu,075940548,EVANGELICAL CHURCH GROWTH MISSION,46 JONESPURAM IST STREET PASUMALAIMADURAI625004,5193642.00
912,2014-2015,Tamil Nadu,075900052,Evangelical Church Of India, Kilpauk Chennai Tamil Nadu-,64023421.63
913,2014-2015,Tamil Nadu,075870054,Evangelical Gospel Mission Trust,2/2 Perumal Koil Street PidamnariDharmapuri (Tamil Nadu)-636701,2590004.00
914,2014-2015,Tamil Nadu,075820040,Evangelical Literature Service,95 A Vepery High Road  Madras Tamil Nadu-,110725.00
915,2014-2015,Tamil Nadu,075900006,Evangelical Nurces Fellowship Of India,10 Millers Road Chennai -600010,222306.00
916,2014-2015,Tamil Nadu,076000166,EVER LOVING MINISTRIES,NO 2 OVAIYAR STREET K M APARTMENTS SUBRAMANIYA NAGARSURAMANGALAM636005,0.00
917,2014-2015,Tamil Nadu,076060062,Everest Charitable Trust,54-56 Cutchery Street ErodeTamilnadu-638001,0.00
918,2014-2015,Tamil Nadu,076050097,EWM-Heart for Asia,No.5SM Colony Kaveri NagarPudukottai622501,38252875.00
919,2014-2015,Tamil Nadu,075900444,Ex Services Association (india),29 Poonnamallee High Road  Chennai-600003,3206591.00
920,2014-2015,Tamil Nadu,076030362,EXCELL (EXCELLENT CHILDREN EDUCATION THROUGH LAY LEADERSHIP),86 VIVEKANANDA STREET VM CHATRAM TIRUNELVELITIRUNELVELI627011,0.00
921,2014-2015,Tamil Nadu,075820396,EXNORA GREEN PAMMAL,NO.4 YOGA NIVAS 22ND STREET SANKAR NAGAR PAMMALCHENNAI600075,0.00
922,2014-2015,Tamil Nadu,075900606,Exnora International Foundation,Old No.35 New No.40 I Floor Rams Apartment Vijayaraghava Road T NagarChennai600017,0.00
923,2014-2015,Tamil Nadu,075850253,F.R.C. MISSION TRUST,NO.3/183 THANEERPANDAL THADAGAMCOIMBATORE641108,0.00
924,2014-2015,Tamil Nadu,075901163,Faith Christian Ministries,2A Madha Koil Street NerkundramChennai600107,280234.90
925,2014-2015,Tamil Nadu,075980271,Faith Foundation India Trust,Christ Cottage Thuthipet North Arcot VelloreTamilnadu-635811,1399805.00
926,2014-2015,Tamil Nadu,075850289,Faith Foundation Mission Trust,Door No.3/325-B Sirumugai Road Arivozhi Nagar JadayampalyamMettupalayam641302,0.00
927,2014-2015,Tamil Nadu,076030280,Faith Gospel Foundation of Jamaica W.I.,11/60F Gopal Nagar Agasthiyarpatti TirunelveliTamilNadu-627416,0.00
928,2014-2015,Tamil Nadu,075820090,Faith Home,Ramakrishna St. Porur ChennaiTn-,88000.00
929,2014-2015,Tamil Nadu,075840097,FAITH IN ACTION CHURCH OF GOD,KODAYALIVILAI  CHOOZHAL FATHIMA NAGAR PO VILAVANCODE TALUKKANYAKUMARI629160,0.00
930,2014-2015,Tamil Nadu,075840018,Faith In Action Ministries India Trust,Gilgal Cottage Mekkamandapam Post Kalkulam Taluk KanniyakumariTamil Nadu-629166,3141307.11
931,2014-2015,Tamil Nadu,075900411,FAITH OUTREACH CHENNAI,Plot NO 4A Michaels Street Opp Mohan GardenAnnai Nagar Korattur600076,121893.00
932,2014-2015,Tamil Nadu,075900096,Faith Prayer & Tract League,Kilpauk Garden Road KilpaukChennai -600010,16604980.29
933,2014-2015,Tamil Nadu,076030327,FAITH PRAYER GROUP MINISTRIES,NO-2/57 A KAMARAJ NAGAR SIVANTHIPATTI POST MAHARAJA NAGAR VIA PALAYAMKOTTAI TALUKATIRUNELVELI627011,604600.00
934,2014-2015,Tamil Nadu,075901247,FALCON FOUNDATION,EBENEZER  NO 5  II STREET  AVM AVENUE  VIRUGAMBAKKAMCHENNAI600092,700996.00
935,2014-2015,Tamil Nadu,075850012,Families For Children,107 Vellore Road PodanurCoimbatore-,13890217.00
936,2014-2015,Tamil Nadu,075850268,FAMILY CARE,No. 9/36 Chennys Chambers Dr. Nanjappa RoadCoimbatore641018,0.00
937,2014-2015,Tamil Nadu,075940504,Family Health amd Development Research Service Foundation,"No:20 Shanmugavel East Street
Aruppukottai-626106Aruppukottai626106",0.00
938,2014-2015,Tamil Nadu,075980282,FAMILY OF NAZARETH CHARITABLE TRUST,Ezharuvi BoomikuppamThirupattur635653,690207.00
939,2014-2015,Tamil Nadu,075940491,Family Restoration Foundation,Sengappadai Road Katrampatti T.Pudupatti Post tirumangalamMadurai Tamilnadu-625704,284584.61
940,2014-2015,Tamil Nadu,075900295,Farms India,Avvai Nagar Chennai.-600094,1000.00
941,2014-2015,Tamil Nadu,075900905,Father Ceyrac Children's Trust,Loyola College Chennai (TamilNadu) -600034,5958340.00
942,2014-2015,Tamil Nadu,076030328,FATHER SEBASTIAN EDUCATIONAL AND CHARITABLE TRUST,PASTOR LENSSEN POLYTECHNIC COLLEGEKUTHENKUZHYRADHAPURAMTIRUNELVELI627104,0.00
943,2014-2015,Tamil Nadu,076100035,Fathimas Educational and Charitable Trust,No.4.8 A.J.Nagar Kodungal Post and Village Thirukoilur TkVillupuram District Tamilnadu.605755,0.00
944,2014-2015,Tamil Nadu,075940580,Fedcrot Formation Education Development Centre for Rural Organisation and Training,1A Arunachalam Street S S Colony North GateMadurai625016,0.00
945,2014-2015,Tamil Nadu,075900660,Federation Of Consumer Organisation-Tamilnadu &Pondicherry (fedcot),Sri Ranga Nivas8-AMuthu  Mariyamman Koil StreetLakshmipuramChrompetChennaiTamilnadu-600044,0.00
946,2014-2015,Tamil Nadu,075900410,Federation Of South India Producers Association,No.21Anna Street Sathya Nagar Extension AnakaputhurChennai600070,331188.00
947,2014-2015,Tamil Nadu,075890018,Fellouship Of Evangelical Friends,23  Isaac Street  Post Bag No 68Nagercoi629001,412805.33
948,2014-2015,Tamil Nadu,075940059,First Baptist Church Of Madurai,8 Bharathiar 2nd St Ss Colony MaduraiTn-,4066573.00
949,2014-2015,Tamil Nadu,075890250,Fishermen Welfare Social Service,KurumpanaiKanyakumari629251,0.00
950,2014-2015,Tamil Nadu,076010120,Florence Home Foundation,1-a St Anthoniyar Kovil Street Sorkalpet Cuddalore Tn-607001,3005366.00
951,2014-2015,Tamil Nadu,075980310,Florence Nightingale Trust,351/1 Bharathi Nagar Palar Anaicut RoadWalajapet632513,0.00
952,2014-2015,Tamil Nadu,075940454,Food First Information and Action Network,No.11 PT Rajan Road 5th Street Narimedu MaduraiTamilnadu-625002,631808.13
