2665,2014-2015,Tamil Nadu,076040096,Society For Community Organisation And Peoples Education,P/176th Cross Ahmad Cly Ramalinga Ramalinga Nagar TriuchirapalliTn-620003,50000.00
2666,2014-2015,Tamil Nadu,076040232,Society For Community Organisation And Rural Education,"Vedhachalapuram
Thogaimalai Post
Karur District
Pin: 621313
Tamil Nadu
India.Karur District621313",1133477.00
2667,2014-2015,Tamil Nadu,075940005,Society For Community Organisation Trust,Justice Bhagwati Bhavan Lake View Road K K NagarMadurai-,1627916.00
2668,2014-2015,Tamil Nadu,076000086,Society For Development Of The Oppressed,40 Avaiyar Street Mullaivadi Attur TalukSalem Distt. (tamil Nadu)-636141,0.00
2669,2014-2015,Tamil Nadu,075860019,SOCIETY FOR EDUCATION  ENVIRONMENT AND DEVELOPMENT,1108 B GRV  GARDEN  GANDHIGRAMKARUR639004,0.00
2670,2014-2015,Tamil Nadu,075820281,Society for Education and Action,107Nemmeli Kuppam Perur Post ECR-MamallapauramKancheepuramTamilnadu-603104,2629181.00
2671,2014-2015,Tamil Nadu,075850250,SOCIETY FOR EDUCATION AND DEVELOPMENT,No. 12/3 Alpha Nagar Siruvani Nagar Extn. Zion School Building Kovaipudur PostCoimbatore641042,0.00
2672,2014-2015,Tamil Nadu,075880010,Society for Education and Economic  Development,3/273 Main Road Thirumarugal NagapattinamTamilnadu-609702,0.00
2673,2014-2015,Tamil Nadu,075900962,Society for Education and Economical Development for Poor,No.24Gloden ComplexM.K.B.Nagar East AvenueVyasarpadi ChennaiTamilnadu-600039,196265.00
2674,2014-2015,Tamil Nadu,076020105,Society for Education and Rural Development,116  Nagalapuram Road Opp. Madha Timber DepotUTHUKOTTAIUTHUKOTTA602026,0.00
2675,2014-2015,Tamil Nadu,076160001,Society For Education And Rural Development,34 East Fort Gate Street Srivaikuntam ThoothukudiTamil Nadu-628602,0.00
2676,2014-2015,Tamil Nadu,076040032,Society For Education Village And Improvement,6 Iii Rd St Anna Ng Pettavaithalai TiruchirapalliTamil Nadu-639112,15707099.60
2677,2014-2015,Tamil Nadu,076010172,Society for Education Research and Village Empowerment,Sirupakkam (PO)Thittakkudi(Tk)606123,0.00
2678,2014-2015,Tamil Nadu,075940558,Society For Enlightenment and Empowerment,4/27 Brindhavan street Iyyer bangalow MaduraiMadurai625016,0.00
2679,2014-2015,Tamil Nadu,076080125,SOCIETY FOR EVANGELICAL AND EDUCATIONAL DEVELOPMENT,MOSES COTTAGE 78/3 DIVERSION ROAD POLUR THIRUVANNAMALAI DISTRICTPOLUR606803,0.00
2680,2014-2015,Tamil Nadu,076040076,Society For Family Integrity & Development,37 Allithurai Road Putaur P.o. Box No. 702Trichirappalli-620017,489205.00
2681,2014-2015,Tamil Nadu,076080104,Society for Gospel Service and Rural Development,Christ NagarR.C.M. Street Vadamathimangalam PostPolurTiruvannamalai Tamilnadu-606907,0.00
2682,2014-2015,Tamil Nadu,076030090,Society for Harmony-Aid and Prosperous Economy,711 A 5th Street Min NagarVengikal606604,557199.00
2683,2014-2015,Tamil Nadu,075910012,Society for Health Environment and rural Development Project,PO Box No.1 5-BVelur Main Road Paramathi PostParamathi velurtalukNamakkal Tamilnadu-637207,138382.00
2684,2014-2015,Tamil Nadu,075940168,Society For Human Education,31319 Sadasiva Nagar VandiyurMadurai Tamilnadu-,2254034.00
2685,2014-2015,Tamil Nadu,076040363,Society for Human Education and Development,30Lime Store Street Pettavaithalai TrichirappalliTamilnadu-639112,0.00
2686,2014-2015,Tamil Nadu,075960078,Society For Human Service,40/3 Pallavan Nagar ExtensionManojipatti South613004,0.00
2687,2014-2015,Tamil Nadu,075940298,Society For Integrated Dev Elopment Of Tribals,No.1/1e2e2 New Colony P.t.rajan RoadMadurai.-625002,2652969.00
2688,2014-2015,Tamil Nadu,075890241,Society For Integrated Development,N. Panjampatty (po) Dindigul DistrictTamil Nadu-624303,0.00
2689,2014-2015,Tamil Nadu,075900774,Society For Integrated Health And Social Service,V-74 Plot No.4026 10th Street Anna Nagar Chennai T N-600040,0.00
2690,2014-2015,Tamil Nadu,075940045,Society For Integrated Rural Development,9A Kamarajar 3rd Street ChinnachokkikulamMadurai625002,10559510.00
2691,2014-2015,Tamil Nadu,075940288,Society For Integrated Social Upliftment,9 Viswashanthi Nagar 1st StreetMADURAI625017,6087410.21
2692,2014-2015,Tamil Nadu,075890308,Society For Litigation Awareness And Aid For The Public (slaap),12-3-36/h Anna Nagar BatlagunduDindigul (tamil Nadu)-624202,0.00
2693,2014-2015,Tamil Nadu,075820429,SOCIETY FOR NONFORMAL EDUCATION EMPOWERMENT HEALTH AND AWARENESS TO MASS,NO.16 KANNIAPPAN STREET SADASIVAM NAGAR NANDIVARAM GUDUVANCHERIKANCHEEPURAM603202,0.00
2694,2014-2015,Tamil Nadu,075940309,Society For Participatroy Research,38 Near Inba Illam PasumalaiMadurai T N-,824638.71
2695,2014-2015,Tamil Nadu,076010171,Society for People Education and Economic Development,15 S.K.S. Nagar Kurinjipadi CuddaloreTamilnadu-607302,0.00
2696,2014-2015,Tamil Nadu,075990095,Society for People Education and Economic Development (SPEED),9/98 Kamaraj Nagar DevipattinamRamanathapuram623514,99027.00
2697,2014-2015,Tamil Nadu,076030211,Society For People Hea Edu And Eco Dev,Eachampoondi Village Banampattu Kadaladi PolurT V Malai-,57462.00
2698,2014-2015,Tamil Nadu,076040034,Society For People's Action & Dev Edu,Kpttayar Thottam PettavaithalaiTrichy-,0.00
2699,2014-2015,Tamil Nadu,075940042,Society For Peoples Action For Ch & Edu,Post Box No. 14  Kodaikanal-624101-,1119840.00
2700,2014-2015,Tamil Nadu,075940219,Society For Peoples Education & Economic Change,2/1060 JEYARAJA ILLAM MANORANJITHAM ST EZHIL NAGAR IYYER BUNGLOW THIRUPALAI MADURAI625 014Madurai625014,27621209.00
2701,2014-2015,Tamil Nadu,075860001,Society For Poor People Development,1/76 A Thuraiyur Main Road Soriyampatti Musiri TalukTiruchirappalli621211,2585384.88
2702,2014-2015,Tamil Nadu,075940268,Society For Promoting Integrated Growth,MARIANS PASUMPON NAGAR KARUMATHURMADURAI625514,8167491.00
2703,2014-2015,Tamil Nadu,075950017,Society for Rural and Environment Development,P.DharmathupattiAndipatti(TK) TheniTamilnadu-625536,0.00
2704,2014-2015,Tamil Nadu,075950002,Society For Rural Development and Protection Of Environment,1588 Periyakulam Main Road AllinagaramTheni T N-625531,0.00
2705,2014-2015,Tamil Nadu,075980210,Society For Rural Development Promotion Services,Post Bag No. 14  195/15 Vallalar Nagar TirupatturDist: Vellore Tamil Nadu-635601,0.00
2706,2014-2015,Tamil Nadu,075980036,Society For Rural Education & Devlopment,Kallaru Perumuchi ArakonamVellore-,12385868.13
2707,2014-2015,Tamil Nadu,076000161,Society for Rural Health AND DEVELOPMENT PROJECT,2 121 Semmanoor Mettur TkSalem636451,241339.00
2708,2014-2015,Tamil Nadu,076040186,Society For Rural Improvement And Action,12-b/5 Parvathipuram MusiriTiruchirapalli-,937605.00
2709,2014-2015,Tamil Nadu,075890177,Society For Serving Humanity,Madurai Road SempattiKanyakumari624707,17634868.95
2710,2014-2015,Tamil Nadu,075890247,Society For Social Development,7-4A/8-1 Technology Bhavan Nangal NagerSuchindrum Kanyakumari629704,56250.00
2711,2014-2015,Tamil Nadu,075900647,Society For Social Education & Development (SAMUGAM),219 12th East Cross Street M.k.b. NagarChennai T.N.-600039,0.00
2712,2014-2015,Tamil Nadu,075890218,Society For Social Service And Child Care Trust,222 North Street Masilamanipuram Distt.- Dindigul Tamil Nadu-624005,1186852.00
2713,2014-2015,Tamil Nadu,076030070,Society For The Care Of Handicapped,50 Ambasamundram Road Kulavanigapuram TirunelveliTn-,6214917.00
2714,2014-2015,Tamil Nadu,076030102,Society For The Dev. Of Depressed,Konmangalam Semmalam Sambuvara Yar -,0.00
2715,2014-2015,Tamil Nadu,075820014,Society for the Educational and Economic Development,"Society for the Educational and Economic Development(SEED)
Venkatrangampillai Chatiram ( opp.PWD Inspection Bunglow)
Chennai Bangalore HighwaySriperumbudur602105",2558091.50
2716,2014-2015,Tamil Nadu,075980153,Society For The Upliftment Of Rural Poor,Manjampoondi Vill. TiruvanamalaiTamilnadu-,236838.00
2717,2014-2015,Tamil Nadu,075820176,Society For The Upliftment Of The Economically Background,82-a  Muduchur High Road  P.o.  Tambaram  Chengleput Tamil Nadu-,4239031.00
2718,2014-2015,Tamil Nadu,076080036,Society For The Welfare And Awareness Of The Poor And,Leprosy Affected People (swaplap) No: 58 Govindan Street ChetpetTiruvannamalai Distt. (tamil Nadu)-606801,1943360.00
2719,2014-2015,Tamil Nadu,075940276,Society For Weavers Education and Appropriate Technology,PLOTNO 15 SIVASAKTHI NAGARPERUNGUDI 625022 MADURAI.TAMIL NADUMadurai625022,0.00
2720,2014-2015,Tamil Nadu,076030259,Society For Welfare Of Leprosy Patients And Rural Development,37a Durgaiamman Koil St Tiruvannamalai Tn-606601,1169599.00
2721,2014-2015,Tamil Nadu,075870075,Society for Women and Child Development,Sigaralapalli-Vill/Post KrishnagiriTamilnadu-635104,0.00
2722,2014-2015,Tamil Nadu,076030152,Society For Women And Downtrodden Development,51/a Bujanai Koil Street   Veppampattu  Village & PostTaluk Vanavasi d Istt. Tamil Nadu-606807,0.00
2723,2014-2015,Tamil Nadu,076060071,SOCIETY FOR WOMEN AND YOUTH DEVELOPMENT (SWYD),MAIN ROAD KALLIPPATTI - 638 505GOBI - TK638505,0.00
2724,2014-2015,Tamil Nadu,076100007,Society For Women Education And Economic Thrust,7/251veedur & Post Tindivanam Tk Villupuram Tamilnadu -605652,316819.00
2725,2014-2015,Tamil Nadu,076100016,Society for Women Empowerment and Reorganisation,No.1/73A North Street Viruyur SankarapuramVillupuramTamilnadu-606402,1007913.00
2726,2014-2015,Tamil Nadu,075890347,Society for Women Integrated Family Development,47/3 Devathur Oddanchatram(Taluka DindigulTamilnadu-624614,0.00
2727,2014-2015,Tamil Nadu,076010148,Society For Women's Education And Awareness Development,Thurinjickollai Nellickollai Po.chidambaram TalukCuddalore Tamil Nadu-608704,1202177.00
2728,2014-2015,Tamil Nadu,076030160,Society For Womens Development,4A/14B Bharathi Street ManathoppuPolur Road606601,98624.00
2729,2014-2015,Tamil Nadu,075940292,Society For Womens Education Economic Development, MaduraiTn-,25301.68
2730,2014-2015,Tamil Nadu,075940097,Society Of Arul Anandar,Arul Anandar College KarumathurMadurai-625514,2556738.00
2731,2014-2015,Tamil Nadu,075820069,Society Of Daughters Of Mary Immaculate,Amala Bhavan Rudra Road St. Thomas Mount ChennaiTamil Nadu-,30922470.95
2732,2014-2015,Tamil Nadu,075890166,Society Of Daughters Of Mary St  Joseph s Province,St. Joseph s Province MartandamKanyakumari629165,20740260.02
2733,2014-2015,Tamil Nadu,075900817,Society Of Daughters Of St. Camillus,Kamarajnagar Perungalathur Anna Street 57Chennai (tamil Nadu)-600063,18442.60
2734,2014-2015,Tamil Nadu,075910005,Society of Education Research for Village Improvement and Community Empowerment,Aruvangkattupudur S K Pudur Manapalli PONamakkal (TamilNadu)-637017,0.00
2735,2014-2015,Tamil Nadu,075900352,Society Of Friars Minor,Madhavaram Chennai -600060,0.00
2736,2014-2015,Tamil Nadu,076040145,Society Of Good Samaritans,Post Box-611 Pauls Cattage  Under  Lucrs Complex     TrichurPuthur  Tirchirapalli Tamil Nadu-,922916.00
2737,2014-2015,Tamil Nadu,075820032,Society Of Holy Family Sisters,Paounjur  Chingleput Tamil Nadu-,8875524.00
2738,2014-2015,Tamil Nadu,075940440,Society Of Human Resource Development,Pillar Annai Velankanni Nagar Nagamalai Madurai (tamil NaduNagamalai625019,18706136.00
2739,2014-2015,Tamil Nadu,075820100,Society Of Mary Immaculate Mercy Home,64 Hall Road Kilpauk  ChennaiTn-600010,27088184.23
2740,2014-2015,Tamil Nadu,076000129,SOCIETY OF MARY IMMACULATE SALEM,ARISIPALAYAMSALEM636009,12020529.00
2741,2014-2015,Tamil Nadu,075820028,Society Of Oblates Of Mary Immaculate,R C Church 15-g Damalwar StreetKancheepuram-,27610558.82
2742,2014-2015,Tamil Nadu,075900034,Society Of Our Lady Fatima, ChromepetChennai-,0.00
2743,2014-2015,Tamil Nadu,076000114,Society of Peace,House of Peace Rahm road Yercaud SalemTamilnadu-636601,0.00
2744,2014-2015,Tamil Nadu,075900862,Society of Pilar  Madras,St. Anthony's Church 444 (New No. 47) P.H.RoadMaduravoyal Chennai (T.N.)-602102,0.00
2745,2014-2015,Tamil Nadu,075940115,Society Of Sacred Heart College,Shembaganur  KodaikanalMadurai-,2298913.29
2746,2014-2015,Tamil Nadu,010160266,Society of Servi Domini,6/128 Opp. Government High SchoolBurkitmangar627351,7993134.84
2747,2014-2015,Tamil Nadu,075820056,Society of Seva Missionaries,Minjur Ponneri Taluk 600103,2632173.71
2748,2014-2015,Tamil Nadu,075820104,Society Of Sisters Of  Our Lad Of  Fatima,St. Joseph's  Convent  Dharkast ChennaiTamil Nadu-600044,0.00
2749,2014-2015,Tamil Nadu,075980113,Society Of Sisters Of St. Anne's S No.11,Chetpet (via) Polur TheresapuramNorth Arcot - 606801-,0.00
2750,2014-2015,Tamil Nadu,075940190,Society Of Sisters Of St.anne's Society,No.23 Perungudi Madurai -,0.00
2751,2014-2015,Tamil Nadu,076040020,Society Of Social Service,Jesuit Residence St. Joseph's CollegeTiruchirapalli Tamil Nadu-620002,0.00
2752,2014-2015,Tamil Nadu,075940183,Society Of Srs Of Our Lady Of Fatima,Chellampatti  Madurai - 625566-,0.00
2753,2014-2015,Tamil Nadu,075890111,Society Of Srs Of Sacred Heart Of Jesus,KurusadyNagercoil629001,21639576.50
2754,2014-2015,Tamil Nadu,075820045,Society Of Srs Of St Anne's Society No.3,Valarpuram SriperumbudurChengalpattu-602105-,0.00
2755,2014-2015,Tamil Nadu,075900139,Society Of Srs. Of Prestenation Of Blessed,Vepery Madras -600112,416937.34
2756,2014-2015,Tamil Nadu,076040021,Society Of St Joseph's College,Jesuit Residence St. Joseph's College Tiruchirapalli-620002,460804.00
2757,2014-2015,Tamil Nadu,075940193,Society Of St Marys,East Veli Street MaduraiTn-625001,0.00
2758,2014-2015,Tamil Nadu,076000023,Society Of The Carmelite Fathers Ocd,Our Lady's House YercaudSalem Distt. (tamil Nadu)-,375407.00
2759,2014-2015,Tamil Nadu,076060012,Society Of The Franciscan Missionaris Of Mary,St. John De Britto Convent SathyamangalamPeriyar Distt. T.n.-,147450.00
2760,2014-2015,Tamil Nadu,076040054,Society Of The Immaculate Heart Of Mary, TiruchirapalliTn-,14850505.24
2761,2014-2015,Tamil Nadu,075970054,Society Of The Sisters Of The Destitute For Social Welfare,Sagayamatha Hospital  Balaclava Hills CoonoorThe Nilgiris Tamil Nadu.-643102,0.00
2762,2014-2015,Tamil Nadu,075890049,Society Of The Sisters Of The Divine Saviour,70 C  Christunagar Road  VettoornimadamP o  Nagercoil629003,2036025.00
2763,2014-2015,Tamil Nadu,075940393,Society Of The Sisters Of The Presentation Of The Blessed Virgin,Presentation Convent TheniTamil Nadu.-625531,6827861.00
2764,2014-2015,Tamil Nadu,075820029,Society Of The Sisters Of The Presentation Of The Blessed Virgin Mary Society-ii,Presentation Convent Church Park 216 Anna Salai Distt.- Chennai Tamil Nadu-600006,492201.00
2765,2014-2015,Tamil Nadu,075990067,Society Organised For Promotions Of Rtd,Gandhiagam M-3/1 Housing Unt Salai Road WoriyurTiruchirapalli Tamil Nadu-,1122250.00
2766,2014-2015,Tamil Nadu,075940438,Socio Economic And Educational Development Society,3/194-D Four Way Main RoadKappalore Thirumangalam Taluk625008,656594.00
2767,2014-2015,Tamil Nadu,075890266,Socio Economic Developmet Association,Trivandrum Road  AzhakiyamandapamMualodu  Kanayakuma629167,0.00
2768,2014-2015,Tamil Nadu,076010199,Socio Economic Education  and Empowerment Trust,NO. 37 MULLIGRAMPATTU ROAD St. DOMINIC SCHOOL CAMPUSNELLIKUPPAM607105,813274.00
2769,2014-2015,Tamil Nadu,076000152,SOCIO ECONOMIC EDUCATIONAL DEVELOPMENT SERVICE TRUST ( SEEDS ),NO.26RANGI CHETTI STREETGUGAISALEM636006,0.00
2770,2014-2015,Tamil Nadu,076030252,Socio-economic And Educational Development Trust,24/12 6th Street Gandhi Nagar Thiruvannamalaithiruvannamalai606601,65130842.00
2771,2014-2015,Tamil Nadu,075901046,SocioEconomic Education and Rehabilitation Society,2627 BlocksIn between Sathya Moorthy NagarChennaiTamilnadu-600039,0.00
2772,2014-2015,Tamil Nadu,075820070,Socy Of St Paul's Seminary College,Place's Garden Perampakkam -,9657215.00
2773,2014-2015,Tamil Nadu,075980073,Solai Program,Christianpet Via - TelVellore-,0.00
2774,2014-2015,Tamil Nadu,076040352,Solai Trust,No.31/9 Theresal Colony PB No.340 West Chinthamani TiruchirapalliTamilnadu-620002,291396.24
2775,2014-2015,Tamil Nadu,075901132,Solidarity and Action Against The HIV Infection in India(SAATHII),C/o. ABK-Aots DosokaiTamilnadu Centre110 Nelson Manickam Road3rd Flor Aminjikarai600029,38317536.92
2776,2014-2015,Tamil Nadu,076100039,Solidarity Trust for Women Development,No. 43 Marakkanam Road Mannarsami Koil TindivanamTindivanam604002,537341.00
2777,2014-2015,Tamil Nadu,075900922,Sornammal Educational Trust,16 Jayalakhmipuram 1st Street  Nungambakkam Chennai 34Chennai600034,7519574.11
2778,2014-2015,Tamil Nadu,075900084,Sos Childrens Villages Of Inida,7 Raja Krishna Rao Road TeynampetChennai -600018,232490.17
2779,2014-2015,Tamil Nadu,075870089,Soteria Trust,2/711 Alasanatham Hosur KrishnagiriTamilnadu-635109,285000.00
2780,2014-2015,Tamil Nadu,075980032,Soty For Rural Development,Gandhi Seva Nilayam Vilvarani - Village & PostTiruvannamalai Tamil Nadu-606906,0.00
2781,2014-2015,Tamil Nadu,075940588,SOURASHTRA GIRLS VIDYA SANGAM,TEPPAKULAM ANUPPANADI ROADMADURAI625009,0.00
2782,2014-2015,Tamil Nadu,076010108,South Arcot Multipurpose Social Service Society,O.l. Of Perp. Succour Church Campus Vikravandi VillupuramTn-605652,2476133.92
2783,2014-2015,Tamil Nadu,075900641,South Central India Network For Development Alternatives,402 B - Block Prince Garden ApartmentsNo. 40 Thambusamy Road Kilpauk600010,34470378.56
2784,2014-2015,Tamil Nadu,075900595,South India Aids Action Programme,"4/51 POONTHOTTAM NORTH MADA STREET
THIRUVANMIYUR 
CHENNAI - 600041CHENNAI600041",26000612.00
2785,2014-2015,Tamil Nadu,076030014,South India Assemblies Of God,Pb-9 Shencalab  TirunelveliTamil Nadu-,0.00
2786,2014-2015,Tamil Nadu,075900967,South India Christian Mission Church Trust,Plot No.30 4th Church StreetKummi Amman NagarMudichur ExtnMannkvakkamChennaiTamilnadu-600048,7832565.00
2787,2014-2015,Tamil Nadu,075901036,South India Positive Network,133West Namachivayapuram ChoolaimeduChennaiTamilnadu-600094,0.00
2788,2014-2015,Tamil Nadu,076080129,SOUTH INDIA TRUST,9A.Ramalinganar Street TiruvannamalaiTiruvannamalai606601,0.00
2789,2014-2015,Tamil Nadu,075890052,Southern District Council Of The South India Assemblies of God,Attor ThiruvattarDistt. Kanyakumari629177,100088.00
2790,2014-2015,Tamil Nadu,075900712,Southern India Education Trust,310 Anna Salai TeynampetChennai T N-600018,0.00
2791,2014-2015,Tamil Nadu,075890229,Southern Rehabilitatioin Society For The Blind,47 C1 Chinniahpenam Anguvilas Road Dindigul Ann Tamil Nadu-,0.00
2792,2014-2015,Tamil Nadu,075820294,Sowbhagya Educational Trust,234 Sri Kapaleeswararar Nagar Neelangarai ChennaiKancheepuramTamilnadu-600041,0.00
2793,2014-2015,Tamil Nadu,076030143,Spastics Society Of Tiruvanmalai Special Education Center,Near Ambedkar  Statute  PolurTiruvannamalai Tamil Nadu-,0.00
2794,2014-2015,Tamil Nadu,076100070,SPEED TRUST,KA MAMANANDHALKALLAKURICHI606202,21338.00
2795,2014-2015,Tamil Nadu,075900859,Springs,No.19/10 3rd East Street  Kamaraj NagarThiruvanmiyur Chennai-600041,0.00
2796,2014-2015,Tamil Nadu,075980251,SRDPS Animal Welfare Organisation,Post Bag No.14195/15 Vallalar Nagar Tirupattur(PO) VelloreTamilnadu-635601,0.00
2797,2014-2015,Tamil Nadu,075820373,SRE KAGABUJANDAR CHARITABLE FOUNDATION,41/77ARIGNAR ANNA STREETSRE KACHABESWARAR NAGARKANCHIPURAM631501,0.00
2798,2014-2015,Tamil Nadu,076080151,Sree Ramajayam Educational Trust,No 45A Vellore to Tiruvannamalai Road Near Railway GatePolur600803,0.00
2799,2014-2015,Tamil Nadu,075900851,Sree Ramarajya Trust,878 Anna Nagar West Extension ChennaiChennai (Tamil Nadu)-600106,0.00
2800,2014-2015,Tamil Nadu,075901249,Sree Siva Educational and Social Welfare Trust,New No.121 Old No.54 Eldams Road Teynampet Chennai.Chennai600018,4694.00
2801,2014-2015,Tamil Nadu,076060074,SREE VINAYAK VIDHYALAYAA CHARITABLE TRUST,3 / 53-B Thottiyanur Paruvachi VillageBhavani Taluk638312,0.00
2802,2014-2015,Tamil Nadu,076080136,Sri Annamalaiyar Trust Help for Lives,407 Main Road Kanji-Post Chengam-Taluk Tiruvannamalai-DistrictTiruvannamalai606702,0.00
2803,2014-2015,Tamil Nadu,076030222,Sri Arunachala Society For Human Welfare And Rural Development,Samudramnalavanpalayam Po ThiruvannamalaiSambuvaryar Dist. Tamil Nadu-,0.00
2804,2014-2015,Tamil Nadu,075901185,Sri Arunodayam Charitable Trust,35 Sivanandan Nagar KolathurChennai600099,3468035.00
2805,2014-2015,Tamil Nadu,075901082,Sri Bala Nandha Educational Trust,No.32State Bank Colony PeramburChennaiTamilnadu-600011,0.00
2806,2014-2015,Tamil Nadu,075950055,SRI DAKSHINAMURTI SEVA SAMITI,CHATTIRAPATTI ROAD VEDAPURITHENI625531,8937.00
2807,2014-2015,Tamil Nadu,075901363,Sri Dhanvantri Trust,Kumara Vijayam Flat A1 Old No 99 New No 187 Royapettah High Road MylaporeChennai600004,72746.00
2808,2014-2015,Tamil Nadu,075850326,SRI G VARADARAJ TRUST,1547 A AVANASHI ROAD  PEELAMEDUCOIMBATORE641004,4035885.00
2809,2014-2015,Tamil Nadu,075901205,SRI GAYATHRI MEDICAL MISSION AND RESEARCH FOUNDATION,"N-27 (Old No.N-465)N Block Second Main Road
Anna Nagar EastChennai600102",37199962.05
2810,2014-2015,Tamil Nadu,076010127,Sri Gnananada Niketan,Thapovanam Tq: Tirukoilur Villupuram Tamil Nadu-605756,1635768.55
2811,2014-2015,Tamil Nadu,076030188,Sri Jai Sankara Educational Trust,Tenkalam Road SonkarnayarNellai Kattabomman T N-627357,9740080.00
2812,2014-2015,Tamil Nadu,075820229,Sri Jayendra Saraswathi Golden Jubilee Educational Institution,(sri Sankara Vidyalaya) Sri Sankara Nagar PammalKancheepuram.-600075,36808.00
2813,2014-2015,Tamil Nadu,075850225,Sri Jayendra Saraswathy Vidyalaya Trust,182 S1 HS Colony Road Singanallur CoimbatoreTamilnadu-641005,0.00
2814,2014-2015,Tamil Nadu,075900142,Sri Jyothi Trust,319 Village Road NungambakkamChennai-600034,0.00
2815,2014-2015,Tamil Nadu,075820247,Sri Kamakoti Ghatikashramam Trust,12 A Panju Kotti Street KancheepuramTamil Nadu-631502,70302629.20
2816,2014-2015,Tamil Nadu,075890128,Sri Kanayakumari Gurukul Ashram,3-48 North StreetKanayakumari624001,6973565.40
2817,2014-2015,Tamil Nadu,075850082,Sri Kanchi Kamakoti Medical Trust,16A Sankara Eye Hospital Road Sathy Road SivanandhapuramSaravanampatti Road Coimbtore641035,553517463.09
2818,2014-2015,Tamil Nadu,075990093,Sri Kannapiran Educational and Charitable Trust,Sri Kanna Nursery and Primary School CompoundMudukulathur623704,0.00
2819,2014-2015,Tamil Nadu,076010168,Sri Lakshmi Hayagriva Trust,2/83Sannathi Street Thiruvendipuram CuddaloreTamilnadu-607401,0.00
2820,2014-2015,Tamil Nadu,075930022,Sri Mahaa Panchamukha Prathyangiri Vedha Dharma Shetra Trust,Vedhiyanendal vilakku Manamadurai SivagangaTamilnadu-630606,0.00
2821,2014-2015,Tamil Nadu,075940224,Sri Mahashadasee Trust,"No. 10 Jawahar Road
Chokkikulam
MaduraiMadurai625002",0.00
2822,2014-2015,Tamil Nadu,075901147,Sri Matha Trust,Gurukrupa 3 Sastha Avenue Thirumazhisai Street Sundaram ColonyEast Tambaram600059,85269.00
2823,2014-2015,Tamil Nadu,075940560,Sri Meenakshi Women Development Trust,5 Sri Sevugaperumal Complex Main Road Anna NagarMadurai625020,0.00
2824,2014-2015,Tamil Nadu,075900926,Sri Muthukrishna Swami Mission Trust,No.1 Third StreetKumaran Colony Vadapalani chennaiTamilnadu-600026,1493938.51
2825,2014-2015,Tamil Nadu,076080054,Sri Nandanar Swamigal Trust,Mariamman Koil 3rd Street TiruvannamalaiTamilNadu-606601,0.00
2826,2014-2015,Tamil Nadu,075901261,SRI PADMAVATHI AMMA AGED HOME,Plot No. 104 No. 10 6th Cross Street Om Sakthi Nagar Extn. MangaduChennai602101,32435.00
2827,2014-2015,Tamil Nadu,075960121,SRI PANDURANGA CHARITIES TRUST,KUMBAKONAM MAYAVARAM MAIN ROADGOVINDAPURAM  VILLAGE TANJORE DISTRICT612101KUMBAKONAM612101,275000.00
2828,2014-2015,Tamil Nadu,075901018,Sri Poorna Mahameru Trust,16/8 Bala Krishna Nackan Street Extn. West Mambalam ChennaiTamilnadu-600033,67000.00
2829,2014-2015,Tamil Nadu,075901294,SRI PRATYAKSHA CHARITABLE TRUST,B-14 3rd Floor Kumara Vijayam 99 Royapettah High RoadMylapore Chennai600004,9649791.00
2830,2014-2015,Tamil Nadu,075980122,Sri Rama Krishna Math,Nattarampalli Vellor North Arcot -635852,1525874.00
2831,2014-2015,Tamil Nadu,075850010,Sri Rama Krishna Mission Vidyalaya, CoimbatoreTamil Nadu-,6974455.48
2832,2014-2015,Tamil Nadu,075900857,Sri Ramacharan Charitable Trust,No.115 Sir PS Sivasamy Salai MylaporeChennai (TamilNadu)-600004,973477.00
2833,2014-2015,Tamil Nadu,075820148,Sri Ramakrishna Math,70 Nellukkara St Kancheepuram ChingleputTn-,976150.00
2834,2014-2015,Tamil Nadu,075900270,Sri Ramakrishna Math,31 Ramakrishna Math Road MylaporeChennai600004,4084279.98
2835,2014-2015,Tamil Nadu,076000056,Sri Ramakrishna Mission Ashram Salem,17 Ramkrishna  Road  Salem Tamil Nadu-636007,2093639.00
2836,2014-2015,Tamil Nadu,075900273,Sri Ramakrishna Mission Ashrama, T.nagarChennai -600017,4190700.00
2837,2014-2015,Tamil Nadu,075880012,Sri Ramakrishna Mission Sarada Vidyalaya,134 Usman Road T. Nagar Chennai - 17.Chennai - 17.600017,12167337.00
2838,2014-2015,Tamil Nadu,076040230,Sri Ramakrishna Sarada Educational Trust,117 Highways Colony TiruchirapallyTamil Nadu.-,200000.00
2839,2014-2015,Tamil Nadu,076100011,Sri Ramakrishna Sarada Trust,Sri Sarada AshramTrichy Trunk Rd. New Edaikkal UlundurpetVillupuram (TamilNadu)-606107,665023.00
2840,2014-2015,Tamil Nadu,076040278,Sri Ramakrishna Tapovanam,Post Box No.1 Po:tiruppakraitturai Tiruchirapalli Tamilnadu -639115,0.00
2841,2014-2015,Tamil Nadu,076080110,Sri ramana Maharshi Natural Remedies Society,Girivalam Road(Opp.to Seenivasa School)AdiannamalaiThiruvannamalaiTamilnadu-606604,0.00
2842,2014-2015,Tamil Nadu,075850222,Sri Ramanandha Moorthy Swamygal Charitable Trust,1/4 Vinayagar Koil Street Navakkarai Post CoimbatoreTamilnadu-641105,0.00
2843,2014-2015,Tamil Nadu,075980129,Sri Ramanasramam,Sri Ramanasramam TiruvannamalaiTamil Nadu-606603,57527368.00
2844,2014-2015,Tamil Nadu,075900998,Sri ramani Ranganayaki Trust,38(57)/A-3 Third Main Road Gandhi Nagar Adyar ChennaiTamilnadu-600020,1976856.09
2845,2014-2015,Tamil Nadu,075901305,SRI RANGANATHA PADUKA VIDYALAYA TRUST,OLD NO 21 NEW NO 31 DESIKA ROAD MYLAPORECHENNAI600004,16907456.00
