1541,2007-2008,Maharashtra,083780860,Society For Initiative In Development And Directed Human Intervention,5-vasshi Saphalya Chs Sector-9/a Navi MumbaiMaharasshtra-400703,0.00
1542,2007-2008,Maharashtra,083780958,Society for Nitrition Education and Health Action,Room No.310Urban Health Centre 60 Ft RoadDharavi MumbaiMaharashtra-400017,6861742.00
1543,2007-2008,Maharashtra,083780010,Society For Promotion Of Area Resources Centre,52 Miami Bhulabhai Desai Road MumbaiMaharashtra-400026,21653629.00
1544,2007-2008,Maharashtra,083870166,Society for Rural and Urban Joint Activities,C/o Yogini Dolke1st floor18/7` Ujwal NagarWardha RoadNagpur Maharashtra-440025,3602260.00
1545,2007-2008,Maharashtra,083780089,Society For Service To Voluntary Agencie,Bombay  Maharashtra-,56467771.00
1546,2007-2008,Maharashtra,083910068,Society for the Prevention of Cruelty to Animals,"""Yashodeep"" Ashok Nagar UdgirLatur (Maharashtra)-413517",0.00
1547,2007-2008,Maharashtra,083990054,Society For The Rehabilitaion Of Paraplegics,Plot No.  52 Sector-9A Navi MumbaiDist- Thane Maharashtra-400703,0.00
1548,2007-2008,Maharashtra,083780041,Society For The Rehabilitation Of Crippled Children,Haj Ali Park  Clerk Road Opp.willingdon Sports ClubMahalaxmi Mumbai -400034,5577188.00
1549,2007-2008,Maharashtra,083990112,Society for the Rehabilitation of the Disabled and the Handicapped,A/4 Lawrance Apts. Bhabola Chulna Vasai Road(W)Thane Maharashtra-401202,1903148.00
1550,2007-2008,Maharashtra,083780705,Society For The Vocational Rehabilitation Of The Retarded,Arya Nagar Municipal School Bldg. Tulsiwadi TardeoMumbai Maharashtra-400034,0.00
1551,2007-2008,Maharashtra,083930218,Society For Welfare Of Physically Handicapped, WanawadiPune Maharashtra-411040,20254.00
1552,2007-2008,Maharashtra,083780832,Society Moved To Install Love With Empathy(smile),13 Pamir Bldg. 258/60  Walkeshwar RoadMumbai (maharashtra)-400006,83894.00
1553,2007-2008,Maharashtra,083780722,Society Of Abbey Of Berne Bombay,St. Joseph The Worker Church Bandra East Mumbai-400501,2696257.00
1554,2007-2008,Maharashtra,083740016,Society Of Amravati Sister, AmravatiMaharashtra-464602,2170484.05
1555,2007-2008,Maharashtra,083930049,Society Of Assumption,Plot No.17 Nagar RoadPune 411014-,12138598.00
1556,2007-2008,Maharashtra,083780178,Society Of Christ The King,F/5  Everad Nagar SionMumbai Maharashtra -,0.00
1557,2007-2008,Maharashtra,083810037,Society Of Daughtesrs Of Mary Chanda,Chunala  P.o. Rajura Chandrapur Maharashtra M. H.-442905,522245.00
1558,2007-2008,Maharashtra,083780049,Society Of Franciscan Brother,Mt. Ponisur S.v.p. Road P.b.- 8470 Borivali (w)Mumbai-400103,0.00
1559,2007-2008,Maharashtra,083780105,Society Of Franciscan Hospitller Sisters,Mt. Mary Road Mount Mary Convent BandraMumbai Maharashtra-400050,653112.00
1560,2007-2008,Maharashtra,083780127,Society Of Friars Minor,C/o Our Lady Of Good Counsel Church SionMumbai-400022,0.00
1561,2007-2008,Maharashtra,083930048,Society Of Friends Of The Sassoon Hospitals,Room No. 80 Sasson General HospitalPune -411001,6418028.00
1562,2007-2008,Maharashtra,083930039,Society Of Ishvani Kendra,Off Nagar Road PuneMaharashtra-411014,1353752.00
1563,2007-2008,Maharashtra,083781001,Society of Pilar,Milton Apartments Flat No. F/214 Near Holy Cross Church JuhuKoliwada Santa Cruz(W)MumbaiMah.-400049,13183.00
1564,2007-2008,Maharashtra,083780167,Society Of Pious Disciples Of Divine Master,113 B.j. Road Bandra (w)Mumbai Maharashtra-400050,0.00
1565,2007-2008,Maharashtra,083780202,Society Of Poor Sister Of Our Lady,Stephen Hall  23 Nathalal Parekh MargMumbai Maharashtra -400001,1047405.99
1566,2007-2008,Maharashtra,083780146,Society Of Sister Of St. Ann,12 Chimbai Road Bandra Mumbai Maharashtra-400050,10345941.34
1567,2007-2008,Maharashtra,083780916,Society of Sisters of Our Lady of Fatima Mumbai Region,Fatima Mata Sadan Mahakali Caves Road Andheri(E)Mumbai Maharashtra-400093,740000.00
1568,2007-2008,Maharashtra,084000008,Society Of Sisters Of St. John,Agaragami Convent Jail Road WardhaMaharashtra-442001,3283766.00
1569,2007-2008,Maharashtra,083860030,Society Of Sisters Of The Cross,Kolhapur 38 Sassoon RoadPune 411001-,1675289.00
1570,2007-2008,Maharashtra,083930090,Society Of St Ursula,Pune 411035   -,13076837.00
1571,2007-2008,Maharashtra,083780144,Society Of St. Francis Xavier Pillar,Bandstand Bandra  (west)Mumbai Maharashtra-400050,1220566.79
1572,2007-2008,Maharashtra,083780045,Society Of St. Paul,23rd Road Tps Iii BandraMumbai 400050-,3888975.00
1573,2007-2008,Maharashtra,083780044,Society Of St. Vincent De Paul,National Council Of India 5 Convent St Colaba MumbaiMaharashtra-400001,82464887.00
1574,2007-2008,Maharashtra,083780090,Society Of St.Francis Industrial Training Institute,Mount Poinsur Borivili (west) Mumbai Maharashtra-400103,0.00
1575,2007-2008,Maharashtra,083780255,Society Of The Divine Word,Svd House 510 32nd Road BandraMumbai Maharashra -400050,17334460.00
1576,2007-2008,Maharashtra,083870147,Society Of The Good Sheperd Sisters,Plont No- 172 Mecosabagh Christian Colony BenzonbaghDist- Nagpur Maharashtra -440004,2790448.00
1577,2007-2008,Maharashtra,083780139,SOCIETY OF THE HELPERS OF MARY,Generalate Shraddha Vihar Veera Desai Road Andheri (w)mumbaiMaharashtra-400058,69535934.24
1578,2007-2008,Maharashtra,083780152,Society Of The Sacred Heart,Sophia Campus Bhulabhai Desai RoadMumbai 400026-,2307269.65
1579,2007-2008,Maharashtra,083850001,Society Of The Servants Of The Holy Spirit,Holy Spirit Hospital  Mahakali Road Andheri (e) MumbaiMaharashtra-400093,396416.86
1580,2007-2008,Maharashtra,083780491,Society Undertaking Poor Peoples Onus for Rehabilitation,Manthan Plaza 3rd FloorNehru RoadVakola Market Santacruz(E),7869202.00
1581,2007-2008,Maharashtra,083920002,Socio-economic Development Corp.(trust),At & Post Kerwadi Tal. GangakhedParbhani  431720-,18760088.26
1582,2007-2008,Maharashtra,083780050,Socty Of The Congregation Of Fr.brothers,P O Box 8470  Mount Poinsur Borivli (west)Mumbai -400103,0.00
1583,2007-2008,Maharashtra,083930144,Socy Of St. Mary The Virgin In India,P.t.r. No.f-1881 5 Gurdwar PethPune  411042-,5401019.00
1584,2007-2008,Maharashtra,083960042,Socy. For Welfare Of Mentally Handicappd,Bal Gandharv Natyagrahvijapur Ves MirajSangli   416410-,0.00
1585,2007-2008,Maharashtra,083780879,Somaiya Vidyavihar,Fazalbhoy Building 45/47 Mahatma Gandhi Road FortMumbai (Maharashtra)-400001,1034783.00
1586,2007-2008,Maharashtra,083780341,Soroptimist International Ofnorth Bombay,13 Rebello House 132 Hill Road Bandra (w)Mumbai - 400050-,111254.00
1587,2007-2008,Maharashtra,083930479,Sosva Training and Promotion Institute,MHADA Commercial Complex 1st Floor Maharashtra Housing Board Colony Nagpur ChawlYerwada411006,0.00
1588,2007-2008,Maharashtra,083780588,Sound & Picutre Archives  For Resrch On Women,B-32jeet Nagar J.p. Road VersovaMumbai 400061-,233405.00
1589,2007-2008,Maharashtra,083930066,South Western India Bible Institute,Post Box -28 JunnarPune 410502-,0.00
1590,2007-2008,Maharashtra,083780620,Soverdia Trust,510 Svd House 32nd Road Bandra MumbiMaharashtra -400050,1092611.00
1591,2007-2008,Maharashtra,083780824,SPARC SAMUDAYA  NIRMAN  SAHAYAK,503 Jolly Bhawan 1 New Marine Linesmumbai400020,14954771.00
1592,2007-2008,Maharashtra,083930114,Spicer Memorial College Of  7th Day Adventists,Aundh Road Ganesh Khind Pune Maharashtra-41107,2697802.27
1593,2007-2008,Maharashtra,083930076,Spiritual Life Centre Fellowship, NasrapurPune 412213-,79399.65
1594,2007-2008,Maharashtra,083870141,Sreh Bahuddeshiya Sanstha Nagpur,Market Samaj Building Sakkardare SquaneDist- Nagpur Maharashtra-440009,0.00
1595,2007-2008,Maharashtra,083780496,Sri Bhagawati Sai Sansthan,Plot No.400/1near Rly Station PanvelRaigad Maharashtra-410206,1108968.00
1596,2007-2008,Maharashtra,231650736,Sri Chaitanya Seva Trust,Bhaktivedanta HospitalSrishti ComplexBhaktivedanta Swami MargMira Road(East)Thane401107,0.00
1597,2007-2008,Maharashtra,083780601,Sri Mahavir Jain A Vidyalaya,50/54 August Kranti Marg  Gowalia Tank MumbaiMaharashtra-400036,1057109.00
1598,2007-2008,Maharashtra,083930244,Sri Prayag Dham Trust,Railway Stn Uruli Tq Haveli PuneMaharashtra-412202,1728256.00
1599,2007-2008,Maharashtra,083781041,Sri Satya Sai Books and Publications Trust,Dharmaksetra Mahakali Caves Road Andheri MumbaiMaharashtra-400093,357509.00
1600,2007-2008,Maharashtra,083750058,ST  MARYS MISSION TRUST,Trimurti Ganapur AurangabadMahrashtra-,2338070.18
1601,2007-2008,Maharashtra,083780108,St Anthony's Home & High School Society,J. Boman Bahram Marg MumbaiMaharashtra-400003,2450017.08
1602,2007-2008,Maharashtra,083870026,St Anthonys Education Society,Ajni  NagpurMaharashtra-440003,0.00
1603,2007-2008,Maharashtra,083720008,St Hilda's Boarding,St. Monica's Compound Savedi RoadAhmednagar 414003-,313761.00
1604,2007-2008,Maharashtra,083720013,St Johns Church,Bhingar AhmednagarMaharashtra-414002,720000.00
1605,2007-2008,Maharashtra,083780106,St Joseph Roman Catholic Parish Society,C/o St Joseph Church New Mill Rd Kurla MumbaiMaharashtra-400070,0.00
1606,2007-2008,Maharashtra,083990029,St Joseph's Church,Umralla Sopara P.o. Via- Nallasopara Tal. BasseinThane - 401203-,0.00
1607,2007-2008,Maharashtra,083810013,St Mary's Chruch Society,Mariabagh  Po Balapur Talodhi Rds.e.rly.tq.nagbhirChandrapur 442701-,1730834.00
1608,2007-2008,Maharashtra,083810008,St Michaels Hostel For Boys & Girls,Naginabagh Mission Compound ChandrapurMaharashtra-442401,125425.00
1609,2007-2008,Maharashtra,083870050,St Ursula Girls Hostel,Nagpur Diocese Cni Civil Lines NagpurMaharashtra-440001,385200.00
1610,2007-2008,Maharashtra,083780103,St. Andrew's Educational Foundation,St. Andrew's College  Bandra West Mumbai Maharashtra-400050,0.00
1611,2007-2008,Maharashtra,083860016,St. Andrews Leprosy Clinic Kagal,Mary Wanless Hospital Hpo KolhapurMaharashtra-416003,0.00
1612,2007-2008,Maharashtra,083780316,St. Anthony's Church,Nehru Road Vakola Santacruz(east)Mumbai -400055,0.00
1613,2007-2008,Maharashtra,083780066,St. Anthony's Educational Trust,267/1-2 S.m. Chawl DharaviBombay  Maharashtra-400017,300000.00
1614,2007-2008,Maharashtra,083780564,St. Anthony's High School,Kherani Road SakinakaMumbai -400072,0.00
1615,2007-2008,Maharashtra,083780894,St. Charles Charitable Society,St. Charles Convent Vakola Santacruz (East)Mumbai (Maharashtra)-400055,555444.00
1616,2007-2008,Maharashtra,083870064,St. Charles Education Society, NagpurMaharashtra-440006,9261853.00
1617,2007-2008,Maharashtra,083780165,St. Columba School,Gamdevi Mumbai  -400007,0.00
1618,2007-2008,Maharashtra,083930122,St. Crispin's  Home,F.p.no.10 Karve Road ErandawanaPune-411004.-,1614757.00
1619,2007-2008,Maharashtra,083870117,St. Francis De Sales Parishsociety,Kamptee Road Mohan NagarNagpur 440001-,0.00
1620,2007-2008,Maharashtra,083780058,St. Francis Xavier's Chapel,Middle Colaba  MumbaiMaharashtra -400005,7170780.39
1621,2007-2008,Maharashtra,083930349,St. George Balikagram,St. Thomas Nagar Mamurdi P.b. No.1 Dehu Road Cantt. P.o.Pune (maharashtra)-412101,306200.00
1622,2007-2008,Maharashtra,083990041,St. Gonsalo Gracia Education Trust,Papdy Vasai P.o.-  VasaiDistrict- Thane Maharashtra-401201,0.00
1623,2007-2008,Maharashtra,083780119,St. Ignatius Conference Society Of St Vincent De Paul,Sune Gunji Road Jacob CircleMumbai -400011,47076.00
1624,2007-2008,Maharashtra,083780132,St. Joseph's Home Society,St. Joseph's Home & Nursery Dr. (mrs.) Leela Melville Marg.Byculla Mumabi-400008,1399640.50
1625,2007-2008,Maharashtra,083780286,St. Joseph's Technical School (i.t.i.),Premier Automobiles Road Kurla(w)Mumbai Maharashtra-400070,2938808.00
1626,2007-2008,Maharashtra,083780425,St. Louis Society,Four Bungalows Andheri (west)Mumbai Maharashtra -400053,0.00
1627,2007-2008,Maharashtra,083950001,St. Luke's Hospital,Vengurla Sindhudurg416516-,11421.00
1628,2007-2008,Maharashtra,083930356,St. Luke's Medical Society,15 Solapur Road Pune Maharashtra -411001,4929080.00
1629,2007-2008,Maharashtra,083720012,St. Lukes Hospital,Srirampur AhmednagarMaharashtra-413709,2771115.00
1630,2007-2008,Maharashtra,083780135,St. Micheal's Church,Lady Jamshedji Road MahimMumbai-400016,1687754.10
1631,2007-2008,Maharashtra,083900002,St. Patricks Church,60 Dhondy Road Dealali CampNasik Dt Maharashtra-,0.00
1632,2007-2008,Maharashtra,083970016,St. Paul School,Camp Satara Satara415001-,0.00
1633,2007-2008,Maharashtra,083780138,St. Pius College,Aarey Road Goregaon EastMumbai 400063-,2601680.00
1634,2007-2008,Maharashtra,083780471,St. Sebastian`s Church,Marouli Village ChemburMumbai Maharashtra -400074,0.00
1635,2007-2008,Maharashtra,083720010,St. Teresa Church Harigaon,Harigaon Tal ShrirampurAhmednagar -413718,1008688.00
1636,2007-2008,Maharashtra,083781094,St. Teresas Society,Santacruz (West)S.V.Road400054,0.00
1637,2007-2008,Maharashtra,083740031,St. Thomas Boys Hostel,Nr. T.b.hospital Reserve Line Po Rukhamani Nagar Amravati444603Maharashtra-,189600.00
1638,2007-2008,Maharashtra,083870080,St. Ursi;a Gorl'shigh School,Red Cross Road Civil LinesNagpur.-440001,0.00
1639,2007-2008,Maharashtra,084000018,St.Anthony's Catholic Church Society,Civil Lines Po WardhaWardha - -442001,0.00
1640,2007-2008,Maharashtra,083780275,St.Catherine's Society,C/o St. Cathrine's Home Veer Desai Road Andheri(w)Mumbai -400058,9986336.25
1641,2007-2008,Maharashtra,083780206,St.dominic Savio High School,Mahakali Caves Road Andheri EastMumbai 400093-,3976556.01
1642,2007-2008,Maharashtra,083990116,St.Gonsalo Garcia Ashram,Bassein fort Vasai(W) ThaneMaharashtra-401201,3330.00
1643,2007-2008,Maharashtra,083780020,St.Joseph's Education And Medical Relife Society,St. Joseph's Convent 64 A Hill Road BandraMumbai Maharashtra-400050,9177368.48
1644,2007-2008,Maharashtra,083780399,St.Teresa Church,252 Rajaram Mohanroy Road GirgaumMumbai -400004,0.00
1645,2007-2008,Maharashtra,083870205,START,C/O Chandrabhan Patil House No. 23 Ward No. 14 Gajanan NagarNagpur Maharashtra440027,1007410.00
1646,2007-2008,Maharashtra,083780660,Stepping Stone Charitable Society,Flat No 2 Datta B Apartments Ramakrishna Mission RoadKhar West Mumbai400052,4254202.78
1647,2007-2008,Maharashtra,083930060,Stree Adhar Kendra,Anand Clinic Satawwadi HadapsaarPune 411028-,2840571.00
1648,2007-2008,Maharashtra,083870130,Stree Atyachar Virodhi Parishad,44 Jusitice Kotwal Nagar Prathpanagr Ring RoadNagpur Maharashtra-440022,0.00
1649,2007-2008,Maharashtra,083780464,Stree Bal Sanjivani Trust,Rock - Cliff 2nd Floor Mumbai Maharashtra -400050,39022.00
1650,2007-2008,Maharashtra,083780322,Stree Hitkarni,Lokmanya Nagar Compound Kakasaheb Godgil Marg DadarMumbai 400025      Maharashtra-,120900.00
1651,2007-2008,Maharashtra,083780682,Stree Mukti Snaghatana,31 Shramik Lokamaya Tilak Colony Road No-3 Dadar(east)Mumbai      Maharastra-400014,2122160.00
1652,2007-2008,Maharashtra,083930411,Streevani,1 & 2 Lotus Building Neco gardens Viman Nagar PuneMaharashtra-411014,1390989.00
1653,2007-2008,Maharashtra,083780418,Stri Zarthosti Mandal,Sir Ratan Tata Insititute 35 N.s. Patkar MargMumbai -400007,0.00
1654,2007-2008,Maharashtra,083930059,Student  Welfare Association,1182/1/4 Fergusson College RoadPune Maharashtra-411055,8943644.00
1655,2007-2008,Maharashtra,083781074,Sujaya Foundation,401 Lotus House New Marine Lines MumbaiMaharashtra-400020,235795.00
1656,2007-2008,Maharashtra,083740071,Sulabh Educational and Social Society,Pushpanil Banglownear Treasury OfficeCamp-Amravati Amravatimaharashtra-444602,0.00
1657,2007-2008,Maharashtra,083780543,Sulabha Trust For Special Edu. & Reserch,8/3 Tilak Nagar ChemburMumbai 400089-,331794.00
1658,2007-2008,Maharashtra,083780658,Sundeep Foundation,118jolly Bhavan No.1. 10 New Marine LinesMumbai 400020-,120087.00
1659,2007-2008,Maharashtra,083930379,Sunil Wankhede Medical Foundation,Sunil Niwas Kiwale Vikas Nagar Tal. HaveliPune-Maharashtra-412113,0.00
1660,2007-2008,Maharashtra,083930461,Sunni Jumma Masjid Educational Society,Sultan Campus Sultanpur Road Manchar Tal AmbegaonPune Maharashtra-410503,0.00
1661,2007-2008,Maharashtra,083780690,Support Unemployed & Needy,602 Beacon R.k. Mission Road  Santacruz  West MumbaiMaharashtra-400054,6875.00
1662,2007-2008,Maharashtra,083780817,Surbhi Foundation For Research and Culture Exchange,Bungalow No 179 S V P NagarNear Versova Telephone ExchangeAndheri(West),300000.00
1663,2007-2008,Maharashtra,083780371,Survarna Charitable Trust,Suvarna General Hospital Mar2 Kastur Park Borivli(w)Bombay 400092-,0.00
1664,2007-2008,Maharashtra,083930299,Sushrut Medical Care & Research Society,1160/61 Shivaji Nagar Dist- PuneMaharashtra-411005,0.00
1665,2007-2008,Maharashtra,083820007,Suvarta Alliance Ministries Trust,Church CompoundNandurbar425412,5747372.16
1666,2007-2008,Maharashtra,083920019,Suyojini Sevabhavi Sanstha,At Post : Ghatangra GangakhedPARBHANI   Maharashtra-431536,0.00
1667,2007-2008,Maharashtra,083930260,Swa' Roopwardhini,Fpno.22/1 Mangalwar Peth Barne Road Park ChowkPune411011-,589096.00
1668,2007-2008,Maharashtra,083930413,Swabhimaan,9Summer Garden South Main Road Koregaon Park PuneMaharashtra-411001,6595287.00
1669,2007-2008,Maharashtra,083780707,Swadhar,C/o Keshav Gore Smarak Trust  Aarey Road Goregaon (west) MumbaiMaharashtara-400062,2228178.00
1670,2007-2008,Maharashtra,083930460,Swami Chandan Prakash Ashram Trust,747Bhawani Peth PuneMaharashtra-411002,7500000.00
1671,2007-2008,Maharashtra,083780666,Swami Gangeshwar Foundation,C/o Shri Ishwar H.Thadhani 1407 Dalamal Tower 211 Nariman PointMumbai400021,40621.00
1672,2007-2008,Maharashtra,083780678,Swami Ramanand Shastri Charitable Trust,201 Rangoli Time Complex Dr. B Ambedkar Road Parel (east)Mumbai Maharshtra-400012,1656000.00
1673,2007-2008,Maharashtra,084050009,Swami Samarth Mahila Bahuudesiya Seva Santha,Shani Mandir ChowkOld Jalna JalnaMaharashtra-431203,0.00
1674,2007-2008,Maharashtra,083780825,Swami Shri Prempuriji Ashram Trust,Prempuri Adhyatma Vidya Bhavan Swami Prempuriji Chowkbabulnath Road Mumbai Maharashtra-400007,0.00
1675,2007-2008,Maharashtra,083870129,Swami Vivekanand Medical Mission,19 Samartha Nagar (west)  NagpurMaharashtra-440015,1096110.00
1676,2007-2008,Maharashtra,084010031,Swapanapurti Shikshan Wa Khadi Gramodhog Prasarak Mahial Mandal,Belora Savalkar Bhavan  Behind Bhagat Singh GroundGedamnagaryavatmal-445001,0.00
1677,2007-2008,Maharashtra,083850007,Swarga Dwar,Village Rohinjan Panvel TalukaDistrict- Raigad -410208,5396500.00
1678,2007-2008,Maharashtra,083900065,Swargiya Annasaheb Tatha Sudhir Baburao Pethkar Shikshan Prasarak Sanshta,1170BGurukrupa Shivaji Road Malegaon Camp MalegaonNashikMaharashtra-423105,0.00
1679,2007-2008,Maharashtra,083930419,Swaroop Yog  Pratishthan,885/3Bhandarkar Institute Road PuneMaharashtra-411004,1366878.00
1680,2007-2008,Maharashtra,083780808,Swayam Shikshan Prayog,6/16 Blossom Co-op Housing Society Ltd Minlitary Road Marol Andheri EastMumbai400059,37856224.00
1681,2007-2008,Maharashtra,084000033,Takshashila Bahuuddeshiya Shikshan Sanstha,Wardha C/o C.b. Bhujade Shivnagarward No.Behind Shivaji Prathmik School -442001,0.00
1682,2007-2008,Maharashtra,083750043,Talat Shikshan Mandal,Kabadipura  AurangabadMaharashtra-431001,414665.00
1683,2007-2008,Maharashtra,083860221,Talimi Aadar-e-Mubarakiya,Aurwad Tal Shirol District KolhapurMaharashtra-,0.00
1684,2007-2008,Maharashtra,083780208,Tara Cultural Trust,Sandeepany Sadhanalaya Saki Vihar RoadMumbai 400072-,1508104.01
1685,2007-2008,Maharashtra,083870161,Tarkeshwar Bahuuddeshiya Samaj  Seva &Shikshan Prasaran Sanstha,19-Doctor's  Colony Chhatrapati  Nagar NagpurMaharashtra-440015,60371.00
1686,2007-2008,Maharashtra,083790007,Tata Institute Of Social Sciences,Po Box 8313 Sio Trombay Rd Deonar MumbaiMaharashtra-400088,22944253.00
1687,2007-2008,Maharashtra,083780359,Tata Memorial Centre,Bombay-12.   -,16267658.41
1688,2007-2008,Maharashtra,083780367,Taylor Memorial Methodist Church,Bombay    -400008,0.00
1689,2007-2008,Maharashtra,083790018,Teacher's Education Society,Ward No.6 Iqbal Nagar Buldana (Maharashtra) -443001,0.00
1690,2007-2008,Maharashtra,083870034,Teen Action International,1 Halleujah Road Taj NagarNagpur 440027-,0.00
1691,2007-2008,Maharashtra,083780219,Tenrikyo Indo Mission,C/o M. I. Jani      Ishwardas Mansionc-block Nana-chowkMumbai 400007-,0.00
1692,2007-2008,Maharashtra,083810023,Tera Prem Church Society,Warur Road Warur P.o. Tq. Rajura        MaharashtraChandrapur 442905-,633652.00
1693,2007-2008,Maharashtra,083930012,Terres Des Homes (g) India Programme,781 Regie House Pudumji Park Pandita Ramabai Road PuneMaharashtra-411002,225237288.00
1694,2007-2008,Maharashtra,083990022,Thane Zila Stree Ahuti Jagriti Samiti,Vikaswadi Kashad Hill Tq. Daharm ThaneMaharashtra-,0.00
1695,2007-2008,Maharashtra,083930126,The  Poona  Blind  Men   Association,PBMAS H V DESAI EYE HOSPITAL 93 TARAWADE VASTI MOHAMMADWADIHADAPSAR PUNE411060,9277632.65
1696,2007-2008,Maharashtra,083781091,THE AANGAN TRUST,48/49 1ST FLOOR TARDEO A.C.MARKETTARDEO ROAD TARDEOMUMBAI400034,1688234.00
1697,2007-2008,Maharashtra,083780211,The Ambekar Institute for Labour Studies,Mazdoor Manzil G.d. Ambedkar RoadMumbai 400012-,4414468.00
1698,2007-2008,Maharashtra,083780492,The American Jewish Joint District Committee,3 Rodef Shalom 23d.k. Marg Byculla Mumbai Maharashtra-400027,13457941.00
1699,2007-2008,Maharashtra,083780476,The American School Of Bombay,Sf2g Block bandra K Comp Road Bandra (e) Mumbai Maharashtra-400051,4882031.00
1700,2007-2008,Maharashtra,083780813,The Anandilal Podar Trust,Podar Chambers 4th Floor 109 S.a.brelvi Road FortMumbai Maharashtra-,0.00
1701,2007-2008,Maharashtra,083930361,The Apostles Of The Trinity,Flat No.5 Bldg No.4golf Residency Survey No.103 Sub Plot No. 23don Bosco Marg Yerwada Pune.-411006,0.00
1702,2007-2008,Maharashtra,083930178,The Apostolic Carmel Society Of Pune,Mount Carmel Convent Lullanagar Pune Maharashtra -411040,11875.00
1703,2007-2008,Maharashtra,083780911,The Asian Film Foundation,1/18 Broadway Shopping Centre DadarMumbai (Maharashtra)-400014,1635560.00
1704,2007-2008,Maharashtra,083930173,The Assumpta Society,105 Koregaon ParkPune 411001-,2464129.00
1705,2007-2008,Maharashtra,083930197,The Automotive Research Assn. Of India,Post Box No. 832 Pune -411004,0.00
1706,2007-2008,Maharashtra,083780014,The Bandra Holy Family Hospital Society,St Andrews Road Bandra MumbaiMaharashtra -400050,2116675.00
1707,2007-2008,Maharashtra,083780431,The Bandra Parsi Convalsecent Home,For Women And Children 48 Lands End BandraMumbai 400050-,0.00
1708,2007-2008,Maharashtra,083780354,The Bd Petit Parsi General Hospital,Bomanjee Petit Road Cumballa Hill MumbaiMaharashtra-400036,21191126.00
1709,2007-2008,Maharashtra,083850016,The Bethany Society,Jeevanalaya Kolkhe Vil Panvel Ongc Post Raigad Maharashtra-410221,40361.00
1710,2007-2008,Maharashtra,083780926,The Bhatia General Hospital,Tardeo Road MumbaiMaharashtra-400007,0.00
1711,2007-2008,Maharashtra,083990110,The Blind Association,Sarasvati Apt. D-3/4 Shiv Basav Kalyan NagarAmbernath(E) Thane Maharashtra-421501,1679090.00
1712,2007-2008,Maharashtra,083870044,The Blind Relief Association,South Ambazari Road Nagpur440022-,302410.00
1713,2007-2008,Maharashtra,083740034,The Blind Welfare Society,Wadali Road Dist. Amravati. -,0.00
1714,2007-2008,Maharashtra,083780771,The Bombay Community Public Trust,"Ramon House 5th Floor
169 Backbay Reclamation
H T Parekh Marg
ChurchgateMumbai400020",404100.00
1715,2007-2008,Maharashtra,083780053,The Bombay Diocesan Society,19 Hazarimal Somani Marg FortMumbai 400001-,1299375.00
1716,2007-2008,Maharashtra,083781023,The Bombay diocesan Trust Association Pvt Ltd,19 Hazarimal Somani Marg MumbaiMaharashtra-400001,0.00
1717,2007-2008,Maharashtra,083780740,The Bombay Humanitarian League (Shri Mumbai Jivdaya Mandali),125/127 Daya Mandir Bldg; Iind  Floor Mumbadevi RoadMumbai Maharashtra-400003,1608963.00
1718,2007-2008,Maharashtra,083781030,THE BOMBAY INTERNATIONAL SCHOOL ASSOCIATION,Gilbert Building Babulnath 2nd Cross RoadMumbai Maharashtra-400007,0.00
1719,2007-2008,Maharashtra,083780521,The Bombay Mothers & Children Welfare Society,Bdd Chawl No.10 N.m. Joshi MargMumbai -400013,0.00
1720,2007-2008,Maharashtra,083780446,The Bombay Soc For Prev.of Cruelty Animl,Dr. S.s. Road ParleMumbai -400012-,4000.00
1721,2007-2008,Maharashtra,083780062,The Bombay Society Of The Franciscan Sisters Of Mary,Villa Theresa 66dr.gopal Rao Deshmukh MargMumbai Maharashtra-400026,127875.00
1722,2007-2008,Maharashtra,083780147,The Bombay Xavierian Corporation Ltd,Vinayalaya P.o.- Midc Chakala Andheri (e) MumbaiMaharashtra -400093,28137174.63
1723,2007-2008,Maharashtra,083780776,The Bridge Public Charitable Trust,36 Oasis Vakola Santacruz (e)Mumbai (maharashtra)-400055,977704.00
1724,2007-2008,Maharashtra,083780637,The Central Society For The Education Of The Deaf,3rd F.municipal Sch Bldgfu Rd Opp.ymca Swiming PoolagripadaMumbai -400011,248138.00
1725,2007-2008,Maharashtra,083780719,The Chandraseniya Kayastha Prabhu Education Society,C.k.p. Dnyatigriha Ram Maruti Road DadarMumbai Maharashtra-400028,0.00
1726,2007-2008,Maharashtra,083780677,The Chitrapur Saraswat Education & Relief Society,F-1/(a) Saraswat Colony Santacruz(west)Mumbai Mahrashtra-400054,390694.00
1727,2007-2008,Maharashtra,083990048,The Church Of  The Infant Jesus,Ganesh Nagar Dombivli (west) Thane Maharashtra -421202,0.00
1728,2007-2008,Maharashtra,083780863,The Company Theatre,"A WING 101 CARNATION
OFF YARI ROAD VERSOVA ANDHERI WESTMUMBAI400061",611274.00
1729,2007-2008,Maharashtra,083740029,The Corporation Of Sister Of Holy Cross,C/o Holy Cross Convent Camp  Amravati.Amravati 444602-,0.00
1730,2007-2008,Maharashtra,083781106,The D.D. Mehta Memorial Trust,G-18 Cusrow Baug S. Bhagat Singh RoadColaba Mumbai Maharashtra400001,0.00
1731,2007-2008,Maharashtra,083780241,The Diamond Jubilee Trust,Diamond Complex 3rd Floor 39/43 Nesbit Road MazgaonMumbai400010,180000.00
1732,2007-2008,Maharashtra,083750001,The Diocese Of Aurangabad,Bishop House AurangabadMaharashtra-,19485005.68
