S.No,Year,State,Registration No,Association name,Address,Amount of FC Received
1,2007-2008,Maharashtra,083780821,A Quest For Knowledge Hope Opportunity & Justice(khoj),Y Tadkeshwar Chawl Ramwadi Jogeshwari(east) MumbaiMaharashtra-40060,160380.00
2,2007-2008,Maharashtra,083900031,A.I.disabled Rehablit.educational Instt.,Datta Mandir Road Behind Mukti DhamNashik - 422101-,3161.00
3,2007-2008,Maharashtra,083820037,Aadi Janta Vidya Prasarak Mandal Dhule,Aadarsh Nagar Shirpur Tal. Shirpur Dhule Maharashtra -425405,0.00
4,2007-2008,Maharashtra,083781097,AAKAR CHARITABLE TRUST,The Phonix Mills Ltd 462Senapati Bapat MargLower Parel Mumbai Maharastra400013,0.00
5,2007-2008,Maharashtra,083781010,Aakar Mumbai,C/oMrsNirmala Gajanam KadamR.No. 1379B.No.6Sane Gurugi colonyMalvaniMalad(W)MumbaiMaharashtra-400060,0.00
6,2007-2008,Maharashtra,083930225,Aalochana Cent.for Docu.& Res. On Women,11-b Kanchan Gali ErandhavanPune-,174076.00
7,2007-2008,Maharashtra,083810020,Aamhi Aamachya Arogya Sathi,At Po Taluka : Kurkheda Gadchiroli441209  M.s.-,6825859.00
8,2007-2008,Maharashtra,083990074,AASARA,B-24 Praful Nakhawa Chendani Koliwada Thane East Maharashtra-400603,4020128.16
9,2007-2008,Maharashtra,083930450,Aashray Charitable Trust,Pune Adventist Hospital Salisbury Park Gultekdi PuneMaharashtra-411038,0.00
10,2007-2008,Maharashtra,083950023,Aavishkar Society for Development of Mentally Handicapped,E-95 MIDC Mirjole RatnagiriMaharashtra-415639,86525.00
11,2007-2008,Maharashtra,083780857,Aawaaz-e-niswaan,Ist Floor Jain High School 84-samuel Street DongriMumbai(maharashtra)-,5269693.50
12,2007-2008,Maharashtra,083900052,Abhivyakti Media For Development,31-a Kalyani Nagar Anandvali Gangapur Road  Nashik Maharashtra-422005,6805437.00
13,2007-2008,Maharashtra,083850003,Academy For Development Science,P.o. Kashele Karjat TalukaRaigad 410201-,3266676.15
14,2007-2008,Maharashtra,083920011,Acharya Narendra Dev EducationalSocialEconomical Dev.Research Project and Bharat Padyatri,Center Parbhani Kranti NagarOpp.Anusaya TalkiesParbhani Maharashtra-431401,0.00
15,2007-2008,Maharashtra,083990092,Achkan Educational Trust,703-Kapoor Tower-3 Jesal Park Bhayander (East)Thane (Maharashtra)-401105,0.00
16,2007-2008,Maharashtra,083780317,Acil Navasarjan Rural Dev. Foundation,408  NEW UDYOG MANDIR NO.2 MOGUL LANE MAHIM (WEST)MUMBAI400016,60000.00
17,2007-2008,Maharashtra,083930013,Action For Agricultural Renewal In Maharashtra,Bld No.2/23 A-braisoni Park  Market Yard PuneMaharashtra-411037,8190021.00
18,2007-2008,Maharashtra,083930291,Action For Self-reliance Hope&awareness,E-3/14 Salunke Vihar KondhwaPune 411048-,1182723.00
19,2007-2008,Maharashtra,083780396,Acworth Leprosy Hospital Society For Research Rehabilitaion & Edu. In Leprosy,Wadala BombayMaharashtra-400031,1889801.00
20,2007-2008,Maharashtra,083780204,ADAPT Able Disabled All People Together,"Upper Colaba Road
Opp. Afghan Church
Colaba.MUMBAI400005",1703745.00
21,2007-2008,Maharashtra,083910094,Adarsh Khadi and Village Industries Development Society,Sai SadanLaxmi Colony Old Ausa Rd LaturMaharashtra-413531,0.00
22,2007-2008,Maharashtra,083910087,Adarsh Mahila Griha Udyog,C/o Shree Sales and Services ChandranagarOpp.Amba Mata MandirLatur413512,0.00
23,2007-2008,Maharashtra,083900015,Adharashram,491/6 Gharpure GhatNashik 422002-,1749340.00
24,2007-2008,Maharashtra,083780835,Adhra Karnataka Dalita Varga Sangha,140/9 Seti Bai Laxmi Chawl  Dharavi Cross RoadMumbai -400017,0.00
25,2007-2008,Maharashtra,083810048,Adhunik Kisan Shikshan Saunstha,At/Post-Bramhapuri ChandrapurMaharashtra-441206,0.00
26,2007-2008,Maharashtra,083780625,Aditya Birla Foundation,Industry House Ist Floor 159  Churchgate Reclamation Mumbai Maharashtra -400021,0.00
27,2007-2008,Maharashtra,083990031,Adivasi Sahaj Shikshan Parivar,250 K Shaniwar Peth PuneMaharashtra-411030,989163.00
28,2007-2008,Maharashtra,083820012,Adivasi Seva Shiksan Sangh,At Kalamba Post Warsa Tal Sakri Dhule -424306,190000.00
29,2007-2008,Maharashtra,083781007,Adivasi Unnati Mandal,C/o Kirti Works(Tablets) 98-B T.H. Kataria Marg Matunga(WR)Mumbai Maharashtra-400001,172053.00
30,2007-2008,Maharashtra,084030007,Adivasi Vikas shikshn Sanstha,Mulchira Post Mulchira Taluka Mulchira GadchiroliMaharashtra-442707,0.00
31,2007-2008,Maharashtra,083780800,Adorers Congregation Mumbai,Sisters Adorers Marol Maroshi Road Andheri (east)Mumbai (maharashtra)-400059,14097995.00
32,2007-2008,Maharashtra,083930378,Advanced Centre for Water Resources Develoment & Management,Plot No.4Lenyadri Co-operative  Housing SocietyPashan-Sus Rd PashanPuneMaharashtra-411021,3505367.00
33,2007-2008,Maharashtra,083780376,Aga Khan Health Service India,39/43nesbit Road Diamon Comp MazagaonMumbai 400010-,7192794.00
34,2007-2008,Maharashtra,083780374,Agakhan Education Service India,"2nd Floor Ancillary Building
39/43 Diamond Complex 
Nesbit Road MazgoanMumbai400010",26346905.00
35,2007-2008,Maharashtra,083780828,Agape Trust,11 Sujata Niwas Co.op. Society S.vroad Bandra (w)Mumbai Maharashtra-400050,250000.00
36,2007-2008,Maharashtra,083780302,Agnel Charities,(agnel Seva Sangh) Bandstand BandraMumbai-400050,19520788.48
37,2007-2008,Maharashtra,083810007,Agricultural Development Project Of Cni Diocese Of Nagpur,Naginbag Farm ChandrapurM.s.-,0.00
38,2007-2008,Maharashtra,083930017,Agricultural Development Trust,Dist.-poona Maharastra State -,0.00
39,2007-2008,Maharashtra,083990014,Agro Industries & Tribal Wel. Foundation,Kosbad Hill BorliThane 401701-,0.00
40,2007-2008,Maharashtra,083910075,Ahailya Bahuudeshiya Shikshan Prasarak mandal,Shree Nagar laturMaharashtra-413531,0.00
41,2007-2008,Maharashtra,084080001,Ahilyadevi Shikshan Prasarak & Bahuuddeshiya Mandal,At Po-uklipen Tq & Distt. WashimMaharashtra-444505,0.00
42,2007-2008,Maharashtra,083780505,Ahlulbayt (as) Foundation,Najafi House 159 Nishanpara Road Dongri MumbaiMaharashtra-400009,0.00
43,2007-2008,Maharashtra,083720017,Ahmed Nagar School Of Theology & Social Science Ahmednagar Maharashtra,P.o.box 21 Ahmednagar CollegeAhmednagar -414001,0.00
44,2007-2008,Maharashtra,083720065,Ahmednagar Boy's High School,Station Road Ahmednagar -414001,0.00
45,2007-2008,Maharashtra,083781088,Aids Combat International,2 Nandra Mansion Goraswadi Malad (W) MumbaiMaharashtra-400064,99563.00
46,2007-2008,Maharashtra,083960077,Ajinkya Foundation Kupwad,Tal Miraj District Sangli House No. 1318 Nr Lal Jain MandirKupwad Sangli Maharashtra-416425,0.00
47,2007-2008,Maharashtra,083870202,Akhil Bhartiya Apang Kalyankari Bhauuddeshiya Sanstha,Near Mahuli Mandir S.R.P.F. Road Jaitala Last Bus Stop JaitalaNagpur Maharashtra-440016,0.00
48,2007-2008,Maharashtra,083990045,Akhil Bhartiya Magasvarjiya Samaj Probo-,16 Prakash Apartment Katemanivali Kalyan (east)Thane -421306,0.00
49,2007-2008,Maharashtra,083730015,Akot Rotary Charitable Sanstha Akot,Popatkheda Road Opp. Civil Court AkotAkola Distt. (maharashtra).-444101,0.00
50,2007-2008,Maharashtra,083930408,Akshay Medical Trust,Shri Mangal BuildingS.N.10/A Unnati NagarHadapsar Rd.GaditalHadapsarPune Maharashtra-411028,0.00
51,2007-2008,Maharashtra,083900025,Al Huda Social Welfare Society,47 Mohd Ali Road Dt NasikMaharashtra-,0.00
52,2007-2008,Maharashtra,083780281,Al Jamia Mahemedia Education Society, MumbaiMaharashtra-400008,4234587.00
53,2007-2008,Maharashtra,083780645,Al-Hamad Hospitals & Medical Research Foundation,C-611 Kailash Apartments 293bellasis RoadMumbai Maharashtra-400008,54998764.40
54,2007-2008,Maharashtra,083780098,Al-jamaiyatul Mohammadiah Al-khairiah,6/8-ahazrat Terrace Annexe Shaikh Hafizuddin MargbycllaBombay-400008,0.00
55,2007-2008,Maharashtra,083781033,Al-Jamiatur Rahmania Wa Tahfizul Quran,Salfi Gali 3 Gandhi Nagar Charkop Kandivli West MumbaiMaharashtra-400067,974330.00
56,2007-2008,Maharashtra,083780493,Alimaan Charitable Trust,Najafi House 159 Nishanpada Road Dongri MumbaiMaharashtra-400009,102356725.00
57,2007-2008,Maharashtra,083780985,Aliyavar Jung National Institute For the Hearing Handicapped,K.C.Marg Bandra Reclamation Bandra(W)Mumbai-400050,0.00
58,2007-2008,Maharashtra,083780755,All India  Memon Jamat Pederation,Beg Mohammed Park  Narayan Dhuru Street Mumbai Maharashtra -400003,146167.68
59,2007-2008,Maharashtra,084000034,All India Apang Kalyankari Bahuuddeshya Sanstha,Ram Nagar Ward No. 17 Near Sindi NakaWardha (maharashtra)-442001,0.00
60,2007-2008,Maharashtra,083780488,All India Balkan-ji-bari,25juhu Road Santacruz(west)Mumbai 400054-,1462137.00
61,2007-2008,Maharashtra,083781006,All India Council of Muslim Economic Upliftment Ltd,1st floorVazir Building 179IR roa MumbaiMaharashtra-400003,3946566.00
62,2007-2008,Maharashtra,083780688,All India Institute Of Local Self Government,Sthanik Raj Bhavan  C.d. Bareiwava Marg  Andheri (west)Mumbai Maharashtra-,720969.00
63,2007-2008,Maharashtra,084050014,All India Muslim OBC Organisation,near Ambad Railway Gate Nutan Vasahat JalnaMaharashtra-431203,0.00
64,2007-2008,Maharashtra,083780215,All India Soverdia Sangam Trust,Gyan Ashrammahakali Caves Rd Andheri EastMumbai Maharashtra-400093,279734.00
65,2007-2008,Maharashtra,083870058,All India Sunday School Association,National Council Of Churches Nagpur446001-,878711.00
66,2007-2008,Maharashtra,083781017,Alliancae Francaise De Bombay,Theosophy Hall 40 New Marine Lines(Ground Floor)MUMBAI     Maharashtra-400020,1630619.00
67,2007-2008,Maharashtra,083780128,Alliance Ministries,19 August Kranti Marg Jwe Society Compundnana ChowkMumbai 400007-,462439.00
68,2007-2008,Maharashtra,083910100,Aman Bahuuddeshiya Sewabhavi Sanstha,Aman Corner M. Gandhi Nagar Mahatma Gandhi Nagar LaturMaharashtra-413512,0.00
69,2007-2008,Maharashtra,083780210,Amar Sewa Samithi,A. C. Provincial House  94 Hill Road Bandra West Mumbai  -400050,3012513.38
70,2007-2008,Maharashtra,083780671,Amar Shaheed Hemu Kalyani Yadgar Mandal,R.c.b.no. 18/211 Chembur Colony MumbaiMaharashtra-400074,0.00
71,2007-2008,Maharashtra,083850029,Amardeep Charitable Trust,Morba Road PO-Mangaon RaigadMaharashtra-402104,6526289.57
72,2007-2008,Maharashtra,084100001,Ambar Singh Maharaj Dnyan Vidnyan Shikshanik Prasar Mandal,Gunjali MOD Taluka TalodaNandurbar (Maharasthra)-425413,0.00
73,2007-2008,Maharashtra,083930476,Ambegaon Taluka Vidya Vikas Mandal,GhodegaonBlock Ambegaon PuneMaharashtra-412408,19400.00
74,2007-2008,Maharashtra,083990088,Amcha Ghar,406-7 Deep Sagar Building Bhavander/uttanThane Maharashtra-401106,2502732.00
75,2007-2008,Maharashtra,083780572,Ammrae Academy For Mobling Rural A.T.E.,Devki Singh Ki Chawl Santacruz(eat)Mumbai   400055-,888954.00
76,2007-2008,Maharashtra,083870189,Amrapali Utkarsh Sangh,Plot No.59 Shreekrishna Nagar 80ft Rd.Opp.Udaynagar NIT GardenNagpur maharashtra-440024,284423.00
77,2007-2008,Maharashtra,083740015,Amravati Catholic Diocesan Education Society,"Bishops House
Amravati Camp
AmravatiAmravati444602",1371405.00
78,2007-2008,Maharashtra,083740008,Amravati Roman Catholic Diocesan Trust,Bishops House Amravati Camp Po AmravatiMaharashtra-444602,16509291.00
79,2007-2008,Maharashtra,083780535,Anand Ashram Charitable Trust,Hf Rangoonwal No.1 C.p. Tank GulalwadiMumbai Maharashtra-400001,1749100.00
80,2007-2008,Maharashtra,084000009,Anand Bhavan Church Society, P.o. KaothaWardha  (m.s.)-442302,232625.00
81,2007-2008,Maharashtra,083770020,Anand Gramin Vikas Pratostisthan,At. Anandgaon Post Jawalban Anandgaon Tq. Kaij Distt. BeedMaharashtra-431123,0.00
82,2007-2008,Maharashtra,083930441,Anand Mahila Balkalyan Shikshan Sanstha Rehabilitation Sanstha,Naavara PhataAnandgram Shirur PuneMaharashtra-412210,0.00
83,2007-2008,Maharashtra,083930101,Anand Niketan Trust,68 Lullanagar Kandhwa RoadPune   411040-,59820.00
84,2007-2008,Maharashtra,083820011,Anand Sadan Society,Anand Sadan At. Amode Tq Shirpur DhuleMaharashtra-425405,120020.00
85,2007-2008,Maharashtra,083780757,Ananda Marga Universal Relief Team,349 A-1 Bldg Shah & Nahar Indl.  Estate S.j. Marg Lower ParelMumbai- (maharashtra).-400013,727408.00
86,2007-2008,Maharashtra,083970034,Andhashradha Nirmulan Samiti Maharashtra,155 Sadashiv Peth Satara Maharashtra. -415001,235635.00
87,2007-2008,Maharashtra,083781107,ANIL AGARWAL FOUNDATION,104 Maker Bhavan No.3 First Floor 21 New Marine LinesMumbai400020,0.00
88,2007-2008,Maharashtra,083850030,Anjuman Darad Mandane Talim-O- Tarakki Trust Mahad,Opp. S.T. Stand At/Post-Mahad -Mahad RaigadMaharashtra-402301,91786.00
89,2007-2008,Maharashtra,083900042,Anjuman Moinut Tulba,405 Mangalwar  Ward MalegaonNasik -423203,0.00
90,2007-2008,Maharashtra,083900067,Anjuman Taraqqui-E-Taleem,Quidwai Road Islampura Malegaon NashikMaharashtra-423203,0.00
91,2007-2008,Maharashtra,083780546,Anjuman-e-mifidul Yavatama,11 Siddiq Lane M.u.rajjab Raod MadanpuraBombay-400 008-,46243.00
92,2007-2008,Maharashtra,083780339,Anjuman-i-islam,92 Dr Dadabhai Narouji Road C.s.t. FortMumbai    Mahrashtra-400001,39253370.00
93,2007-2008,Maharashtra,083850019,ANKUR,Shankar Rama Complex Chinchpada RoadNear Govt. Hospital Flat No.102 1st floor PenRaigad402107,2245994.00
94,2007-2008,Maharashtra,083930412,Annapurna Mahila Mandal,S.No.19 Plot No.7 Hingane Home- Colony Karvenagar HillsidePune Maharashtra-411029,271352.00
95,2007-2008,Maharashtra,083900060,Ansuaya Shikshan Prasarak MandalNashik,17Shantiniketan Colony Gangapur RoadNashik-Maharashtra-424001,0.00
96,2007-2008,Maharashtra,083930314,Anthra Shop,13 Lanthna Garden Nda Road  Pune Maharashtra-411021,13936045.05
97,2007-2008,Maharashtra,083870206,ANUGRAHA ARADHANA SEWAKAI SANSTHA,A-10 MANAVSEWA NAGAR SEMINARY HILLSNAGPUR440006,200103.00
98,2007-2008,Maharashtra,083870181,Anugraha Seva Mandal,A-20 Vastushilpa Nagar Katol  RoadNagpur Maharashtra-440013,950362.00
99,2007-2008,Maharashtra,083780565,Anusandhan Trust,Sai Ashray Aram Society Road Vakola Santacruz(E)Mumbai Maharashtra-400055,28045293.00
100,2007-2008,Maharashtra,083870118,Apang Va Niraddhar Bahudeshiya Kalyan  Sanstha,Ward No. 1 Jhingabai T. Road Geeta NagarNagpur  -440030,0.00
101,2007-2008,Maharashtra,083740019,Apeksha Homeo Society,Gurkunj Mozari Tq. Teosa AmravatiMaharashtra-444902,8337689.90
102,2007-2008,Maharashtra,083930366,Apex Medical Foundation,2 Barton Court Flat No.5 Survey No. 5841 Salisbury ParkPune (maharashtra)-411037,0.00
103,2007-2008,Maharashtra,083780332,Apnalaya,75 Bhulabhai Desai Road  MumbaiMaharashtra -400026,4324352.00
104,2007-2008,Maharashtra,083780802,Apne Aap Women's Collective,27-a Maheshwari Mansion 34 Napean Sea RoadMumbai (maharashtra)-400036,545155.00
105,2007-2008,Maharashtra,083930313,Applied Environment Research Foundation,PLOT NO. 36CKRUSHNARJUN BUILDING MADHAVBAUG CO-OP. HOUSING SOCIETY SHIVTEERTHNAGAR PAUD ROAD KOTHRUD.PUNE411038,2279366.00
106,2007-2008,Maharashtra,083930327,Appropriate Rural Technology Institute,Maninee Apartments Survey No.13 Opp. Pune Road Co.Dhayari Gaon Pune Maharashtra-411041,2155127.00
107,2007-2008,Maharashtra,083990034,Aqsa Educational Society,79 Bhusar Mohalla Bhiwandi-421 302Bhiwandi421302,4046614.00
108,2007-2008,Maharashtra,083810027,Aranya Nivas Catholic Church,Lakkadkott Po Rajura TqDistrict- Chandrapur-442905,219755.00
109,2007-2008,Maharashtra,083781027,Aravali Vikas Mandal,302 Maitri Co-op HSG Society Ltd Golanji Hill Road ParelMumbaiMaharashtra-400012,0.00
110,2007-2008,Maharashtra,083780069,ARCHDIOCESE OF BOMBAY,21 Np Marg MumbaiMaharashtra-,4628607.00
111,2007-2008,Maharashtra,083990067,Arnala Health Trust,Oppsite Ram Mandir At.& Po.- Arnala Taluka VasaiDist- Thane Maharashtra-401302,196991.00
112,2007-2008,Maharashtra,083930416,Arogyaseva Medical Academy of India,S.No.32/2A Erandwane Gulavanimaharaj Street PuneMaharashtra-411004,0.00
113,2007-2008,Maharashtra,083750040,Arpan Sikshan Sanstha,Plot No. 97 Nandanvan Colony Nandanvan ColonyAurangabad 431002 M.s.-,0.00
114,2007-2008,Maharashtra,083780377,Arpan Trust,4054mayuresh C.h.society Ltd. Beh.saibabatempleghatkopar(e)Mumbai -400075,0.00
115,2007-2008,Maharashtra,083890046,Arti Shikshan Prasarak Mandal,At Manaspuri Post Bahadarpura Tq. Kandhar Dist. NandedMaharashtra-431714,0.00
116,2007-2008,Maharashtra,083870191,Aryalok Education Society,136 Laghuvetan Society Nagpur -440014,560000.00
117,2007-2008,Maharashtra,083780665,Aseema Charitable Trust,G3 Josephine Apartments  Ground FI; Chimbai RoadBandra (W) Mumbai-400050-400050,3472445.00
118,2007-2008,Maharashtra,083780180,Asha  Handicrafts Association,28 Suren Road Andheri EastMumbai   400093-,4404901.00
119,2007-2008,Maharashtra,083780043,Asha Deep Vikas Kendra,C/o A.e.netto    109 Kalina Santacruz (east)Mumbai - 400029-,0.00
120,2007-2008,Maharashtra,083810028,Asha Dham Hospital Association,S.c. Railway Wirur Po Rajura Tq Chandrapur Dist.Maharashtra-442905,0.00
121,2007-2008,Maharashtra,083780229,ASHADEEP ASSOCIATION,Shakti Apartments B--002Chakala Road Andheri East400099,15508093.00
122,2007-2008,Maharashtra,083781039,Ashadeep Charitable Trust,Pandit Niwas Ground Floor 32 Mangal Wadi MumbaiMaharashstra-400004,0.00
123,2007-2008,Maharashtra,083870168,Ashirvad Kanti,303 Panchgiri ApartmentChhindwara Rd Byramji Town NagpurMaharashtra-440013,1182702.10
124,2007-2008,Maharashtra,083810031,Ashirvan  Church,Chincholi P.o. Rajpur  Tq.Chandrapur 442905-,427850.96
125,2007-2008,Maharashtra,083750005,Ashish Gram Rachna Trust,P.o. Pachod AurangabadMaharashtra-431121,11821725.00
126,2007-2008,Maharashtra,083740070,Ashray Sevabhavi Society,Shirajgaon(Mozari)Tehsil-Teosa AmravatiMaharashtra-444902,0.00
127,2007-2008,Maharashtra,083930380,Ashta No Kai-India,1 Solitaire 4 Kasturba Samadhi Road Off Nagar RoadPune411006,429786.00
128,2007-2008,Maharashtra,083870059,Ashuklamta Welfare Centre,Sharde Nandpeth NagpurMaharashtra 446 022-,685214.00
129,2007-2008,Maharashtra,083770032,Ashwaling Sevabhavi Sanstha,Palwan Tq. & Dist Beed Maharashtra -431122,0.00
130,2007-2008,Maharashtra,083740066,Ashwamegh Gramin Panlot Kshetra Vikas Va Shaikshanik sanstha,Fattepur(Shivangaon)Tq- Tiosa AmravatiMaharashtra-444902,0.00
131,2007-2008,Maharashtra,083930234,Ashwin Medical Foundation,Mangalmurti Wada ChinchwadgaonPune -411033,0.00
132,2007-2008,Maharashtra,083780656,Ashwini Kumar Medical Relief Society,7 Lalji Complex Link Road Kandivli(w)Mumbai -400 067-,2036980.00
133,2007-2008,Maharashtra,083980024,Ashwini Rural Cancer Research Relief Society,Agalgaon Road Narsi Town SolapurMaharashtra-,5916510.00
134,2007-2008,Maharashtra,083930153,Ashwood Memorial Hospital,P O Box 4 DaundPune 413801-,1391165.00
135,2007-2008,Maharashtra,083780023,Asia Evangelical Fellowship India,10 Bhavan 422 Vs Road Prabha Devi MumbaiMaharashtra-400025,1040821.00
136,2007-2008,Maharashtra,083990125,Asra Foundation,43/18(1)Children Rehabilitation CentreK.M.B. Kazi ChowkBombilBazarKalyanThaneMaharashtra-421301,25000.00
137,2007-2008,Maharashtra,083740063,Assisi Asha Deep Education Society,Christ ColonyAmravati Camp City AmravatiMaharashtra-444602,1328442.00
138,2007-2008,Maharashtra,083810016,Assisi Sewa Sadan Trust,Nagepalli Allapalli  P.o. Gadchiroli Maharashtra-442703,1514225.00
139,2007-2008,Maharashtra,083990035,Assn For Rural People For Heal Edu Needs,C-5/24/3-4  Sector 5 Navi Mumbai400615         Maharashtra-,867689.00
140,2007-2008,Maharashtra,083780389,Assn. Of Consumers' Action On Safety And,Health (acash) Room No.21 R.s.sapore MargMumbai -400002,0.00
141,2007-2008,Maharashtra,083810045,Association 0f Women Awarness & Rural evelopment,Bhagatsingh Chouk Nagbir ChandrapurMaharashtra-441205,0.00
142,2007-2008,Maharashtra,083780185,Association For Christian Thoughtfulness,80 - C The Kurla Kamgar Nagar CHSS. G. Barve MargKurla (East)MUMBAI400024,7631959.00
143,2007-2008,Maharashtra,083780109,Association for Leprosy Education Rehabilitation and Treatment - India ALERT - INDIA,FLAT NO. B-9 PLOT NO. 29B MIRA MANSION ABHINANDSWAMI JAIN MANDIR MARG SION WESTMUMBAI400022,50239536.00
144,2007-2008,Maharashtra,083780511,Association For Social Health In India,Ban Ark No.4 Mumbai Maharashtra -400020,0.00
145,2007-2008,Maharashtra,083920007,Association for Social Research & Pervasive Development,22' Sneha' Super Market Karegaon RoadParbhani  Maharashtra-,0.00
146,2007-2008,Maharashtra,083780810,Association For The Welfare Of Persons With Handicap In Maharashtra,Turner Morrison House(basement) 16 Bank Street FortMumbai Maharashtra-400023,627700.00
147,2007-2008,Maharashtra,083990108,Association of Parents of Mentally Retarded Children,5A/14 Pareira Nagar Khopat Behind S.T. WorkshopThane(W) Thane Maharashtra-400601,0.00
148,2007-2008,Maharashtra,083930073,Association Of The Friends Of German,C/o. Mr.Arvind Godbole 1301 Sadashiv Peth Pune - 411030Pune411030,1205480.00
149,2007-2008,Maharashtra,084000036,Association of the Sisters of the Distitute,KrupadhamSawangi Meghe WardhaMaharashtra-44201,2789323.60
150,2007-2008,Maharashtra,083990038,Astitva Prahladrai Kagzi Instte.Handi.C.,Plot No.a-8 M.i.d.c.phase-i Dambvivli (east) -,2202592.00
151,2007-2008,Maharashtra,083780649,Athornan Mandal,Navsari Building 2nd Floor 240 Dr. D.n. Road    FortMumbai  Maharashtra-400001,29472.00
152,2007-2008,Maharashtra,083780383,Athravan Educational Trust,K.r. Cama Oriental Inst.buildg 136 Mumbai Samachar MargMumbai 400023-,0.00
153,2007-2008,Maharashtra,083900047,Audyogik Shikshan Prasark  Mandal,Mahatma Nagar Trimalik Road NasikM.s-,0.00
154,2007-2008,Maharashtra,083750041,Aurangabad Gramin Yuvak Kalyan Mandal,Kotwalpur AurangabadM.s.-,0.00
155,2007-2008,Maharashtra,083780527,AURED Charitable Trust,King George V MemorialBarrack No-6 Dr. E. Moses Road MahalaxmiMumbai400011,993557.00
156,2007-2008,Maharashtra,083780497,Avehi Public Charitable(educationaltrust,Raoli Campsm Roadsardar Ngar Sion-koliwadMumbai 400037-,11151311.00
157,2007-2008,Maharashtra,083930194,Ayodhya Charitable Trust,577 Shukarwar PethPune   411002-,0.00
158,2007-2008,Maharashtra,083930200,Ayurved Shikshan Sansthan,2062 Sada ShivpethPune -411030-,0.00
159,2007-2008,Maharashtra,083960067,Azad Education SocietyMiraj,5883-High School Road Miraj SangliMaharashtra-416410,0.00
160,2007-2008,Maharashtra,083890024,Baba Harnamsingh Of Langer Sahib Gurudwa, NaginaghatNanded 431601-,10954544.00
161,2007-2008,Maharashtra,083930386,Baby Friend Child Welfare Trust,203 Sterling Centre M.G. Road PuneMaharashtra-411001,0.00
162,2007-2008,Maharashtra,083980002,Backward Class Girls Hostel,145/7 Railway Lines SolapurMaharashtra-,0.00
163,2007-2008,Maharashtra,083780672,Bahman Charitable Foundation,Najafi House 159 Nishan Para Road MumbaiMaharashtra-400009,5328273.40
164,2007-2008,Maharashtra,083930202,Bahujan Hitay,Raja Harish Chandra Road Dapodi PuneMaharashtra-411012,7988380.00
165,2007-2008,Maharashtra,083990043,Bahujan Hitay Vidhyarti Vastigrigh,Ulhasnagar Tbmsg DapodiPune 411012-,371000.00
166,2007-2008,Maharashtra,083750036,Bahujan Hitay Vidyarthi,Vatisgrih Bhim NagarAurangabad Maharastra-,311000.00
167,2007-2008,Maharashtra,084000020,Bahujan Hitay Vidyarti Vastifrigh,T.b.s.m.s.g WardhaWardha M.s.-,491326.00
168,2007-2008,Maharashtra,083780430,Bai S M Cama Convalsecent Home For Poor,Parsi Men & Boys 56 B.j. Road BandraMumbai 400050-,0.00
169,2007-2008,Maharashtra,083930149,Baif Development Research Foundation,Baif Bhavan Dr M.desai Nagar Survey No.134/1warje Malwadi PuneMaharashtra-411029,38663290.12
170,2007-2008,Maharashtra,083960026,Baisinger Memorial Library,Gandhi Chowk MirajMiraj416410,218195.00
171,2007-2008,Maharashtra,083780233,Bal Anand School For Needy Children,28ashadeep Ground Floor Dongersi RoadMumbai 400006-,0.00
172,2007-2008,Maharashtra,083780329,Bal Asha Trust,401 Charlie Ville A- Road ChurchgateMumbai Maharashtra-400020,2266051.00
173,2007-2008,Maharashtra,083930016,Bal Gram Sos Children's  Village,Bungalow No. 5 Koregaon RoadPune 411050-,482101.00
174,2007-2008,Maharashtra,083780849,Bal Jeevan Trust,C/o V.m. Engineera/14sterling Apt 38pedder RoadMumbai-400026,329347.00
175,2007-2008,Maharashtra,083930187,Bal Kalyan Sanstha,Near Raj Bhawwan Ganeshkhand RoadPune - .-411007,0.00
176,2007-2008,Maharashtra,083720004,Bal Shikshan Mandal,Sangamner Dist. AhmednagarMaharashtra.-,0.00
177,2007-2008,Maharashtra,083910038,Bal Vikas Mahila Mandal,Sambhaji Nagar Khalagoas Road Dist- Latur.Maharashtra-,1122791.00
178,2007-2008,Maharashtra,083930143,Balwant Kaur Anand Foundation,18 Dr. Coyaji Road Pune411001-,3765536.74
179,2007-2008,Maharashtra,083780084,Bandra East Community Centre,341-a Siddharth Colony Bandra EastMumbai Maharashtra -400051,1883744.00
180,2007-2008,Maharashtra,083970039,Banjara Vikas samiti,Laxmitekdi Naik Nagarnear Koyana Society Sadar Bazar SataraMaharashtra-415001,0.00
181,2007-2008,Maharashtra,083740018,Baptist Christian Association',Post Box : 5 AchalpurAmravati 444805-,467896.00
182,2007-2008,Maharashtra,083750002,Baptist Missionary Association,92 N-1sector Cidco New AurangabadMaharashtra-431003,1093830.00
183,2007-2008,Maharashtra,083930421,Bapu Trust for Research on Mind and Discourse,A-4/38 Ujwal Park Housing Society Nibm Road Kondhwa PuneMaharashtra-411048,2270487.00
184,2007-2008,Maharashtra,083780194,Basilica Of Our Lady Of The Mount,Mount Mary Road BandraMumbai Maharashtra-400050,12298.00
185,2007-2008,Maharashtra,083990086,Bassein Urdu Education Society,Hathi Mohalla Huzalfa Urdu High  School VasaiThane (maharashtra)-401201,0.00
186,2007-2008,Maharashtra,083950025,Bazme-Urdu Adab,Bazarpeth Rajapur Tal- RajpurRATNAGIRI   Maharashtra-416702,0.00
187,2007-2008,Maharashtra,083930083,Bethany Ashram,Ramwadi Nagasr RoadPune-411004,710871.00
188,2007-2008,Maharashtra,083990085,Bethany Trust,"Bethany Trust - Bethany Hospital
Pokhran Road No.2
Opp. Ma NiketanThane400610",21461237.93
189,2007-2008,Maharashtra,083840011,Bhagini  Mandal Chopda,Dhangar Ali  Post Box No.-20 Jalgaon Distt-Maharashtra-425107,0.00
190,2007-2008,Maharashtra,083930389,Bhagini Nivedita Pratishthan Sangli Shakha Pune,C/O Mrs Leela Shintre 39/28 ErandwanePune (Maharashtra)-411004,39478.00
191,2007-2008,Maharashtra,083780847,Bhagvan Mahavir Pasu Raksh Kendra,5 Gurukrupa Apts. Carter Road No.i Borivali (e)Mumbai-400066,0.00
