388,2007-2008,Maharashtra,083850006,Disha Kendra,5 Ratnaraj Apartment Dr. Ambedkar ChowkKarjat P O410201,2942194.00
389,2007-2008,Maharashtra,083860220,Disha Shikshan-V-Vikas Kendra,Post Box No.10 Neora Campus Sankeshwar Road GadhinglajKolhapur Maharashtra-416502,0.00
390,2007-2008,Maharashtra,083720082,District Probation & Affter Care Association,Observation Home Zarekar GalliAhmednagar -414001,19205.00
391,2007-2008,Maharashtra,083950009,District Probation Aftercare Association Remand Home,Ratnagiri  Maharashtra-415612,36947.00
392,2007-2008,Maharashtra,083930108,Divine Word Seminary,Pune Nagar Road Pune.411014-,3883612.00
393,2007-2008,Maharashtra,083900045,Divya Daan Nashik,College Road Nasik422005             Maharashtra-,4096000.00
394,2007-2008,Maharashtra,083740025,DIVYA SADAN SOCIAL CENTRE WADALI,Pardhan Colony WadaliAmravati 444602-,1388389.61
395,2007-2008,Maharashtra,083780343,Diwaliben M. Lal Mehta Charitable Trust,Khatau Mansion Oomer Park 95-k Bhulabhai Desai RoadMumbai 400036-,0.00
396,2007-2008,Maharashtra,083780836,Dnyan Ganga Education Trust,Durga Nagar Kranti Nagar Road Kandivali (e) MumbaiMaharashtra-400101,0.00
397,2007-2008,Maharashtra,083910090,Dnyan Vikas Mandal,Labour Colony LaturMaharashtra-413512,0.00
398,2007-2008,Maharashtra,084060010,Dnyandev Shikshan Prasarak mandal,At/Post -Kader TA-Omerga Osmanabadmaharashtra-413606,0.00
399,2007-2008,Maharashtra,083920016,Dnyanopasak Shikshan Mandal,C/oDnyanopasak CollegePost Box No.54 ParbhaniMaharashtra-431401,0.00
400,2007-2008,Maharashtra,083780518,Dominic Savio Educational Trust,C/o Tt. Dominic Savio Church Antop Hill Wadala EastMumbai Maharashtra-400037,0.00
401,2007-2008,Maharashtra,083870029,Dominican Fathers Nagpur Society,Seminiary Hill Nagpur.440006-,9390806.95
402,2007-2008,Maharashtra,083780272,Don Bosco High School Society,Vaziram Naka Borivli (w)Mumbai -400092.-,0.00
403,2007-2008,Maharashtra,083930025,Don Bosco School,Lonavla District- PuneMaharashtra-410401,60398.62
404,2007-2008,Maharashtra,083930444,Don Bosco Vyawasaik Prashikshan Kendra,Near St.Andrews School Chinchwad East PuneMaharashtra-411019,23489266.96
405,2007-2008,Maharashtra,083990083,Don Bosco Yuva Vikas Sanstha,P.o. Juchandra Naigaon East Vasai TalukaThane Distt. (maharashtra)-401202,0.00
406,2007-2008,Maharashtra,083890027,Dr Zakir Hussain Education Society,Kazi Lane H.no. 5-4-128 Dist- NandedMaharashtra-431604,0.00
407,2007-2008,Maharashtra,083730016,Dr. Baba Saheb Ambedakar Samarak Samiti,At & Po Shivani Distt. AkolaMaharashtra-444004,0.00
408,2007-2008,Maharashtra,083780851,Dr. Bhanuben Nanavati Hospital,504dalamal Chambers 29new Marine LinesMumbai-400020,14239.00
409,2007-2008,Maharashtra,083780404,Dr. Ernest Borges Memorial Home,Madhusudan Kalelkar Mar Kala Nagar Bandra(east)Bombay -400051,0.00
410,2007-2008,Maharashtra,083810049,Dr. Hedgewar Janmashatabdi Seva,Near Kala Ram mandir Samadhi Ward Chandrapur-2Maharashtra-442402,0.00
411,2007-2008,Maharashtra,083980055,Dr. Hedgewar Rakta Pedhi Sanstha,Sahyandri Shopping Centre Ist Floo Railway Lines SolapurMaharashtra-413001,0.00
412,2007-2008,Maharashtra,083930298,Dr. Hedgewar Smarak Seva Nidhi,309 Shaniwar Peth PuneMaharashtra-411030,0.00
413,2007-2008,Maharashtra,083780501,Dr. Kumud Pravin Mehta Charitable Trust,Gita-b Pandita Ramabai Road GamdeviBombay -400007,0.00
414,2007-2008,Maharashtra,083780587,Dr. M.l.dhawale Memorial Trust,40 Parekh Street GoregaonMumbai 400004-,186330.00
415,2007-2008,Maharashtra,083930345,Dr. Manohar Dole Medical Foundation,Post- NarayangaonTehsil- Junnar410504,0.00
416,2007-2008,Maharashtra,083780982,Dr. R.T. Doshi Foundation,"""Jamunotry"" 26th Road Shah Marg Bandra (West)MUMBAI Maharashtra-400050",0.00
417,2007-2008,Maharashtra,083780509,Dr.ambedkar Seti Vikas Sansodhan Sanstha,211 Indira Nagar Link Road Goregaon WestMumbai 400104-,1944811.00
418,2007-2008,Maharashtra,083750045,Dr.B R  Ambedker Vidyalaya Pratisthan,Sinderteer Bhagyanagar Dist. Aurangabad.Maharashtra-,1678155.00
419,2007-2008,Maharashtra,083930433,Dr.Nanasaheb Parulekar Sakal Charity Trust,C/o Sakas Building 595 Budhwar Peth PuneMaharashtra-411002,0.00
420,2007-2008,Maharashtra,083780904,Drishti Human Resource Centre,5/3A Satnam Society Sion (W)Mumbai (Maharashtra)-400022,0.00
421,2007-2008,Maharashtra,083870172,Drs.Anant and Lata Labhsetwar Charitable Trust,11 Daga Layout North Ambazari Rd. NagpurMaharashtra-440010,390900.00
422,2007-2008,Maharashtra,083870108,Drug Abuse Information rehabilitation &research Centre,Sitaram BuildingPalton Road (H-Block Ist Floor)Bombay-1. -400001,370554.89
423,2007-2008,Maharashtra,083930369,Dyan Deep Jankalyan Foundation,407-shukrawar Peth Pune -411002,3302364.00
424,2007-2008,Maharashtra,083780395,E.N.T. Charitable Trust,4filka Daftary Road MaladBombay-,281031.00
425,2007-2008,Maharashtra,083780379,Each One Teach One Charitable Foundation,7 Ground Floor Plot No. 275 Gope Nivas Opp. Sion HospitalLaxmibai Kelkar Marg Sion Road400022,3804386.00
426,2007-2008,Maharashtra,083870120,Ecumencal Sangam,"No.275 ""sonali Nursing Home"" Civil LinesNagpur  440001-",3285079.13
427,2007-2008,Maharashtra,083870011,Ecumenical Development Centre Of India,Katol Roadghani Manzil Chhaoni(canntoment)Nagpur 440013-,1658841.00
428,2007-2008,Maharashtra,083780102,Edarah Islahul Massed,6/8 A Hazrat Terrace Annexe Sk. Hafizuddin MargBombay-400008,0.00
429,2007-2008,Maharashtra,083780595,Edaratul Masajid Val Madaris,Rn3gr.floor6/8-ahazrat Terr Ace Annexesk.hafizuddin RoadBombay 400008-,7322039.00
430,2007-2008,Maharashtra,083930067,Education Endowment Trust of Union biblical Seminary,Bibwewadi Post Box No.1425 PuneMaharashtra-411037,6767540.00
431,2007-2008,Maharashtra,083740044,Educational & Social Welfare Society,Nr Paratwada- Betul Naka  AmravatiMaharashtra-444805,1625728.00
432,2007-2008,Maharashtra,083870156,Educational Society Of The Sister's Of The Poor Servants Of Divine Providence,Novitiate House  Padri Thana ButiboriNagpur (maharashtra)-441108,727950.00
433,2007-2008,Maharashtra,083780699,Eduljee Framjee Albless Leprosy Home,Trombay MumbaiMaharashtra-400088,18470.00
434,2007-2008,Maharashtra,083900071,Ehyaul-Uloom Education & Welfare Society,S.No.166 Plot No.660 Lane No.8 Raonaqabad MalegaonNasik (Maharashtra)-423203,33569.00
435,2007-2008,Maharashtra,083960009,Ekatma Samj Kendra,Dr. Ambedkar Road Tal Miraj Dist SangliSangli-,0.00
436,2007-2008,Maharashtra,084030006,Ekta Samajik Shikshan Sanstha Gadchiroli,Prakash Arjunwar Chamorshi road GadchiroliMaharashtra-442605,0.00
437,2007-2008,Maharashtra,083910064,Emmanuel Education Committee,Dapegaon Tq AusaLatur (maharashtra)-413572,15000.00
438,2007-2008,Maharashtra,083930325,Entrepreneurship Development And Rehabilitation  Centre For The Hdandic(edrch),212-a Narayan Peth Kelkar RoadPune-411030,0.00
439,2007-2008,Maharashtra,083990056,Eternal Hope Charity Mission,Pb 24 Nerul  New BombayMaharashtra-400706,177433.00
440,2007-2008,Maharashtra,083750104,Everest Educational Trust,C/O Seema Nursing Home RoshangateAurangabad Maharashtra431001,0.00
441,2007-2008,Maharashtra,083780120,Executive Board Of Methodist Church In India,3rd Floor Lawrence & Mayo House 276dr D. N. Road Box 1859 FortMumbai Maharashtra-400001,53490037.05
442,2007-2008,Maharashtra,083780782,Eye Bank Co-ordination & Research Centre,Masina Hospital Sant Savta Marg Byculla (e)Mumbai (maharashtra)-400027,0.00
443,2007-2008,Maharashtra,083860012,Eye Project,Mary Wanless Hospital Hpo KolhapurMaharashtra-416003,0.00
444,2007-2008,Maharashtra,083720048,Fairbank Jemes F. Memo. Hospital & C.h.u,Po: Vadala Mission Tal : NewasaAhmednagar 414001-,948027.00
445,2007-2008,Maharashtra,083750046,Faiz-e-aam Trust,Post Box No. 17 ChowkAurangabad 431001-,2064789.00
446,2007-2008,Maharashtra,083750065,Falah-e-am Trust,Lal Masjid Complex Town Hall AurangabadMaharashtra-431001,2421041.00
447,2007-2008,Maharashtra,083780016,Family Planning Association Of India,Bajaj Bhawan Nariman Point MumbaiMaharashtra-400021,166027089.98
448,2007-2008,Maharashtra,083781003,Fazlani Aishabai and Haji Abdul Latif Charitable Trust,21st Floor Nirmal Building Nariman PointMumbai400021,0.00
449,2007-2008,Maharashtra,083780706,Fellowship Society,August Kranti Marg  MumbaiMaharashtra-400036,218113.00
450,2007-2008,Maharashtra,083780402,Fidai Academy,Fidai Baug S V Road Andheri (west)Mumbai 400058-,1617883.00
451,2007-2008,Maharashtra,083780340,Fiddai Girls Edufsational Institute,S.v. Road Andheri (w)Bombay-58.-,1005861.00
452,2007-2008,Maharashtra,083980035,Fivefold Path Mission,Shivpuri AkalkotSholapur Distt. (maharashtra)-413216,0.00
453,2007-2008,Maharashtra,083780925,Foundation for Humanisation,11 Yogniti 18S.V.Road Santacruz West MumbaiMaharashtra-400054,285000.00
454,2007-2008,Maharashtra,083780556,Foundation For Revitalising Of Local Health Traditions,4 Sara Baug Deonar MumbaiMaharashtra-400088,7133567.00
455,2007-2008,Maharashtra,083730014,Fpatronage - Amravati,Peshkar Building AmbepethAmravati 444601-,0.00
456,2007-2008,Maharashtra,083790005,Fransaliam Vidya Niketan,P.b 64 Khamgaon BuldanaMaharashtra-444303,1870263.00
457,2007-2008,Maharashtra,083750009,Fransalian Technical Institute,Jalna Road Aurangabad.431005-,0.00
458,2007-2008,Maharashtra,084010001,Free Methodist Mission In India,Conference House Wanjari File Road YavatmalMaharashtra-445001,27937509.08
459,2007-2008,Maharashtra,083780762,Free Opthalmic Hospitals Society's  K.b. Haji Bachooalli Charitable Ophthalmic,And E.n.t. Hospital 58/60 Jahangir Mervanji StreetPoiba Wadi Parel Mumbai-400012,1266500.00
460,2007-2008,Maharashtra,083780934,Fresh Start Surgical Gifts,Suite No.16 Laud Mansion 21 M.Karve Road MumbaiMaharashtra-400004,0.00
461,2007-2008,Maharashtra,083970031,Friends Of Moral Re-armament (india),Asia Plateau  PanchganiSatara Distt. (maharashtra).-412805,2010265.00
462,2007-2008,Maharashtra,083890048,Friends of the Earth and Nature Conservator,Near Asst. Charity Commissioner Off Vasava Nager NandedMaharashtra-431602,0.00
463,2007-2008,Maharashtra,083740072,Friends Welfare Society,Khurshidpura Habib NagarAMRAVATI   Maharashtra-444601,2000.00
464,2007-2008,Maharashtra,083780361,Friendship Centre India,1 Friendship 23rd Road Tps-iiiBombay-50.-,0.00
465,2007-2008,Maharashtra,083780440,Front For Rapid Economic Advancement - India,Neelambari 501 Room No. 86Office Gokhale Road Dadar West400028,5225337.00
466,2007-2008,Maharashtra,083990098,Fruitful Ministries,RAC-IIPlot No.50 Madhanear Asra BunglowVeer Savarkar NagarThane Maharashtra-400606,1144377.00
467,2007-2008,Maharashtra,083780457,Fuji Guruji Memorial Trust,Bajaj Bhawan 2nd Floor226 Nariman Point400021,0.00
468,2007-2008,Maharashtra,083990123,Galliard Society(Help for the Children),No.403 Panchashil BhavanShivmarg LalchakkiUlhasnagarThaneKalyanThaneMaharashtra-,0.00
469,2007-2008,Maharashtra,084000002,Gandhi Momorial Leprosy Foundation,Ramnagar  WardhaMaharashtra-442001,1025840.00
470,2007-2008,Maharashtra,083920022,Ganga Shikshan Prasarak Mandal,A/p Dhangar Takali Tq PurnaParbhani431401,0.00
471,2007-2008,Maharashtra,083910074,Ganpatrao Nimbalkar Smruti Mukti Ashram,Swatantra Sainik Nagar Krupa Sadan Road LaturMaharashtra-413512,259919.00
472,2007-2008,Maharashtra,083870028,Gardiner High School,Civil Lines Nagpur440001-,0.00
473,2007-2008,Maharashtra,083860035,Gayan Samaj Deval Club,1081 'B' Khasbag KolhapurMaharashtra-416002,0.00
474,2007-2008,Maharashtra,083720068,Gayatri Mahila Sahakara Adyogik Society,3434 Khist Galli Opp. Balaji's TempleAhmednagar Maharashtra-,0.00
475,2007-2008,Maharashtra,083780929,Gem and Jewellery National Relief Foundation,501 Prasad Chambers Opera House MumbaiMaharashtra-400004,0.00
476,2007-2008,Maharashtra,083730004,General Board Of Church Of Nazarene Mission,Washim  Dist: Akola Maharashtra-444505,12076571.00
477,2007-2008,Maharashtra,083740045,Geramin Vikas Shikshan Sansthan,Manjari Mhasla AmravatiM.s-,0.00
478,2007-2008,Maharashtra,083780266,German Leprosy Relief Assn. & P.r.d.,11 Hardevi Society Caves Roadp.b.no.7456Mumbai -400060.-,662762.00
479,2007-2008,Maharashtra,083920003,Ghulam Nabi Azad Urdu,Kalamnuri Parbhani431702-,1130189.00
480,2007-2008,Maharashtra,083780877,Girivanavasi Educational Trust,Fazalbhoy Building 45/47Mahatma Gandhi Road FortMumbai (Maharashtra)-400001,0.00
481,2007-2008,Maharashtra,083740030,Girls Christian Institute,Warud AmravatiMaharashtra-444906,2706106.00
482,2007-2008,Maharashtra,083780494,Global Hospital & Research Centre,`om Shanti' 48swastik Colony 3 Jvpd Scheme Vile Parle(w)Mumbai 400056-,67653055.20
483,2007-2008,Maharashtra,083990032,Gnanmata Sadan Society,Po Talasari ThaneMaharashtra-401606,1277065.00
484,2007-2008,Maharashtra,083840010,Godavari Foundation Jalgaon,Godavari Hospital Building M. J College RoadDist- Jalgaon Maharashtra-425002,3353000.00
485,2007-2008,Maharashtra,083990027,Gokhale Education Society,Agricultural Insititute Kosbad Hill Thane Maharashtra-,0.00
486,2007-2008,Maharashtra,083990064,Good Samaotan Ministries In India,115 Paras Industrial Complex Kalyan- Ambernath Rd Shanti NagarUlhasnnagar  Thane Maharashtra-421003,475750.00
487,2007-2008,Maharashtra,083781050,Good Samaritan Mission,189/2859 Tagore NagarGroup No.8B Vikhroli(East)MumbaiMaharashtra-400083,2034622.00
488,2007-2008,Maharashtra,083930390,Good Shepherd Homes,S.No. 95 Rajgurav Colony Talegaon Dhabade StationPune (Maharashtra)-410507,8281456.00
489,2007-2008,Maharashtra,083780156,Gospel Literature Service,250-d Worli Udyog BhavanMumbai 400025-,14898.00
490,2007-2008,Maharashtra,083930189,Grace To India,"818-C BHAWANI PETH
Near PUDUMJEE POLICE CHOWKIPUNE411002",803215.00
491,2007-2008,Maharashtra,083930141,Gram Gaurav Pratishthan,"Shetkari Nagar Gotemalkhalad
Tal.PurandarDist.pune 412301Saswad412301",0.00
492,2007-2008,Maharashtra,084010028,Gram Jyot Samajsevi Sanstha,Gram Jyot (mtikheda Roadbehind Rural Hospitalat-post-ralegaonYavatmal-445402,104372.00
493,2007-2008,Maharashtra,083870157,Gram Sewa Sangh,C/o Mr. Philip ParanjaeMure  Memorial Hospital Blood BankNear Maharaj Bag Nagpur (Maha)-440001,403200.00
494,2007-2008,Maharashtra,084000038,Gram Swaraj Seva Trust,P.O. : Dattapur Tah :  WardhaWARDHA    Maharashtra-442001,825000.00
495,2007-2008,Maharashtra,083780197,GRAM SWARAJYA SAMITI MAHARASHTRA,252 MAHATMA GANDHI SEVA MANDIR SWAMI VIVEKANAND ROAD BANDRA WESTBandra West400050,0.00
496,2007-2008,Maharashtra,083960069,Gram Vikas Bahuuddeshiya Sanstha,Laxmi Narayan Apt/  Near Kripa Mai MirajSangli Distt. (Maharashtra)-416416,0.00
497,2007-2008,Maharashtra,083950021,Gram Vikas Mandal,At  & Post Watad Klktaluka  Ratnagiri Maharashtra-415613,0.00
498,2007-2008,Maharashtra,083850027,Gram Vikas Mandal  Nadgaon,At: Nadgaon  Post: Eassane Kamble M.I.D.C. MahadRAIGARH   Maharashtra-402301,311532.00
499,2007-2008,Maharashtra,083990044,Grama Mangal C#r.kdeole,Jai Building Cinema Road Ghatkoper (east)Mumbai  86-,0.00
500,2007-2008,Maharashtra,083750063,Gramayan Kamlesh Society,N-6/m-41 Cidco AurangabadMaharashtra-431003,0.00
501,2007-2008,Maharashtra,084010011,Grameen Samasya Mukti Trust,Jalka Tq.  More Gaon YavatmalMaharashtra-445303,6829308.00
502,2007-2008,Maharashtra,083820030,Gramin Janseva Shikshan Sanstha,At Post- Nardana Taluka- Sindkheda SindkhedaDistt.- Dhule (maharashtra)-425404,0.00
503,2007-2008,Maharashtra,083850012,Gramin Lok Sewa Mandal,Dt. Raigad Ms Po: Kashelle. -,175050.00
504,2007-2008,Maharashtra,083910065,Gramin Mahila Vikas Sanstha,Power House Road Deoni(BK) TQ. DeoniLatur (Maharashtra)-413519,349547.00
505,2007-2008,Maharashtra,084060009,Gramin Punarrachana Kendra,At/po-Kothala TQ-Kallam OsmanabadMaharashtra-413528,170937.00
506,2007-2008,Maharashtra,083910005,Gramin Sharamik Pratisthan Budhopa,At. Budhdda Tq. Ausa  District- LaturMaharashtra-413520,0.00
507,2007-2008,Maharashtra,084030002,Gramin Shishanik Va Sanskrutik Vikas Mandal,At. Post. Taluka- Chamorshi Distt.- GadchiroliMaharashtra.-442603,0.00
508,2007-2008,Maharashtra,083740039,Gramin Vikas Bahuudeshiya  Krida Sansthan,Prashant Nagar Amravati.Maharashtra-,0.00
509,2007-2008,Maharashtra,083720108,Gramin Vikas Kendra,Kumbhar Tale JamkhedAhmednagar413201,0.00
510,2007-2008,Maharashtra,083870187,Gramin Vikas Manch,C/oShri GadbailTeacher Colony Girad Road Umrer NagpurMaharashtra-441203,0.00
511,2007-2008,Maharashtra,083770004,Gramin Vikas Mandal,At/po Bansarola Tq Kaij  BeedMaharashtra-431518,6198500.00
512,2007-2008,Maharashtra,083810021,Gramodaya Sangh,Po: Bhadrawati Chandrapur -442902,0.00
513,2007-2008,Maharashtra,083970040,Gramparivartan Prabhodhnini Katgun,At/Post-KatgunmTal-Khthav SataraMaharashtra-415502,0.00
514,2007-2008,Maharashtra,084060012,Gramvikas Bahuuddeshiya Seva Mandal Nalegaon,C/o K.M.Bagal Samata Colony Near N.P.School No.11Osmanabad Maharashtra-413501,0.00
515,2007-2008,Maharashtra,083930102,GRANT MEDICAL FOUNDATION,40 Sassoon Road Poist Box No. 70Pune 411001-,0.00
516,2007-2008,Maharashtra,083750050,Grass-roots Action For Social Participation,251 Samarth Nagar  AurangabadMaharashtra-431001,387284.00
517,2007-2008,Maharashtra,083780935,Green Earth Foundation for Global Environment,18C/6Shiv Darshan Society AshokvanShiv Vallabh RoadMumbaiBorivali(East)Maharashtra-400066,0.00
518,2007-2008,Maharashtra,083740032,Grp Jiwan Vikas Vidyalaya,Boraj Chander Bazar AmravatiMaharashtra-444704,0.00
519,2007-2008,Maharashtra,083780312,Guild of Service Bombay,B.d.d. Chawl No. 16-a NaigaumBombay -400014-,183366.00
520,2007-2008,Maharashtra,083730018,Gunvant Shikshan Sanstha,Khedkar Nagar Near Madhuri  ColdinksAkola - Maharashtra-444005,0.00
521,2007-2008,Maharashtra,083780868,Gurnani Sati Charitable Trust,32/34 Anandilal Poder Marg Bombays Chambers Ist Floor Dhobi Talao Mumbai (Maharashtra)-400002,1393325.00
522,2007-2008,Maharashtra,083900056,Guru Gobind Singh Foundation,Guru Nanak Housing Society Mumbai Agra Road Behind Inayat CafDistt. Nashik Maharashtra-422009,0.00
523,2007-2008,Maharashtra,083780569,Guru Nanak Quin Centen.memo.hospi.trust,S-341 Gandhi Nagar Bandra (east)Mumbai 400051-,0.00
524,2007-2008,Maharashtra,083780375,Guru Nanak Sewa Mandir,350-b Linking Road 1 Priya Gound Floor KharMumbai 400052-,0.00
525,2007-2008,Maharashtra,084010021,Gurudatta Bahuuddeshiya Gramin Vikas Sanstha, 2 Sawarkar Market Datta ChowkYavatmal Maharashtra-445001,0.00
526,2007-2008,Maharashtra,083990016,Gurudev Sidha Peeth,P.o Ganeshpuri Dist: ThaneMaharashtra-,63771809.60
527,2007-2008,Maharashtra,083780853,H.h. The Prince Agakhan Hostel,Dhandhuka Ratandeep  140/141s.v. Road Andherhi (w)Mumbai-400058,400961.00
528,2007-2008,Maharashtra,083780961,H.M. Charitable Trust,Opp.Holy Spirit HospitalMahakali Caves Road Andheri(East) MumbaiMaharashtra-400093,0.00
529,2007-2008,Maharashtra,083780406,H.P.Karia Charities Arpan Blood Bank,160 R.b. Mehta Road Ghatkopar (east)Mumbai -400077,0.00
530,2007-2008,Maharashtra,083780615,Haji Ali Dargah Trust,Haji Ali Lala Lajpatrai Road MumbaiMaharashtra-400026,91771.00
531,2007-2008,Maharashtra,083930282,HAJI GULAM MOHAMMED AZAM EDUCATION TRUST,2390k B Hidayatullah Road New Modikhana Azam Campus PuneMaharashtra-411001,3463150.00
532,2007-2008,Maharashtra,083750060,Halo Medical Foundation,440- Shodh N-3 Cidco New AurangabadMaharashtra-431003,9945692.00
533,2007-2008,Maharashtra,084010020,Hamdard Education Soceity,C/o Imran Ahmad Abdul Rahman Kalamb Yavatmal Distt.Maharashtra.-445401,0.00
534,2007-2008,Maharashtra,083780148,Handmaids Of Sacred Heart Jesus Society,Dilkush Special School Juhu Road.Mumbai -400049,4705228.69
535,2007-2008,Maharashtra,083780912,Handspun for Urban Market,503 Jolly Bhavan 1 New Marine LinesMumbai (Maharashtra)-400020,916731.00
536,2007-2008,Maharashtra,083780627,Happy Home & School For The Blind,Dr Annie Besant Road Worli MumbaiMaharashtra-400018,521889.58
537,2007-2008,Maharashtra,083780784,Hargobind Trust,43 4th Floor Malkani Mahal  Dr A.b. Road Prabhadeve Opp.Century Bazar Mumbai (maharashtra)-400025,8672252.00
538,2007-2008,Maharashtra,083870043,Harvest Mission For Christ In India,Dr. Dalal Compound Katal RoadNagpur 440013.-,5386098.00
539,2007-2008,Maharashtra,083781075,Health Promotion Trust,Archbishop's House 21 Nathalal Parekh Marg MumbaiMaharashtra-400001,0.00
540,2007-2008,Maharashtra,083780915,Help Handicapped International,Vasant Vilas  31 Dr DD Sathye MargMumbai-400004,396075.00
541,2007-2008,Maharashtra,083860033,Helpers Of The Handicapped Kolhapur,235/11 E Ward Tarabai ParkKolhapur -416003,556242.00
542,2007-2008,Maharashtra,083930103,Helping Hands Poona,3 Parade Ground Road Cantonment Pune Maharashtra-411001,660093.00
543,2007-2008,Maharashtra,083930256,Helpo Foundation,171 M.g. Road Pune-1. -,1034282.00
544,2007-2008,Maharashtra,083740037,Hemant Nritya Kala Mandir,Frezapure Camp Amaravati - M.s. -,0.00
545,2007-2008,Maharashtra,083930280,Hemophila Society Of Maharashtra,Telco Road Chinchwad StationPune  Maharashtra-411019,162566.00
546,2007-2008,Maharashtra,083780791,Himgiri Spiritual And Training Centre,E-minoor Minar Building Veera  Desai Rd. Andheri (w)Mumbai (maharashtra)-400053,0.00
547,2007-2008,Maharashtra,083930301,Hindavi Swaraj Pratishthan,Kille Rajad  At. & Po. Chirmodi Tal- VelheDist- Pune Maharashtra-412213,0.00
548,2007-2008,Maharashtra,083780264,Hindu Women Welfare Society            4,Bombay 19 Maharashtra -,899165.00
549,2007-2008,Maharashtra,083780214,Hinduja Foundation,Hinduja House 171 Dr Annie Besant RoadMumbai,0.00
550,2007-2008,Maharashtra,083780781,Hindustan Lever Educational And Welfare Trust,Hindustan Lever House 165/166 Backbay ReclamationMumbai (maharashtra)-400020,0.00
551,2007-2008,Maharashtra,083930162,Hindustani Convent Church Education Fund,15 Solapur Road PuneMaharashtra-411001,60970627.00
552,2007-2008,Maharashtra,083870071,Hislop Education Society,13/2 2nd Streetcivil Lines Dhanatoli Civil LinesNagpur -440001,0.00
553,2007-2008,Maharashtra,083870024,Hislop Institute Of Social Action & Research,Temple Road Civil LinesNagpur-440001,761649.00
554,2007-2008,Maharashtra,083930312,Holistic Child Development India,Survey No.4A1/A1/1E Salunke Vihar road Kondwa KhurdPune411048,16723548.00
555,2007-2008,Maharashtra,083930417,Holy Angels Convent Society,St. Josephs Convent9Burr Road Kirkee PuneMaharashtra-411003,0.00
556,2007-2008,Maharashtra,083780027,Holy Cross Church,Gawde Marg Juhu Koliwada Santacruz (w)Mumbai -400049,61694.00
557,2007-2008,Maharashtra,083750016,Holy Cross Convent,Mali Ghargaon Tq. Vaijapur AurangabadMaharashtra-423701,1225122.00
558,2007-2008,Maharashtra,083750015,Holy Cross Dispensary,Mali Ghargaon Taluka VaijapurAurangabad -423701,0.00
559,2007-2008,Maharashtra,083740021,Holy Cross Home For Babies,C/o Holy Cross Convent AmravatiMaharashtra-444602,888614.80
560,2007-2008,Maharashtra,083740028,Holy Cross Needle Work Centre,Holy Cross Convent Amravati. -,0.00
561,2007-2008,Maharashtra,083780365,Holy Family   Church,Chakala Andheri(east)Mumbai 400093-,611380.00
562,2007-2008,Maharashtra,083720035,Holy Family Church,Gandhinagar Road KopergaonAhmednagar -423601,0.00
563,2007-2008,Maharashtra,083970006,Holy Family Convent  Trust,Vidyanagar KaradSatara  415124-,0.00
564,2007-2008,Maharashtra,147120176,Holy Mission Of Guru Nanak,"Holy Mission of Guru Nanak
Amrit Vela Mandir
815/16 Bhawani Peth
Padamji Compound 
District : Pune
Pincode : 411 042
State : MaharashtraPune411042",366577.00
565,2007-2008,Maharashtra,083720007,Holy Spirit Church,A/p Tal. Shevgaon AhmednagarMaharashtra-414502,821211.00
566,2007-2008,Maharashtra,083870001,Home For The Aged & Handicapped,Medical College Road UntkhanaNagpur-440009,4352619.79
567,2007-2008,Maharashtra,084010030,Hosanna Minisstries,Giri Nagar Yavatmal -445001,513990.76
568,2007-2008,Maharashtra,083780182,House of Charity,Near Versova Church Mumbai Maharashtra-400061,965883.00
569,2007-2008,Maharashtra,083930065,Human Organ.for Pioneering In Education,S.no.36/2/1 Vadgaon SheriPune 411014-,559832.00
570,2007-2008,Maharashtra,083750061,Human Resource Development Centre,Wahegaon Tq Gangapur AurangabadMaharashtra-431109,1108624.00
571,2007-2008,Maharashtra,083750102,Human Welfare Society,'Lake-View' Plot No.1 CIDCO N-12/B Professor ColonyAurangabad Maharashtra-431003,0.00
572,2007-2008,Maharashtra,083780237,Hume High School,337 Sir J. J. Road BycullaMumbai 400008-,196938.00
573,2007-2008,Maharashtra,083780297,Idara Dawatul Quran,59 Muhammad Ali RoadBombay -400003,140000.00
574,2007-2008,Maharashtra,083780368,Imaan Foundation,Najafi House 159 Nishanpada Road MumbaiMaharashtra-400009,20005120.96
575,2007-2008,Maharashtra,083780080,Immaculata Society,Nitya Sahaya Mata Niwas St. Michael's Bhawan  F.n.-14 Ist Floor Mahim  Mumbai -400016,0.00
576,2007-2008,Maharashtra,083990002,Immaculata Society,Fatima Mata Children's Home Chulna BasseinThane - -401202,188880.00
577,2007-2008,Maharashtra,083781025,Impact Foundation India,F1 1st Floor Laxmi Woollen Mills Estate  Shakti Mills Lane Off Dr. E. Moses Road Mahalaxmi (West)MUMBAI400011,16146147.00
578,2007-2008,Maharashtra,083780372,Impact India Foundation,NHAVA HOUSE 1ST FLOOR 65 MAHARSHI KARVE ROAD MARINE LINESMUMBAI400002,22808828.00
579,2007-2008,Maharashtra,083780752,In Defence Of  Animals,7 Shanti Kunj  124 Hindu Colony  Dadar Mumbai Maharashtra -400014,1741866.00
580,2007-2008,Maharashtra,083780610,Indeal Educational Movement,117JumaMasjid Trust Bldg 9/1st Flr Shaikh B.q.street (Teli Mohalla)Mumbai Maharashtra-400008,732664.00
581,2007-2008,Maharashtra,083720047,India Bible Education Enterprises,Rahuri Station Dist. Ahmednagar.413705-,1367139.00
582,2007-2008,Maharashtra,083930099,India Bible Training Institute,104 Salisbuky ParkPune -411037,79915.00
583,2007-2008,Maharashtra,083870170,India Out reach Missions,Opp.T.B. Ward Gate Medical College Rd. NagpurMaharashtra-440003,1568920.71
584,2007-2008,Maharashtra,083780071,India Sponsorship Committee,Mathurdas Estate Building No. 1 43/45 Colaba Causeway Sbs Road Colaba Mumbai -400039,4904517.00
585,2007-2008,Maharashtra,083780910,Indian Association for Cancer Research,Cancer Research Institute Dr E. Borges RoadMumbai (Maharashtra)-400012,6231.00
