561,2007-2008,Telangana,010240029,Rangineni Sujatha Mohan Rao Educational and Charitable Trust,H. No. 3-1-7 Balajinagar Karimnagar Road SircillaKarimnagar (A.P.)-505301,0.00
562,2007-2008,Telangana,010360105,RAPID- Voluntary Organisation,Dr.B. Surender H.No.6-62/1 Po Arepally Hanamkonda WarangalAarepally Warangal Andhra Pradesh-506006,0.00
563,2007-2008,Telangana,010290021,Reaching the Unreached Ministries,Hoti (b) Post  Zaheerabad Mandal Medak (Andhra Pradesh) -502220,2143098.00
564,2007-2008,Telangana,010230727,Reachout,H.No.1-3-183/40/48 SBI Colony Gandhi NagarHyderabad Andhra Pradesh500080,1746043.00
565,2007-2008,Telangana,010230149,Relief Development Orphanage & Educational Trust,39 Sarojni Devi Road P.O.Nox-1713Secunderabad A.P.-,35433549.55
566,2007-2008,Telangana,010300034,Renuka Mahila Mandali,Ram Nagar  KesraijapallyMiryalguda Nalgonda Distt. A.P-,0.00
567,2007-2008,Telangana,010230290,Research in Environment Education and Development Society,17-1-386/S/22 S. N. Reddy Nagar P.O.- Champapet Hyderabad  A. P.-500060,5268537.00
568,2007-2008,Telangana,010360080,Research Voluntary Association,6-4-21 Brahmin Wada Hanamkonda WarangalAndhra Pradesh-506011,0.00
569,2007-2008,Telangana,010190261,RESPOND,H. No 5-1-565 2nd Floor Hill StreetRani Gunj Secundrabad500003,0.00
570,2007-2008,Telangana,010240041,Resurrection Life Ministries,D.NO. 11-8-61 B.Y. Nagar Town/City:SircillaDistt: Karim Nagar Andhra Pradesh-505301,0.00
571,2007-2008,Telangana,010360098,Revival Christian Centre,100 Darga Road R.E.C. Post Warrangal (Andhra Pradesh) -506004,1427364.00
572,2007-2008,Telangana,010230729,ROCK CHURCH EDUCATIONAL FOUNDATION,10-5/7/6/1 1ST LANCER ROAD MASAB TANK HYDERABAD ANDHRA PRADESH - 500028HYDERABAD500028,804978.00
573,2007-2008,Telangana,010230054,Rock Church Ministries,10 5-7/6/1 First Lancer Road Masab Tank HyderabadA.P.-500028,75725882.79
574,2007-2008,Telangana,010300087,Rosary Socio Educational Society,ISt Floor-Shop No.67 S.P.Market NalgondaAndhra Pradesh-508001,119720.23
575,2007-2008,Telangana,010250068,Rotarian's Community Service Foundation,Rotary Complex Kothagudem   Opp. Sub-Court Distt. KhammamAndhra Pradesh -507101,2173880.00
576,2007-2008,Telangana,010230354,Rotary Trust for Handicapped,5-9-22/50 Adarsh Nagar HyderabadA.P.-,0.00
577,2007-2008,Telangana,010230381,Royal Society,Plot No -1258 Behind Saibaba Temple Ayyappa Society Road Dwarakamai Colony Madhapur HyderabadR.R Dist. Telangana -500081Hyderabad500081,0.00
578,2007-2008,Telangana,010230649,Rural Action for Creative Education,Flat No.103 Raghava ResidencySaraswathi Colony BoduppalHyderabad500092,226243.00
579,2007-2008,Telangana,010230105,Rural Advancement & Integrated Social Evolution Society,3-6-551/1 Himayat Nagar HyderabadA.P.-,0.00
580,2007-2008,Telangana,010250028,Rural Agricultural & Gramodyog Development Society,4-13-19 Pakbanda Distt. KhammamA.P.-,0.00
581,2007-2008,Telangana,010300022,Rural Amelioration Service Society,Aler Station Road Distt. Nalgonda A.P. -,126000.00
582,2007-2008,Telangana,010250115,Rural and Urban Training for Humanising and Development Society,Kusumanchi KhammamAndhra Pradesh-507159,19050.00
583,2007-2008,Telangana,010220135,Rural Awareness and Development Society,Survey No. 115 BTS Colony Near Water Tank VikarabadRanga Reddy Dist.  A.P.-501101,1294539.00
584,2007-2008,Telangana,010230060,Rural Development Advisory Service,Ruhaima 2-13 Tarmaka Secunderabad Distt. HyderabadAndhra Pradesh.-,1215076.00
585,2007-2008,Telangana,010230396,Rural Development Foundation,502 Kaarnik Tws 6-2-967 Khairtabad HyderabadAP-500004,6793329.00
586,2007-2008,Telangana,010220022,Rural Development Society,Lilipriva Palmkale Dubbacherlapp Distt. Rangareddy A.P. -,1864066.00
587,2007-2008,Telangana,010230626,Rural Development Society,12-13-308 Krishna Priya Apartment Flat No.303 Street No.19 TarnakaMarredpally Mandal Secunderabad -500017,0.00
588,2007-2008,Telangana,010250082,Rural Development Society,D.No.4-2-150/3A Srinivasa Nagar KhammamAP-507001,1369130.00
589,2007-2008,Telangana,010280055,Rural Development Society,H.No.14-42-509 Vengal Rao Colony Wanaparthy MahabubnagarAndhra Pradesh-509103,243723.00
590,2007-2008,Telangana,010230683,Rural Development Society old age home for women,H.No. 12-1-508/63 Lakshmi Nagar LalpetSecunderabad Andhra Pradesh-500017,0.00
591,2007-2008,Telangana,010230732,Rural Economical Non-formal Educational Development Society,Plot No. 112 Road No. 2 TMC Mahendra HillsHyderabad/Secunderabad A.P.500026,0.00
592,2007-2008,Telangana,010300040,Rural Education & Agricultural Development Society,H.NO.3-11-20/2 Indira Nagar Colony Bhongir Distt. NalgondaAndhra Pradesh -508116,0.00
593,2007-2008,Telangana,010230192,Rural education and Agriculture Development Society,Flat No.101 H.No.24-88/49/A/F101 Above Syndicate BankEast Anand Bagh Malkajgiri,893801.00
594,2007-2008,Telangana,010240020,Rural Education andCommunity Health Soceity,C/o Usha Lakshmi Maternity and Nurs 1-1-176 Jambigadde RoadJagital Karimnagar Distt.-505327,4990393.00
595,2007-2008,Telangana,010230300,Rural Education for Development Economic Environmnet Motivation,10-1-803/2 Veer Nagar Kairatabad HyderabadAP-,15948.00
596,2007-2008,Telangana,010110020,Rural India Social Engineers, Adilabad DistAndhra Pradesh -,790743.00
597,2007-2008,Telangana,010220078,Rural Mahila Sangham,2-12-29 Annapurna Colony Uppal PostRangareddy Andhra Pradesh -500039,0.00
598,2007-2008,Telangana,010290013,Rural Organisation For Awareness & Development,Distt. Medak Andhra Pradesh          -502313,74000.00
599,2007-2008,Telangana,010230369,Rural Organisation for Social Education,1-6-212/65/107/35Gangaputra Colony Parsigutta HyderabadAndhra Pradesh-500048,13488971.00
600,2007-2008,Telangana,010220081,Rural Welfare Assocation,H. No.2-II-130/23  Dharampuri Colony Uppal Hydrabad Dist-  Ranga Reddy A. P.-500039,0.00
601,2007-2008,Telangana,010230220,S.George's Public Educational Society,13-202 Indiranagar Meerpet  Opp. A.P.H.B. Community HallTown  Moula Ali Hyderabad A.P.-,0.00
602,2007-2008,Telangana,010230669,Saciwaters,House No B 87   third Avenue  sainik PuriSecunderabad500094,12066155.16
603,2007-2008,Telangana,010230525,Sadhana,Flat No G-16 PallaviAparatments Vinayakanagar Balanagar500042,3290170.99
604,2007-2008,Telangana,010220150,Sadhana Society for the Mentally Handicapped,1-4-63/B Sneha Nagar Colony Street No.8 Habsiguda HyderabadRanga Reddy (Andhra Pradesh)-500007,0.00
605,2007-2008,Telangana,010230722,Sagarlal Matadin Charitable Trust,1-5-551 Musheerabad HyderabadAndhra Pradesh-500020,0.00
606,2007-2008,Telangana,010230402,Sahaj Seva Samsthan,254/3 RT Vijaynagar Colony HyderabadAP-500057,5426264.00
607,2007-2008,Telangana,010230259,Sahara,2-3-703/K/1 Tirumalanagar Amberpet HyderabadAndhra Pradesh-500013,731466.00
608,2007-2008,Telangana,010230601,Sahayata Trust,"# 16-2-661/3 JUDGES COLONY NEW MALAKPET
HYDERABAD TELANGANA STATE-500036HYDERABAD500036",35040970.00
609,2007-2008,Telangana,010230213,Sai Oral Health Foundation,6-5-661 Sangeethnagar Hyderabad A.P. -,2297506.00
610,2007-2008,Telangana,010230404,Sai Seva Sangh,231/C  Sanjeeva Reddy Nasgar  Distt. Hyderabad Andhra Pradesh  -500038,694827.00
611,2007-2008,Telangana,010230087,Samakhya,3rd Floor Krishna Complex  Opposite Surya TheatarePB-265 Hyderabad A.P.-500001,3394362.00
612,2007-2008,Telangana,010230437,Sampurna (The Overall Development),16-9-32/2/2/B Kanibagh Malakpet HyderabadAndhra Pradesh-500036,1302341.00
613,2007-2008,Telangana,010230322,Samskar,2-19-35 Kalyanpuri Uppal  HyderabadA.P.-,0.00
614,2007-2008,Telangana,010220192,Samson Rural and Urban Needy Society,Flat No.8&9 Seven Hills Apartment Venkateshwara ColonyBibi Saheb NgrUppal Rangareddy (A.P.)-500005,0.00
615,2007-2008,Telangana,010220194,Samsrita Economical Educational Development Society,Plot No. 204 2nd floor  Balaji Towers Balaji Nagar KukatpaliRanga Reddy Andhra Pradesh-500072,0.00
616,2007-2008,Telangana,010230695,Samuha,8-3-318/11/S/1 III floor Jayaprakash NagarYellareddygudaHyderabad Andhra Pradesh-500073,0.00
617,2007-2008,Telangana,010300077,SANA EDUCATIONAL SOCIETY,H. No.10-147/C Azad Nagar Kodad NalgondaAndhra Pradesh-508206,0.00
618,2007-2008,Telangana,010230056,Sanjeeva Sadanam Society,4-116 Ranamthapur Hyderabad Andhra Pradesh. -,10170622.00
619,2007-2008,Telangana,010300029,Sanjeevani Charitable Trust,Konda Mullipally PO Devekonda Mdl NalgondaAP-508243,2659314.00
620,2007-2008,Telangana,010220102,Sankara Bhaktha Sabha Trust,Veda Bhavan Plot 58-59 Road. No. 1 Chandragiri ColonyHyderabad,1584701.00
621,2007-2008,Telangana,010240016,Sankshema -  Sushiruta Cancer Theropy & Research Institute,Sarawthi Nagar Karimnagar -505001,0.00
622,2007-2008,Telangana,010230333,Sankurathri Foundation,C-3 Mathrushi Apartments HyderabadAP-,12362973.50
623,2007-2008,Telangana,010230588,Sannihita Centre for Women and Girl Children Society,F-89 RBI Staff Quarters Musheerabad HyderabadAndhra Pradesh-500020,165745.00
624,2007-2008,Telangana,010220190,Sarva Loka Nadhuni Sangam,H.No.30-266/8/3/2/4 Venkateshwara Nagar Est.II Old SafilgudaR.K. Puram Hyderabad R.R.Dist. -500056,0.00
625,2007-2008,Telangana,010360104,Sarva Prema Welfare Society,Social Service Centre Fatima Nagar-NIT-P.O.Warangal Andhra Pradesh-506004,3184963.00
626,2007-2008,Telangana,010230330,Sarvartha Samkshema Samiti,501 Pradeep Apts Gandhi Nagar HyderabadAP-,1286.00
627,2007-2008,Telangana,010360067,Sarvodaya Youth Organisation,6-1-76/A Opp. Sridevi Theatre Hanamkonda WarangalAP-506001,5658219.00
628,2007-2008,Telangana,010230581,Sat Prakasan Sangh,St. Anthony's Church Mud Fort SecunderabadHyderabad Andhra Pradesh-500009,4599800.00
629,2007-2008,Telangana,010250130,Scher Voluntary Organisation,H. No.8-6-94 Thummalagadda KhammamAndhra Pradesh-507001,0.00
630,2007-2008,Telangana,010230346,Self Employed Welfare Society,Sangeetha Nilayam Old Urban Colony Vemulawada Dist: KarimnagarAndhra Pradesh-505302,6292256.00
631,2007-2008,Telangana,010230654,Senkoen Association,H.No.293/2RT Vijayanagar Colony HyderabadAndhra Pradesh-500057,476938.00
632,2007-2008,Telangana,010220106,Serene Services,2-153 Marpally Village & Mandal Rangareddy District.Andhra Pradesh.-501202,383691.00
633,2007-2008,Telangana,010360048,Seva,11-29-282Bank Cly -2 Ramanathapuri Lane WarangalAP-506002,5524075.00
634,2007-2008,Telangana,010230537,Seva Bharat,3-36 1st Floor Ashirwad globalLearning Centre Jodimetla ghatkesar Mandal500088,107920838.00
635,2007-2008,Telangana,010320003,Seva Sadan Social Centre,Amdranagar  Distt. Nizamabad A.P. -,103000.00
636,2007-2008,Telangana,010220090,Sevashram,Deepttishi Nagar Colony Chandanagar Hydrabad Andhra Pradesh -500050,0.00
637,2007-2008,Telangana,010220205,Shanthi Ashram Charitable Society,H.No.4-3-83 Don Bosco Nagar Himayat sagar RoadHyderabad500030,8581.93
638,2007-2008,Telangana,010300065,Shanthi Mahila Mandali,H. No. 5-6-460 FCI Godam Road Near New CollectorateNalgonda (Andhra Pradesh)-508001,0.00
639,2007-2008,Telangana,010290018,Shanthi Rural Development Society,Post Hachapet Mandal Dabbak Distt. MedakAndhra Pradesh -502108,0.00
640,2007-2008,Telangana,010360106,Shanthi Service Society,H.No.3-1-94 Kakatiya ColonyHanamkonda506011,104500.00
641,2007-2008,Telangana,010250111,Shanthi Welfare Association for the Deaf Blind and Handicapped,H. No. 20-47/1 'C' ColonyPaloncha Khammam District(Andhra Pradesh)-507115,0.00
642,2007-2008,Telangana,010220124,SHANTHINIKETAN,Plot No.10 Gouthami Nagar VanasthalipuramRangareddy (Andhra Pradesh)-500070,0.00
643,2007-2008,Telangana,010230286,Share,No -12-13-680 Nagarjuna Nagar Tarnaka HyderabadAndhra Pradesh-500017,0.00
644,2007-2008,Telangana,010230233,Share Medical Care,Ghanpur Village Medchal MandalRanga Reddy District501401,0.00
645,2007-2008,Telangana,010230226,Sharfia Educational & Welfare Society, HyderabadAP-500659,5000.00
646,2007-2008,Telangana,010220211,Sharon  Gospel Churuch and Ministries,6-86/3QutubullapurjeedimetlaHyderabad500055,0.00
647,2007-2008,Telangana,010230628,Sharon Gospel Trust,Plot No.6 Manovikas Nagar Opp NIMHSecunderabad500009,0.00
648,2007-2008,Telangana,010230726,Sharon Seva Ministries,B3-52 HUDA Colony Chandanagar Rangareddy DistHyderabad Andhra Pradesh-500050,1980696.68
649,2007-2008,Telangana,010220130,Shekinah Foundation,H.No.4-3-2 Hayathnagar RangareddyAndhra Pradesh-501505,401512.00
650,2007-2008,Telangana,010220203,Shining Stars Centres for youth Development,Plot 59/60 A  V.S.T.  Colony Nacharam Hyderabad Ranga ReddyAndhra Pradesh-500076,520679.00
651,2007-2008,Telangana,010280040,Shramika Vikasa Kendram(SVK),Kollapur Mahabubnagar Andhra Pradesh -509102,2219857.00
652,2007-2008,Telangana,010220087,Shri Swaminarayan Gurukul Cherela,Road  Moinabad  Mandal  EnKapali Hydrabad Ranga Reddy Andhra Pradesh -500075,4647753.00
653,2007-2008,Telangana,010230502,Shyam Prasad Institute of Social Service,1-8-522/7Chikkadapally` HyderabadAndhra Pradesh-500029,30137.00
654,2007-2008,Telangana,010230283,Sidur Society for Integrated Development,Sidur HyderabadAP-144289,32188777.84
655,2007-2008,Telangana,010230040,Siloam Evangelistic & Social Outreach Network,Post Bag-39  Secunderabad               -500003,145388.00
656,2007-2008,Telangana,010230065,Sion Fellowship,Blassington1-6-219/b/3Parsingutta HyderabadDistt. A.P.     (Pl. See also No.0102230002)       -,2799601.00
657,2007-2008,Telangana,010320009,Siri Vennela Social Welfare Society,Office No.6-9-15 Namdevwara Nizamabad Andhra Pradesh -503002,0.00
658,2007-2008,Telangana,010290010,Sisters of charity,St. Vincent D.E.Paul Allirajpet Jagdevpur Gagwal Distt MedakA.P.-,132061.00
659,2007-2008,Telangana,010250062,Sisters of Mary Immaculate of Bishop Morrow,Wara - P.O.  District-  KhammamA.P.-507165,314800.00
660,2007-2008,Telangana,010250140,Sitara Association,Chinturu Village KhammamAndhra Pradesh-507126,954975.00
661,2007-2008,Telangana,010220027,Sivananda Rehabilitation Home,Kukatpally Distt. Rangareddy A.P. -,3781628.00
662,2007-2008,Telangana,010250071,Sneha,P.G. Baxzar Sathupally KhammamA.P.-507303,4792028.00
663,2007-2008,Telangana,010360038,Sneha,Ookal Haveli via Dharmaram WarangalAP-506002,630084.00
664,2007-2008,Telangana,010220107,Sneha Sri Mahila Mandali,C-5-112 Jajpur Colony Nagole Uppal Mandal Rangareddy Distt.Hyderabad. (A.P.)-500068,0.00
665,2007-2008,Telangana,010250074,Social & Humanising Action For Rural Poor,Ambedkar Nagar Kalluru Distt. Khammam Andhra Pradesh  -507209,0.00
666,2007-2008,Telangana,010220059,Social Action  For Need,17-66/1 Sri Sairam Nagar Uppa RangareddyAP-,1621819.00
667,2007-2008,Telangana,010280045,Social Action for Integrated Development,3-85 Asha Colony ShadnagarMahaboobnagar (A.P.)-509216,0.00
668,2007-2008,Telangana,010220061,Social Action for Integrated Development Service,3-2-37/A/2 Srinagar Colony RamanathnagarHyderabadAndhra Pradesh -500013,0.00
669,2007-2008,Telangana,010230004,Social Action for Social Development,Plot No. 243 Srinivasa Colony  Mehboob NagarAndhra Pradesh -509002,875705.00
670,2007-2008,Telangana,010360022,Social and Cultural Development Service Society,Ambedkar NagarJangaon506167,2946449.00
671,2007-2008,Telangana,010300041,Social Awareness for Integrated Development,1-9-237 2nd Floor Pasigutta Road Ramnagar HyderabadAndhra Pradesh.-500048,0.00
672,2007-2008,Telangana,010230725,Social Educational and Awareness Mission India (SEAM INDIA),8-3-228/688 Rehmatnagar Yousufguda HyderabadAndhra Pradesh-500045,0.00
673,2007-2008,Telangana,010250141,Social Educational and welfare Activities Association,Nellipaka Banjar Via - Sarapaka Distt: KhammamAndhra Pradesh-507128,0.00
674,2007-2008,Telangana,010320025,Social Organisation for Uplift of Rural Community and Environment Source,H. No. 8-8 Aloor Village Armoor MandalNizamabad (Andhra Pradesh)-503224,0.00
675,2007-2008,Telangana,010360030,Social Service CentreCSI,Karim Nagar Diocese CASI Compound NekkondaDistt. Warangal A.P.-,0.00
676,2007-2008,Telangana,010110029,Society  For Women and Child Development Services,H.No. 4-100 Uthkoor Village Mandal Luxettipet AdilabadAndhra Pradesh-504215,0.00
677,2007-2008,Telangana,010220075,Society for  Educationa & Research of Visually Handicapped,B-3 65 Huda Colony Chandnagar HyderabadAndhra Pradesh -500050,0.00
678,2007-2008,Telangana,010230417,Society for Abundant Life Resources,25/A Sheshachal Cly Marredpally -W PO Nehru Nagar SecunderabadAP-500026,1225562.00
679,2007-2008,Telangana,010300016,Society for Action With Rural Poor,"H.NO.LIG-I-14
APHB ColonyBhuvanagiri
YadadriBhuvanagiriTelangana-508116
Phone:08685-245646Bhuvanagiri508116",464200.00
680,2007-2008,Telangana,010230651,Society for All Round Development With National Integrity,18-469/2 Mallikarjunanagar Malkajgiri SecunderabadHyderabad (A.P.)-500047,355465.00
681,2007-2008,Telangana,010220149,Society for Awareness and Village Enlightment,17-6-616 Indira Nehru Nagar Malkajgiri Post HyderabadRanga Reddy (Andhra Pradesh)-,0.00
682,2007-2008,Telangana,010250121,Society for Awareness in Rural Mass.,H.No.5-5-189/83 Sambhaninagar KhammamAndhra Pradesh-507002,0.00
683,2007-2008,Telangana,010230334,Society For Centre For Population & Development Studies,G-3 Shanti Apartments Anand Nagar Colony HyderabadAndhra Pradesh-,0.00
684,2007-2008,Telangana,010360096,Society for Community Organisation & Protection of Environemnt,5-11-551/1 Srinagar Colony K.U.C.'X'Road HanamkondaWarangal (Andhra Pradesh)-506009,0.00
685,2007-2008,Telangana,010300044,Society for Economic Education and Economic Development,2-3 Harjanawada Redla repaka  Valigonda(M) Dist: NalgondaAndhra Pradesh-508112,66250.00
686,2007-2008,Telangana,010220153,Society for Enlightment and Reorganisation of the Village Ends,Pl. No 136 Huda Weaker Sec. Colony Lenin Ngr Meerpet HyderabadRangareddy (Andhra Pradesh)-500079,5193963.00
687,2007-2008,Telangana,010290023,Society for Environmental Education and Development,Mucherla VG. Hathnoora Mdl Post TaharkhanpetMedak District (Andhra Pradesh)-502296,303400.00
688,2007-2008,Telangana,010230104,Society for Friar's MinorR,Shalom Friary Ramnagar HyderabadA.P.-,830000.00
689,2007-2008,Telangana,010250143,Society for Health & Agricultureal development,H.No. 5-45 Town/City:Burugumpahad Distt:KhammamAndhra Pradesh-,0.00
690,2007-2008,Telangana,010220186,Society for Health & Educational Development Society,Plot No.59 TRR Township Meerpet Saroornagar Mandal RangareddyAndhra Pradesh-500072,0.00
691,2007-2008,Telangana,010230181,Society for Health Allied Research and Education SHARE India,Ghanpur Village Medchal MandalRanga Reddy District501401,38528052.00
692,2007-2008,Telangana,010250139,Society for Health Awareness and Rural Enlightenment,H.No. C1-124  Sai Sagar Nagar Jilugumadu Madhira Khammam Dist;Andhra Pradesh- 50720,0.00
693,2007-2008,Telangana,010230372,Society for Human Awareness and Rural Development,8-12-95/65 Rajeev Shetty Nagar Karmanghat Saroor NagarMandal Post Meerpet Greater Heyderabad500097,0.00
694,2007-2008,Telangana,010300064,Society for Humancare Agriculture and Rehabilitation for Rural People,Vill:Bhoodan Pochampally NalgondaAndhra Pradesh-508284,0.00
695,2007-2008,Telangana,010320026,Society for Integrated Development Services,H. No. 5-3-353 Vidyanagar Colony KamareddyNizamabad (Andhra Pradesh)-503111,0.00
696,2007-2008,Telangana,010250093,Society for Integrated Rural Improvement,H.No: 13-1-125/1 RDO Office Road Ramnagar New PalonchaNew Paloncha507115,886131.00
697,2007-2008,Telangana,010300078,Society for Integrated Social Service,Post & Village Kotamarthi Mothkur Mandal NalgondaAndhra Pradesh-508277,0.00
698,2007-2008,Telangana,010280047,Society for Integration and Rural Development,H.No.17-98/1 Beside Old MRO Office Near Water Tank KothakotaMahabubnagar (A.P.)-509381,0.00
699,2007-2008,Telangana,010230499,Society for Participatory Development and Research,2-38/4Gautami nagarNizampet road Kukatpally HyderabadAndhra Pradesh-500072,0.00
700,2007-2008,Telangana,010230432,Society for Participoatory Development,"F-1EDEN BANJARA AURORA COLONY
AVENUE-8 ROAD NO -3 BANJARA HILLS HYDERABAD-500034HYDERABAD500034",2045519.00
701,2007-2008,Telangana,010360089,Society for People Advancement and Community Education,4/C APHB Colony Subedari Hanamkonda WarrangalAndhra Pradesh-506001,109000.00
702,2007-2008,Telangana,010280051,Society for Peoples Economic and Educational Development,Door No. 1-3-153 Ist Floor Opp Navarang TheaterSunkulammaMettu Gadwal Mahaboobnagar-509125,0.00
703,2007-2008,Telangana,010230657,Society for Peoples Rehabilitation Educational And Awareness on Development,Flat No.4F Maruti HeightsRd. No.1 Banjara Hills HyderabadAndhra Pradesh-500034,0.00
704,2007-2008,Telangana,010230522,Society for ProgressApplied Research and Education,6-1-134/3Padma Rao Nagar Secunderabad HyderabadAndhra Pradesh-500025,93750.00
705,2007-2008,Telangana,010220083,Society For Promotion of Rural Development,22-242 Plot No-11 Opp.  Raghava Apts Bhagyanagar Colony Kukatpally Hyderabad A.P.-500072,0.00
706,2007-2008,Telangana,010220156,Society for Rural Awakening and Community Organisation,Plot No. 50/51 Ist FloorSri Sai Needhi Enclave Neeredmet X RoadR.K.Puram Rangareddy (A.P.)-500056,0.00
707,2007-2008,Telangana,010230376,Society for Rural Development,1-3-6/2 IInd Floor Nr Civil Hosp Bhongir NalgondaAndhra Pradesh-508116,0.00
708,2007-2008,Telangana,010320011,Society for Rural Reconstruction,11-2-31 Kanteshwar Opp Temple NizamabadAP-503002,1699919.00
709,2007-2008,Telangana,010230423,Society for the Development of the Needy,191 Railway Cly Chilkaguda  SecunderabdAP-500025,826020.00
710,2007-2008,Telangana,010230646,Society for the Transformation of Economically Poor,10-1-18/6 Shyam Nagar Near Masab Tank HyderabadAndhra Pradesh-500002,0.00
711,2007-2008,Telangana,010110030,Society for Urban and Rural Enlightenment,4-3-61/62/A Pulenagar Bhainsa AdilabadAndhra Pradesh-504103,0.00
712,2007-2008,Telangana,010230156,Society for Urban and Rural Enlightenment,16- 10 -27/90 85  SRT Municipal Colony Old  MalakpetHyderabad500036,724554.00
713,2007-2008,Telangana,010300089,Society for women Education and Environment Trainings,V & Po- Kattangur Town: Kattangur Distt: NalgondaAndhra Pradesh-508205,196862.00
714,2007-2008,Telangana,010290019,Society for Women's Awareness and Rural Development,H.No. 12-3-130/6 Khaderpura Street SIddipet Dist: Medak Andhra Pradesh-502103,1878632.00
715,2007-2008,Telangana,010280027,Society Of Help,6-24/6 Sreenivas Colony Distt. Mahabubnagar    Andhra Pradesh -509002,141310.53
716,2007-2008,Telangana,010230067,Society of Jesus Mary & Joseph,Provincialte Society of JMJ-568 Sumajiguda  Hyderabad DistrictAndhra Pradesh-500482,23078754.00
717,2007-2008,Telangana,010220134,Society of Lourdes Vocational Educational and Social Service,1-2-139/1 Malreddypally Tandur Rangareddy Andhra Pradesh-501141,0.00
718,2007-2008,Telangana,010220071,Society of the Immaculate Heart of Mary,Nandrekal Vil.Nadargul PO RangareddyAP-501510,17120740.69
719,2007-2008,Telangana,010360055,Society of the Presentation Sisters,Fathima Nagar REC  WarangalAP-506004,9310188.00
720,2007-2008,Telangana,010300048,Society Of The Servants Of The Holy Spirit,H.NO. 1-58 Paviratma School Valigonda Andhra Pradesh  -508112,63863.00
721,2007-2008,Telangana,010230318,Society with Ethos of Development,H.NO.8-4-403/8 Prem Nagar          Erragadda Hyderabad Andhra Pradesh -,522078.00
722,2007-2008,Telangana,010250069,Socio Economic and Cultural Upliftment in Rural Enviornment,H. NO. 8 -1 -110 GattaigudemPolvoncha507115,7875377.00
723,2007-2008,Telangana,010300026,Sodara Society for Developmental Education and Rural Action,Distt. Nalgonda 508001 AP -,0.00
724,2007-2008,Telangana,010280054,Sonlight Gospel Fellowship Ministries,L.I.G.-II H.No.17A.P.Housing Col. Nagar Kurnool TownMahabubnagar (A.P.)-509209,0.00
725,2007-2008,Telangana,010230012,South-East Asian Missions Trust of India,Secundrabad Distt. Andhra Pradesh               -500017,3680898.00
726,2007-2008,Telangana,010290029,Spandana,HNo.5-1-2/84 Shanti Nagar Beside Old Telecom OfficeSangareddy Medak (A.P.)-502001,0.00
727,2007-2008,Telangana,010230463,Spandana Abhyudaya Mandali,C-9 Balaji Nilayam Madhura Nagar Hyderabad Andhra Pradesh -500038,0.00
728,2007-2008,Telangana,010230561,Spandana Cultural Organisation for Progressive Education,H.NO: 2-2-18/47 B-20 FLAT NO 504 SRI SAI KRUPA RESIDENCY D.D. COLONY BAGH AMBERPETHYDERAABD500013,1348925.00
729,2007-2008,Telangana,010250126,Spandana Mahila Samajam,H.No.2-5-324 P.S.R. Road KhammamAndhra Pradesh-507003,0.00
730,2007-2008,Telangana,010220209,SPANDANA SOCIETY,Plot No. 2-1-88/B/8/1 KRUSHI NAGAR COLONY BANDLAGUDA NAGOLERANGA REDDY500068,0.00
731,2007-2008,Telangana,010230521,Special Education Centre for the Mentally Handicapped,Institute of Genetics Campus Ameerpet HyderabadAndhra Pradesh-500016,0.00
732,2007-2008,Telangana,010240027,Spurthi,H.no.1113/D Javahar nagar Godavarikhani Karim nagarAndhra Pradesh-505209,0.00
733,2007-2008,Telangana,010220212,Sri Andal Educational Cultural Society,H.No. 3-58 Venkateshwara Colony Kuntloor VillageHayathnagar Mandal501505,0.00
734,2007-2008,Telangana,010280013,Sri Balaji Voluntary Service Association,Near Venkateswara Theatre Amargal          Mahaboobnagar Andhra Pradesh-509321,0.00
735,2007-2008,Telangana,010280058,Sri Dattatreya Seva Sadhan,Solipure (pl; & V) Killa Ganpure Distt: Mahaboob nagarAndhra Pradesh-,0.00
736,2007-2008,Telangana,010230715,Sri Durga Women Development Society,Plot No.19 Sri Durga Estates Jeedimetla Medchal RoadHyderabad Ranga Reddy Dist AP-500055,0.00
737,2007-2008,Telangana,010230198,Sri Jain Sewa Sangh,3-5-21/BRankoti Edengagh Road Hyderabad A.P. -500001,0.00
738,2007-2008,Telangana,010230453,Sri Lakshmi Venkateswara Polapragada Charitable Trust,C/o S.L.Dagnostics Lower Ground Floor Windsor PlazaNallakunta-Hyderabad A.P.-500044-,0.00
739,2007-2008,Telangana,010250076,Sri Laxmi Mahila Mandali,H.NO.7-7-69 Medar Basthi Kothagudem Distt. KhammamAndhra Pradesh -507101,0.00
