198,2009-2010,Uttarakhand,347900001,Sarvahitkari Dharmarth Nyas (Regd.),"""Kalpathru""Po-Satyanarayana Temple Shyampur - Rishikesh( Nepali Farm)H-D Road Dehradun Uttaranchal.-249204",0.00
199,2009-2010,Uttarakhand,347920010,Sat Tal Christian Ashram,Sat Tal Ashram Via- MehragaonNainital-Uttranchal-263132,1244903.39
200,2009-2010,Uttarakhand,347920014,Sat Tal Estate Association,P.O. Mehragaon NainitalUttaranchal-,479280.00
201,2009-2010,Uttarakhand,347900073,Seekers Trust Sadhana Kendra Ashram,Vill. Domet P.O. Ashok Ashram Distt. DehradunUttar Pradesh-248125,10138165.67
202,2009-2010,Uttarakhand,347900031,Serve and Share Association (SASA),2299/4 Kishnapur Rajpur RoadDehradun-Uttaranchal-248001,8038727.00
203,2009-2010,Uttarakhand,347900087,Service For Health & Rural Education,Redburn Main Landour Mussoorie Distt. DehradunUttaranchal-248179,868116.00
204,2009-2010,Uttarakhand,347900017,Shalom Childrens Home,Ponta Rd P.O. Dhakrani Colony DehradunUttranchal-248127,8519637.00
205,2009-2010,Uttarakhand,347900023,Sharp Memorial School For Blind,P.O. Rajpur DehradunUttaranchal-248009,4041093.50
206,2009-2010,Uttarakhand,347900122,Shishya Society,Village Atak FarmSailakui248197,7995025.76
207,2009-2010,Uttarakhand,347900016,Shr Bharat Mandir School Society,Haridwar Road Rishikesh Distt. DehradunUttaranchal-249201,1395323.00
208,2009-2010,Uttarakhand,347920024,Shree Kedar Educational And Social Welfare Society Reg.,Rampur Road P.O. Manpur WestHaldwani263139,0.00
209,2009-2010,Uttarakhand,347910011,Shree Raghvendra Sewa Ashram Samiti,Dudhari Chowk Bhoopatwala Haridwar (Uttaranchal) -249410,250000.00
210,2009-2010,Uttarakhand,347960028,Shri Bhubaneshwari Mahila Ashram,Anjanisain Tehri GarhwalUttaranchal -,48507289.85
211,2009-2010,Uttarakhand,347900125,Shri Guru Ram Rai Education Mission Managing Committee,Jhanda MohallaDehraDun248001,0.00
212,2009-2010,Uttarakhand,347960018,Shri Jagdmba Samiti,Village- Bhat Goun Via- Ghansali Distt.- Tehri GarhwalUttranchal-249201,13732856.00
213,2009-2010,Uttarakhand,347910003,Shri Swamy Arjunpuri Sewa Charitable Trust,Sh. Tulsi Manas Mandir Sapt Sarovar RoadHaridwar (Uttaranchal)-249410,0.00
214,2009-2010,Uttarakhand,347900133,Sir Syed Society for Promotion of Education Enlightenment and Communal Harmony SPEECH,22A- Mitralok Colony Ballupur RoadDehradun248001,175105.00
215,2009-2010,Uttarakhand,347960032,Social Upliftman for Rural Youth Association(SURYA),Vill-Sound Koti P.O.-BadshahithoulTehri Garhwal-Uttranchal-249199,0.00
216,2009-2010,Uttarakhand,347900086,Society for Advancement & Awareness of Training Haritage & Integration(SAATHI),Shri Navven Chander Farasi Vill- Kargi P.O.-BanjarawalaDehradun-Uttranchal-,0.00
217,2009-2010,Uttarakhand,347940007,Society For Himalayan Environmental Research,Post Box No.68Srinagar Pauri GarhwalUttaranchal-246174,0.00
218,2009-2010,Uttarakhand,347880006,Society for Himalayan Evangelical Prosperity & Health Education Rural Develop,P.O. Langasu Distt.  ChamoliUttaranchal-246446,0.00
219,2009-2010,Uttarakhand,347900100,Society For Integrated Development,Hazelwood Landour Cantt. P.B.No.19 MussoorieUttaranchal-,4188352.00
220,2009-2010,Uttarakhand,347970001,Society for Interated Management of All Resources,Village & Post- Shantipuri Udham Singh Nagar Distt.Uttranchal-263459,224943.00
221,2009-2010,Uttarakhand,347900026,Society For Motivational Training & Action,Samta Niketan 27 K.M. CKhakrata Lakhamandal Road P.O. ChakrataDistt. Dehradun Uttaranchal.-248123,6000.00
222,2009-2010,Uttarakhand,347900018,Society For Promotion Of Himalyan Indigenous Activities,68/1 Rajpur Road DehradunUttaranchal-248001,1146341.00
223,2009-2010,Uttarakhand,347860021,Society for Uttaranchal Development and Himalayan Action,Apna Ghar The Mall AlmoraUttaranchal-263601,144695.00
224,2009-2010,Uttarakhand,347900051,Society Of Nature Education & Health Advancement,14 A Tegh Bahadur Road DehradunUttaranchal-,3994896.00
225,2009-2010,Uttarakhand,347900052,Society Of Peoples For Development,205/1 Vijay Colony New Cantt. RoadDehradun Uttaranchal-248001,0.00
226,2009-2010,Uttarakhand,136370060,Society Of The Brother Of St Patrick,1 St Georges College Barlowganj Po MussoorieUttaranchal-248122,0.00
227,2009-2010,Uttarakhand,347860015,Sree Baba Haidakhan Charitable Research Hospital,P.o. Box Anandpur Chillianawla Ranikhet Almora.Uttranchal-263647,3468929.00
228,2009-2010,Uttarakhand,347980008,Sri Arya Trust,Bishanpur Vill:sainj Uttar KashiUttaranchal-249194,0.00
229,2009-2010,Uttarakhand,347960031,Sri Gangadhareswar Trust,Swami Dayawanda Ashram Purani Jhadi RishikeshUttaranchal-249201,3011917.42
230,2009-2010,Uttarakhand,347910013,Sri Paramhans Swaroop Manav Utthan Samiti,Sri Adwait Swaroop Anmol Ashram Gali No.3 Raj Nagar JwalapurHARIDWAR  Uttranchal-249407,0.00
231,2009-2010,Uttarakhand,347900077,Sri Sachcha Jagriti Kendra Charitable School,Vpo Haripur Kalan DehradunUttaranchal-,0.00
232,2009-2010,Uttarakhand,347900056,Sri Sai Baba Super Spirituality Hospital Trust,Shyampur Bypass Nr Pol Stn Haridwar Rd Gumamiwla RishikeshDehradun Uttaranchal-249204,5161270.60
233,2009-2010,Uttarakhand,347900081,St Pauls Child Welfare Centre,Clement Town DehradunUttaranchal-,91945.00
234,2009-2010,Uttarakhand,347920012,St. Anthony's Convent Education Society,Jeolikote NainitalUttaranchal-,123440.00
235,2009-2010,Uttarakhand,347900082,St. Jaseph Manav Kalyan Sanstha,Vill. Gumaniwala(near Hanuman  Mandir)P.O.- VirbhdraRishikeshehradun-Uttranchal-249202,1321925.00
236,2009-2010,Uttarakhand,347900042,Stuti Bhawan Believers Church,Civil Hop Rd 1 Landour View Mussoorie Distt. DehradunUttaranchal-,55000.00
237,2009-2010,Uttarakhand,347960043,SWAMI OMKARANANDA DHARMA SAMSTHAN,SWAMI OMKARANANDA SARASWATI MARG MUNI-KI-RETI P.OSHIVANANDANAGAR249192,856878.00
238,2009-2010,Uttarakhand,347960030,Swami Omkaranands Saraswati Charitable Trust,Muni Ki Reti P.O. SKhivanand Nagar Tehri GarhwalUttaranchal-,6391926.75
239,2009-2010,Uttarakhand,347940002,Swami Shukdevanand Trust,Parmarth Niketan P.O.- Swargashram (Rishikesh)Distt.- Pauri Garhwal Uttaranchal-249304,15921455.00
240,2009-2010,Uttarakhand,347900004,Swatantrata Senani Lok Bandhu Ram Murthy Pawsey Seva Nyas Trust,Pawsey Seva Nyas  Trust 35 Krishna StreetDehradun (Uttaranchal)-248001,0.00
241,2009-2010,Uttarakhand,347990006,Swati Gramodyog Sansthan,Vill. Devtola PithoragarhUttaranchal-262501,0.00
242,2009-2010,Uttarakhand,347900038,Swedish Organisation For Individual Relief,16- A Mussoorie Road DehradunUttarachal -,62738132.00
243,2009-2010,Uttarakhand,347900021,Tarab Ling Association,"VILLAGE ASTHAL POST OFFICE MALDEVTA
DEHRADUNDEHRADUN248001",4904795.06
244,2009-2010,Uttarakhand,347980011,TARUN PARYAVARANA VIGYAN SANTHA,PURUNA DUNDADUNDA249151,0.00
245,2009-2010,Uttarakhand,347960013,Tehri Garhwal Manav Vikas Sansthan,Village & Post-  Samendi Dhar Tehri GarhwalUttaranchal-249181,0.00
246,2009-2010,Uttarakhand,347860003,Thakurji Sri Sri Krishna Trust,Po-mirtola Via Panuwanaula AlmoraUttaranchal-263623,243255.00
247,2009-2010,Uttarakhand,347960026,The Divine Life Society,Shivanand NagarMuni Ki Reti249192,18151033.51
248,2009-2010,Uttarakhand,347900071,The Friends Of The Doon,49 Rajpur Road C/o  E.B.D.Business CentreDehradunUttaranchal-,48837.68
249,2009-2010,Uttarakhand,347900064,The Himalaya Trust,274/IIVasnat Vihar DehradunUttaranchal-,569332.00
250,2009-2010,Uttarakhand,347900118,The Himalayan School Society,15-A Amrit Kaur Road DehradunUttaranchal-248001,188000.00
251,2009-2010,Uttarakhand,347900060,The Indian Public Schools Society,C/o The Doon School Chand Bagh The Mall road Dehra DunUttaranchal-248001,11412235.23
252,2009-2010,Uttarakhand,347900032,The John Martyr Memorial Trust,157 Vasant Vihar Phase IIIDehradun248006,214371.00
253,2009-2010,Uttarakhand,347860005,The Leprosy Mission Hospital & Home,P.O. Almora Distt. AlmoraUttaranchal-263601,1986244.00
254,2009-2010,Uttarakhand,347990013,The Leprosy Mission Hospital & Home,Chandag PithoragarhUttaranchal-262501,0.00
255,2009-2010,Uttarakhand,347940009,Thouburn Home For Christian Boys,Po Chopra Pauri GarhwalUttaranchal-,0.00
256,2009-2010,Uttarakhand,347900007,Tibetan Children's Education & Charitable Society,Tibetan Colony Clement Town DehradunUttranchal-248002,2987832.00
257,2009-2010,Uttarakhand,347900028,Tibetan Homes Foundation,Happy Valley MussoorieUttaranchal-248179,130338231.00
258,2009-2010,Uttarakhand,347900117,Tibetian Women's Centre,225 Rajpur Road PO-Rajpur Dehra DunUttaranchal-248009,1851353.69
259,2009-2010,Uttarakhand,347900055,Tushar Community Health Education And Development Society,Vil Manduwale Via Prem Nagar DehradunUttaranchal-,294169.00
260,2009-2010,Uttarakhand,347870005,Unecss Research & Development Society,Unecss HouseBillona BageshwerUttranchal-263642,0.00
261,2009-2010,Uttarakhand,347860020,Upasana Kalyan Samiti,Post Office-Chitreshwar Ranikhet AlmoraUttaranchal-263645,0.00
262,2009-2010,Uttarakhand,347980005,Uttarakhand Jan Jagriti Samiti,SHOP NO-6 KRISHNA COMPLEX SATHI MARKETDEHRADUN248001,0.00
263,2009-2010,Uttarakhand,347960029,Uttarakhand Jan Jagriti Sansthan,Jajal Kunjari P.o Tehri GarhwalUttaranchal-,0.00
264,2009-2010,Uttarakhand,347860010,Uttarakhand Seva Nidhi Pariyavaran Shiksha Sansthan,Jakhan Devi  Mall Road AlmoraUttaranchal-263601,704873.24
265,2009-2010,Uttarakhand,347890002,Uttaranchal Development Institute,P.O. Banbasa Dist: ChampavatUttranchal -262310,663637.00
266,2009-2010,Uttarakhand,347880011,Uttaranchal Youth and Rural Development Centre,Narain Bazar ChamoliUttaranchal-246555,0.00
267,2009-2010,Uttarakhand,347900061,Uttranchal Daivi Apda Peedit Sahayata Samiti,"Sewa Niketan
Jogiwala Opp Bharat Gas Agency
Haridwar Road DehradunDEHRADUN248001",1419600.00
268,2009-2010,Uttarakhand,347910009,Ved Mata Gayatri Trust,Shantikunj Haridwar. uttranchal -249411,12649629.51
269,2009-2010,Uttarakhand,347960002,Vidya Niketan Shiksha Samiti,Kailash Gate Muni ki Reti Muni ki Reti (Rishikesh)Tehri Garhwal Uttaranchal.-249201,0.00
270,2009-2010,Uttarakhand,347920021,Viklang Mand Budhi Kalyan Samiti,Sindhi Building Mungali Garden Rampur Road HaldwaniNainital263139,0.00
271,2009-2010,Uttarakhand,347910020,VILLAGE DEVELOPMENT SOCIETY,H.No-505  Kante Wali Gali  Near Lavkush Vidhya PeethBhaganpur247661,0.00
272,2009-2010,Uttarakhand,347920018,VIMARSH,Bisht Niketan Uppar Danda Post TallitalNainital Uttranchal-,641720.00
273,2009-2010,Uttarakhand,347900075,Vipassana Meditation Centre,Jantanwala Santla Devi Marg Post Box No.275 DehradunUttaranchal-,154402.50
274,2009-2010,Uttarakhand,347890003,Vivekananda Ashram,Shyamla Tal (Himalayas) SukhidhangChampawat-Uttranchal-262523,648824.00
275,2009-2010,Uttarakhand,347990002,Voice Samajik Evam Parayavaran Sanstha,Kamla Sadan Pandey Gaon PithoragarhUttranchal-262501,205135.00
276,2009-2010,Uttarakhand,347860012,Voluntary Association For The Development Of The Hills Of Uttaralkhand,Purani Abkari Ranikhet Distt. AlmoraUttaranchal-263645,0.00
277,2009-2010,Uttarakhand,347900098,Wadia Institute of Himalayan Geology,33 G.M.S. Road DEHRADUNUttranchal-248001,520135.00
278,2009-2010,Uttarakhand,347900039,Wood Stock School,Landour Mussoorie Distt. DehrdunUttaranchal-,50728111.00
279,2009-2010,Uttarakhand,347960025,Yoga Niketan Trust,Muni Ki Reti Tehri GarhwalUttaranchal-,154162.00
