S.No,Year,State,Registration No,Association name,Address,Amount of FC Received
1,2009-2010,Uttarakhand,347990026,Aakashdeep Seva Sansthan,Link Road PithoragarhUttranchal-262501,0.00
2,2009-2010,Uttarakhand,347920007,Aarohi,P.o. Peora Vil lage Satoli Distt. NainitalUttaranchal-263138,2449435.50
3,2009-2010,Uttarakhand,347860002,Adams Girls Hostel,Almora Uttaranchal -263601,0.00
4,2009-2010,Uttarakhand,347910019,ADARSH YUVA SAMITI,DANDI IBRAHIMPUR  POST  BAHADRABADHARIDWAR249402,0.00
5,2009-2010,Uttarakhand,347890005,Advaita Ashram,Po. Mayavati Via Lohaghat Distt. ChampawatUttaranchal -262424,2136173.89
6,2009-2010,Uttarakhand,347900036,Agape,173-C Rajpur Road DehradunUttaranchal-248009,7879444.20
7,2009-2010,Uttarakhand,347900096,Agnes Kunze Society,Pari Mahal D-55 aman ViharVillage Chidowali Kandoli P O Sahastradhara Road,9627271.00
8,2009-2010,Uttarakhand,347960001,AKHANDA YOGA DHAM TRUST,Sree Mangal Yoga and Nature cure Centre Muni-Ki- Reti PO:RishikeshTehri Garhwal  Uttranchal-249201,0.00
9,2009-2010,Uttarakhand,347900114,Akhil Bhartiya Vikas Parishad,89 Dharmpur DehradunUttaranchal-248001,0.00
10,2009-2010,Uttarakhand,347860016,AMAN,Hussain Manzil Narsinghbari Post Almora Dist. AlmoraUttranchal-263601,5188924.00
11,2009-2010,Uttarakhand,347910012,Anath Shishu Palan Trust Of India,Shri Ram Ashram Shyampur Distrt. Haridwar -,4213720.00
12,2009-2010,Uttarakhand,347990020,Association for Rural Planning and Action,Helpiya AskotPithoragarh-Uttranchal-262501,3794741.00
13,2009-2010,Uttarakhand,347900088,Aurovalley Ashram Sosiety,Aurovalley Ashram Rishidwar RaiwalaDehradun-Uttranchal-249205,874869.00
14,2009-2010,Uttarakhand,347990018,Avani,P.O.- Tripuradevi Via- BeringPithoragarh-Uttranchal-262531,2376873.03
15,2009-2010,Uttarakhand,347880014,Badrish Kirti Jan Kalyan Samiti,GopeshwarGopeshwar246401,0.00
16,2009-2010,Uttarakhand,347900014,Bal Evam Mahila Kalyan Sansthan,B-43 Nehru Colony Dharampur Araghar DehradunUttaranchal-248001,0.00
17,2009-2010,Uttarakhand,347900070,Balvikas Kendra,173 Rajpur Road DehradunUttranchal -248009,24569763.00
18,2009-2010,Uttarakhand,347920015,Bareilly Dioceson Social Servicce Centre,Fonseca Estate KathgodamHaldwaniNainital-Uttranchal-263126,12220844.53
19,2009-2010,Uttarakhand,347900119,Basharat Shikska and Vikas Samiti,Vill-Bhuddi Shimla Road Dehradun DehradunUttranchal-248001,0.00
20,2009-2010,Uttarakhand,347990007,Berinag Gram Swarajya Mandal,P. O. Kandey  (Bering ) Distt.- PithoragarhUttaranchal-262531,0.00
21,2009-2010,Uttarakhand,347910008,Bharat Mata Janhit Trust,Raghava Vatika Haripurkalan SaptsarovarHardwal (Uttranchal)-249410,0.00
22,2009-2010,Uttarakhand,347900050,Bharat Susamachar Samiti,Kulhan P.O. Sahastradhara RoadDehradun Uttranchal-248001,31764223.00
23,2009-2010,Uttarakhand,347900022,Bharitya Gramothan Sansthan,Gram & Post  Dandi DehradunUttaranchal-248145,0.00
24,2009-2010,Uttarakhand,347940005,Catholic Diocese Of Bijnore,Kotdwar Pauri GarhwalUttaranchal-246149,24874767.43
25,2009-2010,Uttarakhand,347920016,Central Himalayan Environment Association,06 Waldorf CompoundMallital263001,3472878.57
26,2009-2010,Uttarakhand,347860022,CHANDRA MATRI EVAM BAL KALYAN SAMITI,MAA SARASWATI UPASANA MANDIR PRANAM NIVASP.O. KAUSANI263639,192094.00
27,2009-2010,Uttarakhand,347900072,CHILDREN HOME,Bhogpur Dehra DunUttaranchal -248143,12759712.57
28,2009-2010,Uttarakhand,347960027,Christian Academy Rural Welfare Movement,Bel Road P.O.Box 5 Kotdwar (Garhwal)Uttaranchal-,912027.00
29,2009-2010,Uttarakhand,347900101,Christian Retreat & Study Centre,105 Old Rajpur Road DehradunUttaranchal-248009,101801.00
30,2009-2010,Uttarakhand,347900079,Cni Girls Inter College,51 Rajpur Road DehradunUttaranchal-,0.00
31,2009-2010,Uttarakhand,347990017,Creative Attempts In Rural Development Society,PO- Jhulaghat PithoragarhUttranchal-262526,0.00
32,2009-2010,Uttarakhand,347960006,Daliyon Ka Dagriya,P.O. Box - 44 Birla Parisar Amra Kunj SrinagarTehri (Uttranchal)-246174,1307229.00
33,2009-2010,Uttarakhand,347880007,Dasholi Gram Swarajya Mandal,Gopeshwar ChamoliUttaranchal-246401,0.00
34,2009-2010,Uttarakhand,347900009,Dawa Rinjue School Society,Dehra Dun Road HerbertpurDehra Dun (Uttaranchal)-248142,561100.00
35,2009-2010,Uttarakhand,347900045,Dekyiling Tibetan Handicraft Cum Training And Charitable Society,Po Kulhan Sahastradhara Road DehradunUttaranchal-248001,2603485.67
36,2009-2010,Uttarakhand,347920009,Devi Gramodyog Sewa Sansthan,Post- Kahalkdwera Via- Bhawali `NainitalUttaranchal-,0.00
37,2009-2010,Uttarakhand,347860019,Devoted Organisation for Reforming Environment (DORE),Ranikhet AlmoraUttranchal-263645,0.00
38,2009-2010,Uttarakhand,347900136,DEVRISHI EDUCATIONAL SOCIETY,32/22 CIRCULAR ROADDEHRADUN248001,0.00
39,2009-2010,Uttarakhand,347900134,Dhyana Mandiram Trust,Swami Ram Sadhaka Grama Virpur Khurd Virbhadra RoadRishikesh249203,38020678.00
40,2009-2010,Uttarakhand,347910004,Divya Prem Sewa Mission Trust,Rana Bhawan Bhagirathi Nagar P.O. Saptsarover Sadhubela Hardwar Uttaranchal-249408,1975680.00
41,2009-2010,Uttarakhand,347910014,Divya Yog Mandir Trust,Kripalu Bagh Ashram Near Dadu Bagh Kankhal  HaridwarUttranchal-249408,14273074.77
42,2009-2010,Uttarakhand,347900067,Don Bible College,61 Rajpur Road  . DehradunUttarachal-,10965984.51
43,2009-2010,Uttarakhand,347900005,Doon Charitable Trust Society,41 Shaleen Enclave BadripurDehradun (Uttaranchal)-,0.00
44,2009-2010,Uttarakhand,347900029,Dr B.S. Gupta Medical Charitable Society,13/2 Sadanand Marg RishikeshDehradun Distt. (Uttaranchal)-249201,0.00
45,2009-2010,Uttarakhand,347900047,Drikung Kagyu Institute,Jang Chub  LingSahastradhara Road Dehradun  P.O. KulhanUttaranchal-248001,9476088.92
46,2009-2010,Uttarakhand,347920006,Dwarhat Gram Swaraj ya Mandal,P.O.-Rani Bagh Distt.-NainitalUttaranchal-263126,0.00
47,2009-2010,Uttarakhand,347900092,Eco-Adventreks And Welfare Society,Anandgram 11 Nalapani Road Adhoiwala DehradunUttranchal-248001,6736493.00
48,2009-2010,Uttarakhand,347900112,Edara-shabab-E-Islami,"Vill"" Mehuwal-A-Mafi PO- Majra Distt: DehradoonUttranchal-248171",0.00
49,2009-2010,Uttarakhand,347920013,Emmanuel Masihi Samiti,Chandmari Po Kathgodam NainitalUttaranchal-263126,248761.00
50,2009-2010,Uttarakhand,347900025,Emmanuel Social Association,Muyal's House 28/2 Luxmi Road Dalanwala Dehradun.Uttar Pradesh-248001,0.00
51,2009-2010,Uttarakhand,347900010,Experiments In Rural Advancement,9 Arvind Marg Rajpur Road DehradunUttaranchal-248001,0.00
52,2009-2010,Uttarakhand,347910005,Fathima Siksha Sansthan,Village Baseri Khadar LaksarHaridwar (Uttaranchal)-247663,0.00
53,2009-2010,Uttarakhand,347900027,Finall Touch Educations Society,16-B Subhash RoadDehradun248001,0.00
54,2009-2010,Uttarakhand,347900084,Foundation for Development Research & Action,189Rajpur Road Opp. Sai Baba TempleDehradun-Uttranchal-248001,0.00
55,2009-2010,Uttarakhand,347860009,G.B. Pant Institute Of Himalayan Enviroment & Development,Kosikatarmal Distt. AlmoraUttaranchal-263643,5475560.57
56,2009-2010,Uttarakhand,347980003,Gaden Phelgyeling Nuns- Institute,P.O.- Dunda Village- Ranadi Distt.- Uttar KashiUttaranchal-249151,7952.16
57,2009-2010,Uttarakhand,347860024,Ganga Parvatiye Lok Vikas Sansthan,VPO Sarainkhet VIA SyaldeyMolikhal263661,0.00
58,2009-2010,Uttarakhand,347960014,Garhwal Community Development & Welfare Society,Mussoorie Road Chamba Distt.- Tehri GarhwalUttaranchal-249148,1070436.00
59,2009-2010,Uttarakhand,347980013,Garhwal Rural Awareness Campaign for Eager Society,Post Box No. 1 Ward no – 2 Old Market BarkotUttar Kashi(Dist)249141,0.00
60,2009-2010,Uttarakhand,347960017,Garhwal Vikas Kendra,Village & Post- Suman Kyari Nainbagh Tehri GarhwalUttaranchal-249186,12069187.00
61,2009-2010,Uttarakhand,347950002,Garhwal Welfare Samiti,Kandari Bhawan-Auring RudraprayagUttranchal-246419,0.00
62,2009-2010,Uttarakhand,347900058,Ghanshyam Smriti Shiksha Evam Kalyan Sansthan,38 Laxmi Road DehradunUttaranchal-248001,0.00
63,2009-2010,Uttarakhand,347900128,Gokul Society for Handicapped,1/4 Teg Bahadur RoadDehradun248001,0.00
64,2009-2010,Uttarakhand,347880004,Gomati Prayag Jan Kalyan Parishad,Bhakunda Post- Dhunglwali Block- KaranprayagDistt. Chamoli Uttaranchal-246446,0.00
65,2009-2010,Uttarakhand,347900049,Grace Educational Society,51-C Rajpur Road DehradunUttaranchal-248001,3984294.80
66,2009-2010,Uttarakhand,347960023,Gram Seva Sansthan,Dhapad Goangarh Po Bhatgaon Tehri GarhwalUttaranchal-249181,0.00
67,2009-2010,Uttarakhand,347920020,Grameen Evam Krishi Vikas Samiti,6-334 Kalawati Colony Haldwani NainitalUttaranchal-263139,1711036.00
68,2009-2010,Uttarakhand,347960036,"Gramin Krishi Vikas Avam Paryavaran Sumbharadan Sanstha ""Darem""",C/o Hotel Jyoti Torist Main Market Ghansali  PO.& Via- GhansaliTEHRI-GARHWAL   Uttranchal-249155,0.00
69,2009-2010,Uttarakhand,347960035,Gramin Kshetra Vikash Samiti (RADS),P.B.-06 Vill & Post Ranichauri Tehri GarhwalNew Tehri Uttranchal-249199,0.00
70,2009-2010,Uttarakhand,347860018,Gramin Samaj Kalyan Samiti,Talla Chaina Khan Almora Uttaranchal -263601,0.00
71,2009-2010,Uttarakhand,347950003,Gramin Sudhar Avam Sramik Sewa Sansthan,Vill + Post- Budna (Lassya) JakholiRudraprayag (Uttranchal)-246141,0.00
72,2009-2010,Uttarakhand,347870001,Gramin Uthan Samiti,V.P.O. Kapkote Ta. KapkoteDistt. Bageshwar Uttaranchal-263632,1732037.00
73,2009-2010,Uttarakhand,347900121,Gramin Vikas Sameeti,Vill/Post-Kaulagarh Ambedkar Marg Dehra DunUttaranchal-248001,0.00
74,2009-2010,Uttarakhand,347990022,Gramin Vikas Samiti,Kalyan Baldia Bhawan Cinema Line PithoragarhUttaranchal-262501,0.00
75,2009-2010,Uttarakhand,347900094,Gramya Mahila Kalyan Sansthan,Wing No 3 Barrack No 24/1 Prem Nagar DehradunUttaranchal-248007,0.00
76,2009-2010,Uttarakhand,347900066,Herbertpur Christian Hospital Society,Po Herbertpur DehradunUttaranchal-,11152815.74
77,2009-2010,Uttarakhand,347900012,Herbertpur Trust Association,10 Convent Road DehradunUttaranchal-248001,1271569.00
78,2009-2010,Uttarakhand,347900111,Him Jyoti Foundation,Raj Bhawan DehradunUtteranchal-248003,1460702.00
79,2009-2010,Uttarakhand,347880010,Himad Samiti,Vishwanath Talkies Complex Gopeshwar ChamoliUttaranchal-246401,8502011.00
80,2009-2010,Uttarakhand,347990003,Himalaya Axans Darpan Society,Village & Post- Tejam Distt.- PithoragarhUttranchal-262553,0.00
81,2009-2010,Uttarakhand,347900065,Himalaya Inland Mission,Landour MussoorieUttaranchal-,6408202.00
82,2009-2010,Uttarakhand,347890007,HIMALAYA WATER SERVICES TATHA VIKAS PARYAVARAN SANRAKSHAN SAMITI,DARAHCHAMPAWAT262523,2043060.12
83,2009-2010,Uttarakhand,347900048,Himalayan Action Research Centre,744 Indira Nagar Phase-ii Po New Forest DehradunUttaranchal-248006,6285812.12
84,2009-2010,Uttarakhand,347960041,Himalayan Educationa and  Resource Development Society,Block Road Chamba Tehri Garhwal.New Tehri249145,0.00
85,2009-2010,Uttarakhand,347960037,Himalayan Environment Studies And Conservation Organisation,Vigyanprastha Gholteer Gwar Chowk Distt. Rudraprayag GarhwalUttaranchal-,1534706.00
86,2009-2010,Uttarakhand,347880008,Himalayan Foundation,Village SarotiNandprayag246449,0.00
87,2009-2010,Uttarakhand,347900083,Himalayan Institute for Rural Awakening,C-18 Ugrasen Nagar PO Virbhadra Rishikesh DehradunUttaranchal-249202,0.00
88,2009-2010,Uttarakhand,347900020,Himalayan Institute Hospital Trust,Holly Grant Dehra DunUttaranchal-248140,21336662.00
89,2009-2010,Uttarakhand,347950004,Himalayan Jan Kalyan Evam Bal Vikas Samiti,Village- Daira (Mastura) UkhimathDistt.- Rudraprayag (Uttranchal)-246469,0.00
90,2009-2010,Uttarakhand,347870007,Himalayan Jan Kalyan Samiti,Sri Sri Durga Ashram SilingkheP.O. Harsingiya BagharKapkot263679,0.00
91,2009-2010,Uttarakhand,347900141,HIMALAYAN JYOTI SAMITI (FORMERLY KNOWN AS UTTARANCHAL JYOTI SAMITI,CHAAR DUKAN LANDOUR CANTTMUSSOORIE248179,0.00
92,2009-2010,Uttarakhand,347860013,Himalayan Organisation For Protecting Environment,Post. Pikholi Ram Khet Dist. AlmoraUttaranchal-263647,156035.00
93,2009-2010,Uttarakhand,347990009,Himalayan Seva Samiti,Vill-Dharapani PO- Chandak Distt.-PithoragarhUttaranchal-262501,0.00
94,2009-2010,Uttarakhand,347990008,Himalayan Study Circle for Environment Child Edu. Health & Research,G.I.C. Road Pandey Gaon PithoragarhUttaranchal-262501,0.00
95,2009-2010,Uttarakhand,347900053,Himalayan Torchbearers,15/11green Valley Rajpur Road DehradunUttaranchal-,2645243.11
96,2009-2010,Uttarakhand,347960015,Himalayee Paryavaran Shiksha Sansthan,P.o. Lamb Goan Tehri GarhwalUtttaranchal-249165,5907214.00
97,2009-2010,Uttarakhand,347990011,Himaliyan Gram Vikas Samiti,Awalghat Road Dasaithal Post- Dasaithal (Gangolihat)Distt. Pithoragarh (Uttaranchal)-262522,0.00
98,2009-2010,Uttarakhand,347900137,HIMALYAN EDUCATIONAL LETERACY PROJECT SOCIETY,DREAM HOUSE NEAR PANINGTEM WOOD STOCK SCHOOLLANDOUR BAZAR DEHRADUN248179,1090455.00
99,2009-2010,Uttarakhand,347900085,HOPE FOR CHILDREN SOCIETY,P.T. Seminary51-CRajpur Rdd. dehradunUttranchal-248001,872425.46
100,2009-2010,Uttarakhand,347970003,Indian Institute for Monitoring of Pollution Agricultural Research & Technology Transfer(IMPART),Haldwani by pass road Kishanpur Kichha Udhamsingh nagarUttranchal-263148,0.00
101,2009-2010,Uttarakhand,347910007,Indian Institute of Technology Roorkee,Roorkee Distt.- HaridwarUttaranchal-247667,17372882.34
102,2009-2010,Uttarakhand,347900046,Indian School Society,Jogiwala DehradunUttaranchal-,4654821.00
103,2009-2010,Uttarakhand,347860008,Institute Of Himalayan Environmental Research & Education,village  Chinoni  P.O. Bhagoti via Chaukhutia GanaiChaukhutia Ganai263656,147230.00
104,2009-2010,Uttarakhand,347900063,Integral Education Mission,C/o Dr. Chabra's Pathology Centre 35/1 Subash RoadDehradun Uttaranchal-,14314.00
105,2009-2010,Uttarakhand,347920008,Ishwar-Jyoti Parvatiya Mahila Gramodhog Vikas Sanstha,Vill.- Gorakhpur BhimtalNainital Distt. (Uttaranchal)-263136,0.00
106,2009-2010,Uttarakhand,347980001,Jai Maa Lok Vikas Pashu Sewa Sanstha(dhauntari),Patti Gajena Kathur UttarkashiUttaranchal-249165,0.00
107,2009-2010,Uttarakhand,347880001,Jai Nanda Devi Swrojgarshikshan Sansthan(Jandesh),HO: Kalpkshetra-Bharki(Uram) PO:BhakrkiBlock:Joshimath HimalyaChamoliUttranchal-246443,3233964.00
108,2009-2010,Uttarakhand,347940013,Jan Chetna Kendra,Vill_ Dang Srinagar Garhwal Town/City: SrinagarDistt: Pauri Garhwal Utteranchal-246174,0.00
109,2009-2010,Uttarakhand,347960040,Jan Jati Seva Mandal,Kharson Kyari Po- Sigonisera Distt: Tehri GarhwalUttaranchal-,0.00
110,2009-2010,Uttarakhand,347880013,Jan Kalyan Samiti,Divya Sadan Krishna Colony Subhash Nagar GopeshwarChamoli Uttranchal -246401,538940.00
111,2009-2010,Uttarakhand,347860011,Jan Seva Sansthan,Village Kathpuria Post. Kathpuria (Koshi)Distt. Almora Uttaranchal-263643,0.00
112,2009-2010,Uttarakhand,347960012,Jan Vikas Sansthan,P.O. Chirbatiya Via Jakholi Distt. Tehri GarhwalUttaranchal-246141,1400600.00
113,2009-2010,Uttarakhand,347980009,Janjati Mahila Kalyan Evam Balotthan Samiti,Sarukhet UttarkashiUttaranchal-249391,0.00
114,2009-2010,Uttarakhand,347920026,Jeevandan Charitable Society,Hathikhal Mothinagar (Village) Arjunpur (P.O) HaldwaniNainital Dist.263139,0.00
115,2009-2010,Uttarakhand,347900043,Jesus And Mary Dehradun Educational Society,16 Convent Road DehradunUttaranchal-248001,1781763.00
116,2009-2010,Uttarakhand,347900099,Jesus And Mary Mussoorie Education Society,Waverley MussoorieUttaranchal-248179,3082676.00
117,2009-2010,Uttarakhand,347900108,K.K.M. Handweaving Society,11 Nalapani Road DehradunUttaranchal-,1919057.99
118,2009-2010,Uttarakhand,347990010,Kagas'  Kumaon Agriculture & Greenery Advancement Society,1 Priya Sadan Nr Anand Hostel PithoragarhUttarachal-262501,1945281.56
119,2009-2010,Uttarakhand,347940011,Kailashanand Mission Trust,Po Laxman Jhula Rishikesh Pauri GarhwalUttaranchal-,19873486.00
120,2009-2010,Uttarakhand,347940004,Karuna Social Service Society,Kotdwar GarhwalUttaranchal-246149,5772452.80
121,2009-2010,Uttarakhand,347860004,Kasturba Mahila Uthan Mandal,Lakshmi Ashram P.O. Kausani AlmoraUttaranchal-263639,2858159.05
122,2009-2010,Uttarakhand,347900095,Kinderhilf Swerk,193/1 Rajpur Road Katbungalow RajpurDehradun Uttranchal-248009,11528032.00
123,2009-2010,Uttarakhand,347900015,Kindness Health & Education  For Leprosy Welfare Society,154/3 Rajpur Road DehradunUttranchal  .-248009,753231.00
124,2009-2010,Uttarakhand,347920023,Kumaun mahila gramya vikas samiti,Zahoor Manzil Near GurdwaraRamnagar244715,0.00
125,2009-2010,Uttarakhand,347970006,Kumoun Sewa Samiti,Vill - Inderpur PO- PratappurKichha263156,666953.00
126,2009-2010,Uttarakhand,347900033,Landour Community Hospital,Mussorie DehradunUttaranchal-248179,4798642.00
127,2009-2010,Uttarakhand,347900057,Latika Roy Memorial Foundation,113 Phase 1 Vasant ViharDehradun248001,1118750.00
128,2009-2010,Uttarakhand,347920004,Lok Chetna Manch,Vill. & P.O. Ranibagh Distt. NainitalUttaranchal-263126,0.00
129,2009-2010,Uttarakhand,347960019,Lok Jeevan Vikas Bharti,Budha Kedarnath P.O. Thati Tehri GarhwalUttaranchal-249155,902610.00
130,2009-2010,Uttarakhand,347960042,Lok Paryavaran Shiksha Sansthan,Village - Sitakot P.O. - SaunfaTehri Garhwal246185,0.00
131,2009-2010,Uttarakhand,347870006,Maa Manav Seva Samiti,Village Aithan (Jajar) P.O. Bharari Tesil KapkoteUttranchal-263642,0.00
132,2009-2010,Uttarakhand,347910015,Madarsa-Darus-Salam,Lather Deva Shaikh PO-Iqbalpur PO-Iqbalpur(Roorke)HaridwarUttaranchal-247668,0.00
133,2009-2010,Uttarakhand,347920005,Mahila Kalyan Sanghthan,715 Indra Nagar Haldwani NainitalUttaranchal-263139,0.00
134,2009-2010,Uttarakhand,347970007,Mahila Kalyan Sanstha,Chhakki mod P.O- Majhara Anand Singh Gadarpur U.S. Nagar UttarakhandDineshpur263160,607420.00
135,2009-2010,Uttarakhand,347960020,Mahila Nav Jagran Samiti,Block Road Chamba Tehri GarhwalUttaranchal-249145,0.00
136,2009-2010,Uttarakhand,347990025,Mahila Prerna Evam Utthan Samiti,Vill. Gurna Po. Gurna PithoragarhPithoragarh Dist  Uttranchal-262529,0.00
137,2009-2010,Uttarakhand,347980006,Mahila Utthan Evam Gram Vikas Sanstha,Gainwala Brakhmahal UttarkashiUttaranchal-,0.00
138,2009-2010,Uttarakhand,347900044,Masihi Mandali Christian Church,37 Bindalwala Nashville Road Dehra DunUttaranchal-,66240.00
139,2009-2010,Uttarakhand,347960038,Matrichhaya Parvatiya Vikas Samiti,Vill/Po-Gaja Block chamba Tehri GarhwalUttranchal-249146,0.00
140,2009-2010,Uttarakhand,347900041,Medical Ambassadors,"MEDICAL AMBASSADORS
KEHRI GAON VIA PREMNAGAR PO NANDA KI CHOWKIDEHRADUN248007",11040882.00
141,2009-2010,Uttarakhand,347940001,Messmore Intermediate  College,Methodist Church Chopra Pauri GarhwalUttaranchal-246001,165379.69
142,2009-2010,Uttarakhand,347980010,Mission for Anath Development & Welfare Society,Gussain Bhawan Near ITI Joshiyara UttarkashiUTTARKASHI   Uttranchal-,0.00
143,2009-2010,Uttarakhand,347900034,Moravian Institute,Zhan-Phan-Ling Rajpur DehradunUttaranchal-248009,6121294.00
144,2009-2010,Uttarakhand,347960005,Mount Valley Development Association,Doni P.O.- MegadharTehri Garhwal Distt. (Uttranchal)-249155,4260616.00
145,2009-2010,Uttarakhand,347990027,Multifarious  Organisation for the Human  for the  Human & Ecological Resources,Narayan Niwas Cinema Line Distt: PithoragarhUttranchal-262501,0.00
146,2009-2010,Uttarakhand,347900102,Mussoorie Gramin Vikas Samiti,Tabor West Sisters Bazar Landourn MussoorieUttarachal-248179,6970367.00
147,2009-2010,Uttarakhand,347990023,Nag Bhumi Chetna Samiti,Berinag PO-Berinag PithorgarhUttranchal-262552,0.00
148,2009-2010,Uttarakhand,347900105,Nanhi Duniya,10 Inder Road DehradunUttaranchal-248001,626362.00
149,2009-2010,Uttarakhand,347900131,NATIONAL EDUCATION DEVELOPMENT CENTRE,401 D   Khurbura MohallaDehradun248001,0.00
150,2009-2010,Uttarakhand,347900115,Nav Bharat Manav Vkas Sanstha,near Green Land School Dehradun Road DoiwalaDeradun Uttaranchal-248140,0.00
151,2009-2010,Uttarakhand,347900062,Neo Tibetan Childrens Home,Saleem House Herberpurdi DehradunUttaranchal-,1199358.50
152,2009-2010,Uttarakhand,347900069,New Life Centre,25- Old Connaught Place District- DehradunUttranchal -248001,7746929.00
153,2009-2010,Uttarakhand,347900059,Ngor Pal,Po Manduwala Via Prem Nagar DehradunUttaranchal-248007,2793998.63
154,2009-2010,Uttarakhand,347900132,NIJAAT,Regd Add-14/1 PRITAM ROAD DEHRADUN Present Postal Add- 37B AAM BAGH Garhi Cantt Near Garhi Cantt Thana Dehradun Pin -248003DEHRADUN248001,169118.00
155,2009-2010,Uttarakhand,347900126,NIRMAL MISSION FOR VISION SOCIETY,V. KHAIRI KALANRISHIKESH249204,31168093.00
156,2009-2010,Uttarakhand,347900090,No Change,53-C Rajpur Road DehradunUttaranchal-248001,4228926.57
157,2009-2010,Uttarakhand,347900076,Nyimgmapa Mahabodhi Charitable Society,Clement town Dehra DunUttaranchal-248002,18041497.00
158,2009-2010,Uttarakhand,347900019,Operation Eye Of  The Tiger - India,300 Aara Ghar Model  Colony DehradunUttaranchal-248001,74506.00
159,2009-2010,Uttarakhand,347900011,Organisation For Prosperity Education And Nurture,26/123 Old Rajpur DehradunUttaranchal-248009,691321.00
160,2009-2010,Uttarakhand,347900127,Panchayati Rule and Gender Awareness Training Institute,68/1 Suryallok ColonyDehradun248001,0.00
161,2009-2010,Uttarakhand,347900006,Param Pujya Gurudev Gayatri Parivar Trust,"""Gayatri-Tapovan"" Haripur Kalan (Raiwala)Dehradun (Uttranchal)-249205",662001.00
162,2009-2010,Uttarakhand,347900113,Participatory Development Institute Sahabhagi Vikas Sansthan,22/1 Malviya Road Rishikesh DehradunUttaranchal-249201,102037.00
163,2009-2010,Uttarakhand,347990014,Parvateeya Paryavaran Sanrakshan Samithi,Hindarshan Kutir P.O. DharamgharDistt. Pithoragarh Uttaranchal.-262571,0.00
164,2009-2010,Uttarakhand,347990024,Parvatiya  Aranya Sewa Evam Vikas Sansthan,Police line Road PithoragarhKumor Uttaranchal -262501,0.00
165,2009-2010,Uttarakhand,347960021,Parvatiya Jan Kalyan Samiti,Po - Ranichauri Tehri GarhwalUttaranchal-249199,0.00
166,2009-2010,Uttarakhand,347960024,Parvatiya Jankalyan Sansthan,Po Pilkhi Gangar Patti Kemar Tehri GarhwalUttaranchal-,0.00
167,2009-2010,Uttarakhand,347870003,Parvatiya Nav Jagran Samiti,Vill- Gawar Pajera Po: Dangoli BageshwarUttaranchal-263635,0.00
168,2009-2010,Uttarakhand,347960011,Parvatiya Navjeevan Mandal,Silyara Via Ghanshali Tehri GarhwalUttaranchal-249155,0.00
169,2009-2010,Uttarakhand,347890001,Parvatiya Phalotpadan Evam Bahudhandi Sansthan,G.I.C. Road Kanal Gaon Distt ChampawatUttaranchal-262523,0.00
170,2009-2010,Uttarakhand,347990012,Parwatiya Sanskritik Awam  Sahitic Kala Samiti,Gopishree Corege Tildhukari Pithoragarh Distt.Uttaranchal-262501,0.00
171,2009-2010,Uttarakhand,347980012,Paryavaran Evam Samajik Vikas Sansthan,Pritam  Ramola Bhawan Manera(Dilsuar)Uttarkashi249193,0.00
172,2009-2010,Uttarakhand,347990016,Paryavaran Sanrankshan Samiti,Po Pati Chamhawati PithoragarhUttaranchal-,0.00
173,2009-2010,Uttarakhand,347900024,People's  Science Institute,252 Vasant Vihar Phase-i DehradunUttranchal -248006,2214366.00
174,2009-2010,Uttarakhand,347990015,Pithora Sanskrutic Samajik Samiti,Diwan Niwas Tildhukasi PithoragarhUttaranchal-262501,0.00
175,2009-2010,Uttarakhand,347920011,Pragatisheel Gramin Yuva Chetna Kalyan Samiti,Indira Nagar No.1 Buiduhatta Laltuan NainitalUttaranchal-262402,0.00
176,2009-2010,Uttarakhand,347920017,Prayas,Ramgarh Road Bhowali Bhowali Distt: BhowaliNainital Utteranchal-263132,4022239.00
177,2009-2010,Uttarakhand,347900035,Presbeterian Theological Seminary,51 C. Rajpur Road DehradunUttaranchal-248001,10078898.66
178,2009-2010,Uttarakhand,347900120,Purkal Youth Development Society,Town/City/Po- Bhagwanthpur Distt: DehradunUttaranchal-248009,5127528.58
179,2009-2010,Uttarakhand,347910018,rajat shahri evam gramothan sansthan,396 vikas colony jamna takeej ranipur modharidwar249401,0.00
180,2009-2010,Uttarakhand,347900106,Ramakrishna Ashram,Rajpur Road Kishanpur DehradunUttaranchal-248009,10975.00
181,2009-2010,Uttarakhand,347860001,Ramakrishna Kutir,Bright End Corner AlmoraUttaranchal-263601,203001.00
182,2009-2010,Uttarakhand,136370100,Ramakrishna Mission Ashram,168 Raspur Krishanpur DehradunUttaranchal-,148339.00
183,2009-2010,Uttarakhand,347910006,Ramakrishna Mission Sevashram,Kankhal HardwarUttar Pradesh-249408,3196402.16
184,2009-2010,Uttarakhand,347960008,Ramana's Seva Samiti,Ramana's Garden Project for Rural Development Village- TapovanTehri Garhwal Distt. (Uttranchal)-249192,874381.78
185,2009-2010,Uttarakhand,347900103,Raphael Ryder Cheshire International Centre,Po Box No. 157 Dehra DunUttaranchal-,10711399.97
186,2009-2010,Uttarakhand,347910017,RC Patil Education ANd Development Society,Shivpuri Colony Kankhal HardwarHardwar249408,0.00
187,2009-2010,Uttarakhand,347900003,Rural Entreneurship for Art and Cultural Heritage,C/O Mr. Lokesh OhriParson's Estate 91 Rajpur Road DehradunUttaranchal.-248001,0.00
188,2009-2010,Uttarakhand,347900013,Rural Litigation & Entitlement Kendra,68/1 Rajpur Road Suryalok Colony DehradunUttranchal-248001,1683773.85
189,2009-2010,Uttarakhand,347960016,Sacha Vedic Sanstha,Sach Dham P.O. Tapovan Sarai Via Shivanand NagarTehri Garhwal Uttaranchal-249192,12246842.00
190,2009-2010,Uttarakhand,347900030,Sadhana Mandir Trust,Ram Nagar Virbhadra Road RishikeshDehradun (Uttaranchal)-249203,105124.00
191,2009-2010,Uttarakhand,347860014,Sahyog Society For Participatory Rural Development,Ram Singh Bisht Bhawan Vill: Buribana NainitalUttaranchal-263132,21448125.35
192,2009-2010,Uttarakhand,347900040,Sakya Centre,187 Rajpur Road DehradunUttaranchal-,6911951.60
193,2009-2010,Uttarakhand,347900109,Sakya College,Mussoorie Road P.O. Rajpur DehradunUttaranchal-,4129728.00
194,2009-2010,Uttarakhand,347900089,Sakya Nunnery,P.O. Kulhan Sahastradhara Road DehradunUttranchal-248001,3236267.20
195,2009-2010,Uttarakhand,347880003,Samagra Grameen Vikas Samiti,Village-GwaldamPost-Gwaldam246441,0.00
196,2009-2010,Uttarakhand,347900054,Samarpit Sewa Sansthan,96 Saket Colony Block E Azabpure KaleDehradunUttaranchal-,0.00
197,2009-2010,Uttarakhand,347920002,Sanion Ka Sangthan,Nagari Gaon BhowaliNainital (Uttranchal)-263132,0.00
