434,2006-2007,Delhi,231650184,India Bible Publishers,11-A Pocket-A 3rd Floor Street No. 1 Gautam NagarNew Delhi110049,82571.00
435,2006-2007,Delhi,231660019,India Forum For Cooperative Development,244-c Mig Flats Green Aptmts Rajauri GardenNew Delhi -110027,0.00
436,2006-2007,Delhi,231660612,India Habitat Centre,Lodhi Road New Delhi -110003,1442874.00
437,2006-2007,Delhi,231650792,India Heritage Research Foundation,207/7 Krishna Nagar Safdarjung EnclaveNew Delhi -110029,39275449.00
438,2006-2007,Delhi,231660645,India HIV/AIDS Alliance,6 Zamrodpur Community CentreKailash Colony Extention110048,170638075.00
439,2006-2007,Delhi,231650898,India International Centre,40 Max Muller Marg  Lodhi EstateNew Delhi-110003,0.00
440,2006-2007,Delhi,231650639,India International Rural Cultural Centre,7 Nelson Mandel Marg Inst Area Sector C-1 Vasant Kunj New Delhi-110070,0.00
441,2006-2007,Delhi,231650789,India Islamic Cultural Centre,87-88 Lodi EstateNew Delhi-110003,1822871.00
442,2006-2007,Delhi,231660414,India Sponsor Foundation,A-13 Friends colony East New Delhi -110065,741923.60
443,2006-2007,Delhi,231650936,India Vision Foundation,56 BasementUday Park New Delhi110049,5085631.00
444,2006-2007,Delhi,231650026,Indian  Social Institute,10  Institutional Area Lodi RoadNew Delhi -110003,5450310.00
445,2006-2007,Delhi,231650081,Indian Assn Of Parliamentarian On Population Development,1/6 Sri Instt. Area Khel Gaon RoadNew Delhi -110049,1315992.00
446,2006-2007,Delhi,231650690,Indian Association of Womens Studies,25 Bhai Vir Singh MargNew Delhi110001,125000.00
447,2006-2007,Delhi,231650614,Indian Christian Mission (regd),87tenament Ii Rbtb Hospital Kingsway CampDelhi-110009,3462095.00
448,2006-2007,Delhi,231650973,Indian Church Of Christ,H 6 B  Hauz Khas  New Delhi Change In Address On 29/11/2000-110016,25040292.28
449,2006-2007,Delhi,231660115,Indian Coalition For Control Of Iodine Deficiency Disorders,L-441 Sarita Vihar New Delhi -110048,32071932.28
450,2006-2007,Delhi,231660020,Indian Confederation Of Indigenous & Tribal People,2 Masjid Lane Jangpura BhogalNew Delhi-110014,2491489.00
451,2006-2007,Delhi,231650177,Indian Council For Child Welfare,4 Deen Dayal Upadhya MargNew Delhi -110002,0.00
452,2006-2007,Delhi,231650316,Indian Council for Research on International Economic Relations,Core 6a4th Floor Ihc Lodi RoadNew Delhi-110003,0.00
453,2006-2007,Delhi,231650537,Indian Council Of Agricultural Research,Krishi Bhavan Dr. Rajinder Prasad RoadNew Delhi-110001,49688965.00
454,2006-2007,Delhi,231650371,Indian Environmental Society,U-112 Vikas Marg ShakarpurDelhi-110092,2803805.00
455,2006-2007,Delhi,231650982,Indian Evangelical Team,126 Andheria Modh MehrauliNew Delhi-110030,13277613.00
456,2006-2007,Delhi,231650953,Indian Farm Forestry Development Cooperative Limited,14-15 Farm Bhawan Nehru PlaceNew Delhi -110019,14084966.77
457,2006-2007,Delhi,231650050,Indian Federation Of United Nations Association,12 Janpath Lane  New Delhi-110001,0.00
458,2006-2007,Delhi,231660021,Indian Grameen Services,F-5 Ground Floor Kailash ColonyGreater Kailash Part-1110048,16734778.00
459,2006-2007,Delhi,231650221,Indian Inland Mission,V-20 Green Park Extension   New Delhi-110016,95934444.00
460,2006-2007,Delhi,231660101,Indian Insstitute Of Technology,Haus Khas New Delhi -110016,23911820.00
461,2006-2007,Delhi,231650620,Indian Institute Of Public Administration,I.p. Estate Ring RoadNew Delhi-110002,5954635.00
462,2006-2007,Delhi,231650851,Indian Instt. Of Ecology Environment,A-15 Paryavaran Complex Saodi;azaon Salet Maidan GariNew Delhi -110030,0.00
463,2006-2007,Delhi,231650597,Indian Medical Association,I.M.A. House I.P. EstateNew Delhi-110002,66589702.00
464,2006-2007,Delhi,231650887,Indian Medicines Development Trust,5106 Phatak Bans SirikiwalanDelhi -110066,0.00
465,2006-2007,Delhi,231650606,Indian National Academy Of Engineering,117 Nalanda House Iit Campus Haus KhasNew Delhi-110016,44140.00
466,2006-2007,Delhi,231650274,Indian National Community Of World Service,R-579 New Rajinder Nagar  New Delhi-110060,4840134.00
467,2006-2007,Delhi,231650350,Indian National Trust For Art Culture And Heritage,71 Lodi Estate  New Delhi-110003,17171576.00
468,2006-2007,Delhi,231660271,Indian Olympic Association,Gate No.25 J.N. Stadium New Delhi-110003,35581116.00
469,2006-2007,Delhi,231650379,Indian Pentecostal Church Of God,14 Bhai Veer Singh Marg  New Delhi-110001,969402.00
470,2006-2007,Delhi,231660494,Indian Pollution Control Association,450/1/B-1 Street No. 14A Vishwas Nagar ShahdaraDelhi-110032,0.00
471,2006-2007,Delhi,231660307,Indian Pugwash Coswa Society,D-43 Press Enclave SaketNew Delhi-110017,0.00
472,2006-2007,Delhi,231650003,Indian Red Cross Society,1 Red Cross Road  New Delhi-110001,68051453.64
473,2006-2007,Delhi,231660311,Indian Rural Energy Network,Plot No1 MTNL Exchange Building II Floor Savitri NagarNew Delhi-110017,400000.00
474,2006-2007,Delhi,231650082,Indian Society For Promotion Of Christian Knowledge,1654 Madras Road Kashmiri Gate Delhi-110006,314355.00
475,2006-2007,Delhi,231650937,Indian Society For Technical Education,Iit Campus New Mehrauli RoadNew Delhi-110016,0.00
476,2006-2007,Delhi,231660662,Indian Society for Trenchless Technology,908 Hemkunt Tower89 Nehru Place New Delhi -110019,473196.00
477,2006-2007,Delhi,231660466,Indian Society of Agribusiness Professionals,PLOT NO. B-1 BLOCK B-1 MOHAN COOPERATIVENEW DELHI110044,2499200.00
478,2006-2007,Delhi,231660528,Indian Sociological Society,8 Nelson Mandela Road Vasant KunjNew Delhi -110070,67945.00
479,2006-2007,Delhi,231650686,Indian Spinal Injuries Centre,Sector C Vasant Kunj New Delhi -110070,1044190.00
480,2006-2007,Delhi,231660501,Indian Trust for Innovation and Social Change,EB-166 Maya Enclave New Delhi -110064,0.00
481,2006-2007,Delhi,231650369,Indian Youth Centres Trust,Vishwa Yuvak Kendra Circular Road ChanakyapuriNew Delhi-110021,0.00
482,2006-2007,Delhi,231660449,Indiasocial. Org,11/158 (LGF) Malviya Nagar New Delhi -110017,0.00
483,2006-2007,Delhi,231650609,Indira Gandhi National Centre For Arts, JanpathNew Delhi -110001,0.00
484,2006-2007,Delhi,231650817,Indira Gandhi National Open University, Maidan GarhiNew Delhi-110068,0.00
485,2006-2007,Delhi,231650067,Indo-Global Social Service Society,28 Institutional Area Lodi RoadNew Delhi-110003,181231524.84
486,2006-2007,Delhi,231660387,Indraprastha Vyavsayik Evam Paryavarneeya Swasthya Samiti,B.L.Taneja Block Lok Nayak HospitalNew Delhi-110002,3114605.00
487,2006-2007,Delhi,231650080,INDUSTRIALL GLOBAL UNION,16-D Atma Ram House No.-1 Tolstoy MargNew Delhi110001,12722585.00
488,2006-2007,Delhi,231660460,Initiative for Social Change and Action,157 Sahyog Apartments Mayur Vihar Phase IDelhi-110091,621040.00
489,2006-2007,Delhi,231660362,Inspiration,AG-1/123D Vikas PuriNew Delhi-110018,33334.00
490,2006-2007,Delhi,231660173,Inspire Network for Environment,S-212 2nd Floor Panchsheel ParkNew Delhi,48470703.10
491,2006-2007,Delhi,231660077,Inst. Of Applied Manpower Research,I. P. Estat Mahatama Gandhi Marg  New Delhi  -,0.00
492,2006-2007,Delhi,231650401,Institute For Christian Life & Vocation,19 Raj Niwas Marg Civil Lines Delhi-110054,0.00
493,2006-2007,Delhi,231660117,Institute For Conflict Management,11 Talkatora Road New Delhi -,0.00
494,2006-2007,Delhi,231660184,Institute For Human Development,Iamr Building 3rd Floor I.p. Estate M.g.margDelhi-110002,13583720.00
495,2006-2007,Delhi,231650501,Institute For Resource Management & Economic Development,2-b Instituttion Area  Karkardooma Vikas Marg Extension Delhi-110092,0.00
496,2006-2007,Delhi,231650524,Institute Of Economic Growth,University Enclave Delhi UniversityDelhi-110007,6812236.00
497,2006-2007,Delhi,231660044,Institute of Human Behaviour & Allied Science,Post Box No. 9520 JhilmilDelhi -110095,0.00
498,2006-2007,Delhi,231660366,Institute of Objective Studies,Post Box No.9725162Jogabai Main Road.PO-Jamia NagarOkhlaNew  Delhi-110025,9290472.20
499,2006-2007,Delhi,231660329,Institute of Peace and Conflict Studies,B-7/3 Safdarjung Enclave New Delhi -,9979630.00
500,2006-2007,Delhi,231650380,Institute Of Peace Research And Action,B4/22 Azad Apartments  Sri Aurobindo MargNew Delhi-110017,1632200.00
501,2006-2007,Delhi,231650232,Institute Of Public Health & Hygiene Society,95krishna Nagar Safdarjang EnclaveNew DelhiClosed.request lr. dt. 14.08.2004-110029,0.00
502,2006-2007,Delhi,231660215,Institute Of Road Traffic Education,S-63 Okhla Industrial Area-phase-2 New Delhi. -110020,0.00
503,2006-2007,Delhi,231650241,Institute Of Sisters Of Charity, 110024,928839269.00
504,2006-2007,Delhi,231660119,Institute Of Social Action,H.no.310 Iiird Floor Ward-4 MehrauliNew Delhi-110030,0.00
505,2006-2007,Delhi,231650405,Institute Of Social Sciences,8 Nelson Mandela Road  New Delhi -110070,18502053.87
506,2006-2007,Delhi,231650094,Institute Of Social Service,Prabhat Tara Working Womens Hostel Mohamedpur Govt Colony R. K  PuramNew Delhi -110066,37440.00
507,2006-2007,Delhi,231650070,Institute Of Social Studies Trust,UG Floor Core 6a East Court India Habitat CentreLodhi Road New Delhi -110003,10022723.00
508,2006-2007,Delhi,231650494,Instt. Of Company Secretaries Of India,22 Instt. Area Lodi RoadNew Delhi -110003,0.00
509,2006-2007,Delhi,231650708,Integrated Development Education Association,162 Ward No.3 MehrauliNew Delhi -110030,0.00
510,2006-2007,Delhi,231660566,Integrated Development Trust,A-193 2nd FloorShahin Bagh Abul Fazal Enclave Part-2 Jamia Nagar OkhlaDelhi110025,0.00
511,2006-2007,Delhi,231650476,Integrated Human Development Service Fn.,K/37-a Green PartNew Delhi-110016,0.00
512,2006-2007,Delhi,231660424,Integrated Research and Action for Development,C-50 Asian Games Village Complex KhelgaonNew Delhi-110049,3756527.00
513,2006-2007,Delhi,231660054,Integrated Sustainable Energy & Ecological Development  Association,WZ A-5FIRST FLOOR ASALATPUR JANAKPURI NEW DELHI-110058DELHI110058,2250467.00
514,2006-2007,Delhi,231660180,Interaction India,C-192 (2nd Floor) Hari NagarNew Delhi -110064,0.00
515,2006-2007,Delhi,231660395,Interlife India,209Delhi Chamber Delhi GateNew Delhi-,0.00
516,2006-2007,Delhi,231650882,International Academy Of  Environmental Sanitation and Public Health,RZ-L-5 1st Floor Mahavir EnclavePalam Dabri Road New Delhi110045,0.00
517,2006-2007,Delhi,231660663,International Association for Human Values,No 6 Aradhana Enclave Sector-13 R K PuramNew Delhi110066,8319041.00
518,2006-2007,Delhi,231660535,International Center for Research on Women,42 First Floor Golf Links New Delhi -110003,33600735.25
519,2006-2007,Delhi,231650771,International Centre For Alternative Dispute Resolution,Trikoot-ii 3rd Floor             Bhikaji Cama Place R.k.puramNew Delhi-110066,0.00
520,2006-2007,Delhi,231650578,International Commission On Irrigation And Drainage,48 Nyaya Marg Chankya PuriNew Delhi -110021,6776890.00
521,2006-2007,Delhi,231660589,International Development Center Foundation,B 4/290 Safdarjung Enclave New Delhi -110029,0.00
522,2006-2007,Delhi,231660310,International Development Enterprises,Plot No 10 Local Shopping CentreSector 12 Dwaraka New Delhi,79342842.00
523,2006-2007,Delhi,231660200,International Foundation For Health,B2/11 Vasant Vihar  New Delhi. -110057,0.00
524,2006-2007,Delhi,231660179,International Life Science Institute - India,"C-39  GROUND FLOOR
LAJPAT NAGAR - III
NEW DELHI.NEW DELHI110024",1393419.00
525,2006-2007,Delhi,231660614,International Society for Human Welfare and Rehabilitation,19 Rajendra Park New Delhi -110060,148070.00
526,2006-2007,Delhi,231650359,International Society For Krishna Consciousness,Hare Krishna Hill Sant NagarMain Road East of Kailash New Delhi110065,767617.00
527,2006-2007,Delhi,231650258,Interserve India,PLOT NO. E - 537GREATER KAILASH  II110048,7176095.72
528,2006-2007,Delhi,231660053,Intervida Foundation,B-1/117 Lajpatnagar-I New Delhi. -,0.00
529,2006-2007,Delhi,231660439,IRAM,68 Mandakini Enclave Alaknanda South DelhiNew Delhi-110019,605876.00
530,2006-2007,Delhi,231660297,Ish Putra,27/15. Radhey Shyam Park East DelhiDelhi-110051,14452.00
531,2006-2007,Delhi,231650416,Ishwar Charitable Trust (KARE),C 57 Basement Defence ColonyNew Delhi110024,474869.00
532,2006-2007,Delhi,231650902,Islamia Anjuman Committee,F-6 SultanpuriNew Delhi-110041,0.00
533,2006-2007,Delhi,231650216,Islamic Academy Of  Social& Natural Society,1601 SuiwalanNew Delhi -110002,0.00
534,2006-2007,Delhi,231660485,Islamic Fiqh Academy (India),161-F Joga Bai Extn. Jamia Nagar OkhlaNew Delhi-110025,4286053.02
535,2006-2007,Delhi,231650037,Islamic Studies Association,R-1/302 Hauz Khas (park View)New Delhi -110016,70246.00
536,2006-2007,Delhi,231660515,Isra Welfare Trust,51-A Johri Farm Ist Floor JamianagarNew Delhi-110025,2678433.00
537,2006-2007,Delhi,231660739,Jagadguru Kripalu Parishat (Shyama Shyam Dham),A.F.(B) Part 1 Sector 10 Dwarka SubcityNew Delhi-110075,57023336.74
538,2006-2007,Delhi,231660003,Jagadguru Kripalu Parishat - Rangeeli Mahal,Radha Govind SamitiHAF(B) Part 1 Sector 10Dwaraka New Delhi110075,51038773.16
539,2006-2007,Delhi,231660379,Jagadguru Kripalu Parishat(Bhakti Dham),HAF Part I Sector 10 Dwarka SubcityNew Delhi-,121519488.68
540,2006-2007,Delhi,231650137,JAGORI,B-114 ShivalikMalviya Nagar110017,20648004.00
541,2006-2007,Delhi,231650249,Jagran,E-7 /10b Vasant ViharNew Delhi -110057,0.00
542,2006-2007,Delhi,231650564,Jai Jawan Jai Kishan Trust,92-c  Vinoba Puri Lajpat NagarNew Delhi-110024,0.00
543,2006-2007,Delhi,231660241,Jai Prakash Seva Safnsthan,Ja House 63 Basant Lok Vasant ViharNew Delhi-110057,0.00
544,2006-2007,Delhi,231650654,Jai Shankar Memorial Centre,Plot No. 5 Sarita Vihar Institutional AreaNew Delhi-110044,100000.00
545,2006-2007,Delhi,231660397,Jaisalmer Heritage Trust,Lower Ground Floor A-89 Nizamuddin EastNew Delhi-110013,0.00
546,2006-2007,Delhi,231650710,Jamia Hamdard,Hamdard University Hamdard NagarNew Delhi -110062,1064038.00
547,2006-2007,Delhi,231660575,Jamia-Tul-Banat Al Islamia,B-112 Thokar No.7 Shaheen Bagh Abul Fazal Enclave-II OkhlaNew Delhi -110025,0.00
548,2006-2007,Delhi,231660557,Jamiat Imam Wali - Ulah Trust,Rehman Complex (B-1/25) Batla House Chowk Near Jamia CoopBank Jamia Nagar New Delhi-110025,4262484.00
549,2006-2007,Delhi,231650694,Jamiat-ulama-i-hind,1-b.s.z.marg DaryaganjNew Delhi  -110002,13866365.00
550,2006-2007,Delhi,231650558,Jan Jagariti Educational Society,M-186 MangolpuriDelhi-110083,204875.00
551,2006-2007,Delhi,231660240,Jan Kalyan Siksha Samiti,A-287 Derawal Nagar Delhi  -110009,222325.00
552,2006-2007,Delhi,231650522,Jan Madhyam,B-43 Kailash Apartments  Lala Lajpat Rai MargNew Delhi-110048,1555394.00
553,2006-2007,Delhi,231650664,Jan Sewa Ashram,65-e Munirka EnclaveNew Delhi -110067,0.00
554,2006-2007,Delhi,231650924,Janani,B - 4 Press Apartments  23 Indraprastha ExtensionPatpartanj Delhi-110092,64148287.00
555,2006-2007,Delhi,231660631,Janhit Society for Social Welfare,N-9A/383 Lal Bagh Azadpur Delhi -110033,0.00
556,2006-2007,Delhi,231650594,Janta Vidhyapeeth,WZ-196 B/3B Virender Nagar Janakpuri RoadNew Delhi  -110058,0.00
557,2006-2007,Delhi,231660720,Jeevan Uday,R-33 Ramesh Park Laxmi Nagar Delhi -110092,0.00
558,2006-2007,Delhi,231650702,Jeevasharam Foundation,7 Amrita Shergil MargNew Dehi-110003,343216.00
559,2006-2007,Delhi,231650242,Jesuit Conference Of India,225 Jor Bagh New Delhi -110003,93789119.08
560,2006-2007,Delhi,231650272,Jesus & Mary Delhi Educational Society,Bangla Sahib Road New Delhi -110001,0.00
561,2006-2007,Delhi,231650083,Jewish Welfare Association,2 Humayun RoadNew Delhi  -110003,132009.00
562,2006-2007,Delhi,231650231,Jiv Prakash Vidyapeeth,23 Raj Niwas MargDelhi -110054,18411714.00
563,2006-2007,Delhi,231660351,JSW Foundation,6 Prithvi Raj RoadNew Delhi110011,679505.00
564,2006-2007,Delhi,231660111,Justice Sunanda Bhandare Foundation,C-109 South Ext.pt.-i New Delhi -110049,0.00
565,2006-2007,Delhi,231660256,Jyoti Development Trust,B-18 Mig Flats Saket New Delhi -110017,453210.00
566,2006-2007,Delhi,231650145,Jyoti Social Welfare Society,B-14(west)jyothi Nagar ShahadraDelhi  -110092,214080.00
567,2006-2007,Delhi,231660768,Jyoti Women and Children Development Society,W-Z-4A Palam Village New Delhi -110045,0.00
568,2006-2007,Delhi,231650796,K D Singh Memorial For Allround Development & Research,77 Ghalib Apptts Parwana Road Pitam PuraNew Delhi  -110034,0.00
569,2006-2007,Delhi,231660045,Kalaikoodam,888-890/v Nai Sarak  Delhi-110006,0.00
570,2006-2007,Delhi,231650673,Kalakar Trust,139-b Humayunpur  Safdarjung EnclaveNew Delhi -110029,1374907.00
571,2006-2007,Delhi,231660375,Kalyanam,41-1407DDA flats MadanGiriSouth Delhi Delhi-110062,0.00
572,2006-2007,Delhi,231660678,Kamla Jagriti Manch,C-98A South Ext-II New Delhi -110049,0.00
573,2006-2007,Delhi,231660454,Karm Marg Charitable Society,D-45 Gulmohar Park New Delhi -110049,3007405.00
574,2006-2007,Delhi,231660022,Karmath Charitable Trust,Plot No.23&24 Ph.II Shyam Vihar  NajafgarhNew Delhi-110043,788850.00
575,2006-2007,Delhi,231660384,Karuna Prem,Patliputra Nursing Home 7Sameypur PODelhi-110042,359376.00
576,2006-2007,Delhi,231650637,Katha,A-3sarvodaya Enclave Aurobindo MargNew Delhi-110017,17377107.00
577,2006-2007,Delhi,231650247,Khawja Hasan Nizami Memorial Society,Khawja Hasan Basti Hazrat NizamuddinNew Delhi    -110014,0.00
578,2006-2007,Delhi,231660082,Khoj International Artist's Association,A-74A South Extension Part II New Delhi  -110049,5915870.00
579,2006-2007,Delhi,231650514,Khosla Medical Instt.& Research Society,Block B Pocket-p Shalimar Bagh(west)Delhi  110052-110052,0.00
580,2006-2007,Delhi,231650074,Khrist Raja Family Helper Project,Khrist Raja School Bangla Sahib MargNew Delhi -110001,0.00
581,2006-2007,Delhi,231660396,Kiwanis Club aof New Delhi,Kiwanis BhawanB-35 Qutab Institutional AreaNew Delhi-110016,0.00
582,2006-2007,Delhi,231650095,Knh Diocese Of Delhi,1 Church Lane New Delhi -110001,0.00
583,2006-2007,Delhi,231660604,Krishna Foundation,24-Kallol Apartments 35 I.P.ExtensionDelhi-110092,0.00
584,2006-2007,Delhi,231660435,Kumayun Technical Education and Social Welfare Society of India,3749Kucha Parmanand Subhash Marg DaryaganjNew Delhi-110002,0.00
585,2006-2007,Delhi,231660620,Ladakh Buddhist Vihara,Bela Road Near I.S.B.T. Civil Line Delhi -110054,0.00
586,2006-2007,Delhi,231660615,Lady Shri Ram College for Women,Lajpat Nagar - IV New Delhi -110024,850000.00
587,2006-2007,Delhi,231650821,Lal Bahadur Shastri Memorial Foundation,1 Motilal Nehru Marg New Delhi   -110011,0.00
588,2006-2007,Delhi,231660172,Lal Bahadur Shastri National Memorial Trust,1-motilal Nehru Place  New Delhi. -110011,0.00
589,2006-2007,Delhi,231660520,Lala Thakur Dass Memorial and Charitable trust,12 Pocket - 2Jasola New Delhi110025,212109.00
590,2006-2007,Delhi,231660498,Latter-Day Saint Charities India Liaison Office,199 DBL Storey New Rajinder NagarNEW DELHI-100060,170280.00
591,2006-2007,Delhi,231660482,Lead India,M-8 3rd Floor Greater Kailash-I110048,5942993.00
592,2006-2007,Delhi,172270036,Learning Links Foundation,Allied House 2nd Floor Near B-7 Post office Vasant KunjNew Delhi110070,120317112.00
593,2006-2007,Delhi,231660063,Liberty Institute,E-6 Press Apartments Patparganj Delhi. -,2312417.00
594,2006-2007,Delhi,231660222,Life Sciences Foundation,Gh-13/590 Paschim Vihar New Delhi -110041,21980.00
595,2006-2007,Delhi,231660725,Lions Club of Delhi Vidya Mandir Trust,Lions Vidya Mandir Kushak Lane New Delhi -110001,197427.00
596,2006-2007,Delhi,231660156,Literacy India,C-1/11 Vasant Vihar Ist floor New Delhi -110057,6957241.00
597,2006-2007,Delhi,231660638,Little Star Public School Education Society,P-5/40-41 Mangolpuri Delhi -110083,0.00
598,2006-2007,Delhi,231650649,Living Hope Ministries,B 101 GF Palam Apartments Main Road BijwasanNew Delhi110061,5739528.00
599,2006-2007,Delhi,231650001,Lok Kalyan Samiti,11 A Vishnu Digambar Marg Rouse AvenueNew Delhi -110002,1228546.80
600,2006-2007,Delhi,231660771,Lord Buddha Memorial & Education Foundation,107-A Pocket A-3Mayur Vihar Ph.III Delhi -110096,0.00
601,2006-2007,Delhi,231660757,Lords Education and  Health Society,Building No. 24 3rd floor Okhla Industrial Estate Phase-IIINEW DELHI110020,0.00
602,2006-2007,Delhi,231650033,Lott Carey Baptist Mission Charitable Trust,5ansari Road DaryaganjNew Delhi -110002,8329111.00
603,2006-2007,Delhi,231660637,Louis Braille Blind Welfare Trust,Village Madanpur Dabas Rani Khera Nangloi RoadDelhi-110081,0.00
604,2006-2007,Delhi,231660147,Love & Care,D-178 Okhla Industrial Area  Phase-1New Delhi-110020,0.00
605,2006-2007,Delhi,231660727,Love Faith & Action Trust,17-A Christian Colony Patel Chest Delhi -110007,0.00
606,2006-2007,Delhi,231650911,M Foundation,Spice Avenue Press Enclave Road SaketNew Delhi   -110017,198200.00
607,2006-2007,Delhi,231660372,M.L. Kumar Memorial Medical Trust,D-1/28 Vasant ViharNew Delhi-110057,150651.00
608,2006-2007,Delhi,231650646,M/s Al Bashir,358 Pocket Jg-i Block -j Vikaspuri New Delhi-110018,2642276.00
609,2006-2007,Delhi,231660706,M/s Drishtee Foundation,1397 1st Floor Dr. Mukherjee NagarDelhi110009,1535310.00
610,2006-2007,Delhi,231650611,M/s Handicapped Childrens Parents Assocation,Room No. G-31 N.d.s.e. Part-iNew Delhi-110049,811694.00
611,2006-2007,Delhi,231660741,M/s Om Foundation,C-11 Tarang Apartments I.P. Extension New Delhi -110092,0.00
612,2006-2007,Delhi,231660202,M/s The Asian Heritage Foundation,Flat No.4 Shankar Market New Delhi -110001,448007.00
613,2006-2007,Delhi,231660138,Maa Ratni,Shahi Mohalla  Vill:gokalpurDelhi-110094,421019.00
614,2006-2007,Delhi,231650296,Madarsa Amina Islamia,Kashmere Darwaza  Delhi Gate New Delhi-110002,0.00
615,2006-2007,Delhi,231660583,Madarsa Arabia Rashediya Mairaj Ul Uloom,B-122/1 Gali No.1 Kabir Nagar Shahadra Delhi -110094,866832.00
616,2006-2007,Delhi,231650341,Maddrasa Tul Banat Al Islamia,Jamia Nagar Okhla RoadNew Delhi -110025,0.00
617,2006-2007,Delhi,231660549,Madhok Foundation,8408-Sector-C-8 Vasant Kunj New Delhi -110070,168038.00
618,2006-2007,Delhi,231660744,Madhyam,148 Maitri Apartments Plot No.28 PatparganjDelhi-110092,0.00
619,2006-2007,Delhi,231660380,Madrasah Tajweedul Quran,1993 Shivaji Road Azad Market Delhi -110006,2903144.29
620,2006-2007,Delhi,231650861,Magic Lantern Foundation,J-1881 Chittaranjan Park New Delhi  -110019,3944344.52
621,2006-2007,Delhi,231660008,Mahamana Malviya Mission,C-3 Gulmohar Park  New Delhi-110049,0.00
622,2006-2007,Delhi,231650657,Maharaja Agarsen Medical Edu.& Soc.society,28 Najafgarh RoadNew Delhi  -110015,0.00
623,2006-2007,Delhi,231660334,Maharaja Agrasen Hospital Charitable Trust,Rohtak Road West Punjabi Bagh New Delhi -110026,0.00
624,2006-2007,Delhi,231660780,Maharaja Agrasen Technical Education Society,10/4 Keshav Kunj East Punjabi Bagh New DelhiDelhi-110026,0.00
625,2006-2007,Delhi,231660419,Maharaja Dr.Karni Singh Ji Memorial Foundation,Flat No.9 III Rd Floor 10-A Prithviraj RoadNew Delhi-110011,0.00
626,2006-2007,Delhi,231650368,Maharishi Ayurveda Pratishthan,A-14 Mohan Co-op Ind Estate Mathura RoadNew Delhi-110044,0.00
627,2006-2007,Delhi,231650468,Maharishi Gandharva Ved Vishwa Vidyapeeth,A-14mohan Coop Indust.estate Mathura RoadNew Delhi-110044,0.00
628,2006-2007,Delhi,231650043,Maharishi Institute Of Creative Intelligence,DGL - 121 FIRST FLOOR - DLF THE GALLERIA MAYUR VIHAR PHASE-1DELHI110091,0.00
629,2006-2007,Delhi,231650044,Maharishi Mahila Education Society,121 FIRST FLOOR DLF THE GALLIARA MAYUR VIHAR PHASE-1DELHI110091,94633.00
630,2006-2007,Delhi,231660432,Maharishi Ram shankar Global Divine Life Society,Vill-Kadipur Kadipur Road North West DelhiDelhi-110036,0.00
631,2006-2007,Delhi,231660335,Maharishi Shiksha Sansthan,E 5 5th Floor Hansalaya Bldg.15 Barakhamba Road110001,0.00
632,2006-2007,Delhi,231660316,Maharishi Ved Vigyan Vishwa Vidyapeetham,121 First Floor DLF Galleria Mayur Vihar Phase-1Delhi110091,162324576.00
633,2006-2007,Delhi,231650805,Mahavir International,6550  Qutab Road Nabi KarimNew Delhi -110005,43910.00
634,2006-2007,Delhi,231650206,Mahila Dhyan Vidya Peeth,121 FIRST FLOOR DLF THE GALLIARA MAYUR VIHAR PHASE-1DELHI110091,0.00
635,2006-2007,Delhi,231650570,Mahila Haat,5 Deen Dayal Updhyay Marg New Delhi  -110002,3241499.00
636,2006-2007,Delhi,231650866,Mahila Pratiraksha Mandal,B-1/58 Lajpat NagarNew Delhi-110024,0.00
637,2006-2007,Delhi,231660371,Mahila Utthan Samiti,C-6/226Yamuma Vihar Delhi -110053,0.00
638,2006-2007,Delhi,231650860,Maitri Charitable Trust,K-24                              Haus KhasNew Delhi-110016,6716760.00
639,2006-2007,Delhi,231660701,Maitri Research & Development Foundation,B-4/89 B Rohini Delhi -110088,0.00
640,2006-2007,Delhi,231660753,Malankara Catholic Church Society,Malankara Catholic Centre 762 Sector-A Pocket B&CVasant Kunj New Delhi-110070,0.00
641,2006-2007,Delhi,231650638,Mamta Health Institute For Mother and Child,B-5 Greater Kailash Enclave-IINew Delhi110048,0.00
642,2006-2007,Delhi,231660295,Management Development Insititute,IFCI Tower 14th Floor 61 Nehru PlaceNew Delhi-110019,0.00
643,2006-2007,Delhi,231660221,Manas Sewa Nyas,V-1 / I-A Rajouri GardenNew Delhi110027,0.00
644,2006-2007,Delhi,231660428,Manav Kalyan Yog Va Prakritik Chikitsa Avam Shiksha Sansthan,82 Triveni Apartment West Enclave PitampuraNew Delhi-110034,0.00
645,2006-2007,Delhi,231650918,Manav Mandir Mission Trust,Jain Ashram Ring Road Opp. Sarai Kale Khan IsbtNew Delhi-110013,66817.00
646,2006-2007,Delhi,231660277,Manav Sewa Pratisthan,60/B Humayun Pur South DelhiDelhi-110029,143844.00
647,2006-2007,Delhi,231660561,Manav Uthan Educational & Welfare Society,D-6/02 Sultan Puri New Delhi -110041,0.00
648,2006-2007,Delhi,231660659,Manushi Sangathan,C1/3 Sangam Estate 1 Underhill Road Civil LinesDelhi-110054,231550.00
649,2006-2007,Delhi,231660392,Manzil Welfare Society,13 Khan Market New DelhiNCT of Delhi-110003,609374.00
650,2006-2007,Delhi,231650397,Marathoma Syrian Church,53/12 W.e.a. Karol Bagh New Delhi -110005,1983035.00
651,2006-2007,Delhi,231660556,Maria Seva Society,Maria Seva Ashram Khera KhurdDelhi-110082,1038553.00
