820,2006-2007,Uttar Pradesh,136760011,Queen Of Apostles Society, VaranasiUttar Pradesh-,1534573.00
821,2006-2007,Uttar Pradesh,136210007,Queen Victoria Boarding House,Civil Line  AgraUttar Pradesh-282002,36830.00
822,2006-2007,Uttar Pradesh,136800003,Rachna,New Sangam Vihar Datia Gate BaharNai Basti Jhansi284003,539000.00
823,2006-2007,Uttar Pradesh,136210001,Radhaswami Satsang,Dayal Bagh AgraUttar Pradesh-,5346721.05
824,2006-2007,Uttar Pradesh,136550139,Raghuvansh Mani Sewa Sansthan,Vill. Rasoolpur Post Bhalgaon LucknowU P-226005,0.00
825,2006-2007,Uttar Pradesh,136320016,Rahat Foundation Society,B010/85 Mohalla Mirdagan near Royal Children AcademyBijnor246701,0.00
826,2006-2007,Uttar Pradesh,136210050,Rahat Samaj Seva Samiti,104 Ayodhya Kunj 'a' Arjun NagarAgra Uttar Pradesh.-282001,0.00
827,2006-2007,Uttar Pradesh,136710013,Rahi Foundation,244 Narottam Nagar SidhauliSitapur U.P.-261303,495705.00
828,2006-2007,Uttar Pradesh,136700016,Rainbow Manav Utthan Samiti,2 Civil Line ShahjahanpurUttar Pradesh-242001,0.00
829,2006-2007,Uttar Pradesh,136550054,Rajasthan Uttar Pradesh Catholic Health Association,35-C MahanagarLucknow,10658609.00
830,2006-2007,Uttar Pradesh,136760129,Rajkali Mahila Kalyan Samiti,D-63/13-7Annapurna colony near Kashi Gramin BankMahamoorganjVaranasi Uttar Pradesh-,0.00
831,2006-2007,Uttar Pradesh,136410018,Rajput Vikas Seva Samiti,Salarpur Post Chirra Mohammadpur Faizabad Up-,0.00
832,2006-2007,Uttar Pradesh,136420002,Rakha Girls Higher Secondary School,Fatehgarh  FarrukhabadUp-,0.00
833,2006-2007,Uttar Pradesh,136570039,Ram Bhagwan Memorial Academic Welfare Society,7/2-32 Civil Line MathuraUttar Pradesh-281001,0.00
834,2006-2007,Uttar Pradesh,136550300,Ram Kishore Rastogi Development  foundation,240/27 Bagh Kaji Raja Bazar LucknowUttar Pradesh-226003,9670039.00
835,2006-2007,Uttar Pradesh,136650016,Ram Krishna Sewa Samiti,Civil Line South PilibhitUttar Pradesh-262001,0.00
836,2006-2007,Uttar Pradesh,136230069,Ramakrishna Math,VIJNANANANDA MARG MUTTHIGANJ ALLAHABAD - 211003ALLAHABAD211003,49762.00
837,2006-2007,Uttar Pradesh,136550021,Ramakrishna Math,Nirala Nagar LucknowUp-226020,65963.50
838,2006-2007,Uttar Pradesh,136570004,Ramakrishna Math,Rly Stn. Vrindaban (n.e.rly)  Vrindaban-281121 Mathura Up-,12185.00
839,2006-2007,Uttar Pradesh,136690011,Ramakrishna Math,Kankhal  HardwarUttar Pradesh-249408,20683.00
840,2006-2007,Uttar Pradesh,136550043,Ramakrishna Mission Ashram,Ramakrishna Nagar KanpurUp-208012,242979.00
841,2006-2007,Uttar Pradesh,136760016,Ramakrishna Mission Home Of Service,Luxa VaranasiUttar Pradesh-21010,17642157.79
842,2006-2007,Uttar Pradesh,136230072,Ramakrishna Mission Sevashram,Vijananda Marg Muthiganj AllahabadUttar Pradesh-211003,168765.00
843,2006-2007,Uttar Pradesh,136550022,Ramakrishna Mission Sewashram,Vivekananda Puram  LucknowUp-226007,19981941.85
844,2006-2007,Uttar Pradesh,136570005,Ramakrishna Mission Sewashram,Nr. Rly Stn. Vrindaban MathuraUp-281121,4601053.75
845,2006-2007,Uttar Pradesh,136250046,Ramanand Sarswati Pustkalaya,Vill: Jokhara  Teh: Lagadi Distt: AzamgarhU.P.-,400000.00
846,2006-2007,Uttar Pradesh,136670004,Rameshwari  Manav Kalyan Samiti,Sinha Kutir Sri K.b. Sinha Govt.  Girls Inter College Devanandpur Ratapur Dt.  Raibralle U.p.-229316,0.00
847,2006-2007,Uttar Pradesh,136680010,Rampur Zila Gramin Vikas Samiti,Bazaria Khansama RampurUttar Pradesh-,0.00
848,2006-2007,Uttar Pradesh,136250047,Rani Laxmi Bai Shiksha Samiti,Vill-DeoriaPO-Mehnagar AzamgarhUttar Pradesh-,0.00
849,2006-2007,Uttar Pradesh,136550308,Rashtriya Drishtivadhi Tarth Sanstha,A-143Talkatora MargRajajipuram near Cotton Mill Lucknow`Uttar Pradesh-,0.00
850,2006-2007,Uttar Pradesh,136440072,Rashtriya Grameen Vikas Samiti,Vill-Koryadih Post-Sammanpur GhazipurUttar Pradesh-233306,0.00
851,2006-2007,Uttar Pradesh,136550223,Rashtriya Gramin Jan Kalyan Sansthan,93Jageshwar Vihar Kalyanpur(West) LucknowU.P.-226022,0.00
852,2006-2007,Uttar Pradesh,136510010,Rashtriya Gramin Vikas And Mahila Kalyan Sansthan,Siddiquepur Jaunpur Uttar Praesh. -222001,0.00
853,2006-2007,Uttar Pradesh,136250009,Rashtriya Gramodyog Sewa Sansthan,Manpur Patwadhkautuk  AzamgarhUttar Pradesh-,0.00
854,2006-2007,Uttar Pradesh,136230105,Rashtriya Jan Kalyan Sansthan,Vill &po Mukundpur 90a/ic/2 Baghambari GaddiallahpurAllahabaduttar Pradesh-211002,0.00
855,2006-2007,Uttar Pradesh,136230139,Rashtriya Mahila Bal evam Yuva Samaj Sewa Sansthan,28/2A/2A Shivkuti AllahabadUttar Pradesh-211005,0.00
856,2006-2007,Uttar Pradesh,136520029,Rastiya Nirman Yojana Samiti,329/1 Jhokan Bagh JhansiUttar Pradesh-284001,0.00
857,2006-2007,Uttar Pradesh,136420039,Rastriya Gramin Vikas Shiksha Sansthan,97 A/3 Civil Lines FatehpurUttar Pradesh-212601,0.00
858,2006-2007,Uttar Pradesh,136800001,Refromed Episcopal Mission,Lalitpur  Uttar Pradesh -284403,0.00
859,2006-2007,Uttar Pradesh,136550170,Regional Artisan & Female Establishment Center (india),15/45 Indira Nagar LucknowUttar Pradesh.-,0.00
860,2006-2007,Uttar Pradesh,136760001,Regional Pastoral Centre, VaranasiUttar Pradesh-,7512045.00
861,2006-2007,Uttar Pradesh,136760076,Rishi Pragatisheel Shikshan Sansthan,B-1/111 AssiVaranasi221005,1067044.96
862,2006-2007,Uttar Pradesh,136580025,Rohit Serve Bal Vihar Hitkari Siksha,Prachar Shbha Nehru NagarMeerut  Up-,0.00
863,2006-2007,Uttar Pradesh,136520009,Roman Catholic Diocese Of Jhansi,Bishop's House  Jhansi Uttar Pradesh-,19173416.00
864,2006-2007,Uttar Pradesh,136300019,Rotary Sewa Kendra Samiti,17 Anand Nagar Complex BareillyUttar Pradesh-,3294268.00
865,2006-2007,Uttar Pradesh,136230035,Rotary Sponsored Crippled and Youth Welfare Society,Viklang Kendra Opp. Bhardwaj AshramJ L N Road Allahabad211002,10000.00
866,2006-2007,Uttar Pradesh,136600003,Rotary Sunderlal Eye Hospital,Bisauli Gate ChandausiUp-202412,4128850.00
867,2006-2007,Uttar Pradesh,136700010,Ruby Gramodyog Sansthan,Moh Husanpurshahjahanpur Uttar Pradesh -242001,0.00
868,2006-2007,Uttar Pradesh,136470055,Rudra Dheeraj Prashikshan Samiti,Vill. Sahijana Post SahjanwaGorakhpur U.P.-273209,37361.00
869,2006-2007,Uttar Pradesh,136210059,Rudra Geeta Gyan Yagya Sansthan,1/64 Pachkkuiya AGRAUttar Pradesh-282010,0.00
870,2006-2007,Uttar Pradesh,136550246,Rural Organisation For Social Education,350/59-A Dariapur F.C.I. Road Near Sima Icecream Factory)Lucknow Uttar Pradesh-,0.00
871,2006-2007,Uttar Pradesh,136420010,S. D. Kinder Garden Vidyalaya,Village- Sikander J. T. More Farukhabad Up-,0.00
872,2006-2007,Uttar Pradesh,136670015,Sabla,57r.d.a. Indira Nagar Rae BareliUttar Pradesh-,2742668.00
873,2006-2007,Uttar Pradesh,136630024,Sadhna Bhawan Trust,Vill. & Post Mangarh Teh. KundaPRATAPGARH Uttar Pradesh-229417,0.00
874,2006-2007,Uttar Pradesh,136550220,Sagar  Sewa  Samiti,Plot No.951 Manas Nagar Krishna Nagar LucknowUttar Pradesh-,0.00
875,2006-2007,Uttar Pradesh,136550047,Sahabhagi Shikshan Kendra, LucknowUttar Pradesh -,23984136.86
876,2006-2007,Uttar Pradesh,136260008,Sahas  Seva Sansthan,V&P -Risia-Bazar BahraichUttar Pradesh-271875,490225.00
877,2006-2007,Uttar Pradesh,136590031,Sahbhagi Gramin Vikas Samiti,74 Avas Vikas Colony MirzapurUttar Pradesh-231001,751850.00
878,2006-2007,Uttar Pradesh,136550205,Sahil Educational Society,Rais Manzil163/329Chickmandi Moulvi GanjLucknow-Uttar Pradesh-226018,0.00
879,2006-2007,Uttar Pradesh,136280020,Sahyog Samajik Sansthan,Tarauhan  Karwi Chitrakoot District.Uttar Pradesh.-210205,0.00
880,2006-2007,Uttar Pradesh,136690034,Sahyog Sarvodaya Mandal, SaharanpurUttar Pradesh-,0.00
881,2006-2007,Uttar Pradesh,136670024,Sahyog Shakti,132/1 Behind Dashmesh Complex Super Market RaibrallyUttar Pradesh-229001,0.00
882,2006-2007,Uttar Pradesh,136800005,Sai Jyoti Gramodoyog Samaj Sewa Samiti,417 Gandhi Nagar Lalitpur LalitpurUttar Pradesh-284403,1464438.00
883,2006-2007,Uttar Pradesh,136400011,Sai Kirpa Mahila & Bal Vikas Sansthan,10-B Baijal Colony  Mal Godam RoadEtawah U.P.-,0.00
884,2006-2007,Uttar Pradesh,136810029,Sai Kripa,A- 153 Sector - 21 Jal Vaya Vihar Noida Uttar Pradesh-201301,1578847.00
885,2006-2007,Uttar Pradesh,136390019,Saifi Gramodhyog Sewa Niketan,Soron Gate Kasganj EtahUttar Pradesh-207123,0.00
886,2006-2007,Uttar Pradesh,136660017,Saikshnik Gramonnati Samiti,Vill Gona Po Golchora PithoragarhUttaranchal-,0.00
887,2006-2007,Uttar Pradesh,136470059,Sainik Mahila Prashikshan Sansthan,Jubilee Chowk P.O. Sadar GorakhpurUttar Pradesh-273001,0.00
888,2006-2007,Uttar Pradesh,136550135,Saint Joseph's Charitable Society,Vishal Khand 5- Gomti Nagar LucknowU P-,255094.00
889,2006-2007,Uttar Pradesh,136410005,Saket Mahila Sansthan,Hanswar Kothi Ayodhya FaizabadUp-,0.00
890,2006-2007,Uttar Pradesh,136380046,Samadhan Manav Seva Sansthan,Karmajitpur Gouri Bazar DeoriaUttar Pradesh-274202,346985.00
891,2006-2007,Uttar Pradesh,136440017,Samagrah Lok Hit Sewashram,Vill- Bhadesar Post- Bairan Ghazipur Up-,437573.00
892,2006-2007,Uttar Pradesh,136650003,Samaj Kalyan Evam Vikas Adhyayan Kendra,Shekh Chand PilibhitUttar Pradesh-,0.00
893,2006-2007,Uttar Pradesh,136440043,Samaj Kalyan Gramodyog Sansthan,E-29 Goutam Buddh Colony Malgodam RoadGhazipur U.P.-233001,0.00
894,2006-2007,Uttar Pradesh,136440049,Samaj Kalyan Krishi Pashupalan Avam Takniki Shiksha Kendra,Chainpur SadatGHAZIPUR     Uttar Pradesh-255204,0.00
895,2006-2007,Uttar Pradesh,136530038,Samaj Sewa  Sansthan,385 Near Azad Kutic Bura No-2 KanpurUttar Pradesh-,0.00
896,2006-2007,Uttar Pradesh,136290013,Samaj Sewa Sansthan Barabanki,Sant. Ravidas Ashram Siddharth Nagar Faizabad RoadBarabanki Uttar Pradesh-,0.00
897,2006-2007,Uttar Pradesh,136210057,Samajik Sanrachana Samiti,MIG A-145 Shastri PuramSikandara Agra Uttar Pradesh -282--7,0.00
898,2006-2007,Uttar Pradesh,136550234,Samajik Vikas Evam Computer Prashikshan Samiti,551-K/407 F Azadnagar Hasanpur Road AlambaghLucknow U.P.-226005,0.00
899,2006-2007,Uttar Pradesh,136500003,Samarpan Jan Kalyan Samiti, JalaunUp-,7287107.00
900,2006-2007,Uttar Pradesh,136440074,Samarpan Sansthan Ghazipur,Shastri Nagar Behind Tehsil Distt-GhazipurGhazipur233001,0.00
901,2006-2007,Uttar Pradesh,136440013,Sambhav Samiti,Vill MakhadumpurPost Makhadumpur233307,0.00
902,2006-2007,Uttar Pradesh,136670025,Sameer Bal Mahila Evam Gramya Abhiyantran Sewa Sansthan,Village & Post-Kannawan BachhrawanDist.RaibareillyUttar Pradesh-229301,0.00
903,2006-2007,Uttar Pradesh,136810035,Samiksha Social Voluntary Organisation,D-520 Shastri Nagar GhaziabadUttar Pradesh-201002,0.00
904,2006-2007,Uttar Pradesh,137390011,Samjothan Evam Bal Kalyan Sansthan,Bhairo Paga(near of Mandakuni takie Karwi ChitrakootUttar Pradesh-210205,0.00
905,2006-2007,Uttar Pradesh,136550193,Sampark,Bhandari Complex551/10Natkhera Rd AlambaghLucknow-Uttar Pradesh-226005,0.00
906,2006-2007,Uttar Pradesh,136760128,Sampooran Kshetra Vikas Samiti,A-3 DIG ColonyPrashantpuri Kachahari VaranasiUttar Pradesh-221002,0.00
907,2006-2007,Uttar Pradesh,136310015,Samta Shiksha Samiti,Pradash Nagar Khaurahwa Gandhi Nagar BastiUttar Pradesh-,0.00
908,2006-2007,Uttar Pradesh,137230006,Samta Vikas Samiti,Gram Sakoorabad Gajraula Distt: J.P. NagarUttar Pradesh-244235,0.00
909,2006-2007,Uttar Pradesh,136550257,Samvad Samajik Sansthan,459 B Manas Enclave Indra NagarLucknow226015,11313.00
910,2006-2007,Uttar Pradesh,136410043,Samvad Seva Samiti,626 Mohalla-Taksal. Tajso;-Sadar FaizabadUttar Pradesh-,0.00
911,2006-2007,Uttar Pradesh,136310021,Sanchit Vikas- Sansthan,Vill- Hasana-pur P.o.- BargadwaDistt.- Basti (uttar Pradesh)-272190,429244.00
912,2006-2007,Uttar Pradesh,136230023,Sangeet Sadhna Mandir,Bishop House  AllahabadUttar Pradesh-,0.00
913,2006-2007,Uttar Pradesh,136380008,Sanjay Gandhi Seva Sansthan,Sondha Barhai Road Distt. Deoria Uttar Pradesh  -,0.00
914,2006-2007,Uttar Pradesh,136760115,Sanjeevani Social Welfare Society,Plot No.19 Cotton Mill Colony ChowkaghatVARANASI  Uttar Pradesh-221001,0.00
915,2006-2007,Uttar Pradesh,136550214,Sanjivini Agrotech . Foundation,Visen House 1/8AVihwas Khand Gomati NagarLucknow  Uttar Pradesh-226010,0.00
916,2006-2007,Uttar Pradesh,136760037,Sankat Mochan Foundation, VaranasiUttar Pradesh-,1393840.00
917,2006-2007,Uttar Pradesh,136230045,Sardar Bhagwan Singh Govind Sewa Sansthan,118 Darbhanga Colony AllahabadUttar Pradesh-,0.00
918,2006-2007,Uttar Pradesh,136280037,Sardar Patel Lok Kalyan Samiti,Tindwari Road-Mandi GaliBaberu BandaUttar Pradesh-210121,0.00
919,2006-2007,Uttar Pradesh,137390007,Sarv Sewa Sansthan,Laxmanpuri (Behind's of Deepak Palace)KarwiChitrakoot-210205,0.00
920,2006-2007,Uttar Pradesh,136600028,Sarva Daliya Manav Vikas Kendra,Bahjoi  MoradabadUttar Pradesh-202410,0.00
921,2006-2007,Uttar Pradesh,136230087,Sarvajan Kalyan Samiti,275 Katghar AllahabadUttar Pradesh-,530119.00
922,2006-2007,Uttar Pradesh,136490015,Sarvajanik Gramin Vikas Sansthan,72/A5-New Civil Line HardoiUttar Pradesh-241001,387775.00
923,2006-2007,Uttar Pradesh,136440042,Sarvangin Gramin Vikas Awam Prasikshan Samiti,Village-Muhammedpur Post MubarakpurGhazipur U.P.-233301,0.00
924,2006-2007,Uttar Pradesh,136720022,Sarvoday Gramodyog Seva Samit,847/3 vinowapuri Hathiya Nala SultanPurUttar Pradesh-,0.00
925,2006-2007,Uttar Pradesh,136490001,Sarvodaya Ashram,Vill and Post ThamrawaHardoi241001,7703929.00
926,2006-2007,Uttar Pradesh,136670016,Sarvodaya Gram Vikas Sansthan,Vill. Pure Molvikhud Po Jais Rae BareliUttar Pradesh-229305,0.00
927,2006-2007,Uttar Pradesh,136280005,Sarvodaya Sewa Ashram,Chitrakut Csm Nagar Uttar Pradesh-,652615.00
928,2006-2007,Uttar Pradesh,136480003,Sarvodaya Vikas Ashram,Maudaha Po Ragaul HamirpurUp-210507,0.00
929,2006-2007,Uttar Pradesh,137340005,Satguru Kabir Smarak Sansthan,Sant Kabir Samadhi Sathali Kabir ChauraMagharSant Kabir Nagar-Uttar Pradesh-272173,0.00
930,2006-2007,Uttar Pradesh,136670002,Satya Ahinsa Bal Vidyalaya Samiti,Rajamou Road Bachhrawan  Rae BareliUttar Pradesh-229301,470689.00
931,2006-2007,Uttar Pradesh,137420006,Satyagrah Seva Samiti,Ward No.(2)Vill/Po-Hata Hata KushinagarUttar Pradesh-247203,0.00
932,2006-2007,Uttar Pradesh,136550303,Savera Shikshan Sansthan,71 Christian Colony21 Vikramaditya MargBandariabaghLucknowUttar Pradesh-226001,0.00
933,2006-2007,Uttar Pradesh,136550120,School For  Potential Advancement & Restoration Of Confidence India,Surudaya Niwas 26 Sachivalaya  Colony Mauram Bagh Sitapur RoadLucknow.U P-226020,4072438.00
934,2006-2007,Uttar Pradesh,136760131,School of Management Sciences,Khushipur(Mohan Sarai-Mughal Sarai Bypass)PO-Bahhaon VaranasiUttar Pradesh-221011,0.00
935,2006-2007,Uttar Pradesh,136550025,Self Employed Womens Association,1 Habibullah Estate Hazratganj LucknowUp-,7897006.00
936,2006-2007,Uttar Pradesh,136230062,Setukaran Sansthan,Mirzapur Road Nr Bethany School Naini AllahabadUttar Pradesh-211008,803543.00
937,2006-2007,Uttar Pradesh,136550197,Sewa Sahayata Samitti,1A-Shivlok Trivani-3 LucknowUttar Pradesh-226020,2500.00
938,2006-2007,Uttar Pradesh,136410022,Sh. Mani Ram Dass Chhawni Seva Trust,Basudeo Ghat Ayodhya Faizabad Up-,0.00
939,2006-2007,Uttar Pradesh,136220011,Shabbir Memorial Education Society,Po  Kwarsi  AligarhUttar Pradesh-,182219.00
940,2006-2007,Uttar Pradesh,137230011,Shafeequl Hasan Educational and Social Welfare Society,Darbar-E-Kalan Amroha J.P. NagarUttar Pradesh-244221,0.00
941,2006-2007,Uttar Pradesh,137280019,Shakti Seva Sansthan,East of old Tehsil Sahadatpura Nai Basti Mau Nath BhajanMau Uttar Pradesh-275101,0.00
942,2006-2007,Uttar Pradesh,136510023,Shakuntala Shiksha Samiti,katchahari Road Husanabad JaunpurUttar Pradesh-222002,0.00
943,2006-2007,Uttar Pradesh,136290012,Shalom Junior High School Samiti,Vill_ Gandhi Nagar Po- BaburigaonDistt: Barabanki Uttar Pradesh-,0.00
944,2006-2007,Uttar Pradesh,136400013,Shanker Gramodhyog Sewa Sansthan,106 Vijay Nagar Colony ETAWAHUttar Pradesh-206001,0.00
945,2006-2007,Uttar Pradesh,136470038,Sharda Mahila Gramodhyog,Sewa Sansthan H.no.195/ews Rapti Nagar Phase 1(prathan Charan)Arogya Mandirgorakhpuru.p-,0.00
946,2006-2007,Uttar Pradesh,136550281,Sharda Samajothan and shiksha Samiti,2/180Ruchi Khand I Sharda Nagar LucknowUttar Pradesh-,0.00
947,2006-2007,Uttar Pradesh,136550280,Sharnam Sansthan,Plot No.7 House A-43 Rejeev NagarKanchana Bihari MargKalyanpurLucknowUttar Pradesh-226022,1356136.00
948,2006-2007,Uttar Pradesh,136550218,Shashwat Sahbhagi Sanstha,Head Officw 212 Durvijay Ganj Lucknow -261401,805566.00
949,2006-2007,Uttar Pradesh,137270003,Shaswat,Village : Nandna PO: BelwakhrudMAHARAJGANJ   Uttar Pradesh-,325481.00
950,2006-2007,Uttar Pradesh,136710014,Sheeba Public Welfare Society,544 Pink House sheikh Sarain City Station Road  SitapurU.P.-261001,0.00
951,2006-2007,Uttar Pradesh,136810041,Shiksha Bharti,640 Reoti Kunj  HapurUttar Pradesh-245101,3024752.00
952,2006-2007,Uttar Pradesh,136220025,Shiksha Vikas Sabha,Ghanghauli Post Jaidpura AligarhUttar Pradesh-202165,224300.00
953,2006-2007,Uttar Pradesh,136310017,Shikshit Yuva Sewa Samiti,Pandey Bazar BastiUttar Pradesh-272002,2663074.00
954,2006-2007,Uttar Pradesh,136550251,Shilp Sadhana,14 Ram Block Sector-11 Rajaji Puram LucknowUttar Pradesh-226017,0.00
955,2006-2007,Uttar Pradesh,137420005,Shirin Basumata Nari Sansthan,Vill-Parsauni KalanPO-Padrauna Vikaskhand-PadraunaKushinagarUttar Pradesh-274304,0.00
956,2006-2007,Uttar Pradesh,136310013,Shish Mania Darul Uloom,Vill. Shish Mania Po Alidapur Sidhartha NagarUttar Pradesh-,0.00
957,2006-2007,Uttar Pradesh,137410002,Shiv Devi Sewa Sansthan,Pant chauraha G.T. Road Sikandra Roa HathrasUttar Pradesh-,0.00
958,2006-2007,Uttar Pradesh,136410032,Shiv Gramodyog Sansthan,Village- Chhatirwa Post- Pora Block- Masodha Tehsil- SohawalDistt.- Faizabad (uttar Pradesh)-224201,0.00
959,2006-2007,Uttar Pradesh,136410011,Shiv Gramodyog Vikas Sansthan,Palia Mafi  Shahganj Faizabad Up-224184,0.00
960,2006-2007,Uttar Pradesh,136810055,Shiv Shakti Gramodyog Sansthan,Near Bus Stand Murad NagarGhazaibad-UP-,1823485.00
961,2006-2007,Uttar Pradesh,136550222,Shivalik Rural Development & Women Welfare Society,E-70L.D.A.Colony Hind Nagar Kanpur Road LucknowU.P.-226012,0.00
962,2006-2007,Uttar Pradesh,136380021,Shivam Seva Sansthan,Rudrapur DeoriaUp-,0.00
963,2006-2007,Uttar Pradesh,136310016,Shohratgarh Environmental Society,Prem Kunj Adarsh Colony Garakul Shohratgarh Siddharthnagar- 272205 Uttar PradeshShohratgarh272205,2359067.00
964,2006-2007,Uttar Pradesh,136530019,Shramik Bharti,392 Vikas Nagar (lakhanpur) KanpurUttar Pradesh-208024,11848336.00
965,2006-2007,Uttar Pradesh,136610014,Shramik Sewa Kendra,711-a Dayanand Nagar Shamli MuzaffarnagarUp-247776,167600.00
966,2006-2007,Uttar Pradesh,136570027,Shree Bhagwat Mission Trust,302 Bihari Pura Shree Dham Vrindavan Mathura U P-281121,10193661.00
967,2006-2007,Uttar Pradesh,136250054,Shree Bhawanand Balika Mahavidyala siksha Samite,Vill-Post/Punarjee Jahanaganj Tehsil-Sadar AzamgarhUttar Pradesh-276131,0.00
968,2006-2007,Uttar Pradesh,136580040,Shree Ram Gram Vikas Samiti,Vill. Nagauri Post: Phalauda Teh. Mawana Meerut Uttar Pradesh -250401,2211870.00
969,2006-2007,Uttar Pradesh,136570032,Shri Akhand Harinam Sankirtan Mahyagya,Shri Radha Girdhari Temple Gaura Nagar - 3Vrindaban281121,1322796.73
970,2006-2007,Uttar Pradesh,136480016,Shri B.K.S. Prakash Deep Pratishthan,11-Subhash Bazar Hamirpur-UP -210301,0.00
971,2006-2007,Uttar Pradesh,136230108,Shri Balram Shaikchhik Evam Samaj Sudhar Samiti,Vill-sirhir Po-silaudhi Meja BlockAllahabad Uttar Pradesh.-,0.00
972,2006-2007,Uttar Pradesh,136530069,Shri Behari Ji Gramdhyog Seva Samiti,18/190 Mall Road KanpurUttar Pradesh-,0.00
973,2006-2007,Uttar Pradesh,136570028,Shri Brij Sewa Samiti Tb Sanatorium Trust,Vrindaban(mathura) Uttar Pradesh -281121,0.00
974,2006-2007,Uttar Pradesh,136630015,Shri Ganga Prasad Smarak Mahila Kalyan Sansthan,32 Subhash Nagar KundaPratapgarh Distt. (uttar Pradesh)-230204,0.00
975,2006-2007,Uttar Pradesh,136310019,Shri Gaushala Kathar Jungle,Vill & Post - Kathar Jungle  Basti DistrictUttar Pradesh.-,0.00
976,2006-2007,Uttar Pradesh,136280013,Shri Lal Bahadur Shastri Jan Kalyan Kendra,Terah Maufi Tindwari BandaUttar Pradesh-210218,0.00
977,2006-2007,Uttar Pradesh,136230047,Shri Lal Bahadur Shastri Smarak Gramodyog Pratishthan,Lokmanpur AllahabadUttar Pradesh-,0.00
978,2006-2007,Uttar Pradesh,136530067,Shri Meera Saraswati Siksha Samiti,S/1 New Officer Colony Moti JheelKanpur (Uttar Pradesh)-,0.00
979,2006-2007,Uttar Pradesh,136230100,Shri Nageshwar Jan Kalyan Samiti,125/1chotta Baghara Prayag AllahabadUp-,0.00
980,2006-2007,Uttar Pradesh,136210061,Shri Niroti Lal Budhha Sansthan,3-4-P-2A Bank Colony Opp-Subhash Park MG Road282010,885477.00
981,2006-2007,Uttar Pradesh,137280012,Shri Parmanand Shikshan Prashikshan Sansthan,Vill-Kasara(Malusia)Post-Kasara MauUttar Pradesh-275101,0.00
982,2006-2007,Uttar Pradesh,136530031,Shri Puran Chandra Gupta Smark Trust, Kanpur U P-,0.00
983,2006-2007,Uttar Pradesh,136380030,Shri Rajmangal Seva Sansthan,Barsath Po Majhagawa DeoriaU.p.-274001,0.00
984,2006-2007,Uttar Pradesh,136700005,Shri Ram Chandra Mission,Hardoi Road Rosa Post District- ShahajahanpurUttar Pradesh-242405,16125781.98
985,2006-2007,Uttar Pradesh,136690051,Shri Ram Krishna Sewa Sadan Hospital Education & Medical Science,G.T. Road DeobandSaharanpur Uttar Pradesh-247554,0.00
986,2006-2007,Uttar Pradesh,136390014,Shri Roop Kishore Gautam Manav Seva Sansthan,Katara Chowki Tahaseel Road Jalesar CityEtah (uttar Pradesh)-207302,0.00
987,2006-2007,Uttar Pradesh,136420043,Shri Sadhu Shran Singh Bal Vidya Niketan,Vill.  & Po- Barayepur Distt: FatehpurUttar Pradesh-212656,0.00
988,2006-2007,Uttar Pradesh,137400001,Shri Sai Samiti Noida (regd.),64-d/2 F Block Sector-  40 NoidaGautam Budha Nagar Distt. (u.p.)-201301,37919.00
989,2006-2007,Uttar Pradesh,136390012,Shri Sardar Seva Sansthan,Vpo Sujrai Etah Uttar Pradesh-,0.00
990,2006-2007,Uttar Pradesh,136760036,Shri Scahidanand Shiksha Sansthan,A28/59 Chandpura VaranasiUttar Pradesh-221001,525342.00
991,2006-2007,Uttar Pradesh,136570035,Shri Shri Narhari Sewa Sansthan,302-Gurukul Road VrindavanMathura-Uttar Pradesh-281121,0.00
992,2006-2007,Uttar Pradesh,137230013,Shrimad Dayanand Kanya gurukul Mahavidyalaya,Chotipura PO-rajabpur J.P. NagarUttar Pradesh-244236,0.00
993,2006-2007,Uttar Pradesh,136520004,Shrine Of St. Jude,Civil Lines  JhansiUttar Pradesh -284001,812631.00
994,2006-2007,Uttar Pradesh,136760059,Shushrusha Samiti,7 Professor Colony Jagatganj VaranasiUttar Pradesh-221002,788315.00
995,2006-2007,Uttar Pradesh,136670026,Shyam Jan Kalyan Samiti,Vill: Mathgosai Po- Dahigawan RaebareliUttar Pradesh-,0.00
996,2006-2007,Uttar Pradesh,136570017,Shyama Shyam Dham Samiti,Vrindivan   Uttar Pradeshh-,50530834.00
997,2006-2007,Uttar Pradesh,136530082,Sir Syed Eduational Society,68 Cantt. KANPURUttar Pradesh-208004,0.00
998,2006-2007,Uttar Pradesh,136760021,Sisters Of Our Lady Of Providence,Shivpur Dist. VaranasiUttar Pradesh-,6621813.00
999,2006-2007,Uttar Pradesh,136710001,Sitapur Eye Hospital Trust,Post Box No. 42 SitapurUttar Pradesh-261001,12589.00
1000,2006-2007,Uttar Pradesh,136380024,Smitsonia Gramin Mahila Avam Bal Kalyan Sansthan,Mahrauna Po Lahilpar Deoria Up-,240000.00
1001,2006-2007,Uttar Pradesh,136230089,Smt. Chandra Kumari Shikshan Samiti,61 Gariwan Tola AllahabadUttar Pradesh-211003,0.00
1002,2006-2007,Uttar Pradesh,136470069,Smt. Dropadi Devi Dharmada Trust,Rudrapur Khajni GorakhpurUttar Pradesh-273212,0.00
1003,2006-2007,Uttar Pradesh,136250019,Smt. Saraswati Devi Charitable Society,Vpo Lakhandih Atraulia AzamgarhUttar Pradesh-,0.00
1004,2006-2007,Uttar Pradesh,136760110,Sneha Deep  Socitey Of The Helpers Of Mary,BISHUNPURA VILLAGE P.O. LOHATAVaranasi221107,3535345.00
1005,2006-2007,Uttar Pradesh,136760118,Social Action and Research Center (SARC),147 Vindyavasini Colony Orderly BazarVaranasi Utter Pradesh-221002,2565377.00
1006,2006-2007,Uttar Pradesh,136530058,Social Development And Management Society,117/n/4/hig Kda Colony Raniganj Kakadeo Kanpur (uttar Pradesh.)-208025,0.00
1007,2006-2007,Uttar Pradesh,137160002,Social Development Society,B.P 691   Subash Nagar Mughal saraiChandauli  Uttar Pradesh-232101,0.00
1008,2006-2007,Uttar Pradesh,136550262,Social Enginering Through Education & Research,1/15 Vishwas Khand Gomti Nagar Lucknow Uttar Pradesh -226010,0.00
1009,2006-2007,Uttar Pradesh,136680016,Social Welfare Association,Green House Purana Ganj Ghair Baz KhanRampur-UP-244901,0.00
1010,2006-2007,Uttar Pradesh,136760058,Social Welfare Institute,S-8/4 1k Ram Bharose Nagar Shivpur Dist. VaranasiUttar Pradesh-221003,1716959.00
1011,2006-2007,Uttar Pradesh,136810056,Society for Agrarian Research Improvement and Education,Village and Post Razapur GhaziabadUttar Pradesh-201002,0.00
1012,2006-2007,Uttar Pradesh,136600027,Society For Agro-industrial Education In India,Amarpurkashi MoradabadUp-202411,1183034.21
1013,2006-2007,Uttar Pradesh,136550165,Society For Aid In Development S-AID,3/66 Patrakarpuram Gomti NagarLucknow226010,2241538.00
1014,2006-2007,Uttar Pradesh,136230102,Society For Community Development Training & Research,104 Mori Daraganj AllahabadU P-211006,50000.00
1015,2006-2007,Uttar Pradesh,136550286,Society for Computer Education & Development in Rural Area,631/1Shankarpuri Kamta Chinhat LucknowUttar Pradesh-,0.00
1016,2006-2007,Uttar Pradesh,136300014,Society For Development Of Appropriate Technology, BareillyUttar Pradesh-,0.00
1017,2006-2007,Uttar Pradesh,136530084,Society for Empowerment of Women Youth & Children for Action,Christu Sewa Niketan Mariampur Jr. High School 117/M/2 Double PuliaKakadeo KANPUR  Uttar Pradesh-208025,1136866.00
1018,2006-2007,Uttar Pradesh,137230007,Society for Institute of Psychological Research & Health,247/3 Mohammdi Sarai Amroha Distt: J.P. NagarUttar Pradesh-,0.00
1019,2006-2007,Uttar Pradesh,136230085,Society For Integrated Development And Social Reconstruction,971/641 Mutthiganj AllahabdUttar Pradesh-211003,0.00
1020,2006-2007,Uttar Pradesh,136530052,Society For Integrated Sustainable Development,R-22 White House Yasoda Nagar Kanpur DistrictUttar Pradesh.-208011,0.00
