S.No,Year,State,Registration No,Association name,Address,Amount of FC Received
1,2016-2017,Manipur,194130323,ABUNDANT LIFE MINISTRY,LAMNENGTE INNFIRST STREET NEW NAMBULAND795001,0.00
2,2016-2017,Manipur,194130427,ACTION FOR SOCIAL JUSTICE ORGANIZATION,SOIBAM LEIKAI AYANGPALI ROADIMPHAL EAST795001,0.00
3,2016-2017,Manipur,194130092,Action For Welfare Awakening In Rural Environment,Thangmeiband Imphal  Manipur-795001,0.00
4,2016-2017,Manipur,194160098,Action for Woman and Child Advancement,New ZovengImphal795128,0.00
5,2016-2017,Manipur,194140057,Action of Women in Development,Wino BazarUkhrul795142,0.00
6,2016-2017,Manipur,020780133,AGAPE CHRISTIAN OUTREACH MISSION INDIA,"ANUGRAHA NIWAS. RATENPHAI WW II OLD WORKSHOP
LEIKAI. P.O. PALLEL. CHANDEL DISTRICT. MANIPUR
795135.CHANDEL795135",0.00
7,2016-2017,Manipur,194160059,Agape Museum,Post Box 110Opposite Tuibuong Petrol PumpChurachandpur,0.00
8,2016-2017,Manipur,194130248,Agent for Social Change (ASOC),C/O  Principal Prima Donna English High School Thangmeiband LilashingKhongnangkhongImphal Manipur-795010,0.00
9,2016-2017,Manipur,194130294,All Women and Child Development,Chingamathak First Floor Electricity BuildingImphal West(Manipur)-795001,0.00
10,2016-2017,Manipur,194160080,Amazing Grace Ministry Asia,Bijang Vengnom P. O. Box - 161Churachandpur795128,0.00
11,2016-2017,Manipur,194180003,Analon Christian Development Committee,Anallon Christian Institute CampusLambung795127,0.00
12,2016-2017,Manipur,194190006,Apunba Mahei Shanglem,Ishok PO Nambol BishnupurManipur-795134,0.00
13,2016-2017,Manipur,194190023,ASSOCIATION FOR RURAL DEVELOPMENT AND WOMEN EMPOWERMENT,KeinouP.O. Nambol795135,0.00
14,2016-2017,Manipur,194130431,Association for Rural Maintenance Services,Pukhao Iranpham PO PangeiImphal795114,0.00
15,2016-2017,Manipur,194130278,Association for Social Advancement and Resource Authority,Awang Sekmai Imphal West DistrictAndhra Pradesh-795136,0.00
16,2016-2017,Manipur,194150063,Association For Welfare And Rural development,Church road ColonySenapati795106,0.00
17,2016-2017,Manipur,194170024,Assumption Parish,Catholic Church New Awangkhul  B.p.o.-lamphalpatTamenglong Manipur-795004,0.00
18,2016-2017,Manipur,194130348,Auxiliary Service for Human Affairs,H.O. Asha Yaiphakol Sagolmang Bazar P.O. PangeiImphal795114,0.00
19,2016-2017,Manipur,194130042,Awang Jiri Nupi Marup,Nambol  ImphalManipur-795134,0.00
20,2016-2017,Manipur,194130054,Bashikong Chanura Sinlon Lup,Ningom Thongjao ImphalManipur-,0.00
21,2016-2017,Manipur,194160057,Bethany Christian Institute,Post Box No.-23 Family LaneChuruchandpur Manipur-795128,0.00
22,2016-2017,Manipur,194160103,Bethesda Khankho Foundation,Head Office K Salbung B P O KoiteChurachandpur795128,3949507.00
23,2016-2017,Manipur,194160099,Bible Hill outh Club,Rengkai Bible HillChurachandpur795128,0.00
24,2016-2017,Manipur,194130241,Care Foundation,Chassad Avenue Imphal East DistrictManipur-795001,0.00
25,2016-2017,Manipur,194130220,Catholic Educational Society,Archibishops House ImphalManipur-795002,702000.00
26,2016-2017,Manipur,194130109,Catholic Medical Centre,Koirengi ImphalManipur-795001,1343477.00
27,2016-2017,Manipur,194160092,Centre for Community Initiative,Zuihnuam Road College Veng New LamkaChurachandpur795128,2966360.00
28,2016-2017,Manipur,194200059,Centre for Development Activities,Near Indo-Myanmar Road WangjingManipur.-795148,0.00
29,2016-2017,Manipur,194150067,Centre for Information and Technology in Rural Areas,Selsi Motbung P.O. MotbungSenapati795107,0.00
30,2016-2017,Manipur,194130018,Centre for Mental Hygiene,Sangaipren Airport Road ImphalManipur-795001,0.00
31,2016-2017,Manipur,194130155,Centre For Organisation Research & Education,Paona Road Imphal Manipur-795001,0.00
32,2016-2017,Manipur,194130072,Centre For Social Development,Palace Compound Imphal Manipur-795001,20228690.00
33,2016-2017,Manipur,194180052,Centre for Women and Girls,Lhunnajang village Corner Stone AcademyTengnoupal block795135,0.00
34,2016-2017,Manipur,194180018,Chamdil Khubil Social Welfare Arts & Culture Asociation, ChandelManipur-795127,150000.00
35,2016-2017,Manipur,194130205,Charik Pareng Child Welfare Association,Mantripukhri Bazar Imphal EastManipur-,0.00
36,2016-2017,Manipur,194130344,Charitbale and Religious Society,New Lambulande P.O. ImphalImphal795001,2389613.04
37,2016-2017,Manipur,194150010,CHIL CHIL ASIAN MISSION SOCIETY,P.O. Leikham Pokpi  KanglatongbiManipur-795151,5768151.00
38,2016-2017,Manipur,194150026,Chivairy Poverty Allevation Dev. Association,P.O. Mao SenapatiManipur-795150,0.00
39,2016-2017,Manipur,194160074,Christian Revival Church Manipur,K. Phaicham Chiengkonpang PO ChurachandpurManipur-795128,0.00
40,2016-2017,Manipur,194180015,Christian Social Development Organisation,Panchai ChandelManipur-795127,448470.00
41,2016-2017,Manipur,194160088,Church of the Nazarene International (North East India),Hmarveng (Teddim Road)P.O. Churachandpur795128,1176179.00
42,2016-2017,Manipur,194140053,Citizens Alliance for Re Empowerment,Viewland Zone One Ukhrul TownUkhrul795142,0.00
43,2016-2017,Manipur,194130330,CLARIST HOME,MANTRIPUKHRIIMPHAL795002,8755902.00
44,2016-2017,Manipur,194190032,Community Development Organisation,Ngaikhong Khullen  PO BishnupurBishnupur795126,0.00
45,2016-2017,Manipur,194200037,Community Development Organisation,Wangbal Lamboithong ThoubalManipur-795138,2053628.00
46,2016-2017,Manipur,194200048,Community Development Programme Centre,Mi Road  ThoubalManipur.-,0.00
47,2016-2017,Manipur,194150065,Compassion Manipur,DamdeiMotbung795107,192604.00
48,2016-2017,Manipur,194130445,Cornerstone Academy Manipur,LEF Church EnclaveLangol795004,287195.00
49,2016-2017,Manipur,194130085,Council For Antipoverty Action,Urup Litan Makhong Imphal  Manipur-795130,0.00
50,2016-2017,Manipur,194130338,COUNCIL FOR DEVELOPMENT OF POOR AND LABOURERS,LILONG BAZARIMPHAL WEST-IILILONG BAZAR795130,0.00
51,2016-2017,Manipur,194160076,Covenant Childrens Home,Mualkoi Churachandpur Manipur-795006Churachandpur795006,15037957.00
52,2016-2017,Manipur,194170032,Development Agency for Tribal People,Chiulon (Khingjaron) Village PO Box - 7 TamenglongManipur-795141,0.00
53,2016-2017,Manipur,194190014,Development on Communication Arts and Culture Science,Economic and Education Centre (D-Cacus-Education Centre) BCECNing Thoukhong Bazar Area Ningthoukhong795126,0.00
54,2016-2017,Manipur,194130110,Diocesan Social Service Society,Bishops House Mantripukhri ImphalManipur-795001,14758299.00
55,2016-2017,Manipur,194130016,Diocese of Imphal,Post Box No. 35 Mantripukhri ImphalManipur-795002,31056720.34
56,2016-2017,Manipur,194150047,Don Bosco College Maram,Maram Centre Maram Bazar PO SenapatiManipur-795105,0.00
57,2016-2017,Manipur,194170002,Don Bosco Social Welfare Centre, TamenglongManipur-795141,0.00
58,2016-2017,Manipur,194130406,Dr.Lalmohon Memorial Trust,Komberei Keithel Lamphel ImphalImphal795001,0.00
59,2016-2017,Manipur,194130306,Educated and Self Employed Women's Social Service Association,Wangkhei Thangiam Leikai Imphal Municipality Ward No.20Imphal Manipur-795001,0.00
60,2016-2017,Manipur,194130103,El Shaddai Resource Centre,Gracy Home Chingmeirong East  ImphalManipur-795001,3321034.00
61,2016-2017,Manipur,194170028,Elim Christian Children Home,PO Tamei Tamenglong DistrictManipur-795125,8763.00
62,2016-2017,Manipur,194150006,Emmanuel School Society,Haipi SenapatiManipur-,1665075.00
63,2016-2017,Manipur,194130227,Environment and Economics Management Association,Haobam Marak Chingtham Leikai Imphal West IIManipur-795001,0.00
64,2016-2017,Manipur,194140012,Evangelical Assembly Church,Rengkai Road  ChurachandpurManipur-795129,0.00
65,2016-2017,Manipur,194160100,EVANGELICAL CHURCHES ASSOCIATION,CHIENGKONPANG  CHURACHANDPURCHURACHANDPUR795128,1979219.00
66,2016-2017,Manipur,194160004,Evangelical Congregational Church of India,Post Box 24 Nehru Marg RengkaiChurachandpur,2671326.06
67,2016-2017,Manipur,194160016,Evangelical Convention Church,P.O.Box 6 ChurachandpurOrissa-795128,516994.00
68,2016-2017,Manipur,194160093,Evangelical Organisation Church,Agape AvenueChurachandpur795128,0.00
69,2016-2017,Manipur,194130119,Foundation for Environment and Economic Development Services,HengbungP O Kangpokpi795129,0.00
70,2016-2017,Manipur,194160046,Frontier Mission Society,Agape Avenue Hill Town ChurachandpurManipur-,5722318.41
71,2016-2017,Manipur,194130440,GENDER AND DEVELOPMENT INITIATIVE,NAGAMAPAL KHWAI LAIMAYUM LEIRAKIMPHAL795001,0.00
72,2016-2017,Manipur,194160029,Good Sheperd English High School,Sagang Village BPO Sagang PO Moirang ChurachandpurManipur-795133,834788.00
73,2016-2017,Manipur,194160021,Grace Bible College,New Lamka  ChurachandpurManipur-795128,0.00
74,2016-2017,Manipur,194130214,Green Foundation,Sega Road Thouda Bhobok Leikai Imphal WestManipur-795001,0.00
75,2016-2017,Manipur,194130362,Handicapped Development Foundation,Sagolband Tera Pukhri Mapal P.O. ImphalImphal795001,1009271.00
76,2016-2017,Manipur,194200101,Handicapped Welfare Society(HAWS),Kakching Phousupat Leikai P.O. KakchingImphal795103,0.00
77,2016-2017,Manipur,194160091,Health Integrated Ministries,Rengkai villageChurachandpur795128,0.00
78,2016-2017,Manipur,194160102,HENGKAPKOT VILLAGE DEVELOPMENT SOCIETY,opposite tuibuong petrol pump churachandpurchurachandpur795128,0.00
79,2016-2017,Manipur,194150039,Highland Welfare Association,Keithelmanbi Military Colony Imphal SenapatiManipur-795122,0.00
80,2016-2017,Manipur,194130260,Hill People's Development Council,B/184 Zone II National Games Vill PO Lamphel ImphalManipur-795004,0.00
81,2016-2017,Manipur,194130334,Human Empowerment for Social Integration,Khurai Nandeibam Leikai P.O. LamlongImphal795010,0.00
82,2016-2017,Manipur,194180051,Human Resource and Environment Development Organisation,S Lhangnom Village PO ChakpikarongChandel795135,0.00
83,2016-2017,Manipur,194130314,Human Resource Development Organisation,Porompat Chithek JNIMS Road Near SBI PorompatImphal EastImphal East Districy795001,0.00
84,2016-2017,Manipur,194130441,Huyel Langlon Thang Ta Association Manipur,Yumnam Huidrom  Imphal West  PO Wangoi Pin 795009 ManipurImphal795009,0.00
85,2016-2017,Manipur,194160018,Independent Church of India,Sielmat P.O.  ChurachandpurManipur-795128,3202135.63
86,2016-2017,Manipur,194170041,Indigenous Women and Children Foundation,Pansy Vale  Apollo Bazar UtopiaTamenglong  1795141,833771.25
87,2016-2017,Manipur,194130161,Institute for Social Disease,Singgamei Mathah Chongtham Leikai Imphal Manipur-795001,0.00
88,2016-2017,Manipur,194140058,Institute of Goodwill Foundation,Po. # 45 Viewland Ukhrul ManipurUkhrul795412,1302768.00
89,2016-2017,Manipur,194130176,Institute Of Rural Development & Training Centre,Kaina Road Poironkhongjin Awang Leikai Imphal Manipur-795138,0.00
90,2016-2017,Manipur,194130399,INSTITUTE OF SOCIAL RESEARCH AND DEVELOPMENT,LAMSANG BAZAR NEAR RDO LAMSANGLAMSANG795146,1466510.00
91,2016-2017,Manipur,194150085,INTEGRATED INDIGENOUS TRIBAL CHILDRENS MINISTRY OF INDIA,THANGKANPHAI VILLAGE PO SAIKULSAIKUL795118,0.00
92,2016-2017,Manipur,194130067,Integrated Rural Areas Development Organisation,Salam B.PO. Thaoroijam  ImphalManipur-795113,0.00
93,2016-2017,Manipur,194200015,Integrated Rural Development & Education Organisation,Wangbal ThoubalManipur-795138,0.00
94,2016-2017,Manipur,194200029,Integrated Rural Development Agency, Hangul B.P.OMayang Imphal-795132,0.00
95,2016-2017,Manipur,194200085,Integrated Rural Development Centre (IRDC),KiyamSipaiBabuBazarThoubal795138,0.00
96,2016-2017,Manipur,194200012,Integrated Rural Development Service Organisation,Wangjing   Manipur-795148,337735.50
97,2016-2017,Manipur,194150052,Integrated Rural Management Association IRMA,Lien Cottage Chassad AvenueImphal East795001,0.00
98,2016-2017,Manipur,194150081,INTEGRATED TRIBAL ORGANIZATION FOR UPLIFTMENT COMMUNICATION AND HEALTH,KAYINU MAOMAO795150,0.00
99,2016-2017,Manipur,194200020,Islamic Educational Development Organisation,Sangaiyumpham P.O. Wangjing Dist: Thoubal Manipur-795148,0.00
100,2016-2017,Manipur,194130448,Jamia Halima Aziz Educational Trust,Khabeisoi Azamnagarimphal East795114,0.00
101,2016-2017,Manipur,194150013,Kangchup Area Tribal Women Society,Sherwood 5th Avenue Deaulah Lane  ImphalManipur-795001,0.00
102,2016-2017,Manipur,194130394,KANGLA FOUNDATION,WANGKHEI KHUNOU NEAR CITIZEN CLUBIMPHAL EAST795001,0.00
103,2016-2017,Manipur,194130276,Kanglei Enat Thang Ta Shindam Sanglen,Kongpal Chanam Leikai Imphal East DistrictManipur-795001,0.00
104,2016-2017,Manipur,194150037,Kangpokpi Christian Hospital,PO Kangpokpi Sadar Hills KangpokpiSenapati Manipur-781001,346491.00
105,2016-2017,Manipur,194200008,Kha Manipur Yoga & Nature Cure Association,Kakching ThoubalManipur-795103,0.00
106,2016-2017,Manipur,194130002,Kuki Christian Church,Dewlahland Imphal Manipur-795001,12832041.00
107,2016-2017,Manipur,194160101,LEIMATAK AREA SOCIAL TRANSMISSION ORGANIZATION,zion veng tuibuong churachandpur districtchurachandpur795128,0.00
108,2016-2017,Manipur,194170005,Liangmai Naga Baptist Association,Tamei TamenglongManipur-,0.00
109,2016-2017,Manipur,194130122,Life Line Foundation,Keishamthong Top Leirak  Imphal Manipur-795001,0.00
110,2016-2017,Manipur,194130310,Lodestar Public School Trust,Khongsai Veng Laipham Khunou Imphal Manipur -795001,1071697.00
111,2016-2017,Manipur,194130377,M.M. Higher Secondary School,Wangkhei Wangkheimayum Leirak Imphal East DistrictImphal795001,0.00
112,2016-2017,Manipur,194130036,Manipur Baptist Convention,Centre Church  Imphal Manipur-795001,5020571.00
113,2016-2017,Manipur,194130004,Manipur Chanura Leishem Marup,Konung Lampak Imphal Manipur-795001,0.00
114,2016-2017,Manipur,194160073,Manipur Evangelical Lutheran Church,Post Box No. 10 Zomi Colony ChurachandpurManipur-795128,0.00
115,2016-2017,Manipur,194130137,Manipur Mahila Kalyan Samiti,Deulah Land ImphalManipur.-,0.00
116,2016-2017,Manipur,194190033,Manipur Nature Cure and Yoga Hospital,Ngaikhong Khullen PO BishnupurBishnupur795126,0.00
117,2016-2017,Manipur,194130232,Manipur Network of Positive People,Yaiskul Hiruhanaba Leikai ImphalManipur-795001,0.00
118,2016-2017,Manipur,194150020,Manipur North Economic Development Association,Senapati H.Q Behind SenapatiImphal Manipur-795106,1121440.00
119,2016-2017,Manipur,194160044,Manipur Presbyterian Synod,Ib Road Pb 39 ChurachandpurManipur-,0.00
120,2016-2017,Manipur,194130068,Manipur Ramakrishna Society,Prajatantra Building Imphal Manipur-795001,0.00
121,2016-2017,Manipur,194130011,Manipur Rural Institute Society,Tera Bazar Sapam Leirak Imphal Manipur-795001,0.00
122,2016-2017,Manipur,194130035,Manipur Voluntary Health Association,Wangkhei Ningthem Pukhri Mapan Imphal EastManipur-795001,0.00
123,2016-2017,Manipur,194130106,Manipur Women Co-ordinating Council,Konok Khongnang Khong  Opp Manipur Univ P.o. CanchipurImphal Manipur-795003,0.00
124,2016-2017,Manipur,194150066,Maria Bianchi Social Care Ministry,Broadway Complex Senapati BazarSenapati795106,560450.00
125,2016-2017,Manipur,194190035,MARUPLOI FOUNDATION,BISHNUPUR BAZAR MUNICIPALITY ROADBISHNUPUR795126,0.00
126,2016-2017,Manipur,194130298,Meetei Leimarol Sinnai Sang (MLSS),Khoyathong Traffic Point Imphal West DistrictManipur-795001,0.00
127,2016-2017,Manipur,194130457,MOTHERS CARE CHILDREN HOSPITAL AND RESEARCH CENTRE,SAGOLBAND MOIRANG LEIRAKIMPHAL795001,0.00
128,2016-2017,Manipur,194160036,Muolvaiphei Rural Health & Research Centre,PO Box 3 ChurachandpurManipur-795128,0.00
129,2016-2017,Manipur,194150022,Naotoumai Rural Development Association,Kathikho VillageKarong795007,0.00
130,2016-2017,Manipur,194130318,New Era Environmental & Development Society,Maringlane New Checkon Imphal East Manipur -795001,1386570.00
131,2016-2017,Manipur,194200026,New Integrated Rural Managemet Agency, Sangaiyumpham NungphoWaggling-795148,0.00
132,2016-2017,Manipur,194190028,NEW LIFE FOUNDATION,THAMNAPOKPI P.O / P.S MOIRANGMOIRANG795133,1414570.00
133,2016-2017,Manipur,194160030,New Testament Baptist Churches Association,Bible Hill ChurachandpurManipur-795128,7083891.48
134,2016-2017,Manipur,194130097,New-Era Progressive Service Centre,Chingamathak Imphal  ManipurImphal795001,0.00
135,2016-2017,Manipur,194130188,Nirmalabas Convent,M.G Avenue ImphalManipur.-,7026280.50
136,2016-2017,Manipur,194130247,Nirvana Foundation,South Babupara ImphalManipur-795001,0.00
137,2016-2017,Manipur,194160087,NORTH EAST INDIA OUTLOOK,Saikawt Churachandpur P.Box 301 Manipur IndiaChurachandpur795128,0.00
138,2016-2017,Manipur,194160079,NORTH EASTERN CHILDRENS HOME,RENGKAI BETHLEHEM VENG P.BOX-62CHURACHANDPUR795128,6169500.00
139,2016-2017,Manipur,194130456,Nupi Khunai,c/o Oinam Ibohal Polytechnic Keishampat JunctionImphal795001,0.00
140,2016-2017,Manipur,194140043,Participatory Action for Sustainable Development Organisation,Post Box No. 22 UkhrulManipur-795142,3022879.50
141,2016-2017,Manipur,194160001,Partnership Mission Society,Sielmat Box 2  ChurachandpurManipur-795128,76839920.75
142,2016-2017,Manipur,194140029,Patkai Christian Academy,Changraphung Ukhrul Manipur-795142,3658821.00
143,2016-2017,Manipur,194140050,People Action for Rural Development Association,Hamleikhong PO Ukhrul Manipur -795142,1558151.00
144,2016-2017,Manipur,194170037,People Action for Social Tranformation(PAST),chiuluan villageTamenglong795141,1584269.00
145,2016-2017,Manipur,194160064,People Advance in Social Service,New Mata ChurachandpurManipur-795128,0.00
146,2016-2017,Manipur,194130266,People Advancement Centre,Heinoumakhong Opp Manipur University Girls HostelCanchipur,0.00
147,2016-2017,Manipur,194170034,People's Endeavour for Social Changes (PESCH),Church Road Tamenglong H/Q District ManipurTamenglong Manipur-795141,0.00
148,2016-2017,Manipur,194180045,PEOPLES DEVELOPMENT PROGRAMME (PDP),MOLNOI VILLAGE PALLEL P.O.PALLEL CHANDEL795135,0.00
149,2016-2017,Manipur,194190029,Peoples Foundation Manipur,Kumbi Bazar  KNP Ward No 7Kumbi795133,0.00
150,2016-2017,Manipur,194190015,Peoples Resource Development Association,Ishok PO Nambol BishnupurManipur-795134,3683808.00
151,2016-2017,Manipur,194200087,Philanthropic Society,Wangjing Heitupokpi P.O. WangjingImphal795148,0.00
152,2016-2017,Manipur,194130303,Population Health Institute,Chingmeirong East Imphal EastManipur-795010,0.00
153,2016-2017,Manipur,194160037,Presbyterian Church In India,"Hebron Veng New Lamka
P.O. New Lamka
Churachandpur
Manipur-795006Churachandpur795006",8986757.62
154,2016-2017,Manipur,194130368,Radiance Socio Economic Development Organisation,Uripok Huidrom Leikai ImphalImphal795001,0.00
155,2016-2017,Manipur,194140030,Ramungo Library Group,Phungreitang UkhrulManipur-795142,0.00
156,2016-2017,Manipur,194130256,Reach an Orphan Ministry,Opposite Langol Housing Complex Imphal WestManipur-795001,2154283.90
157,2016-2017,Manipur,194160022,Reformed Presbyterian Church North East India,Peace Lane P.O. Box-4795128,20482664.03
158,2016-2017,Manipur,194180022,Resource Centre for Social Welfare Community Development,Japhor Bazar ChandelManipur-795127,0.00
159,2016-2017,Manipur,194130380,Resource Mobilisation Centre,Heingang Makha LeikaiImphal795002,0.00
160,2016-2017,Manipur,194140007,Rongmei Christian Development Society,Thanikhun Bishenpur  UkhrulManipur-795126,0.00
161,2016-2017,Manipur,194170007,Rongmei Naga Baptist Association, Tamenlong Manipur-795141,13580207.00
162,2016-2017,Manipur,194160065,Rural Aid Service,Tuibuong Khopi ChurachandpurManipur-795128,0.00
163,2016-2017,Manipur,194200108,Rural Area Development Organisation,Wangjing Awang LeikaiThoubal795148,0.00
164,2016-2017,Manipur,194130446,Rural Backward Development Organisation,Kwakeithel Konjeng LeikaiImphal795001,0.00
165,2016-2017,Manipur,194130328,RURAL COMMUNITY DEVELOPMENT CENTRE,POURABI SAWOMBUNG IMPHAL EASTIMPHAL EAST795010,0.00
166,2016-2017,Manipur,194130444,RURAL DEVELOPMENT AGENCY,a k building majorkhul m g avenueimphal795001,0.00
167,2016-2017,Manipur,194150061,RURAL DEVELOPMENT ASSOCIATION,Wainem Village B.P.O. Bungte Chiru P.O. NambolNambol795134,0.00
168,2016-2017,Manipur,194150028,Rural Development Foundation Association,Karong Distt.-senapatiManipur-795007,0.00
169,2016-2017,Manipur,194170009,Rural Development Society,P.O. Box. 2 Church Road  Tamenlong H.Q. Manipur-795141,0.00
170,2016-2017,Manipur,194200006,Rural Development Society,R D A Bhawan Wangjing Bazar  P.O. WangjingManipur-795148,2163399.00
171,2016-2017,Manipur,194180021,Rural Education & Action for Change,Pallel ChandelManipur-795135,0.00
172,2016-2017,Manipur,194160062,Rural Environment Development Agency,Tuikuimuallum Village Singnggat Sub Division ChurachandpurManipur-795128,0.00
173,2016-2017,Manipur,194130213,Rural Health Organisation,Naoremthong Laishram Leirak Imphal WestManipur-795001,0.00
174,2016-2017,Manipur,194200017,Rural Industries Development Association,Wanghem P.O.  ThoubalManipur-795138,0.00
175,2016-2017,Manipur,194130087,Rural Peoples Development & Resource Foundation,Maring Lane ImphalManipur-795001,0.00
176,2016-2017,Manipur,194130046,Rural Service Agency,Palace Compound (west)  ImphalManipur-795001,0.00
177,2016-2017,Manipur,194200073,Rural Social and Educational Development Association,Heibong Makhong Mayang  Imphal ThoubalManipur-795132,0.00
178,2016-2017,Manipur,194130123,Rural Voluntary Organisation,P O CRPF Camp Langjing Group Centre(Patsoi Part-II) N C RoadImphal795113,0.00
179,2016-2017,Manipur,194200064,Rural Voluntary Services,Wangbal Mayaj Leikai ThoubalManipur-,0.00
180,2016-2017,Manipur,194130433,RURAL WOMEN SOCIETY,KODOMPOKPIIMPHAL795008,0.00
181,2016-2017,Manipur,194140018,Rural Women Upliftment Society,Sielmat P.O. Box-3 Churachandpur - 795128 Manipur IndiaChurachandpur795128,903007.62
182,2016-2017,Manipur,194190027,SACSAS ACADEMY,C/O SURJITKUMAR YUMKHAIBAM MOIRANG LAMKHAIMOIRANG795133,2409500.00
183,2016-2017,Manipur,194130049,Salam Young Learners Development Association,B.PO Salam ImphalManipur-795113,0.00
184,2016-2017,Manipur,194160095,SAMARITAN EDUCATIONAL SOCIETY,B Vengnuom ChurachandpurChurachandpur795128,0.00
185,2016-2017,Manipur,194150027,School Of Higher Academy & Litercy Org. Motbung,S.p.o. Motbung Sadar HillsManipur-795107,1097310.00
186,2016-2017,Manipur,194130268,Self Employment Voluntary Association,Naoremthong Bazar Imphal WestManipur-795001,0.00
187,2016-2017,Manipur,194160058,Shalom(society For Hiv/aids Lifseline Operation In Manipuri),Post Box No. 139 Nehru Marg ChurachandpurManipur-795128,1779268.00
188,2016-2017,Manipur,194130203,Shija Foundation,LangolImphal West795004,0.00
189,2016-2017,Manipur,194160049,Siam Sinpawlpi,P Box -99 Churachandpur Manipur-795128,0.00
190,2016-2017,Manipur,194180016,Sita Womens Development Association,Pallel ChandelManipur-,0.00
191,2016-2017,Manipur,194130381,Smart Society,Nagamapal Kanjabi MachinImphal795001,0.00
192,2016-2017,Manipur,194130363,Sneha Bhavan,C/O Little Flower SchoolImphal-West795001,4306597.60
193,2016-2017,Manipur,194130218,Social And Health Development Organisation,Pishumthong Oniam Lekai Imphal Manipur -795001,0.00
194,2016-2017,Manipur,194130173,Social Awareness Service Organisation,Lamphel ImphalManipur-795001,0.00
195,2016-2017,Manipur,194130386,SOCIAL DEVELOPMENT FOUNDATION (TRUST),PALACE COMPOUND (WEST) IMPHAL EASTIMPHAL795001,0.00
196,2016-2017,Manipur,194130384,Social Development Organisation,Oinam Sawombung P.O. WangoiImphal795123,0.00
197,2016-2017,Manipur,194150054,Social Development Organisation,Saikul Bazar PO Saikul Manipur -,0.00
198,2016-2017,Manipur,194200072,Social Environment Economic Development Society,Lamding Cherapur Thoubal DistrictManipur-795148,0.00
199,2016-2017,Manipur,194160094,Social Human Action for Rural Empowerment Society (SHARE),New Mata ChurachandpurChurachandpur795128,0.00
200,2016-2017,Manipur,194130309,Social Reformation and Development Organisation,Soibam Leikai Ayangpalli Road Imphal East Manipur -795001,0.00
201,2016-2017,Manipur,194160086,SOCIETY FOR TRIBAL ALLIANCE FOR INTEGRATED RURAL(STAIR),SUMCHINVUM VILLAGECHURACHANDPUR795128,0.00
202,2016-2017,Manipur,194200014,South Eastern Rural Development Organisation,Sangaiyumpham Part - II Idgah Road P.O. Wangjing Dist: Thoubal Manipur-795148,0.00
203,2016-2017,Manipur,194130034,Southern Tangkhul Naga Baptist Association,Irong  Manipur-795149,0.00
204,2016-2017,Manipur,194130324,ST. ANTHONY S EDUCATIONAL SOCIETY,Chingmeirong Paomei ColonyImphal795001,0.00
205,2016-2017,Manipur,194130340,STANDARD ROBARTH EDUCATIONAL TRUST,Canchipur Imphal West District Manipur India.Imphal795003,0.00
206,2016-2017,Manipur,194190022,SUSTAINABLE DEVELOPMENT CENTRE,THAMNAPOKPIBISHNUPUR795133,0.00
207,2016-2017,Manipur,194140060,SUSTAINABLE LIVING FOUNDATION TRUST,KAMPHASOM P O AND  P S UKHRULUKHRUL795142,13256174.00
208,2016-2017,Manipur,194130030,Tangkhul Theological Association, Ukhrul  Manipur-795142,11295930.00
209,2016-2017,Manipur,194150008,Thadou Baptist Association,Motbung SenapatiManipur-,1896501.00
210,2016-2017,Manipur,194160003,The Childrens Home,P.B.15 Saikot ChurachandpurManipur-795128,4172906.00
211,2016-2017,Manipur,194130223,The Chingmeirong Don Bosco,Don Bosco High School PB 9 ImphalManipur-795001,0.00
212,2016-2017,Manipur,194130277,The Dedicated People's Union,Kakwa Imphal West Manipur -795008,0.00
213,2016-2017,Manipur,194200083,The Foundation of Rural Development,Wangjing Heitupokpi Leikai Thoubal Manipur -795148,0.00
214,2016-2017,Manipur,194130419,The Hope Home Imphal,Tera Loukrakpam LeikaiImphal795001,0.00
215,2016-2017,Manipur,194130219,The Hundred Flowers Higher Secondary Schools' Society,Koubak Houbi Pangei Road ImphalManipur-795114,0.00
216,2016-2017,Manipur,194130017,The Ideal Mothers Association,Naoriya Pakhanglapa Keishem Leikai Imphal Manipur-795001,0.00
217,2016-2017,Manipur,194130361,The Integrated Rural Development Association (IRDA),Khurai Kongpal Laishram LeikaiImphal East795005,0.00
218,2016-2017,Manipur,194130234,The Kripa Society,Keisampat Thockchom Leikai Lalambung RIMS Road (South)Imphal (West) Manipur-795001,0.00
